level	anoj de mia sporta klubo	मेरे स्पोर्ट्स क्लब के सदस्य	members of my sports club	grupo	0    	0000-00-00 00:00:00
level	kara mia	मेरे प्रिय	my dear	grupo	0    	0000-00-00 00:00:00
level	ĉu ĝuste ~ ?	क्या वह सही है?	is that right?	grupo	0    	0000-00-00 00:00:00
level	vi devas foresti	तुम्हें अनुपस्थित रहना होगा	you must be absent	grupo	0    	0000-00-00 00:00:00
level	ĉu vi ne ~ ?	क्या आप नहीं ~?	don't you ~ ?	grupo	0    	0000-00-00 00:00:00
level	viaj samklubanoj	आपके साथी क्लब के सदस्य	your fellow club members	grupo	0    	0000-00-00 00:00:00
level	intervidiĝas kun viaj samklubanoj	अपने साथी क्लब सदस्यों के साथ एक-दूसरे को देखें	sees each other with your fellow club members	grupo	0    	0000-00-00 00:00:00
level	trifoje semajne	एक हफ्ते में तीन बार	three times a week	grupo	0    	0000-00-00 00:00:00
level	ĉu mi rajtas ~ ?	क्या मैं ~?	may I ~ ?	grupo	0    	0000-00-00 00:00:00
level	rajtas ion proponi	कुछ प्रस्तावित करने का अधिकार है	has the right to propose something	grupo	0    	0000-00-00 00:00:00
level	mi kunmanĝos kun la familianoj	मैं परिवार के सदस्यों के साथ भोजन करूंगा	I will eat with the family members	grupo	0    	0000-00-00 00:00:00
level	sed en la dua parto	लेकिन दूसरे भाग में	but in the second part	grupo	0    	0000-00-00 00:00:00
level	mi foriros kun miaj geamikoj	मैं अपने दोस्तों के साथ जाऊंगा	I will go with my friends	grupo	0    	0000-00-00 00:00:00
level	parolos pri ~	~ के बारे में बात करेंगे	will talk about ~	grupo	0    	0000-00-00 00:00:00
level	malsukcesa veturado	एक असफल ड्राइव	a failed drive	grupo	0    	0000-00-00 00:00:00
level	certe parolos pri la malsukcesa veturado	असफल ड्राइव के बारे में निश्चित रूप से बात करेंगे	will definitely talk about the failed drive	grupo	0    	0000-00-00 00:00:00
level	post la kuko	केक के बाद	after the cake	grupo	0    	0000-00-00 00:00:00
level	mi ne plu volas tion	मैं अब ऐसा नहीं चाहता	I don't want that anymore	grupo	0    	0000-00-00 00:00:00
level	volas tion aŭdi	वह सुनना चाहता है	wants to hear that	grupo	0    	0000-00-00 00:00:00
level	kial ni ne havas ~ ?	हमारे पास ~ क्यों नहीं है?	why don't we have ~ ?	grupo	0    	0000-00-00 00:00:00
level	ideoriĉa onklo	एक विचार-समृद्ध चाचा	an idea-rich uncle	grupo	0    	0000-00-00 00:00:00
level	havas iun ideoriĉan onklon	कुछ पता है अमीर अंकल	has some idea rich uncle	grupo	0    	0000-00-00 00:00:00
level	en mia familio	मेरे परिवार में	in my family	grupo	0    	0000-00-00 00:00:00
level	la patrino ridetis	माँ मुस्कुराई	the mother smiled	grupo	0    	0000-00-00 00:00:00
level	je liaj vortoj	उसके शब्दों पर	at his words	grupo	0    	0000-00-00 00:00:00
level	ŝi scias, ke ~	वह यह जानती है~	she knows that ~	grupo	0    	0000-00-00 00:00:00
level	iom tro parolas	कुछ ज्यादा ही बोलता है	talks a little too much	grupo	0    	0000-00-00 00:00:00
level	ne sufiĉas nur ~	यह सिर्फ ~ पर्याप्त नहीं है	it's not enough just ~	grupo	0    	0000-00-00 00:00:00
level	riĉeco de la ideoj	विचारों का खजाना	wealth of ideas	grupo	0    	0000-00-00 00:00:00
level	necesas ankaŭ ~	~की भी जरूरत है	~ is also needed	grupo	0    	0000-00-00 00:00:00
level	plena monujo por realigi ĝin	ऐसा करने के लिए एक पूरा बटुआ	a full wallet to make it happen	grupo	0    	0000-00-00 00:00:00
level	la patrino daŭrigis ~	माँ ने आगे कहा~	the mother continued ~	grupo	0    	0000-00-00 00:00:00
level	post iom da silento	थोड़ी सी खामोशी के बाद	after a little silence	grupo	0    	0000-00-00 00:00:00
level	antaŭ kelkaj minutoj	कुछ क्षणों पहले	a few minutes ago	grupo	0    	0000-00-00 00:00:00
level	Ana telefonis, ke ŝi ~	एना ने फोन किया कि वह ~	Ana called that she ~	grupo	0    	0000-00-00 00:00:00
level	ankaŭ ŝi vizitos nin	वह हमसे मिलने भी आएंगी	she will also visit us	grupo	0    	0000-00-00 00:00:00
level	dolĉa kuko	एक मीठा केक	a sweet cake	grupo	0    	0000-00-00 00:00:00
level	ŝi tre ŝatas dolĉan kukon	उसे मीठा केक बहुत पसंद है	she really likes sweet cake	grupo	0    	0000-00-00 00:00:00
level	atentas por ne dikiĝi	सावधान है कि मोटा न हो जाए	is careful not to get fat	grupo	0    	0000-00-00 00:00:00
level	kvankam ŝi atentos	हालाँकि वह ध्यान देगी	although she will pay attention	grupo	0    	0000-00-00 00:00:00
level	tuj ŝanĝis la opinion	तुरंत मन बदल गया	immediately changed the mind	grupo	0    	0000-00-00 00:00:00
level	dum la ekskurso	भ्रमण के दौरान	during the excursion	grupo	0    	0000-00-00 00:00:00
level	sen ŝi	उसके बिना	without her	grupo	0    	0000-00-00 00:00:00
level	li estus tre soleca	वह बहुत अकेला होगा	he would be very lonely	grupo	0    	0000-00-00 00:00:00
level	mi tamen pasigos	फिर भी मैं पास हो जाऊंगा	I will pass though	grupo	0    	0000-00-00 00:00:00
level	mi tamen pasigos la morgaŭan tagon hejme	हालाँकि मैं कल घर पर बिताऊँगा	I will spend tomorrow at home though	grupo	0    	0000-00-00 00:00:00
level	en juneco	युवावस्था में	in youth	grupo	0    	0000-00-00 00:00:00
level	oni havas	किसी के पास	one has	grupo	0    	0000-00-00 00:00:00
level	havas ankaŭ belecon	सौंदर्य भी है	also has beauty	grupo	0    	0000-00-00 00:00:00
level	malsimplaj laboroj	जटिल कार्य	complicated jobs	grupo	0    	0000-00-00 00:00:00
level	malsimplajn laborojn	जटिल कार्य (उद्देश्य)	complicated jobs (objective)	grupo	0    	0000-00-00 00:00:00
level	devus plisimpligi	सरलीकरण करना चाहिए	should simplify	grupo	0    	0000-00-00 00:00:00
level	en tiu aĝo	उस उम्र में	at that age	grupo	0    	0000-00-00 00:00:00
level	li jam fariĝis ~	वह पहले ही ~ बन चुका है	he has already become ~	grupo	0    	0000-00-00 00:00:00
level	estro de la sporta klubo	स्पोर्ट्स क्लब के प्रमुख	head of the sports club	grupo	0    	0000-00-00 00:00:00
level	monon oni metas	कोई पैसा लगाता है	one puts money	grupo	0    	0000-00-00 00:00:00
level	en monujon	एक बटुए में	into a wallet	grupo	0    	0000-00-00 00:00:00
level	metas en monujon	पर्स में रखता है	puts in a purse	grupo	0    	0000-00-00 00:00:00
level	sekvu la ekzemplojn	उदाहरणों का पालन करें	follow the examples	grupo	0    	0000-00-00 00:00:00
level	de la bonaj familianoj	अच्छे परिवार के सदस्यों से	from the good family members	grupo	0    	0000-00-00 00:00:00
level	ĉu amikeco pli feliĉigas?	क्या दोस्ती आपको अधिक खुश करती है?	does friendship make you happier?	grupo	0    	0000-00-00 00:00:00
level	feliĉigas vin	आपको खुश करता है	makes you happy	grupo	0    	0000-00-00 00:00:00
level	ol la amo	प्यार से भी ज्यादा	than the love	grupo	0    	0000-00-00 00:00:00
level	kiel ofte vi ~ ?	आप कितनी बार ~?	how often do you ~ ?	grupo	0    	0000-00-00 00:00:00
level	vi skribas leterojn al ~	आप ~ को पत्र लिखते हैं	you write letters to ~	grupo	0    	0000-00-00 00:00:00
level	skrivas leterojn al viaj amikinoj	अपनी गर्ल फ्रेंड को पत्र लिखता है	writes letters to your girl friends	grupo	0    	0000-00-00 00:00:00
level	viaj amikinoj en Italio	इटली में आपकी गर्लफ्रेंड	your girl friends in Italy	grupo	0    	0000-00-00 00:00:00
level	la rilato inter vi kaj via instruisto	आपके और आपके शिक्षक के बीच का संबंध	the relation between you and your teacher	grupo	0    	0000-00-00 00:00:00
level	ĉu la rilato ŝanĝiĝis?	क्या रिश्ता बदल गया है?	has the relationship changed?	grupo	0    	0000-00-00 00:00:00
level	ĉu vi jam scias ~ ?	क्या आप पहले से ही जानते हैं~?	do you already know ~ ?	grupo	0    	0000-00-00 00:00:00
level	sufiĉe bone	काफी अच्छी तरह से	quite well	grupo	0    	0000-00-00 00:00:00
level	estis vespero en ~	~ में शाम थी	it was evening in ~	grupo	0    	0000-00-00 00:00:00
level	centoj da homoj	सैकड़ों लोगों की	hundreds of people	grupo	0    	0000-00-00 00:00:00
level	plenigas la placon	वर्ग भरता है	fills the square	grupo	0    	0000-00-00 00:00:00
level	junuloj kaj militistoj	जवान आदमी और सैनिक	young men and soldiers	grupo	0    	0000-00-00 00:00:00
level	maristoj de sur la ŝipoj	जहाजों से नाविक	sailors from the ships	grupo	0    	0000-00-00 00:00:00
level	elstara sinjorino	उत्कृष्ट महिला	outstanding lady	grupo	0    	0000-00-00 00:00:00
level	elstaraj sinjorinoj	उत्कृष्ट देवियाँ	outstanding ladies	grupo	0    	0000-00-00 00:00:00
level	alilandaj vojaĝantoj	विदेशी यात्री	foreign travelers	grupo	0    	0000-00-00 00:00:00
level	ĉiuj moviĝas al urbomezo	हर कोई शहर के केंद्र की ओर जा रहा है	everyone is moving to the city center	grupo	0    	0000-00-00 00:00:00
level	iom plue	थोड़ा सा आगे	a little further	grupo	0    	0000-00-00 00:00:00
level	ne malproksime de la maro	समुद्र से ज्यादा दूर नहीं	not far from the sea	grupo	0    	0000-00-00 00:00:00
level	troviĝis malgranda placo	वहाँ एक छोटा सा चौक था	there was a small square	grupo	0    	0000-00-00 00:00:00
level	iom plue sed ne malproksime	थोड़ा आगे लेकिन ज्यादा दूर नहीं	a little further but not far	grupo	0    	0000-00-00 00:00:00
level	fine de ĝi	इसके अंत में	at the end of it	grupo	0    	0000-00-00 00:00:00
level	proksime de la maro	समुद्र के पास	near the sea	grupo	0    	0000-00-00 00:00:00
level	proksime staris homo	एक आदमी पास में खड़ा था	a man stood nearby	grupo	0    	0000-00-00 00:00:00
level	laŭ la vestaĵo	कपड़ों के अनुसार	according to the clothing	grupo	0    	0000-00-00 00:00:00
level	oni facile scii ~	कोई भी आसानी से जान सकता है ~	one may know easily ~	grupo	0    	0000-00-00 00:00:00
level	oni povis ekscii, ke ~	यह पता लगाना संभव था कि ~	it was possible to find out that ~	grupo	0    	0000-00-00 00:00:00
level	gondolisto de iu riĉulo	एक अमीर आदमी का गोंडोलियर	a rich man's gondolier	grupo	0    	0000-00-00 00:00:00
level	povis ekscii, ke li estas gondolisto	पता लगा सका कि वह एक गोंडोलियर था	could find out that he was a gondolier	grupo	0    	0000-00-00 00:00:00
level	li rigardis ~	उसने देखा~	he looked ~	grupo	0    	0000-00-00 00:00:00
level	rigardis la ĝojan hommulton	हर्षित भीड़ को देखा	looked at the joyful crowd	grupo	0    	0000-00-00 00:00:00
level	rideto lumigis lian vizaĝon	उसके चेहरे पर मुस्कान खिल उठी	a smile lit up his face	grupo	0    	0000-00-00 00:00:00
level	kiam li ekvidis mariston	जब उसने एक नाविक को देखा	when he saw a sailor	grupo	0    	0000-00-00 00:00:00
level	la mariston, kiu alvenis	नाविक जो आ गया	the sailor who arrived	grupo	0    	0000-00-00 00:00:00
level	la flanko de la maro	समुद्र का किनारा	the side of the sea	grupo	0    	0000-00-00 00:00:00
level	alvenis el la flanko de la maro	समुद्र के किनारे से आये	arrived from the side of the sea	grupo	0    	0000-00-00 00:00:00
level	ĉu tio estas vi, Stefano?	क्या वह तुम हो, स्टीफन?	is that you, Stephen?	grupo	0    	0000-00-00 00:00:00
level	ekkriis la gondolisto	गोंडोलियर ने चिल्लाकर कहा	exclaimed the gondolier	grupo	0    	0000-00-00 00:00:00
level	ĉiuj diras, ke ~	हर कोई यही कहता है~	everyone says that ~	grupo	0    	0000-00-00 00:00:00
level	en la manojn de la Turkoj	तुर्कों के हाथ में	into the hands of the Turks	grupo	0    	0000-00-00 00:00:00
level	ke vi falis en la manojn de la Turkoj	कि तुम तुर्कों के हाथ में पड़ गये	that you fell into the hands of the Turks	grupo	0    	0000-00-00 00:00:00
level	ni renkontis unu	हम एक से मिले	we met one	grupo	0    	0000-00-00 00:00:00
level	el niaj ŝipoj	हमारे जहाजों से	from our ships	grupo	0    	0000-00-00 00:00:00
level	ĝi sekvis nin	इसने हमारा पीछा किया	it followed us	grupo	0    	0000-00-00 00:00:00
level	dum pli ol unu horo	एक घंटे से अधिक समय तक	for more than an hour	grupo	0    	0000-00-00 00:00:00
level	sed ne estas facile iri ~	लेकिन जाना आसान नहीं~	but it is not easy to go ~	grupo	0    	0000-00-00 00:00:00
level	iri pli rapide ol nia ŝipo	हमारे जहाज़ से भी तेज़ चलने के लिए	to go faster than our ship	grupo	0    	0000-00-00 00:00:00
level	kiaj novaĵoj estas tie ĉi?	यहाँ कौन सी खबर है?	what news is here?	grupo	0    	0000-00-00 00:00:00
level	tie ĉi en Venecio	यहाँ वेनिस में	here in Venice	grupo	0    	0000-00-00 00:00:00
level	nenio interesa	कुछ खास दिलचस्प नहीं	nothing interesting	grupo	0    	0000-00-00 00:00:00
level	nur granda malfeliĉo	बस एक बड़ा दुर्भाग्य	just a big misfortune	grupo	0    	0000-00-00 00:00:00
level	ĉu vi konas Pietron?	क्या आप पिएत्रो को जानते हैं?	do you know Pietro?	grupo	0    	0000-00-00 00:00:00
level	mi konas lin	उसे पहचानती हूँ	I know him	grupo	0    	0000-00-00 00:00:00
level	granda ŝipo subakvigis lian gondolon	एक बड़े जहाज़ ने उसके गोंडोला को डुबा दिया	a large ship submerged his gondola	grupo	0    	0000-00-00 00:00:00
level	kaj kio pri li?	और उसके बारे में क्या?	and what about him?	grupo	0    	0000-00-00 00:00:00
level	la gondolo subakviĝis	गोंडोला डूब गया	the gondola sank	grupo	0    	0000-00-00 00:00:00
level	okazis, ke ~	ऐसा हुआ कि~	it happened that ~	grupo	0    	0000-00-00 00:00:00
level	ni troviĝis proksime	हम करीब थे	we were close	grupo	0    	0000-00-00 00:00:00
level	ni prenis lin en nian gondolon	हम उसे अपने गोंडोला में ले गए	we took him in our gondola	grupo	0    	0000-00-00 00:00:00
level	en la sama tempo	एक ही समय पर	at the same time	grupo	0    	0000-00-00 00:00:00
level	mia estro subakviĝis	मेरा बॉस डूब गया	my boss drowned	grupo	0    	0000-00-00 00:00:00
level	por helpi junulinon	एक युवा महिला की मदद करने के लिए	to help a young woman	grupo	0    	0000-00-00 00:00:00
level	junulinon, kiu preskaŭ mortis	एक युवा महिला जो लगभग मर चुकी थी	a young woman who almost died	grupo	0    	0000-00-00 00:00:00
level	kun sia onklo	अपने चाचा के साथ	with his uncle	grupo	0    	0000-00-00 00:00:00
level	preskaŭ mortis kun sia onklo	अपने चाचा के साथ लगभग मर गया	almost died with his uncle	grupo	0    	0000-00-00 00:00:00
level	tie estis junulino	वहाँ एक जवान औरत थी	there was a young woman	grupo	0    	0000-00-00 00:00:00
level	lin ni ne povis helpi	हम उसकी मदद नहीं कर सके	we could not help him	grupo	0    	0000-00-00 00:00:00
level	estis grava homo	एक महत्वपूर्ण व्यक्ति थे	was an important person	grupo	0    	0000-00-00 00:00:00
level	kio alvenigis vin en Venecion?	आपको वेनिस तक क्या लाया?	what brought you to Venice?	grupo	0    	0000-00-00 00:00:00
level	amiko mia	मेरा दोस्त	my friend	grupo	0    	0000-00-00 00:00:00
level	la maristo ekrigardis	नाविक ने ऊपर देखा	the sailor looked up	grupo	0    	0000-00-00 00:00:00
level	rapide ekrigardis sian amikon	जल्दी से अपने दोस्त की ओर देखा	quickly glanced at his friend	grupo	0    	0000-00-00 00:00:00
level	kaj komencis diri	और कहने लगा	and began to say	grupo	0    	0000-00-00 00:00:00
level	do vi scias ~	तो आप जानते हैं~	so you know ~	grupo	0    	0000-00-00 00:00:00
level	mi alportis ~	मैं ~ लाया	I brought ~	grupo	0    	0000-00-00 00:00:00
level	la gondolisto subite haltigis lin	गोंडोलियर ने अचानक उसे रोक दिया	the gondolier suddenly stopped him	grupo	0    	0000-00-00 00:00:00
level	li diris	उसने कहा	he said	grupo	0    	0000-00-00 00:00:00
level	tiam iu homo pasis	तभी एक आदमी वहां से गुजरा	then a man passed by	grupo	0    	0000-00-00 00:00:00
level	iu homo pasis apud li	एक आदमी उसके पास से गुजरा	a man passed by him	grupo	0    	0000-00-00 00:00:00
level	li ankoraŭ ne estis tridekjara	वह अभी तीस का नहीं हुआ था	he was not yet thirty	grupo	0    	0000-00-00 00:00:00
level	kaj lia vizaĝo estis senkolora	और उसका चेहरा बेरंग था	and his face was colorless	grupo	0    	0000-00-00 00:00:00
level	lia iro estis certa kaj facila	उसका जाना निश्चित और आसान था	his going was sure and easy	grupo	0    	0000-00-00 00:00:00
level	lia vizaĝo estis malĝoja	उसका चेहरा उदास था	his face was sad	grupo	0    	0000-00-00 00:00:00
level	kiam li ekvidis la homon, ~	जब उसने उस आदमी को देखा, ~	when he saw the man, ~	grupo	0    	0000-00-00 00:00:00
level	oni diras, ke ~	ऐसा कहा जाता है कि~	it is said that ~	grupo	0    	0000-00-00 00:00:00
level	multaj gravuloj donas ~	कई महत्वपूर्ण लोग ~ देते हैं	many important people give ~	grupo	0    	0000-00-00 00:00:00
level	sekreta laboro	गुप्त कार्य	secret work	grupo	0    	0000-00-00 00:00:00
level	sekretaj laboroj	गुप्त नौकरियाँ	secret jobs	grupo	0    	0000-00-00 00:00:00
level	donas sekretajn laborojn al li	उसे गुप्त नौकरियाँ देता है	gives secret jobs to him	grupo	0    	0000-00-00 00:00:00
level	tro da sekretoj	बहुत सारे रहस्य	too many secrets	grupo	0    	0000-00-00 00:00:00
level	li scias tro da sekretoj	वह बहुत सारे रहस्य जानता है	he knows too many secrets	grupo	0    	0000-00-00 00:00:00
level	tial ili timas	इसलिये वे डरते हैं	therefore they are afraid	grupo	0    	0000-00-00 00:00:00
level	sendi lin en malliberejon	उसे जेल भेजने के लिए	to send him to prison	grupo	0    	0000-00-00 00:00:00
level	diris la maristo	नाविक ने कहा	said the sailor	grupo	0    	0000-00-00 00:00:00
level	kaj dum li parolis	और जैसे वह बोला	and as he spoke	grupo	0    	0000-00-00 00:00:00
level	li montris la domegon	उसने हवेली की ओर इशारा किया	he pointed to the mansion	grupo	0    	0000-00-00 00:00:00
level	la domego de Doĝoj	डोगेस की हवेली	the mansion of Doges	grupo	0    	0000-00-00 00:00:00
level	multaj gravuloj bezonas lian helpon	कई महत्वपूर्ण लोगों को उसकी मदद की जरूरत है	many important people need his help	grupo	0    	0000-00-00 00:00:00
level	kiom ili pagas?	वे कितना भुगतान करते हैं?	how much they pay?	grupo	0    	0000-00-00 00:00:00
level	pagas al li	उसे भुगतान करता है	pays him	grupo	0    	0000-00-00 00:00:00
level	pagas por unu mortigo	एक हत्या के लिए भुगतान करता है	pays for one kill	grupo	0    	0000-00-00 00:00:00
level	certe ne malpli ol ~	निश्चित रूप से ~ से कम नहीं	certainly not less than ~	grupo	0    	0000-00-00 00:00:00
level	ol cent moneroj	सौ सिक्कों से भी ज्यादा	than a hundred coins	grupo	0    	0000-00-00 00:00:00
level	ne forgesu, ke ~	यह मत भूलो ~	don't forget that ~	grupo	0    	0000-00-00 00:00:00
level	ke li laboras por tiuj	कि वह उनके लिए काम करता है	that he works for them	grupo	0    	0000-00-00 00:00:00
level	por tiuj, kiuj havas sufiĉe da mono	उन लोगों के लिए जिनके पास पर्याप्त पैसा है	for those who have enough money	grupo	0    	0000-00-00 00:00:00
level	por pagi al li	उसे भुगतान करने के लिए	to pay him	grupo	0    	0000-00-00 00:00:00
level	en Venecio estas ~	वेनिस में ~ है	in Venice there is ~	grupo	0    	0000-00-00 00:00:00
level	tiuj aferoj	उन चीजों	those things	grupo	0    	0000-00-00 00:00:00
level	forgesi tiujn aferojn	उन बातों को भूल जाना	to forget those things	grupo	0    	0000-00-00 00:00:00
level	aferoj, kiujn estas pli bone forgesi	ऐसी चीज़ें जिन्हें भूल जाना ही बेहतर है	things that are better forgotten	grupo	0    	0000-00-00 00:00:00
level	se vi volas trankvile manĝi	अगर आप शांति से खाना चाहते हैं	if you want to eat in peace	grupo	0    	0000-00-00 00:00:00
level	trankvile manĝi vian panon	अपनी रोटी शांति से खाओ	to eat your bread in peace	grupo	0    	0000-00-00 00:00:00
level	estis iom da silento	कुछ सन्नाटा था	there was some silence	grupo	0    	0000-00-00 00:00:00
level	kaj poste	और बाद में	and later	grupo	0    	0000-00-00 00:00:00
level	la gondolisto denove ekparolis	गोंडोलियर फिर बोला	the gondolier spoke again	grupo	0    	0000-00-00 00:00:00
level	vi venis ĝustatempe	तुम ठीक समय पर आये	you came just in time	grupo	0    	0000-00-00 00:00:00
level	por vidi ŝipkuron	नौका दौड़ देखने के लिए	to see a boat race	grupo	0    	0000-00-00 00:00:00
level	iu diris malforte	किसी ने कमजोर होकर कहा	someone said weakly	grupo	0    	0000-00-00 00:00:00
level	proksime de la gondolisto	गोंडोलियर के पास	near the gondolier	grupo	0    	0000-00-00 00:00:00
level	la estro de la urbo	शहर के मेयर	the mayor of the city	grupo	0    	0000-00-00 00:00:00
level	senvorte montris al la gondolo	बिना शब्दों के गोंडोला की ओर इशारा किया	wordlessly pointed to the gondola	grupo	0    	0000-00-00 00:00:00
level	diris la gondolisto	गोंडोलियर ने कहा	said the gondolier	grupo	0    	0000-00-00 00:00:00
level	kaj prenis la manon de sia amiko	और अपने दोस्त का हाथ पकड़ लिया	and took his friend's hand	grupo	0    	0000-00-00 00:00:00
level	ĵetas la paperon	कागज फेंक देता है	throws the paper	grupo	0    	0000-00-00 00:00:00
level	en la paperujon	कागज़ के डिब्बे में	into the paper bin	grupo	0    	0000-00-00 00:00:00
