level	glason da kafo	एक गिलास कॉफ़ी	a glass of coffee	grupo	0    	0000-00-00 00:00:00
level	kaj iom da akvo	और थोड़ा पानी	and some water	grupo	0    	0000-00-00 00:00:00
level	mi petas glason da kafo	मुझे एक गिलास कॉफ़ी चाहिए	I would like a glass of coffee	grupo	0    	0000-00-00 00:00:00
level	mi petas tason da teo	मुझे एक कप चाय चाहिए	I would like a cup of tea	grupo	0    	0000-00-00 00:00:00
level	doloris lin	उसे मारो	hurt him	grupo	0    	0000-00-00 00:00:00
level	la kapo doloris lin	उसके सिर पर चोट लगी	his head hurt	grupo	0    	0000-00-00 00:00:00
level	li malsaniĝis	वह बीमार पड़ गया	he fell ill	grupo	0    	0000-00-00 00:00:00
level	ŝatas esti bela	सुंदर रहना पसंद है	likes to be beautiful	grupo	0    	0000-00-00 00:00:00
level	ŝi beligis sian vizaĝon	उसने अपना चेहरा सुंदर बनाया	she beautified her face	grupo	0    	0000-00-00 00:00:00
level	la knabo ŝatas esti bela	लड़के को सुंदर रहना पसंद है	the boy likes to be pretty	grupo	0    	0000-00-00 00:00:00
level	pro tio ŝi beligis ĝin	इसलिए उसने इसे सुंदर बनाया	therefore she beautified it	grupo	0    	0000-00-00 00:00:00
level	post la tagmanĝo	दोपहर के भोजन के बाद	after lunch	grupo	0    	0000-00-00 00:00:00
level	purigi la kuirejon	रसोई साफ़ करने के लिए	to clean the kitchen	grupo	0    	0000-00-00 00:00:00
level	kiu purigos la kuirejon?	रसोई की सफ़ाई कौन करेगा?	who will clean the kitchen?	grupo	0    	0000-00-00 00:00:00
level	volas trinki	पीना चाहता है	wants to drink	grupo	0    	0000-00-00 00:00:00
level	kion vi volas trinki?	आप क्या पीना चाहते हो	what do you want to drink	grupo	0    	0000-00-00 00:00:00
level	trinki teon	चाय पीने के लिए	to drink tea	grupo	0    	0000-00-00 00:00:00
level	iom da akvo	थोड़ा सा पानी	a little of water	grupo	0    	0000-00-00 00:00:00
level	ĉu vi volas nenion?	क्या तुम्हें कुछ नहीं चाहिए?	do you want nothing?	grupo	0    	0000-00-00 00:00:00
level	tiel subite	तो अचानक	so suddenly	grupo	0    	0000-00-00 00:00:00
level	kial vi decidis ~ ?	आपने यह निर्णय क्यों लिया~?	why did you decide ~ ?	grupo	0    	0000-00-00 00:00:00
level	kial vi tiel subite decidis ~ ?	आपने इतना अचानक निर्णय क्यों लिया?	why did you decide ~ so suddenly?	grupo	0    	0000-00-00 00:00:00
level	via ĉambro	आपका कमरा	your room	grupo	0    	0000-00-00 00:00:00
level	via ĉambreto	आपका छोटा कमरा	your little room	grupo	0    	0000-00-00 00:00:00
level	vian ĉambreton	अपने छोटे से कमरे में	to your little room	grupo	0    	0000-00-00 00:00:00
level	renovigi vian ĉambreton	अपने छोटे से कमरे का नवीनीकरण करने के लिए	to renovate your little room	grupo	0    	0000-00-00 00:00:00
level	decidis renovigi vian ĉambreton	आपके छोटे से कमरे का नवीनीकरण करने का निर्णय लिया	decided to renovate your little room	grupo	0    	0000-00-00 00:00:00
level	al kiu	किसके लिए	to whom	grupo	0    	0000-00-00 00:00:00
level	vi donis ~	आपने ~ दे दिया	you gave ~	grupo	0    	0000-00-00 00:00:00
level	al kiu vi donis ~ ?	आपने किसको दिया~?	to whom did you give ~ ?	grupo	0    	0000-00-00 00:00:00
level	puraj glasoj	साफ चश्मा	clean glasses	grupo	0    	0000-00-00 00:00:00
level	vi donis la purajn glasojn	आपने साफ़ चश्मा दे दिया	you gave the clean glasses	grupo	0    	0000-00-00 00:00:00
level	la puraj glasoj por la vino	शराब के लिए साफ गिलास	the clean glasses for the wine	grupo	0    	0000-00-00 00:00:00
level	kontraŭ kiu	किसके खिलाफ	against whom	grupo	0    	0000-00-00 00:00:00
level	via sportklubo	आपका स्पोर्ट्स क्लब	your sports club	grupo	0    	0000-00-00 00:00:00
level	ludas kontraŭ ~	~ के विरुद्ध खेलता है	plays against ~	grupo	0    	0000-00-00 00:00:00
level	antaŭ du semajnoj	दो सप्ताह पहले	two weeks ago	grupo	0    	0000-00-00 00:00:00
level	kontraŭ kiu via sportklubo ludis?	आपका स्पोर्ट्स क्लब किसके विरुद्ध खेला?	who did your sports club play against?	grupo	0    	0000-00-00 00:00:00
level	ĉu vi vidas ~ ?	क्या आप देखते हैं~?	do you see ~ ?	grupo	0    	0000-00-00 00:00:00
level	ĉu vi ofte vidas ~ ?	क्या आप अक्सर देखते हैं~?	do you often see ~ ?	grupo	0    	0000-00-00 00:00:00
level	ofte vidas la policiston	अक्सर पुलिसवाले को देखते हैं	often see the policeman	grupo	0    	0000-00-00 00:00:00
level	tiu, kiu loĝas en ~	वह जो ~ में रहता है	the one who lives in ~	grupo	0    	0000-00-00 00:00:00
level	loĝas en la loĝejo	आवास स्थान में रहता है	lives in the lodging place	grupo	0    	0000-00-00 00:00:00
level	la loĝejo super vi	तुम्हारे ऊपर निवास स्थान	the dwelling place above you	grupo	0    	0000-00-00 00:00:00
level	vidas la policiston, kiu loĝas en ~	उस पुलिस अधिकारी को देखता है जो ~ में रहता है	sees the police officer who lives in ~	grupo	0    	0000-00-00 00:00:00
level	plano pri veturado	ड्राइविंग योजना	driving plan	grupo	0    	0000-00-00 00:00:00
level	volis vojaĝi	यात्रा करना चाहता था	wanted to travel	grupo	0    	0000-00-00 00:00:00
level	vojaĝi al alia lando	दूसरे देश की यात्रा करने के लिए	to travel to another country	grupo	0    	0000-00-00 00:00:00
level	en libertempo	खाली समय में	in free time	grupo	0    	0000-00-00 00:00:00
level	ili decidis iri	उन्होंने जाने का फैसला किया	they decided to go	grupo	0    	0000-00-00 00:00:00
level	decidis iri al Italio	इटली जाने का फैसला किया	decided to go to Italy	grupo	0    	0000-00-00 00:00:00
level	malnovaj urboj	पुराने शहर	old cities	grupo	0    	0000-00-00 00:00:00
level	lando kun malnovaj urboj	पुराने शहरों वाला देश	a country with old cities	grupo	0    	0000-00-00 00:00:00
level	aliaj belaĵoj	अन्य सुंदरियाँ	other beauties	grupo	0    	0000-00-00 00:00:00
level	kaj aliaj belaĵoj	और अन्य सुंदरियाँ	and other beauties	grupo	0    	0000-00-00 00:00:00
level	bela lando kun malnovaj urboj kaj aliaj belaĵoj	पुराने शहरों और अन्य सुंदरताओं वाला एक खूबसूरत देश	a beautiful country with old cities and other beauties	grupo	0    	0000-00-00 00:00:00
level	ili estis feliĉaj	वे खुश थे	they were happy	grupo	0    	0000-00-00 00:00:00
level	kie estas ~ ?	~ कहाँ है?	where is ~ ?	grupo	0    	0000-00-00 00:00:00
level	kie estas mia vestaĵo?	मेरे कपड़े कहाँ है	where are my clothes	grupo	0    	0000-00-00 00:00:00
level	ŝi demandis ~	उसने पूछा~	she asked ~	grupo	0    	0000-00-00 00:00:00
level	ni ne forgesu kunporti ~	आइए ~ लाना न भूलें	let's not forget to bring ~	grupo	0    	0000-00-00 00:00:00
level	kunporti la libron	किताब अपने साथ ले जाने के लिए	to take the book with you	grupo	0    	0000-00-00 00:00:00
level	libro por lerni Esperanton	एस्पेरान्तो सीखने के लिए एक किताब	a book to learn Esperanto	grupo	0    	0000-00-00 00:00:00
level	kunporti libron por lerni	सीखने के लिए एक किताब ले जाना	to carry a book to learn	grupo	0    	0000-00-00 00:00:00
level	ni povas komenci ~	हम शुरू कर सकते हैं~	we can start ~	grupo	0    	0000-00-00 00:00:00
level	en la vagonaro	रेल गाडी में	in the train	grupo	0    	0000-00-00 00:00:00
level	jam en la vagonaro	पहले से ही ट्रेन में	already in the train	grupo	0    	0000-00-00 00:00:00
level	ni nenion faros	हम कुछ नहीं करेंगे	we won't do anything	grupo	0    	0000-00-00 00:00:00
level	per aŭto	कार से	by car	grupo	0    	0000-00-00 00:00:00
level	ni veturos per ~	हम ~ द्वारा ड्राइव करेंगे	we will drive by ~	grupo	0    	0000-00-00 00:00:00
level	veturos per aŭto	कार चलाऊंगा	will drive a car	grupo	0    	0000-00-00 00:00:00
level	mi havas sekreton	मेरे पास एक रहस्य है	I have a secret	grupo	0    	0000-00-00 00:00:00
level	mia riĉa onklo	मेरे अमीर चाचा	my rich uncle	grupo	0    	0000-00-00 00:00:00
level	mia deziro	मेरी इच्छा	my wish	grupo	0    	0000-00-00 00:00:00
level	plenumis mian deziron	मेरी इच्छा पूरी की	fulfilled my wish	grupo	0    	0000-00-00 00:00:00
level	donis al ni	हमें दिया	gave us	grupo	0    	0000-00-00 00:00:00
level	sian aŭton	उसकी गाड़ी	his car	grupo	0    	0000-00-00 00:00:00
level	kaj donis al ni sian aŭton	और हमें अपनी कार दी	and gave us his car	grupo	0    	0000-00-00 00:00:00
level	por uzo	इस्तेमाल के लिए	for use	grupo	0    	0000-00-00 00:00:00
level	ĝi staras antaŭ ~	यह ~ से पहले खड़ा है	it stands before ~	grupo	0    	0000-00-00 00:00:00
level	staras antaŭ la domo	घर के सामने खड़ा है	stands in front of the house	grupo	0    	0000-00-00 00:00:00
level	mi devas diri ~	मुझे ~ कहना होगा	I have to say ~	grupo	0    	0000-00-00 00:00:00
level	nenion diru	कुछ मत कहो	don't say anything	grupo	0    	0000-00-00 00:00:00
level	ni eksidu	चलो बैठ जाएँ	let's sit down	grupo	0    	0000-00-00 00:00:00
level	eksidu en la aŭton	कार में बैठ जाओ	get in the car	grupo	0    	0000-00-00 00:00:00
level	veturi al ~	~ तक ड्राइव करने के लिए	to drive to ~	grupo	0    	0000-00-00 00:00:00
level	kaj veturu al Italio	और इटली के लिए ड्राइव करें	and drive to Italy	grupo	0    	0000-00-00 00:00:00
level	sidis en la aŭto	कार में बैठ गया	sat in the car	grupo	0    	0000-00-00 00:00:00
level	ankaŭ la vestaĵoj	कपड़े भी	also the clothes	grupo	0    	0000-00-00 00:00:00
level	~ estis en la aŭto	~ कार में था	~ was in the car	grupo	0    	0000-00-00 00:00:00
level	ankoraŭ sidadis kaj atendis	फिर भी बैठा रहा और इंतज़ार करता रहा	still sat and waited	grupo	0    	0000-00-00 00:00:00
level	sed li atendis	लेकिन उसने इंतजार किया	but he waited	grupo	0    	0000-00-00 00:00:00
level	kial ni ne ~ ?	हम क्यों नहीं~?	why don't we ~ ?	grupo	0    	0000-00-00 00:00:00
level	kial ni ne ekveturas?	हम गाड़ी चलाना क्यों शुरू नहीं करते?	why don't we start driving?	grupo	0    	0000-00-00 00:00:00
level	ankaŭ mi havas ~	मेरे पास ~ भी है	I have ~ too	grupo	0    	0000-00-00 00:00:00
level	veturigus la aŭton	कार चलाएंगे	would drive the car	grupo	0    	0000-00-00 00:00:00
level	sed mi ne scias ~	लेकिन मैं नहीं जानता ~	but I don't know ~	grupo	0    	0000-00-00 00:00:00
level	mi neniam lernis tion	मैंने वह कभी नहीं सीखा	I never learned that	grupo	0    	0000-00-00 00:00:00
level	mi kredus ~	मुझे विश्वास होगा ~	I would believe ~	grupo	0    	0000-00-00 00:00:00
level	se mi estus sana	अगर मैं स्वस्थ होता	if I were healthy	grupo	0    	0000-00-00 00:00:00
level	mi estus tre feliĉa	मुझे बहुत प्रसन्नता होगी	I would be very happy	grupo	0    	0000-00-00 00:00:00
level	kvazaŭ vi estus riĉulo	मानो तुम अमीर हो	as if you were rich	grupo	0    	0000-00-00 00:00:00
level	vi sidas tie kvazaŭ vi estus riĉulo	तुम वहाँ ऐसे बैठते हो मानो तुम कोई अमीर आदमी हो	you sit there as if you were a rich man	grupo	0    	0000-00-00 00:00:00
level	kvazaŭa lernejo	कथित स्कूल	alleged school	grupo	0    	0000-00-00 00:00:00
level	kvazaŭ riĉulo	एक अमीर आदमी की तरह	like a rich man	grupo	0    	0000-00-00 00:00:00
level	vi sidas tie kvazaŭ riĉulo	तुम वहाँ एक अमीर आदमी की तरह बैठते हो	you sit there like a rich man	grupo	0    	0000-00-00 00:00:00
level	tiom da mono	बहुत सा धन	so much money	grupo	0    	0000-00-00 00:00:00
level	tiom da mono kiom da ideoj	जितना पैसा उतना विचार	as much money as ideas	grupo	0    	0000-00-00 00:00:00
level	se mi havus tiom da mono	अगर मेरे पास इतना पैसा होता	if I had that much money	grupo	0    	0000-00-00 00:00:00
level	mi vojaĝadus	मैं यात्रा करूंगा	I would travel	grupo	0    	0000-00-00 00:00:00
level	ĉirkaŭ la mondo	दुनिया भर में	around the world	grupo	0    	0000-00-00 00:00:00
level	en ĉiu vortaro	हर शब्दकोश में	in every dictionary	grupo	0    	0000-00-00 00:00:00
level	mankas io	कुछ याद आ रही है	something is missing	grupo	0    	0000-00-00 00:00:00
level	mankas kelkaj vortoj	कुछ शब्द गायब हैं	some words are missing	grupo	0    	0000-00-00 00:00:00
level	homo, kiu longe parolis	एक आदमी जो लम्बी बात करता था	a man who spoke at length	grupo	0    	0000-00-00 00:00:00
level	ĉe la manĝotablo	खाने की मेज पर	at the dining table	grupo	0    	0000-00-00 00:00:00
level	homo, kiu rakontas, restos malsata	बताने वाला भूखा रह जायेगा	a person who tells will remain hungry	grupo	0    	0000-00-00 00:00:00
level	rakontadas ĉe la manĝo tablo	डाइनिंग टेबल पर बताते रहते हैं	keeps telling at the dining table	grupo	0    	0000-00-00 00:00:00
level	li devis atenti ~	उसे ~ पर ध्यान देना था	he had to pay attention to ~	grupo	0    	0000-00-00 00:00:00
level	ne rajtis ~	~की अनुमति नहीं थी	was not allowed to ~	grupo	0    	0000-00-00 00:00:00
level	rajtis resti	रहने की इजाजत दे दी गई	was allowed to stay	grupo	0    	0000-00-00 00:00:00
level	ne rajtis longe resti	ज्यादा देर रुकने की इजाजत नहीं थी	was not allowed to stay long	grupo	0    	0000-00-00 00:00:00
level	resti ekstere en pluvo	बारिश में बाहर रहने के लिए	to stay out in the rain	grupo	0    	0000-00-00 00:00:00
level	tial li malvarmumis	इसीलिए उसे सर्दी लग गई	that's why he caught a cold	grupo	0    	0000-00-00 00:00:00
level	li havas sian klaran ideon	उनका अपना स्पष्ट विचार है	he has his own clear idea	grupo	0    	0000-00-00 00:00:00
level	sed li kredos ĉion	लेकिन वह हर बात पर विश्वास करेगा	but he will believe everything	grupo	0    	0000-00-00 00:00:00
level	ĉion, kion vi diros	आप जो भी कहते हैं	whatever you say	grupo	0    	0000-00-00 00:00:00
level	kvazaŭ vi estus lia edzino	मानो तुम उसकी पत्नी हो	as if you were his wife	grupo	0    	0000-00-00 00:00:00
level	viaj gepatroj	आपके माता - पिता	your parents	grupo	0    	0000-00-00 00:00:00
level	ĝojigi viajn gepatrojn	अपने माता-पिता को खुश करने के लिए	to make your parents happy	grupo	0    	0000-00-00 00:00:00
level	kio povus ĝojigi ~ ?	कृपया क्या कर सकते हैं~?	what could please ~ ?	grupo	0    	0000-00-00 00:00:00
level	kio povus plej ĝojigi viajn gepatrojn?	आपके माता-पिता को सबसे अधिक ख़ुशी किस चीज़ से मिल सकती है?	what could make your parents the most happy?	grupo	0    	0000-00-00 00:00:00
level	post la lernado	सीखने के बाद	after the learning	grupo	0    	0000-00-00 00:00:00
level	almenaŭ post la lernado	कम से कम सीखने के बाद	at least after the learning	grupo	0    	0000-00-00 00:00:00
level	en la urbocentron	शहर के केंद्र में	into the city center	grupo	0    	0000-00-00 00:00:00
level	se vi irus kun mi	अगर तुम मेरे साथ चलोगे	if you would go with me	grupo	0    	0000-00-00 00:00:00
level	se vi irus kun mi en la urbocentron	यदि आप मेरे साथ शहर चलेंगे	if you would go downtown with me	grupo	0    	0000-00-00 00:00:00
level	kien vi dezirus vojaĝi?	तुम कहाँ जाना पसंद करोगे?	where would you like to travel?	grupo	0    	0000-00-00 00:00:00
level	se vi havus ~	यदि आपके पास ~ होता	if you had ~	grupo	0    	0000-00-00 00:00:00
level	sufiĉe da mono	पर्याप्त धन	enough money	grupo	0    	0000-00-00 00:00:00
level	se vi havus sufiĉe da mono kaj tempo	यदि आपके पास पर्याप्त पैसा और तापमान है	if you had enough money and temp	grupo	0    	0000-00-00 00:00:00
level	ĉu vi planas ~ ?	क्या आप ~ की योजना बना रहे हैं?	are you planning to ~ ?	grupo	0    	0000-00-00 00:00:00
level	planas veturi al Parizo	पेरिस की यात्रा की योजना है	plans to travel to Paris	grupo	0    	0000-00-00 00:00:00
level	veturi per aŭto	एक्सुटो के साथ ड्राइव करना	to drive with an axuto	grupo	0    	0000-00-00 00:00:00
level	multe pli bone	काफी बेहतर	much better	grupo	0    	0000-00-00 00:00:00
level	ŝajnas multe pli bone	बहुत बेहतर लगता है	seems much better	grupo	0    	0000-00-00 00:00:00
level	per vagonaro	ट्रेन से	by train	grupo	0    	0000-00-00 00:00:00
level	aŭ ĉu ne ŝajnas esti multe pli bone?	या यह ज़्यादा बेहतर नहीं लगता?	or doesn't it seem to be much better?	grupo	0    	0000-00-00 00:00:00
level	diversaj homoj	विभिन्न लोग	various people	grupo	0    	0000-00-00 00:00:00
level	kial homoj klarigas diversmaniere?	लोग अलग-अलग तरीके से क्यों समझाते हैं?	why do people explain in different ways?	grupo	0    	0000-00-00 00:00:00
level	samaj ideoj	वही विचार	same ideas	grupo	0    	0000-00-00 00:00:00
level	klarigas samajn ideojn	उन्हीं विचारों की व्याख्या करता है	explains the same ideas	grupo	0    	0000-00-00 00:00:00
level	familianoj kunvenas	परिवार के सदस्य एकत्र होते हैं	family members get together	grupo	0    	0000-00-00 00:00:00
level	kiel rapide	कैसे इतनी जल्दी	how quickly	grupo	0    	0000-00-00 00:00:00
level	tagoj pasas	दिन बीतते हैं	days pass	grupo	0    	0000-00-00 00:00:00
level	kiel rapide pasas tagoj!	दिन कितनी जल्दी बीत जाते हैं!	how quickly the days pass!	grupo	0    	0000-00-00 00:00:00
level	morgaŭ estos ~	कल होगा~	tomorrow will be ~	grupo	0    	0000-00-00 00:00:00
level	la naskiĝtago de via patro	आपके पिता का जन्मदिन	your father's birthday	grupo	0    	0000-00-00 00:00:00
level	kelkaj familianoj	परिवार के कई सदस्य	several family members	grupo	0    	0000-00-00 00:00:00
level	alvenos kelkaj familianoj	परिवार के कई सदस्य आएंगे	several family members will come	grupo	0    	0000-00-00 00:00:00
level	kaj geamikoj	और मित्रों	and friends	grupo	0    	0000-00-00 00:00:00
level	ĉu vi bonvolus ~ ?	क्या आप कृपया ~?	would you please ~ ?	grupo	0    	0000-00-00 00:00:00
level	ĉu vi bonvolus iom helpi?	क्या आप कृपया थोड़ी मदद कर सकते हैं?	could you please help a little?	grupo	0    	0000-00-00 00:00:00
level	iomete da tempo	थोड़ी देर	a little while	grupo	0    	0000-00-00 00:00:00
level	trovu iomete da tempo	थोड़ा समय निकालें	find a little time	grupo	0    	0000-00-00 00:00:00
level	por ordigi vian ĉambron	अपने कमरे को साफ करने के लिए	to tidy your room	grupo	0    	0000-00-00 00:00:00
level	almenaŭ por ordigi vian ĉambron	कम से कम अपने कमरे को साफ़ करने के लिए	at least to tidy your room	grupo	0    	0000-00-00 00:00:00
level	mi ŝatus ~	मैं चाहूँगा~	I would like ~	grupo	0    	0000-00-00 00:00:00
level	mi ŝatus kuiri ion	मुझे कुछ पकाना है	I would like to cook something	grupo	0    	0000-00-00 00:00:00
level	ion bonan	कुछ अच्छा	something good	grupo	0    	0000-00-00 00:00:00
level	kuiri ion bonan	कुछ अच्छा पकाओ	cook something good	grupo	0    	0000-00-00 00:00:00
level	por la naskiĝ-taga kuko	जन्मदिन के केक के लिए	for the birthday cake	grupo	0    	0000-00-00 00:00:00
level	mankas lakto	दूध की कमी है	is lacking of milk	grupo	0    	0000-00-00 00:00:00
level	en la hejmo	घर में	in the home	grupo	0    	0000-00-00 00:00:00
level	necesas havigi ~	~प्राप्त करना आवश्यक है	it is necessary to procure ~	grupo	0    	0000-00-00 00:00:00
level	iom da manĝaĵo	कुछ भोजन	some food	grupo	0    	0000-00-00 00:00:00
level	el vendejo	एक दुकान से	from a store	grupo	0    	0000-00-00 00:00:00
level	havigi iom da manĝaĵo el vendejo	किसी ठिकाने से कुछ भोजन प्राप्त करने के लिए	to get some food from a hideout	grupo	0    	0000-00-00 00:00:00
level	mi aĉetumos	मैं शॉपिंग करूंगा	I will do shopping	grupo	0    	0000-00-00 00:00:00
level	por la naskiĝtago	जन्मदिन के लिए	for the birthday	grupo	0    	0000-00-00 00:00:00
level	anstataŭ sidi kaj manĝegi	बजाय बैठकर खाने के	instead of sitting and eating	grupo	0    	0000-00-00 00:00:00
level	interesaj homoj	रुचिकर लोग	interesting people	grupo	0    	0000-00-00 00:00:00
level	kun neinteresaj familianoj	अरुचिकर परिवार के सदस्यों के साथ	with uninteresting family members	grupo	0    	0000-00-00 00:00:00
level	mi ŝatus ekskursi	मैं पिकनिक पर जाना चाहूँगा	I would like to go on a picnic	grupo	0    	0000-00-00 00:00:00
level	kun klubanoj	क्लब के सदस्यों के साथ	with club members	grupo	0    	0000-00-00 00:00:00
level	kun kiuj klubanoj?	किस क्लब के सदस्यों के साथ?	with which club members?	grupo	0    	0000-00-00 00:00:00
level	diris la patro	पिता ने कहा	said the father	grupo	0    	0000-00-00 00:00:00
level	ia papero, iaj paperoj	किसी तरह का कागज, किसी तरह का कागज	some kind of paper, some kind of papers	grupo	0    	0000-00-00 00:00:00
level	en paperujo	एक ब्रीफ़केस में	in a briefcase	grupo	0    	0000-00-00 00:00:00
level	en paperujon	एक कागज़ के डिब्बे में	into a paper bin	grupo	0    	0000-00-00 00:00:00
level	ĵetis paperojn en paperujon	कागज़ों को कागज़ के डिब्बे में फेंक दिया	threw papers into a paper bin	grupo	0    	0000-00-00 00:00:00
level	ĵetis iajn paperojn en paperujon	कुछ कागज़ों को कागज़ के डिब्बे में फेंक दिया	threw some papers into a paper bin	grupo	0    	0000-00-00 00:00:00
level	morgaŭ frue	कल जल्दी	early tomorrow	grupo	0    	0000-00-00 00:00:00
