eo	en-us	ko-kr	fr	ja-jp	zh-cn	zh-tw	vi-vn	mn	th	ms	id	hi	fa	ne	ur	tr	he	ar
jes, mi ŝatus tion	yes, I would like that	예, 나는 그것을 좋아합니다	Oui, j'aimerais cela	はい、私はそれが好きです	是的，我想要那个	是的，我想要那個	Vâng tối muốn thế	тийм ээ, би үүнийг хүсч байна	ใช่ ฉันต้องการสิ่งนั้น	ya, saya mahu itu	ya, saya ingin itu	हां मैं चाहूंगा कि	بله، من آن را دوست دارم	हो, म त्यो चाहन्छु	ہاں، میں یہ چاہوں گا۔	evet bunu isterim	כן, הייתי רוצה את זה	نعم، أود ذلك
venigi mian gitaron	to bring my guitar	나의 기타를 가져오기	apporter ma guitare	私のギターをインポートする	带上我的吉他	帶上我的吉他	mang theo cây đàn guitar của tôi	гитараа авчрах гэж	เพื่อนำกีตาร์ของฉันมา	untuk membawa gitar saya	untuk membawa gitarku	मेरा गिटार लाने के लिए	تا گیتارم را بیاورم	मेरो गितार ल्याउन	میرا گٹار لانے کے لیے	gitarımı getirmek için	להביא את הגיטרה שלי	لإحضار جيتاري
tuj venigos mian gitaron	will bring my guitar right away	즉시 나의 기타를 가져올 것이다	j'apporterai ma guitare tout de suite	すぐに私のギターをもたらします	我会马上带来我的吉他	我會馬上帶來我的吉他	sẽ mang cây đàn guitar của tôi ngay	тэр даруй гитараа авчрах болно	จะเอากีต้าร์ของฉันไปทันที	akan membawa gitar saya segera	akan segera membawa gitarku	मैं तुरंत अपना गिटार लाऊंगा	فوراً گیتار من را خواهد آورد	तुरुन्तै मेरो गितार ल्याउनेछु	میرا گٹار فوراً لے آؤں گا۔	gitarımı hemen getireceğim	יביא את הגיטרה שלי מיד	سوف أحضر جيتاري على الفور
tre bone, mi venigos gitaron	very well, I'll bring a guitar	좋아요, 나는 기타를 가져올께요	très bien, j'apporterai une guitare	さて、私はギターを持ってきます。	很好，我会带一把吉他	很好，我會帶一把吉他	được rồi, tôi sẽ mang theo một cây đàn guitar	За, би гитар авчирна	ดีมาก ฉันจะเอากีตาร์มาด้วย	sangat baik, saya akan membawa gitar	baiklah, aku akan membawa gitar	बहुत अच्छा, मैं एक गिटार लाऊंगा	خیلی خوب، من یک گیتار می آورم	धेरै राम्रो, म गिटार ल्याउँछु	بہت اچھا، میں گٹار لاتا ہوں۔	pekala, bir gitar getireceğim	טוב מאוד, אני אביא גיטרה	حسنًا، سأحضر جيتارًا
mi tuj venigos mian gitaron	I'll bring my guitar right away	나는 즉시 내 기타를 가져올께요	J'apporte ma guitare tout de suite	私はすぐに私のギターを持ってきます。	我马上带上我的吉他	我馬上帶上我的吉他	Tôi sẽ mang cây đàn guitar của tôi tới ngay	Би тэр даруй гитараа авчирна	ฉันจะเอากีตาร์ของฉันไปทันที	Saya akan membawa gitar saya segera	Aku akan segera membawa gitarku	मैं तुरंत अपना गिटार लाऊंगा	فوراً گیتارم را می‌آورم	म तुरुन्तै मेरो गितार ल्याउनेछु	میں ابھی اپنا گٹار لے آؤں گا۔	Hemen gitarımı getireceğim	אני מיד אביא את הגיטרה שלי	سأحضر جيتاري على الفور
atendas vian revenon	waits for your return	당신이 되돌아올 것을 기다립니다	attend ton retour	あなたが戻ってくるのを待ちます	等待你的归来	等待你的歸來	chờ đợi sự trở lại của bạn	Таныг эргэж ирэхийг хүлээж байна	รอการกลับมาของคุณ	menunggu kepulangan awak	menunggumu kembali	आपके लौटने का इंतज़ार कर रहा है	منتظر بازگشت شماست	तपाइँको फिर्ता को लागी प्रतीक्षा गर्दै	آپ کی واپسی کا انتظار ہے۔	dönüşünü bekliyor	מחכה לשובך	ينتظر عودتك
via espereble rapida reveno	your hopefully speedy return	희망컨데 당신의 빠른 복귀	votre retour, je l'espère, rapide	希望に応じてあなたの速い復帰	希望你能尽快回来	希望你能盡快回來	sự trở lại đầy hy vọng của bạn nhanh chóng	Таныг хурдан эргэж ирнэ гэж найдаж байна	หวังว่าคุณจะกลับมาอย่างรวดเร็ว	semoga cepat kembali	semoga kamu cepat kembali	आशा है आपकी शीघ्र वापसी होगी	امیدوارم بازگشت سریع شما	तपाईंको आशा छ छिटो फिर्ता	آپ کی جلد واپسی کی امید ہے۔	umarım hızlı bir şekilde geri dönersiniz	בתקווה לחזור המהירה שלך	نأمل عودتك السريعة
mi atendas rapidan revenon	I expect a quick return	나는 빨리 되돌아오길 기다린다	j'attends un retour rapide	私はすぐに戻ってくるのを待ちます。	我期待快速回报	我期待快速回報	Tôi mong đợi sự trở lại nhanh chóng	Би хурдан эргэж ирнэ гэж найдаж байна	ฉันคาดหวังผลตอบแทนที่รวดเร็ว	Saya mengharapkan pulangan yang cepat	Saya mengharapkan pengembalian yang cepat	मुझे जल्द वापसी की उम्मीद है	من انتظار بازگشت سریع دارم	म छिटो फिर्ताको अपेक्षा गर्दछु	مجھے جلد واپسی کی امید ہے۔	Hızlı bir dönüş bekliyorum	אני מצפה להחזרה מהירה	أتوقع عودة سريعة
atendas vian espereble rapidan revenon	waits for your hopefully speedy return	희망컨데 당신이 빨리 되돌아오기를 기다린다	attend votre retour, je l'espère, rapide	希望するには、すぐに戻ってくるのを待つ	等待着你希望的快速归来	等待著你希望的快速歸來	chờ đợi sự trở lại đầy hy vọng nhanh chóng của bạn	Таныг хурдан эргэж ирэхийг хүлээж байна	รอการกลับมาของคุณโดยหวังว่าจะกลับมาอย่างรวดเร็ว	menunggu kepulangan anda yang diharapkan cepat	menunggu kepulanganmu yang semoga cepat	आपकी आशातीत शीघ्र वापसी की प्रतीक्षा कर रहा है	منتظر بازگشت سریع شماست	तपाईंको आशापूर्वक छिटो फिर्ताको लागि पर्खिरहेको छ	امید ہے کہ آپ کی جلد واپسی کا انتظار ہے۔	umutla hızlı dönüşünüzü bekliyor	מחכה לחזרתך המהירה בתקווה	ينتظر عودتك السريعة على أمل
du tagojn poste	two days later	이틀 후에	deux jours plus tard	2日後	两天后	兩天後	hai ngày sau	хоёр хоногийн дараа	สองวันต่อมา	dua hari kemudian	dua hari kemudian	दो दिन पश्चात	دو روز بعد	दुई दिन पछि	دو دن بعد	iki gün sonra	יומיים לאחר מכן	بعد يومين
ekster la dancejo	outside the dance floor	댄스장 밖에서	en dehors de la piste de danse	ダンス場の外で	舞池外	舞池外	bên ngoài sàn nhảy	бүжгийн талбайн гадна	นอกฟลอร์เต้นรำ	di luar lantai tarian	di luar lantai dansa	डांस फ्लोर के बाहर	خارج از زمین رقص	डान्स फ्लोर बाहिर	ڈانس فلور کے باہر	dans pistinin dışında	מחוץ לרחבת הריקודים	خارج حلبة الرقص
tagojn poste, ekster la dancejo	days later, outside the dance floor	몇일 후에, 댄스장 밖에서	quelques jours plus tard, à l'extérieur de la piste de danse	数日後、ダンス場の外で	几天后，舞池外	幾天后，舞池外	Vài ngày sau, bên ngoài sàn nhảy	хоногийн дараа бүжгийн талбайн гадаа	วันต่อมา นอกฟลอร์เต้นรำ	hari kemudian, di luar lantai tarian	beberapa hari kemudian, di luar lantai dansa	कुछ दिनों बाद, डांस फ्लोर के बाहर	چند روز بعد، بیرون از میدان رقص	दिन पछि, डान्स फ्लोर बाहिर	دن بعد، ڈانس فلور کے باہر	günler sonra dans pistinin dışında	ימים לאחר מכן, מחוץ לרחבת הריקודים	بعد أيام، خارج حلبة الرقص
ej Kabe, vi aspektas ~	hey Kabe, you look ~	헤이 카베(Kabe), 너는 ~ 해 보인다	Hé Kabe, tu as l'air ~	平部（かべ）、お前は～して見える	嘿卡贝你看~	嘿卡貝你看~	này Kabe, bạn nhìn kìa ~	Хөөе Каби, чи харагдаж байна ~	เฮ้ คาเบะ คุณดูสิ~	hey Kabe, awak nampak ~	hei Kabe, kamu lihat ~	अरे काबे, तुम देखो~	هی کابه، تو نگاه می کنی ~	हे काबे, तिमी हेर ~	ارے کبے، تم دیکھ رہے ہو ~	hey Kabe, bak ~	היי קייב, אתה נראה ~	يا كابي، أنت تنظر ~
vi aspektas feliĉega	you look very happy	너는 매우 행복해 보인다	Tu sembles très heureux	あなたはとても幸せそうです。	你看起来很高兴	你看起來很高興	bạn trông rất hạnh phúc	чи их аз жаргалтай харагдаж байна	คุณดูมีความสุขมาก	awak nampak sangat gembira	kamu terlihat sangat bahagia	तुम बहुत खुश दिख रहे हो	به نظر خیلی شاد میرسی	तिमी धेरै खुसी देखिन्छौ	تم بہت خوش لگ رہے ہو	mutlu görünüyorsun	אתה נראה שמח	تبدو سعيدا جدا
jes, mi estas ~	yes, I am ~	예, 나는 ~ 합니다	oui, je le suis ~	はい、私は〜します	是的，我就是~	是的，我就是~	vâng, tôi là ~	тийм ээ, би ~	ใช่แล้ว ฉันเอง~	ya, saya ~	ya, aku ~	हाँ, मैं ~ हूँ	بله، من هستم ~	हो, म हुँ	ہاں، میں ہوں ~	evet öyleyim ~	כן, אני ~	نعم انا~
bele, mi ĝojas!	nicely, I'm glad!	좋아요, 나도 기쁘네요!	bien, je suis content!	さて、私も嬉しいです！	很好，我很高兴！	很好，我很高興！	tốt, tôi rất vui!	сайхан байна, би баяртай байна!	สบายดี ฉันดีใจ!	baik, saya gembira!	baiklah, aku senang!	अच्छा, मुझे ख़ुशी है!	خوب، خوشحالم!	राम्रोसँग, म खुसी छु!	اچھی طرح، میں خوش ہوں!	güzel, sevindim!	יפה, אני שמח!	جيد، أنا سعيد!
kongreso plaĉas al vi?	do you like congress?	대회가 당신의 마음에 드나요?	tu aimes le congrès ?	大会はあなたのお気に入りですか？	你喜欢国会吗？	你喜歡國會嗎？	bạn có thích quốc hội không?	их хуралд дуртай юу?	คุณชอบรัฐสภาไหม?	adakah anda suka kongres?	apakah kamu suka kongres?	क्या आपको कांग्रेस पसंद है?	آیا کنگره را دوست دارید؟	तपाईलाई कांग्रेस मन पर्छ?	کیا آپ کو کانگریس پسند ہے؟	Kongreyi sever misin?	האם אתה אוהב קונגרס?	هل تحب الكونغرس؟
ĉu la kongreso tiom plaĉas al vi?	do you like the congress that much?	대회가 당신에게 그렇게 마음에 드나요?	est-ce que tu aimes tant le congrès ?	大会はあなたにそんなに好きですか？	你这么喜欢大会吗？	你這麼喜歡大會嗎？	bạn có thích đại hội đến thế không?	их хурал тийм их таалагдаж байна уу?	คุณชอบการประชุมมากขนาดนั้นเลยเหรอ?	adakah anda sangat menyukai kongres itu?	apakah kamu sangat menyukai kongres itu?	क्या आपको कांग्रेस इतनी पसंद है?	کنگره را تا این حد دوست دارید؟	के तपाईलाई कांग्रेस यति धेरै मन पर्छ?	کیا آپ کو کانگریس اتنی پسند ہے؟	Kongreyi bu kadar mı seviyorsunuz?	האם אתה כל כך אוהב את הקונגרס?	هل يعجبك المؤتمر إلى هذا الحد؟
jes kaj ne	yes and no	예 그리고 아니요	Oui et non	はい、いいえ	是和否	是和否	có và không	тийм, үгүй	ใช่และไม่	Ya dan tidak	iya dan tidak	हां और ना	بله و خیر	हो र होइन	ہاں اور نہ	Evet ve hayır	כן ולא	نعم و لا
certe mi tre kontentas	I'm sure I'm very satisfied	예 확실히 나는 매우 만족해 합니다	je suis sûr que je suis très satisfait	はい確かに私はとても満足しています	我确信我非常满意	我確信我非常滿意	Tôi chắc chắn là tôi rất hài lòng	Би маш их сэтгэл хангалуун байгаа гэдэгт итгэлтэй байна	ฉันแน่ใจว่าฉันพอใจมาก	Saya pasti saya sangat berpuas hati	Saya yakin saya sangat puas	मुझे यकीन है कि मैं बहुत संतुष्ट हूं	مطمئنم خیلی راضی هستم	म पक्का छु कि म धेरै सन्तुष्ट छु	مجھے یقین ہے کہ میں بہت مطمئن ہوں۔	eminim çok memnun kaldım	אני בטוח שאני מאוד מרוצה	أنا متأكد من أنني راضٍ جدًا
tre kontentas pri IJK	is very satisfied with IJK	청년대회(IJK)에 대해서 매우 만족해 한다	est très satisfait d'IJK	青年大会（IJK）について非常に満足する	对IJK非常满意	對IJK非常滿意	rất hài lòng với IJK	IJK-д маш их сэтгэл хангалуун байна	พอใจกับ IJK มาก	sangat berpuas hati dengan IJK	sangat puas dengan IJK	IJK से बहुत संतुष्ट है	از IJK بسیار راضی است	IJK संग धेरै सन्तुष्ट छ	IJK سے بہت مطمئن ہے۔	IJK'dan çok memnun	מאוד מרוצה מ-IJK	راض جدًا عن IJK
sed estas io alia	but there is something else	하지만 무언가 다른게 있습니다	mais il y a autre chose	しかし、何か違うものがあります	但还有别的事	但還有別的事	Nhưng có cái gì đó khác	гэхдээ өөр зүйл байна	แต่มีอย่างอื่นอีก	tetapi ada sesuatu yang lain	tapi ada hal lain	लेकिन बात कुछ और है	اما چیز دیگری وجود دارد	तर त्यहाँ अरू केहि छ	لیکن کچھ اور ہے	ama başka bir şey daha var	אבל יש משהו אחר	ولكن هناك شيء آخر
io alia, kio feliĉigas min	something else, that makes me happy	다른 무언가, 다를 행복하게 하는	autre chose, ça me fait plaisir	他の何か、違うことを幸せにする	其他让我高兴的事情	其他讓我高興的事情	điều gì đó khác khiến tôi hạnh phúc	өөр зүйл бол намайг аз жаргалтай болгодог	อย่างอื่นที่ทำให้ฉันมีความสุข	sesuatu yang lain, yang membuatkan saya gembira	sesuatu yang lain, itu membuatku bahagia	कुछ और, जो मुझे खुश करता है	چیز دیگری، که من را خوشحال می کند	अरू केही, जसले मलाई खुसी बनाउँछ	کچھ اور، جو مجھے خوش کرتا ہے۔	beni mutlu eden başka bir şey	משהו אחר, שמשמח אותי	شيء آخر، يجعلني سعيدا
estas io kio feliĉigas ~	is something that makes ~	무언가가 있다, ~를 행복하게 만드는	est quelque chose qui fait ~	何かがある、〜を幸せにする	是一些使〜	是一些使〜	là thứ gì đó khiến ~	~ болгодог зүйл юм	เป็นสิ่งที่ทำให้~	ialah sesuatu yang menjadikan ~	adalah sesuatu yang membuat ~	कुछ ऐसा है जो ~ बनाता है	چیزی است که باعث می شود ~	~ बनाउने कुरा हो	ایسی چیز ہے جو ~ بناتی ہے۔	~ yapan bir şeydir	הוא משהו שעושה ~	هو الشيء الذي يجعل ~
pli ĝuste dirite	more correctly said	좀 더 정확히 말해서	dit plus correctement	もっと正確に言って	更正确地说	更正確地說	nói đúng hơn	илүү зөв хэлсэн	พูดถูกต้องมากขึ้น	lebih tepat dikatakan	lebih tepat dikatakan	अधिक सही कहा गया है	درست تر گفته	अझ सही भन्नुभयो	زیادہ درست کہا	daha doğru söyledi	נאמר יותר נכון	قال بشكل صحيح
estas iu, kiu batigas ~	there is someone who beats ~	누군가가 있다, ~를 두드리는	il y a quelqu'un qui bat ~	誰かがいる、〜を叩く	有人打~	有人打~	có người đánh ~	~ зоддог хүн байдаг	มีคนมาตี~	ada orang pukul ~	ada yang mengalahkan ~	कोई तो है जो पीटता है~	کسی هست که ~ می زند	त्यहाँ कोही छ जसले पिट्छ	کوئی ہے جو مارتا ہے۔	döven biri var ~	יש מישהו שמרביץ ~	هناك من يدق ~
iu kiu batigas mian koron	someone who makes my heart beat	누군가, 나의 심장이 뛰게 만드는	quelqu'un qui fait battre mon coeur	誰かが、私の心を走らせる	一个让我心跳的人	一個讓我心跳的人	một người khiến trái tim tôi rung động	миний зүрхийг цохилуулдаг хүн	คนที่ทำให้หัวใจฉันเต้นแรง	seseorang yang membuat jantungku berdegup kencang	seseorang yang membuat jantungku berdetak kencang	कोई है जो मेरे दिल को धड़कता है	کسی که قلبم را به تپش وا می دارد	कोही जसले मेरो मुटुको धड्कन बनाउँछ	کوئی ہے جو میرا دل دھڑکتا ہے۔	kalbimin atmasını sağlayan biri	מישהו שגורם ללב שלי לפעום	شخص يجعل قلبي ينبض
diru, diru, ĉu vi enamiĝis?	say, say, have you fallen in love?	말해봐, 말해봐, 사랑에 빠졌니?	dis, dis, es-tu tombé amoureux ?	教えて、教えて、恋に落ちた？	说吧，说吧，你恋爱了吗？	說吧，說吧，你戀愛了嗎？	nói đi, nói đi, bạn đã yêu chưa?	гэж хэл, чи дурласан уу?	พูด, พูด, คุณเคยตกหลุมรักบ้างไหม?	katakan, katakan, adakah anda telah jatuh cinta?	katakanlah, katakanlah, apakah kamu sudah jatuh cinta?	कहो, कहो, क्या तुम्हें प्यार हो गया है?	بگو، بگو عاشق شدی؟	भन, भन, के तिमी मायामा परेका छौ?	کہو، بولو، کیا تمہیں محبت ہو گئی ہے؟	söyle söyle, aşık oldun mu?	תגיד, תגיד, התאהבת?	قل قل هل وقعت في الحب؟
enamiĝis al iu knabino	fell in love with some girl	어떤 소녀에게 사랑에 빠졌다	je suis tombé amoureux d'une fille	ある女の子に恋に落ちた	爱上了某个女孩	愛上了某個女孩	đã yêu một cô gái nào đó	нэг охинд дурласан	ตกหลุมรักหญิงสาวคนหนึ่ง	jatuh cinta dengan seorang gadis	jatuh cinta dengan seorang gadis	किसी लड़की से प्यार हो गया	عاشق یه دختر شد	कुनै केटीको प्रेममा परे	کسی لڑکی سے محبت ہو گئی۔	bir kıza aşık oldum	התאהב באיזו בחורה	وقعت في حب فتاة ما
ĉu vi enamiĝis al knabino?	did you fall in love with a girl?	소녀에게 사랑에 빠졌니?	es-tu tombé amoureux d'une fille ?	少女に恋に落ちた？	你爱上一个女孩了吗？	你愛上一個女孩了嗎？	bạn đã yêu một cô gái chưa?	чи охинд дурласан уу?	คุณหลงรักผู้หญิงคนหนึ่งหรือเปล่า?	adakah anda jatuh cinta dengan seorang gadis?	apakah kamu jatuh cinta dengan seorang gadis?	क्या आपको किसी लड़की से प्यार हो गया?	عاشق دختری شدی؟	के तपाई केटीसँग प्रेममा पर्नु भयो?	کیا آپ کو کسی لڑکی سے پیار ہو گیا؟	bir kıza mı aşık oldun?	התאהבת בבחורה?	هل وقعت في حب فتاة؟
ne certas ĉu mi enamiĝis	is not sure if I fell in love	내가 사랑에 빠졌는지는 확실하지 않다	je ne suis pas sûr d'être tombé amoureux	私が恋に落ちたかどうかはわかりません。	不确定我是否坠入爱河	不確定我是否墜入愛河	không chắc là mình đã yêu chưa	Би дурласан эсэхээ мэдэхгүй байна	ไม่แน่ใจว่าฉันตกหลุมรักหรือเปล่า	tidak pasti jika saya jatuh cinta	tidak yakin apakah aku jatuh cinta	मुझे यकीन नहीं है कि मुझे प्यार हो गया	مطمئن نیستم عاشق شدم یا نه	पक्का छैन कि म प्रेममा परें	یقین نہیں ہے کہ میں محبت میں گر گیا	aşık olup olmadığımdan emin değilim	לא בטוח אם התאהבתי	لست متأكدا إذا وقعت في الحب
ne certas, sed sentiĝas bone	is not sure, but it feels good	확실하지는 않지만, 좋게 느껴진다	je ne suis pas sûr, mais ça fait du bien	確かではないけど、良く感じる	不确定，但感觉不错	不確定，但感覺不錯	không chắc lắm, nhưng cảm thấy tốt	итгэлтэй биш ч сайхан санагдаж байна	ไม่แน่ใจแต่ก็รู้สึกดี	tidak pasti, tetapi ia berasa baik	tidak yakin, tapi rasanya enak	निश्चित नहीं है, लेकिन अच्छा लगता है	مطمئن نیستم ولی حس خوبی داره	निश्चित छैन, तर राम्रो लाग्छ	یقین نہیں ہے، لیکن یہ اچھا لگتا ہے	emin değilim ama iyi hissettiriyor	לא בטוח, אבל זה מרגיש טוב	لست متأكدا، لكنه يشعر بالارتياح
mi ne certas ĉu mi jam enamiĝis	I'm not sure if I'm in love yet	내가 이미 사랑에 빠졌는지 확실하지 않다	Je ne sais pas si je suis encore amoureux	私はすでに恋に落ちたかどうかはわかりません。	我不确定我是否恋爱了	我不確定我是否戀愛了	Tôi không chắc mình đã yêu chưa	Би дурласан эсэхээ эргэлзэж байна	ฉันไม่แน่ใจว่าฉันมีความรักหรือยัง	Saya tidak pasti sama ada saya sudah jatuh cinta	Aku belum yakin apakah aku sedang jatuh cinta	मुझे अभी तक यकीन नहीं है कि मैं प्यार में हूँ	من هنوز مطمئن نیستم که عاشق شده ام یا نه	म अझै प्रेममा छु कि छैन भन्ने पक्का छैन	مجھے یقین نہیں ہے کہ میں ابھی تک محبت میں ہوں یا نہیں۔	Henüz aşık olup olmadığımdan emin değilim	אני עדיין לא בטוח אם אני מאוהב	لست متأكدا إذا كنت في الحب حتى الآن
sed sentiĝas tre bone	but it feels very good	하지만 매우 좋게 느껴진다	mais ça fait du bien	しかし、とても良く感じる	但感觉很好	但感覺很好	nhưng nó cảm thấy rất tốt	гэхдээ маш сайхан санагдаж байна	แต่รู้สึกดีมาก	tapi rasanya sangat sedap	tapi rasanya sangat enak	लेकिन यह बहुत अच्छा लगता है	اما حس خیلی خوبی داره	तर यो धेरै राम्रो लाग्छ	لیکن یہ بہت اچھا لگتا ہے	ama çok iyi hissettiriyor	אבל זה מרגיש טוב מאוד	لكنه شعور جيد جدا
