eo	en-us	ko-kr	fr	ja-jp	zh-cn	zh-tw	vi-vn	mn	th	ms	id	hi	fa	ne	ur	tr	he	ar
montris la oran kronon	showed the golden crown	그 금관을 보여 줬다	a montré la couronne d'or	その金管を見せてくれた	展示了金色的王冠	展示了金色的王冠	khoe vương miện vàng	алтан титмээ үзүүлэв	ทรงแสดงมงกุฏทองคำ	menunjukkan mahkota emas	menunjukkan mahkota emas	स्वर्ण मुकुट दिखाया	تاج طلایی را نشان داد	सुनको मुकुट देखाए	سنہری تاج دکھایا	altın tacı gösterdi	הראה את כתר הזהב	أظهر التاج الذهبي
nu, mi baldaŭ montros al vi	well, I will show you soon	저, 제가 잠시후에 당신에게 보여 주겠습니다	eh bien, je te montrerai bientôt	私、私はしばらくしてあなたに見せてあげます。	好吧，我很快就会告诉你	好吧，我很快就會告訴你	được rồi, tôi sẽ cho bạn xem sớm	За, би удахгүй үзүүлэх болно	ฉันจะแสดงให้คุณดูเร็ว ๆ นี้	baik, saya akan tunjukkan tidak lama lagi	baiklah, akan kutunjukkan padamu segera	अच्छा, मैं तुम्हें जल्द ही दिखाऊंगा	خوب، به زودی به شما نشان خواهم داد	राम्रो, म चाँडै देखाउनेछु	ٹھیک ہے، میں آپ کو جلد ہی دکھاؤں گا۔	peki, yakında sana göstereceğim	ובכן, אני אראה לך בקרוב	حسنًا، سأريكم قريبًا
sed unue pli da teo	but first more tea	그러나 우선 차를 조금 더	mais d'abord encore du thé	しかし、まず車をもう少し	但首先要喝茶	但首先要喝茶	nhưng trước tiên hãy uống thêm trà	гэхдээ эхлээд дахиад цай	แต่ขอชาเพิ่มก่อน	tetapi teh terlebih dahulu	tapi pertama-tama, minum teh lagi	लेकिन पहले और चाय	اما اول چای بیشتر	तर पहिले थप चिया	لیکن پہلے مزید چائے	ama önce bir çay daha	אבל קודם עוד תה	ولكن أولا المزيد من الشاي
ĉu ankaŭ vi volas?	do you want too?	당신도 원하시나요?	est-ce que tu veux aussi?	あなたも欲しいですか？	你也想要吗？	你也想要嗎？	bạn có muốn không?	чи ч бас хүсэж байна уу?	คุณต้องการเหมือนกันไหม?	awak nak juga?	apakah kamu mau juga?	क्या आप भी चाहते हैं?	آیا شما هم می خواهید؟	के तपाई पनि चाहनुहुन्छ?	کیا آپ بھی چاہتے ہیں؟	Sende istermisin?	אתה רוצה גם?	أتريد أيضا؟
jes, dankon	yes, thank you	예, 감사합니다	Oui merci	はい、ありがとう	是的，谢谢	是的，謝謝	Vâng, cảm ơn	Тиймээ баярлалаа	ใช่ขอบคุณ	Ya terima kasih	ya terima kasih	हाँ धन्यवाद	بله متشکرم	हुन्छ धन्यवाद	ہاں آپ کا شکریہ	Evet teşekkür ederim	כן תודה לך	نعم شكرا لك
en la sama kafejo	in the same cafe'	같은 카페안에서	dans le même café'	同じカフェで	在同一家咖啡馆’	在同一家咖啡館'	trong cùng một quán cà phê&#39;	нэг кафед'	ในร้านกาแฟเดียวกัน'	di kafe yang sama'	di kafe yang sama'	उसी कैफे में'	در همان کافه	एउटै क्याफेमा'	اسی کیفے میں	aynı kafede'	באותו בית קפה'	في نفس المقهى&quot;
io daŭras, daŭrigas tion	something goes on, keeps (doing) that on	무엇인가가 지속된다, 그것을 계속한다	quelque chose se passe, continue à (faire) ça	何かが続く、それを続ける	某件事正在发生，继续（做）这件事	某件事正在發生，繼續（做）這件事	điều gì đó tiếp diễn, tiếp tục (làm) điều đó	ямар нэг зүйл үргэлжилсээр, үргэлжилсээр байна	มีบางอย่างดำเนินต่อไป และทำสิ่งนั้นต่อไป	sesuatu berjalan, terus (melakukan) itu	sesuatu terjadi, terus (lakukan) hal itu	कुछ न कुछ चलता रहता है, चलता रहता है	چیزی ادامه دارد، آن را ادامه می دهد (انجام می دهد).	केहि जान्छ, जारी राख्छ (गर्दै)	کچھ چلتا ہے، اسے جاری رکھتا ہے۔	bir şey oluyor, bunu sürdürüyor (yapıyor)	משהו ממשיך, ממשיך (עושה) את זה	شيء ما يستمر، ويستمر (يفعل) ذلك
plano, plani, planado	a plan, to plan, planning	계획, 계획하다, 계획하기	un plan, planifier, planifier	計画、計画、計画	计划，计划，计划	計劃，計劃，計劃	một kế hoạch, lên kế hoạch, lên kế hoạch	төлөвлөгөө, төлөвлөх, төлөвлөх	แผน, แผน, การวางแผน	rancangan, merancang, merancang	rencana, merencanakan, merencanakan	एक योजना, योजना बनाना, योजना बनाना	برنامه ریزی، برنامه ریزی، برنامه ریزی	योजना, योजना, योजना	ایک منصوبہ، منصوبہ بندی، منصوبہ بندی	plan yapmak, planlamak, planlamak	תוכנית, לתכנן, לתכנן	خطة، تخطيط، تخطيط
ŝi kaj li daŭrigas la planadon	she and he continue the planning	그녀와 그는 계획하기를 계속한다	elle et lui continuent la planification	彼女と彼は計画を続ける	她和他继续计划	她和他繼續計劃	cô và anh tiếp tục kế hoạch	тэр болон тэр төлөвлөлтөө үргэлжлүүлнэ	เธอและเขาวางแผนต่อไป	dia dan dia meneruskan perancangan	dia dan dia melanjutkan perencanaan	वह और वह योजना बनाना जारी रखते हैं	او و او به برنامه ریزی ادامه می دهند	उनी र उनी योजना जारी राख्छन्	وہ اور وہ منصوبہ بندی جاری رکھتے ہیں۔	o ve o planlamaya devam ediyor	היא והוא ממשיכים בתכנון	يواصل هي وهو التخطيط
bonvolu, jen via teo	please, here's your tea	드세요(부디~하세요), 여기 차가 있습니다	s'il te plaît, voici ton thé	お召し上がりください（是非～お願いします）、ここに車があります	请，这是您的茶	請，這是您的茶	xin vui lòng, trà của bạn đây	Таны цай энд байна	ได้โปรด นี่คือชาของคุณ	tolong, ini teh anda	tolong, ini tehmu	कृपया, आपकी चाय यहाँ है	لطفا، اینجا چای شما است	कृपया, यहाँ तपाईंको चिया छ	براہ کرم، یہ رہی آپ کی چائے	lütfen, işte çayın	בבקשה, הנה התה שלך	من فضلك، وهنا الشاي الخاص بك
mi dume rigardis la invitilon	meanwhile I looked at the invitation	그동안 저는 초청장을 봤습니다	pendant ce temps j'ai regardé l'invitation	その間、私は招待状を見ました	与此同时我看了看邀请函	同時我看了看邀請函	trong khi đó tôi nhìn vào lời mời	Энэ хооронд би урилга руу харав	ขณะเดียวกันฉันก็ดูคำเชิญ	sambil tu aku tengok jemputan	sementara itu aku melihat undangan itu	इसी बीच मेरी नजर निमंत्रण पर पड़ी	در همین حال به دعوتنامه نگاه کردم	यसैबीच मैले निमन्त्रणा हेरेँ	اسی دوران میں نے دعوت نامہ پر نظر ڈالی۔	bu arada davetiyeye baktım	בינתיים הסתכלתי על ההזמנה	وفي الوقت نفسه نظرت إلى الدعوة
rigardis la invitilon por IJK	looked at the invitation of IJK	청년대회(IJK) 초청장을 봤습니다	j'ai regardé l'invitation d'IJK	青年大会（IJK）招待状を見ました	看了IJK的邀请函	看了IJK的邀請函	nhìn vào lời mời của IJK	IJK-ийн урилгыг харлаа	ดูคำเชิญของ IJK	tengok jemputan IJK	melihat undangan IJK	IJK के निमंत्रण को देखा	به دعوت IJK نگاه کرد	IJK को निमन्त्रणा हेर्यो	IJK کی دعوت کو دیکھا	IJK'nin davetine baktım	הסתכל על ההזמנה של IJK	نظرت إلى دعوة IJK
mi multon komprenas, sed ne ĉion	I understand much, but not all	나는 많은 것을 이해했지만, 전부는 아닙니다	Je comprends beaucoup de choses, mais pas tout	たくさん理解しましたが、全部ではありません	我明白了很多，但不是全部	我明白了很多，但不是全部	Tôi hiểu nhiều nhưng không phải tất cả	Би маш их зүйлийг ойлгодог, гэхдээ бүгдийг нь биш	ฉันเข้าใจมากแต่ก็ไม่ทั้งหมด	Saya faham banyak, tetapi tidak semua	Saya mengerti banyak, tapi tidak semua	मैं बहुत कुछ समझता हूं, लेकिन सब कुछ नहीं	من خیلی چیزها را می فهمم، اما نه همه	म धेरै बुझ्छु, तर सबै होइन	میں بہت کچھ سمجھتا ہوں، لیکن سب نہیں۔	Çoğunu anlıyorum ama hepsini değil	אני מבין הרבה, אבל לא הכל	أنا أفهم الكثير، ولكن ليس كل شيء
bone bone, nur demandu	all right all right, just ask	좋아요 좋아요, 질문만 해 주세요	très bien, très bien, demande juste	いいね いいね、質問だけしてください	好吧好吧，就问吧	好吧好吧，就問吧	được rồi được rồi, cứ hỏi đi	зүгээр, зүгээр л асуу	เอาล่ะ เอาล่ะ แค่ถาม	baiklah, tanya saja	baiklah baiklah, tanyakan saja	ठीक है ठीक है, बस पूछो	باشه باشه فقط بپرس	ठीक छ, ठीक छ, सोध्नुहोस्	ٹھیک ہے، بس پوچھو	tamam tamam, sadece sor	בסדר בסדר, פשוט תשאל	حسنًا حسنًا، فقط اسأل
jen la aferoj	here are the things	여기 그것들이 있어요	voici les choses	ここにそれらがあります。	这是这些东西	這是這些東西	đây là những thứ	зүйлс энд байна	นี่คือสิ่งต่างๆ	inilah perkaranya	inilah hal-halnya	यहाँ चीजें हैं	در اینجا چیزهایی وجود دارد	यहाँ चीजहरू छन्	یہاں چیزیں ہیں	işte bazı şeyler	הנה הדברים	هذه هي الأشياء
klaraj aferoj	clear things	명확한 것들	choses claires	明確なもの	清楚的事情	清楚的事情	mọi thứ rõ ràng	тодорхой зүйлүүд	เคลียร์สิ่งต่างๆ	perkara yang jelas	hal-hal yang jelas	स्पष्ट बातें	چیزهای روشن	कुराहरू स्पष्ट	صاف چیزیں	şeyleri temizle	דברים ברורים	أشياء واضحة
la aferoj kiuj estas malklaraj	the things that are confusing	그것들, 명확하지 않은 그것들	les choses qui prêtent à confusion	それら、明確ではない	那些令人困惑的事情	那些令人困惑的事情	những điều khó hiểu	төөрөгдүүлсэн зүйлүүд	สิ่งที่น่าสับสน	perkara yang mengelirukan	hal-hal yang membingungkan	जो बातें भ्रमित करने वाली हैं	چیزهایی که گیج کننده هستند	भ्रमित गर्ने चीजहरू	وہ چیزیں جو مبہم ہیں۔	kafa karıştırıcı şeyler	הדברים שמבלבלים	الأشياء التي مربكة
estas malklaraj por mi	are confusing to me	나에게 명확하지 않습니다	me déroutent	私には明確ではない	让我感到困惑	讓我感到困惑	đang làm tôi bối rối	намайг төөрөлдүүлж байна	กำลังทำให้ฉันสับสน	mengelirukan saya	membingungkan saya	मुझे भ्रमित कर रहे हैं	برای من گیج کننده هستند	मलाई भ्रमित छन्	مجھے الجھا رہے ہیں	kafamı karıştırıyor	מבלבלים אותי	مربكة بالنسبة لي
aliĝi, aliĝilo	to join, a registration form	가입하다, 가입원서	pour adhérer, un formulaire d'inscription	参加する、登録申請書	加入，登记表	加入，報名表	để tham gia, một mẫu đăng ký	элсэх, бүртгэлийн маягт	เพื่อเข้าร่วม, แบบฟอร์มลงทะเบียน	untuk menyertai, borang pendaftaran	untuk bergabung, formulir pendaftaran	शामिल होने के लिए, एक पंजीकरण फॉर्म	برای عضویت، فرم ثبت نام	सामेल हुन, एक दर्ता फारम	شامل ہونے کے لیے، ایک رجسٹریشن فارم	katılmak için bir kayıt formu	להצטרפות, טופס הרשמה	للانضمام، استمارة التسجيل
TEJO (la organizo)	The World Esperanto Youth Organization	세계 에스페란토 청년회	L'Organisation Mondiale de la Jeunesse Espéranto	世界エスペラント青年会	世界世界语青年组织	世界世界語青年組織	Tổ chức Thanh niên Esperanto Thế giới	Дэлхийн эсперанто залуучуудын байгууллага	องค์การเยาวชนภาษาเอสเปรันโตโลก	Pertubuhan Belia Esperanto Sedunia	Organisasi Pemuda Esperanto Dunia	विश्व एस्पेरान्तो युवा संगठन	سازمان جهانی جوانان اسپرانتو	विश्व एस्पेरान्तो युवा संगठन	ورلڈ ایسپرانٹو یوتھ آرگنائزیشن	Dünya Esperanto Gençlik Örgütü	ארגון הנוער האספרנטו העולמי	منظمة شباب الاسبرانتو العالمية
Pepo (la TEJO-birdo)	Pepo, a bird that represents the TEJO	Pepo, 세계 에스페란토 청년회 상징인 새	Pepo, un oiseau qui représente le TEJO	ペポ、世界エスペラント青年会のシンボルの鳥	Pepo，代表 TEJO 的鸟	Pepo，代表TEJO 的鳥	Pepo, loài chim đại diện cho TEJO	Пепо бол TEJO-г төлөөлдөг шувуу юм	Pepo นกที่เป็นตัวแทนของ TEJO	Pepo, burung yang mewakili TEJO	Pepo, burung yang melambangkan TEJO	पेपो, एक पक्षी जो तेजो का प्रतिनिधित्व करता है	پپو، پرنده ای که نماینده TEJO است	पेपो, TEJO को प्रतिनिधित्व गर्ने चरा	پیپو، ایک پرندہ جو TEJO کی نمائندگی کرتا ہے۔	Pepo, TEJO'yu temsil eden bir kuş	פפו, ציפור המייצגת את ה-TEJO	بيبو، طائر يمثل تيجو
loĝi, loĝejo	to stay, a place to stay (a lodging)	머무르다 (숙박하다), 숙소	rester, un lieu de séjour (un logement)	滞在する（宿泊）、宿泊施設	停留，住宿的地方（住宿）	停留，住宿的地方（住宿）	chỗ ở, chỗ ở (chỗ ở)	байрлах, байрлах газар (орон байр)	ที่จะอยู่, ที่พัก (ที่พัก)	tinggal, tempat tinggal (penginapan)	untuk tinggal, tempat tinggal (penginapan)	रहने के लिए, रहने के लिए जगह (एक आवास)	ماندن، مکانی برای ماندن (مسکن)	बस्नको लागि, बस्ने ठाउँ (बास)	ٹھہرنے کی جگہ، ٹھہرنے کی جگہ	kalacak yer, kalacak yer (konaklama yeri)	להישאר, מקום לינה (מלון)	مكان للإقامة (مسكن)
amasloĝejo	a lodging for mass people	단체 합숙소 (체육관 바닥 같은 곳)	un logement pour les gens de masse	団体合宿所（体育館の床のような場所）	为大众提供住宿	為大眾提供住宿	một chỗ ở cho người dân đại chúng	олон нийтийн байр	เป็นที่พักอาศัยสำหรับคนจำนวนมาก	tempat penginapan untuk orang ramai	sebuah penginapan untuk orang banyak	बड़े पैमाने पर लोगों के लिए एक आवास	اقامتگاهی برای توده مردم	ठूलो मान्छे को लागि एक आवास	بڑے پیمانے پر لوگوں کے لئے ایک قیام	kitlesel insanlar için bir konaklama yeri	מקום לינה להמונים	سكن للجماهير
aliĝilo estas ilo por al-iĝi	a registration form is a tool for registering	입회원서는 가입-하기 위한 도구이다	un formulaire d'inscription est un outil d'inscription	入会願書は加入-するためのツールである	注册表是一种注册工具	註冊表是一種註冊工具	Mẫu đăng ký là công cụ để đăng ký	бүртгэлийн маягт нь бүртгүүлэх хэрэгсэл юм	แบบลงทะเบียนเป็นเครื่องมือในการลงทะเบียน	borang pendaftaran ialah alat untuk mendaftar	formulir pendaftaran adalah alat untuk mendaftar	पंजीकरण फॉर्म पंजीकरण करने का एक उपकरण है	فرم ثبت نام ابزاری برای ثبت نام است	दर्ता फारम दर्ताको लागि एक उपकरण हो	رجسٹریشن فارم رجسٹریشن کا ایک ٹول ہے۔	kayıt formu kayıt için bir araçtır	טופס הרשמה הוא כלי לרישום	استمارة التسجيل هي أداة للتسجيل
aliĝilo en kiu vi skribas vian nomon, adreson ktp	a membership form in which you write your name, address, etc	입회원서, 그 안에 당신이 당신의 이름, 주소 등등을 쓰는	un formulaire d'adhésion dans lequel vous inscrivez votre nom, adresse, etc.	入会願書、その中にあなたがあなたの名前、住所などを書く	您填写姓名、地址等的会员表格	您填寫姓名、地址等的會員表格	một mẫu đơn thành viên trong đó bạn viết tên, địa chỉ, v.v.	нэр, хаяг гэх мэтийг бичдэг гишүүнчлэлийн маягт	แบบฟอร์มสมาชิกที่คุณเขียนชื่อ ที่อยู่ ฯลฯ	borang keahlian di mana anda menulis nama, alamat, dsb	formulir keanggotaan di mana Anda menulis nama, alamat, dll	एक सदस्यता प्रपत्र जिसमें आप अपना नाम, पता आदि लिखते हैं	یک فرم عضویت که در آن نام، آدرس و غیره خود را بنویسید	एउटा सदस्यता फारम जसमा तपाईंले आफ्नो नाम, ठेगाना, आदि लेख्नुहुन्छ	ایک رکنیت کا فارم جس میں آپ اپنا نام، پتہ وغیرہ لکھتے ہیں۔	adınızı, adresinizi vb. yazdığınız bir üyelik formu	טופס הצטרפות בו אתה כותב את שמך, כתובתך וכו'	نموذج العضوية الذي تكتب فيه اسمك وعنوانك وما إلى ذلك
longa, mallongigo	long, an abbreviation	긴, 축약(약자)	long, une abréviation	長い、短縮（略）	长，缩写	長，縮寫	dài, viết tắt	урт, товчлол	ยาวเป็นคำย่อ	panjang, singkatan	panjang, singkatan	लंबा, एक संक्षिप्त रूप	طولانی، مخفف	लामो, संक्षिप्त नाम	طویل، ایک مخفف	uzun, bir kısaltma	ארוך, קיצור	طويل، وهو اختصار
mallongigo de Tutmonda Esperantista Junulara Organizo	an abbreviation of the World Esperanto Youth Organization	세계에스페란토청년회의 약자	une abréviation de l'Organisation Mondiale de la Jeunesse Espéranto	世界エスペラント青年会議の略	世界世界语青年组织的缩写	世界世界語青年組織的縮寫	tên viết tắt của Tổ chức Thanh niên Esperanto Thế giới	Дэлхийн эсперанто залуучуудын байгууллагын товчлол	ย่อมาจากองค์การเยาวชนภาษาเอสเปรันโตโลก	singkatan daripada Pertubuhan Belia Esperanto Sedunia	singkatan dari Organisasi Pemuda Esperanto Dunia	विश्व एस्पेरान्तो युवा संगठन का संक्षिप्त रूप	مخفف سازمان جهانی جوانان اسپرانتو	विश्व एस्पेरान्तो युवा संगठनको संक्षिप्त नाम	ورلڈ ایسپرانٹو یوتھ آرگنائزیشن کا مخفف	Dünya Esperanto Gençlik Örgütü'nün kısaltması	קיצור של ארגון הנוער האספרנטו העולמי	اختصار لاسم منظمة شباب الاسبرانتو العالمية
Pepo estas la amuza birdo de TEJO	Pepo is the funny bird of TEJO	페포(Pepo)는 세계청년회의 익살스런 새이다	Pepo est le drôle d'oiseau de TEJO	ペポ（Pepo）は世界青年会のおとなしい鳥です	Pepo 是 TEJO 的有趣鸟	Pepo 是TEJO 的有趣鳥	Pepo là chú chim ngộ nghĩnh của TEJO	Пепо бол TEJO-ийн хөгжилтэй шувуу юм	Pepo เป็นนกตลกของ TEJO	Pepo ialah burung TEJO yang kelakar	Pepo adalah burung lucu TEJO	पेपो TEJO का अजीब पक्षी है	پپو پرنده بامزه TEJO است	Pepo TEJO को हास्यास्पद चरा हो	پیپو TEJO کا مضحکہ خیز پرندہ ہے۔	Pepo, TEJO'nun komik kuşu	פפו הוא הציפור המצחיקה של TEJO	بيبو هو طائر تيجو المضحك
amasloĝejo estas ejo kie amaso de homoj loĝas	a mass-lodging is a place where a lot of people stay	단체합숙장은 다수의 사람들이 숙박하는 그곳이다	un hébergement de masse est un endroit où beaucoup de gens séjournent	団体合宿場は多数の人々が宿泊するそこである	大众住宿是很多人住宿的地方	大眾住宿是很多人住宿的地方	nhà nghỉ tập thể là nơi có nhiều người ở	олон нийтийн буудал нь олон хүн амьдардаг газар юм	ที่พักมวลชนเป็นสถานที่ที่มีผู้คนจำนวนมากอาศัยอยู่	penginapan beramai-ramai ialah tempat tinggal ramai orang	penginapan massal adalah tempat dimana banyak orang menginap	सामूहिक आवास वह स्थान है जहाँ बहुत से लोग ठहरते हैं	اقامتگاه دسته جمعی مکانی است که افراد زیادی در آن اقامت می کنند	सामूहिक आवास एउटा ठाउँ हो जहाँ धेरै मानिसहरू बस्छन्	ایک اجتماعی رہائش ایک ایسی جگہ ہے جہاں بہت سے لوگ ٹھہرتے ہیں۔	toplu konaklama, birçok insanın kaldığı bir yerdir	לינה המונית היא מקום בו שוהים הרבה אנשים	السكن الجماعي هو مكان يقيم فيه الكثير من الناس
dormo, dormigilo, dormosako	a sleep, a sleeping pill, a sleeping bag	잠, 수면제, 침낭	un sommeil, un somnifère, un sac de couchage	睡眠、睡眠薬、寝袋	一次睡眠、一颗安眠药、一个睡袋	一次睡眠、一顆安眠藥、一個睡袋	giấc ngủ, thuốc ngủ, túi ngủ	нойр, нойрны эм, унтлагын уут	การนอนหลับ ยานอนหลับ ถุงนอน	tidur, pil tidur, beg tidur	tidur, obat tidur, kantong tidur	एक नींद, एक नींद की गोली, एक स्लीपिंग बैग	یک خواب، یک قرص خواب، یک کیسه خواب	निद्रा, निद्राको चक्की, निद्राको झोला	ایک نیند، ایک نیند کی گولی، ایک سلیپنگ بیگ	uyku, uyku hapı, uyku tulumu	שינה, כדור שינה, שק שינה	نوم، حبة نوم، كيس نوم
