Reveno	sed sentiĝas tre bone	but it feels very good	mais ça fait du bien	Reveno		
Reveno	ŝi eĉ kisis min	she even kissed me	elle m'a même embrassé	Reveno		
Reveno	kisis min sur la buŝon	kissed me on the lips	m'a embrassé sur les lèvres	Reveno		
Reveno	eĉ kisis min dum labambo	even kissed me during La Bamba	m'a même embrassé pendant La Bamba	Reveno		
Reveno	mirinde kian kison	amazing what a kiss	incroyable quel baiser	Reveno		
Reveno	kian kison ŝi donis!	what a kiss she gave!	quel baiser elle a donné !	Reveno		
Reveno	bonege! nun mi komprenas	great! now I understand	super! Maintenant, je comprends	Reveno		
Reveno	komprenas kial vi elradias	understands why you are radiating	comprend pourquoi vous rayonnez	Reveno		
Reveno	vi elradias tiom da ĝojo	you exude so much joy	tu respires tellement de joie	Reveno		
Reveno	fakte, io simila okazis	in fact, something similar happened	en fait, quelque chose de similaire s'est produit	Reveno		
Reveno	io simila okazis al mi	something similar happened to me	quelque chose de similaire m'est arrivé	Reveno		
Reveno	sed mi pensis ke ~	but I thought that ~	mais je pensais que ~	Reveno		
Reveno	pensis ke vi ne ŝatas ~	thought you didn't like ~	je pensais que tu n'aimais pas ~	Reveno		
Reveno	vi ne ŝatas labambumi	you don't like dance on La Bamba	tu n'aimes pas danser sur La Bamba	Reveno		
Reveno	prave, ne okazis	right, it didn't happen	c'est vrai, ça n'est pas arrivé	Reveno		
Reveno	okazis en la dancejo	happened in the dance floor	c'est arrivé sur la piste de danse	Reveno		
Reveno	ne okazis en dancejo	it didn't happen on a dance floor	ça ne s'est pas produit sur une piste de danse	Reveno		
Reveno	sed en la Gufujo	but in the Owlery	mais dans la Volière	Reveno		
Reveno	kaj ne estis kiso	and it was not kiss	et ce n'était pas un baiser	Reveno		
Reveno	ne kiso sed tamen io ĝojiga	not a kiss but still something gratifying	pas un baiser mais quand même quelque chose de gratifiant	Reveno		
Reveno	sed tamen io tre ĝojiga	but nevertheless something very joyful	mais néanmoins quelque chose de très joyeux	Reveno		
Reveno	do, rakontu!	so, tell!	alors, dis-le !	Reveno		
Reveno	mi ne scias kion diri	I don't know what to say	Je ne sais pas quoi dire	Reveno		
Flirtumi	ne scias kion diri vere	don't know what to say really	je ne sais pas vraiment quoi dire	Flirtumi		
Flirtumi	nenio speciala okazis	nothing special happened	rien de spécial ne s'est produit	Flirtumi		
Flirtumi	almenaŭ ankoraŭ ne okazis	at least it hasn't happened yet	au moins, ce n'est pas encore arrivé	Flirtumi		
Flirtumi	sed mi iel sentis ~	but I somehow felt ~	mais je me sentais d'une manière ou d'une autre ~	Flirtumi		
Flirtumi	sentis ke ŝi tre ŝatas min	felt that she likes me very much	je sentais qu'elle m'aimait beaucoup	Flirtumi		
Flirtumi	iel sentis ke ŝi tre ŝatas min	somehow felt that she likes me very much	d'une manière ou d'une autre, j'avais l'impression qu'elle m'aimait beaucoup	Flirtumi		
Flirtumi	ŝi ŝatas min kaj mi ŝin	she likes me and I like her	elle m'aime bien et je l'aime bien	Flirtumi		
Flirtumi	ni longe babilis pri ~	we chatted for a long time about ~	nous avons longuement discuté de ~	Flirtumi		
Flirtumi	longe babilis pri muziko	had a long chat about music	nous avons longuement discuté de musique	Flirtumi		
Flirtumi	kaj poste kantis kune	and then sang together	puis ils ont chanté ensemble	Flirtumi		
Flirtumi	mi pensas ke ŝi flirtumis	I think she was flirting	Je pense qu'elle flirtait	Flirtumi		
Flirtumi	ŝi flirtumis kun mi	she was flirting with me	elle flirtait avec moi	Flirtumi		
Flirtumi	estis tre agrable	it was very nice	c'était très agréable	Flirtumi		
Flirtumi	kiel diras via amiko de Kanado	as your friend from Canada says	comme le dit ton ami du Canada	Flirtumi		
Flirtumi	"Malfeke!", kiel diras amiko de Kanado	"Shit good!", as a friend from Canada says	Merde, c'est bien !, comme dit un ami du Canada	Flirtumi		
Flirtumi	jes, vere! mi esperas ~	yes, really! I hope ~	Oui vraiment! j'espère ~	Flirtumi		
Flirtumi	renkonti ŝin baldaŭ denove	to meet her again soon	pour la revoir bientôt	Flirtumi		
Flirtumi	esperas renkonti ŝin denove	hopes to meet her again	j'espère la revoir	Flirtumi		
Flirtumi	mi esperas renkonti ŝin baldaŭ	I hope to meet her soon	J'espère la rencontrer bientôt	Flirtumi		
Flirtumi	same mi	same me	pareil moi	Flirtumi		
Flirtumi	ĉe lago proksime de ~	at a lake near ~	au bord d'un lac près de ~	Flirtumi		
Flirtumi	lago proksime de kongresejo	a lake near a congress place	un lac près d'un lieu de congrès	Flirtumi		
Flirtumi	proksime de la kongresejo	near the congress hall	près de la salle des congrès	Flirtumi		
Flirtumi	ho, ankaŭ vi estas ~	oh, you are too ~	oh, tu l'es aussi ~	Flirtumi		
Flirtumi	ankaŭ vi estas ĉi tie!?	you are here too!?	tu es là aussi !?	Flirtumi		
Flirtumi	jes, mi renkontos ~	yes, I will meet ~	oui, je vais rencontrer ~	Flirtumi		
Flirtumi	renkontos amikon ĉi tie baldaŭ	will meet a friend here soon	je rencontrerai bientôt un ami ici	Flirtumi		
Flirtumi	por privata interparolo	for a private conversation	pour une conversation privée	Flirtumi		
Flirtumi	renkontos amikon por privata interparolo	will meet a friend for a private conversation	je rencontrerai un ami pour une conversation privée	Flirtumi		
Flirtumi	do, mi ŝatus peti vin ~	so, I would like to ask you ~	alors, je voudrais vous demander ~	Flirtumi		
Flirtumi	mi ŝatus peti vin foriri	I'd like to ask you to leave	J'aimerais te demander de partir	Flirtumi		
Flirtumi	nu, tio ne eblas	well, that's not possible	eh bien, ce n'est pas possible	Flirtumi		
Flirtumi	tute ne eblas fakte	is not possible at all actually	ce n'est pas du tout possible en fait	Flirtumi		
Flirtumi	kial? estas tre grava por mi!	why? it is very important to me!	pourquoi ? c'est très important pour moi!	Flirtumi		
Flirtumi	tiu ĉi renkonto estas tre grava	this meeting is very important	cette réunion est très importante	Flirtumi		
Flirtumi	do, bonvolu lasi min	so please let me go	alors s'il te plaît, laisse-moi partir	Flirtumi		
Flirtumi	bonvolu lasi min sola	please leave me alone	s'il te plaît laisse moi seul	Flirtumi		
Flirtumi	kiel mi ĵus diris,	like I just said,	comme je viens de le dire,	Flirtumi		
Flirtumi	mi diris, tio ne eblas	I said, that is not possible	J'ai dit, ce n'est pas possible	Flirtumi		
Flirtumi	amiko de mi baldaŭ aperos	a friend of mine will appear soon	un de mes amis apparaîtra bientôt	Flirtumi		
Flirtumi	ĉar ankaŭ amiko baldaŭ aperos	because a friend will soon appear too	parce qu'un ami va bientôt apparaître aussi	Flirtumi		
Flirtumi	ankaŭ amiko aperos ĉi tie	a friend will also appear here	un ami apparaîtra également ici	Flirtumi		
Flirtumi	damne, tipe ke ĝuste nun	damn, typically that right now	putain, c'est généralement ça en ce moment	Flirtumi		
Flirtumi	fakte temas pri la knabino	actually it's about the girl	en fait, c'est à propos de la fille	Flirtumi		
Flirtumi	la knabino, pri kiu mi rakontis	the girl, whom I told about	la fille dont j'ai parlé	Flirtumi		
Flirtumi	ŝia nomo estas Jesi cetere	her name is Jesi by the way	au fait, elle s'appelle Jesi	Flirtumi		
Flirtumi	gekaraj! bonege ke vi povis veni	boys and girls! great that you could come	garçons et filles! super que tu puisses venir	Flirtumi		
Flirtumi	mi tiom ĝojas vidi vin	I'm so glad to see you	Je suis si content de te voir	Flirtumi		
Flirtumi	mi ĝojas vidi vin denove	I'm glad to see you again	Je suis content de vous revoir	Flirtumi		
Flirtumi	sed, vi aspektas ~	but, you look ~	mais tu as l'air ~	Flirtumi		
Aspektas Ŝokita	vi aspektas ŝokitaj kaj konfuzitaj	you look shocked and confused	tu as l'air choqué et confus	Aspektas Ŝokita		
Aspektas Ŝokita	ŝokita kaj iel konfuzita	shocked and somehow confused	choqué et quelque peu confus	Aspektas Ŝokita		
Aspektas Ŝokita	evidente	obviously	évidemment	Aspektas Ŝokita		
Aspektas Ŝokita	do, mi supozas ke ~	so, I guess ~	donc je suppose ~	Aspektas Ŝokita		
Aspektas Ŝokita	vi jam ekkomprenis	you already got it	tu l'as déjà eu	Aspektas Ŝokita		
Aspektas Ŝokita	ekkomprenis kiel statas, ĉu?	understand how it is, right?	tu comprends comment c'est, non ?	Aspektas Ŝokita		
Aspektas Ŝokita	supozas ke vi jam komprenis	guess you already understood	je suppose que tu as déjà compris	Aspektas Ŝokita		
Aspektas Ŝokita	jam ekkomprenis kiel statas	already understood how it is	j'ai déjà compris comment c'est	Aspektas Ŝokita		
Aspektas Ŝokita	mi nenion komprenas!	I don't understand anything!	Je ne comprends rien !	Aspektas Ŝokita		
Aspektas Ŝokita	mi pensas ke mi ne volas ~	I think I don't want ~	Je pense que je ne veux pas ~	Aspektas Ŝokita		
Aspektas Ŝokita	ne volas kompreni	doesn't want to understand	ne veut pas comprendre	Aspektas Ŝokita		
Aspektas Ŝokita	mi ne volas kompreni	I don't want to understand	je ne veux pas comprendre	Aspektas Ŝokita		
Aspektas Ŝokita	sed ne estas komplike!	but it's not complicated!	mais ce n'est pas compliqué !	Aspektas Ŝokita		
Aspektas Ŝokita	lasu al mi klarigi	let me explain	laisse-moi expliquer	Aspektas Ŝokita		
Aspektas Ŝokita	kiam Ina rakontis al mi	when Ina told me	quand Ina m'a dit	Aspektas Ŝokita		
Aspektas Ŝokita	rakontis al mi pri sia amiko	told me about his own friend	m'a parlé de son propre ami	Aspektas Ŝokita		
Aspektas Ŝokita	amiko kiu lernis Esperanton	a friend who learned Esperanto	un ami qui a appris l'espéranto	Aspektas Ŝokita		
Aspektas Ŝokita	lernis Esperanton tre rapide	learned Esperanto very quickly	j'ai appris l'espéranto très rapidement	Aspektas Ŝokita		
Aspektas Ŝokita	amiko kiu nomiĝas Kabe	a friend who is called Kabe	un ami qui s'appelle Kabe	Aspektas Ŝokita		
Aspektas Ŝokita	mi kaptis ke ~	I have caught that ~	J'ai compris ça ~	Aspektas Ŝokita		
Aspektas Ŝokita	mi kaptis ke vi du jam konas	I understood that you two already know each other	J'ai compris que vous vous connaissiez déjà	Aspektas Ŝokita		
Aspektas Ŝokita	vi du jam konas unu la alian	you two already know each other	vous vous connaissez déjà tous les deux	Aspektas Ŝokita		
Aspektas Ŝokita	jes, sed. sed kio?	yes, but. but what?	Oui mais. mais quoi?	Aspektas Ŝokita		
Aspektas Ŝokita	havis la impreson ke ~	had the impression that ~	j'ai eu l'impression que ~	Aspektas Ŝokita		
Aspektas Ŝokita	ni ambaŭ havis la impreson	we both had the impression	nous avons tous les deux eu l'impression	Aspektas Ŝokita		
Aspektas Ŝokita	vi flirtumis kun ni, kaj	you flirted with us, and	tu as flirté avec nous, et	Aspektas Ŝokita		
Aspektas Ŝokita	la impreson ke vi flirtumis kun ni	the impression that you were flirting with us	l'impression que tu flirtais avec nous	Aspektas Ŝokita		
Aspektas Ŝokita	tute prave!	absolutely right!	absolument raison!	Aspektas Ŝokita		
Aspektas Ŝokita	pro tio mi volis paroli	that's why I wanted to talk	c'est pourquoi je voulais parler	Aspektas Ŝokita		
Aspektas Ŝokita	mi volis paroli kun vi	I wanted to talk to you	je voulais te parler	Aspektas Ŝokita		
Aspektas Ŝokita	paroli kun vi ambaŭ nun	to talk to you both now	je dois vous parler à tous les deux maintenant	Aspektas Ŝokita		
Aspektas Ŝokita	aŭskultu mi petas	listen to me please	écoute-moi s'il te plaît	Aspektas Ŝokita		
Aspektas Ŝokita	mi ofte tre ŝatas ~	I often really like ~	J'aime souvent beaucoup ~	Aspektas Ŝokita		
Aspektas Ŝokita	ŝatas plurajn personojn samtempe	likes several people at once	aime plusieurs personnes à la fois	Aspektas Ŝokita		
Aspektas Ŝokita	mi ŝatas plurajn personojn	I like several people	J'aime plusieurs personnes	Aspektas Ŝokita		
Aspektas Ŝokita	ne gravas ĉu estas ~	it doesn't matter if it's ~	peu importe si c'est ~	Aspektas Ŝokita		
Aspektas Ŝokita	ĉu estas viro aŭ virino	whether it is a man or a woman	que ce soit un homme ou une femme	Aspektas Ŝokita		
Aspektas Ŝokita	kaj dum IJK okazis ~	and during IJK happened ~	et pendant IJK c'est arrivé ~	Aspektas Ŝokita		
Aspektas Ŝokita	okazis ke mi enamiĝis	it happened that I fell in love	il m'est arrivé de tomber amoureux	Aspektas Ŝokita		
Aspektas Ŝokita	mi enamiĝis al vi ambaŭ!	I fell in love with you both!	Je suis tombée amoureuse de vous deux !	Aspektas Ŝokita		
Aspektas Ŝokita	kaj ni ambaŭ al vi	and we both to you	et nous deux à toi	Aspektas Ŝokita		
Aspektas Ŝokita	ŝajne ni al vi	apparently us to you	apparemment nous à toi	Aspektas Ŝokita		
Aspektas Ŝokita	momenton, mi estas laca	wait a minute, I'm tired	attends une minute, je suis fatigué	Aspektas Ŝokita		
Aspektas Ŝokita	tiom laca ke mi apenaŭ povas ~	so tired that I can hardly ~	tellement fatigué que je peux à peine ~	Aspektas Ŝokita		
Aspektas Ŝokita	mi apenaŭ povas pensi	I can hardly think	J'arrive à peine à penser	Aspektas Ŝokita		
Aspektas Ŝokita	ĉu mi ĝuste komprenis ke ~	did I understand correctly that ~	ai-je bien compris que ~	Aspektas Ŝokita		
Aspektas Ŝokita	Jes! vidu	Yes! take a look	Oui! regarde	Aspektas Ŝokita		
Aspektas Ŝokita	kun ĝojplena vizaĝo	with a joyful face	avec un visage joyeux	Aspektas Ŝokita		
Aspektas Ŝokita	desegnis grandan koron	drew a big heart	a dessiné un grand coeur	Aspektas Ŝokita		
Aspektas Ŝokita	desegnis grandan koron en la sablo	drew a big heart in the sand	a dessiné un grand coeur dans le sable	Aspektas Ŝokita		
Jen nia IJK	en la sablo kaj skribis en ĝi	in the sand and wrote in it	dans le sable et j'ai écrit dessus	Jen nia IJK		
Jen nia IJK	skribis en ĝi "I J K"	wrote in it "I J K"	il y a écrit "I J K"	Jen nia IJK		
Jen nia IJK	post sekunda pripensado diris	after a second thought said	après une seconde réflexion, j'ai dit	Jen nia IJK		skribis en ĝi, yi jo ko
Jen nia IJK	post pripensado diris "Jen nia IJK"	after thinking said "this is our IJK"	après réflexion, j'ai dit "c'est notre IJK"	Jen nia IJK		
Jen nia IJK	kaj ili ekridis!	and they burst out laughing!	et ils ont éclaté de rire !	Jen nia IJK		
Jen nia IJK	ili ĉiuj ekridis!	they all burst out laughing!	ils ont tous éclaté de rire !	Jen nia IJK		
Jen nia IJK	post sekunda pripensado kaj ili ridis	after a second's thought and they laughed	après une seconde de réflexion et ils ont ri	Jen nia IJK		
Jen nia IJK	Kabe diris "Jen nia IJK"	Kabe said "this is our IJK"	Kabe a dit "c'est notre IJK"	Jen nia IJK		
Jen nia IJK	ĉu vi sendis la aliĝilon?	have you sent the application form?	as-tu envoyé le formulaire de candidature ?	Jen nia IJK		
Dua Bulteno	submetis aliĝilon al loka asocio	submitted a registration form to a local association	soumis un formulaire d’inscription à une association locale	Dua Bulteno		
Dua Bulteno	mendis grupe pere de la asocio	ordered as a group through the association	commandé en groupe via l'association	Dua Bulteno		
Dua Bulteno	submetis pere de retpoŝto	submitted via email	soumis par email	Dua Bulteno		
Dua Bulteno	ricevis konfirmilon de aliĝo	received a confirmation of registration	reçu une confirmation d'inscription	Dua Bulteno		
Dua Bulteno	ne trovis kien submeti aliĝilon	could not find where to submit a registration form	je n'ai pas trouvé où soumettre un formulaire d'inscription	Dua Bulteno		
Dua Bulteno	ĉu estas reta aliĝilo?	is there an online application form?	existe-t-il un formulaire de candidature en ligne ?	Dua Bulteno		
Dua Bulteno	ĉu vi submetis paperan mendilon?	did you submit a paper order?	avez-vous soumis une commande papier ?	Dua Bulteno		
Dua Bulteno	ĉu oni devas pagi per eŭro?	do someone have to pay in euro?	est-ce que quelqu'un doit payer en euros ?	Dua Bulteno		
Dua Bulteno	ĉu eblas pagi surloke?	is it possible to pay on the spot?	est-il possible de payer sur place ?	Dua Bulteno		
Dua Bulteno	pagis sed ne ricevis kvitancon	paid but did not receive a receipt	payé mais n'a pas reçu de reçu	Dua Bulteno		
Dua Bulteno	povas pagi grupe pere de loka societo	can pay as a group through local society	peut payer en groupe via la société locale	Dua Bulteno		
Dua Bulteno	ĉu oni repagas se ne ĉeestus?	is there a refund if not present?	y a-t-il un remboursement en cas d'absence ?	Dua Bulteno		
Dua Bulteno	ne mendis specialan programon	did not order a special program	n'a pas commandé de programme spécial	Dua Bulteno		
Dua Bulteno	kiel oni povas mendi aldone?	how can someone order additionally?	comment quelqu'un peut-il commander en plus ?	Dua Bulteno		
Dua Bulteno	kiel oni povas pagi por aldona mendo?	how can someone pay for an additional order?	comment quelqu'un peut-il payer une commande supplémentaire ?	Dua Bulteno		
Dua Bulteno	ĉu ni povas vidi liston de aliĝintoj?	can we see a list of registrants?	peut-on voir une liste des inscrits ?	Dua Bulteno		
Dua Bulteno	mia nomo ne troviĝas en la listo de aliĝintoj	my name is not in the list of registrants	mon nom n'est pas dans la liste des inscrits	Dua Bulteno		
Dua Bulteno	ĉu vi bonvolus kontroli la liston?	could you please check the list?	pourriez-vous s'il vous plaît vérifier la liste ?	Dua Bulteno		
Dua Bulteno	post la limdato de mendado	after the order deadline	après la date limite de commande	Dua Bulteno		
Dua Bulteno	ĉu oni povas aliĝi plu?	can someone join furthermore?	quelqu'un peut-il rejoindre en plus ?	Dua Bulteno		
Dua Bulteno	rezervi hotelon kune	to book a hotel together	réserver un hôtel ensemble	Dua Bulteno		
Dua Bulteno	oni rezervas hotelon, ĉu vi volas akompani?	someone is booking a hotel, do you want to come along?	quelqu'un réserve un hôtel, tu veux venir ?	Dua Bulteno		
Dua Bulteno	se estus libera ĉambro, mi volas tion rezervi	if there was a free room, I want to book it	s'il y avait une chambre libre, je veux la réserver	Dua Bulteno		
Dua Bulteno	ĉu eblas rezervi hotelon surloke?	is it possible to book a hotel on site?	est-il possible de réserver un hôtel sur place ?	Dua Bulteno		
Dua Bulteno	ĉu ni aĉetu aviadilan bileton kune?	should we buy a plane ticket together?	on devrait acheter un billet d'avion ensemble ?	Dua Bulteno		
Dua Bulteno	bileto de kiu dato	ticket from which date	billet à partir de quelle date	Dua Bulteno		
Dua Bulteno	ĉu ni akompanu al la flug-haveno?	shall we accompany you to the airport?	allons-nous vous accompagner à l'aéroport ?	Dua Bulteno		
Dua Bulteno	ĉu estas iu gvidanto ĉe la flug-haveno?	is there a guide at the airport?	y a-t-il un guide à l'aéroport ?	Dua Bulteno		
Dua Bulteno	ĉu oni devas iri al la kongresejo per si mem?	does someone have to go to the convention place by oneself?	est-ce que quelqu'un doit se rendre seul au lieu de la convention ?	Dua Bulteno		
Dua Bulteno	giĉeto de la kongresejo	box office of the convention place	billetterie du lieu de la convention	Dua Bulteno		
Dua Bulteno	mi pagis tamen mia nomŝildo ne troviĝas	I paid but my name tag can't be found	J'ai payé mais mon badge est introuvable	Dua Bulteno		
Dua Bulteno	volas registriĝi surloke	wants to register on the spot	veut s'inscrire sur place	Dua Bulteno		
Dua Bulteno	pagis grupe, tamen kial ne estas markita?	paid in group, yet why is it not marked?	payé en groupe, mais pourquoi ce n'est pas marqué ?	Dua Bulteno		
Dua Bulteno	kongresa sako kun kongresa libro kaj aliaj informiloj	a conference bag with conference book and other information materials	un sac de conférence contenant un livre de conférence et d'autres documents d'information	Dua Bulteno		
Dua Bulteno	rektora halo, ekspozicio	rector's hall, exhibition	salle du recteur, exposition	Dua Bulteno		
Dua Bulteno	malfermo kaj fermo	opening and closing	ouverture et fermeture	Dua Bulteno		
Dua Bulteno	ekzamenejo de KER (Kadro de Eŭropa Referenco)	KER (Common European Framework of Reference) examination place	Lieu d'examen KER (Cadre Européen Commun de Référence)	Dua Bulteno		
Dua Bulteno	kongresa komitato	congressional committee	comité du Congrès	Dua Bulteno		
Dua Bulteno	komitato de asocio	association committee	comité associatif	Dua Bulteno		
Dua Bulteno	kongresa bankedo	convention banquet	banquet de congrès	Dua Bulteno		
Dua Bulteno	Interkona Vespero	Evening of getting to know each other	Soirée pour faire connaissance	Dua Bulteno		
Dua Bulteno	solena inaŭguro	grand opening	Grande ouverture	Dua Bulteno		
Dua Bulteno	Zamenhofa halo	Zamenhof hall	Salle Zamenhof	Dua Bulteno		
Dua Bulteno	LKK (loka kongresa komitato)	LKK (local congress committee)	LKK (comité local du congrès)	Dua Bulteno		
Dua Bulteno	IKU (Internacia Kongresa Universitato)	IKU (International Congress University)	IKU (Université Internationale du Congrès)	Dua Bulteno		
Dua Bulteno	KER-ekzameno je kvar niveloj (Kadro de Eŭropa Referenco)	KER examination at four levels (Common European Framework of Reference)	Examen KER à quatre niveaux (Cadre européen commun de référence)	Dua Bulteno		
Dua Bulteno	internacia arta vespero	international art evening	soirée artistique internationale	Dua Bulteno		
Dua Bulteno	solena fermo	solemn closing	clôture solennelle	Dua Bulteno		
Dua Bulteno	libroservo kun esperanto-libroj	book service with Esperanto books	service de réservation de livres en espéranto	Dua Bulteno		
Dua Bulteno	AIS (Akademio Internacia de la Sciencoj)	AIS (International Academy of Sciences)	AIS (Académie Internationale des Sciences)	Dua Bulteno		
Dua Bulteno	SAT (Sennacieca Asocio Tutmonda)	SAT (World Anarchist Association)	SAT (Association Anarchiste Mondiale)	Dua Bulteno		
Dua Bulteno	prelegoj enuaj	boring lectures	cours ennuyeux	Dua Bulteno		
Dua Bulteno	deĵorantoj por diversaj fakoj	duty officers for various departments	agents de service pour divers départements	Dua Bulteno		
Dua Bulteno	deĵorantoj skipe kunlaboras	buty officers cooperate as a team	les officiers buty coopèrent en équipe	Dua Bulteno		
Dua Bulteno	vojaĝa agento	a travel agent	Un agent de voyage	Dua Bulteno		
Dua Bulteno	aviadila bileto	a plane ticket	un billet d'avion	Dua Bulteno		
Dua Bulteno	nuligis la hotelon kaj aviadilan bileton	canceled the hotel and plane ticket	annulé l'hôtel et le billet d'avion	Dua Bulteno		
Dua Bulteno	kongresa kuriero	convention courier	coursier du congrès	Dua Bulteno		
Dua Bulteno	unua bulteno, dua bulteno	first newsletter, second newsletter	première newsletter, deuxième newsletter	Dua Bulteno		
Dua Bulteno	kongresa temo	congress theme	thème du congrès	Dua Bulteno		
Dua Bulteno	paroligaj kursoj	speaking courses	cours d'expression orale	Dua Bulteno		
Dua Bulteno	provizoraj programoj	temporary programs	programmes temporaires	Dua Bulteno		
Dua Bulteno	ĝeneralaj kondiĉoj de mendado	general conditions of ordering	conditions générales de commande	Dua Bulteno		
Dua Bulteno	antaŭ-kongresaj ekskursoj	pre-congress tours	visites pré-congrès	Dua Bulteno		
Dua Bulteno	post-kongresa ekskurso	a post-congress tour	une tournée post-congrès	Dua Bulteno		
Dua Bulteno	tut-tagaj ekskursoj	full-day tours	visites d'une journée	Dua Bulteno		
Dua Bulteno	duon-tagaj ekskursoj	half-day tours	visites d'une demi-journée	Dua Bulteno		
Dua Bulteno	tabelo de dum-kongresaj ekskursoj	a table of during-congress tours	un tableau des visites pendant le congrès	Dua Bulteno		
Dua Bulteno	aranĝoj ĉirkaŭ la UK (Universala Kongreso)	events around the UK (Universal Congress)	événements à travers le Royaume-Uni (Congrès universel)	Dua Bulteno		
Dua Bulteno	kontaktoj kun amas-komunikiloj	contacts with mass media	contacts avec les médias	Dua Bulteno		
Dua Bulteno	vic-prezidanto prezidis la programon	vice president presided over the program	le vice-président a présidé le programme	Dua Bulteno		
Dua Bulteno	kun landaj aŭtoritatoj	with country authorities	avec les autorités du pays	Dua Bulteno		
Dua Bulteno	sekretario, kasisto	secretary, treasurer	secrétaire, trésorier	Dua Bulteno		
Dua Bulteno	artaj aranĝoj	arts events	événements artistiques	Dua Bulteno		
Dua Bulteno	Infana Kongreseto	Children's Congress	Congrès des enfants	Dua Bulteno		
Dua Bulteno	sociaj retejoj	social websites	sites Web sociaux	Dua Bulteno		
Dua Bulteno	reĝisoro de la kongresa temo	director of the congress theme	directeur du thème du congrès	Dua Bulteno		
Dua Bulteno	rektoro de IKU (Internacia Kongresa Universitato)	rector of IKU (International Congress University)	recteur de l'IKU (International Congress University)	Dua Bulteno		
Dua Bulteno	san-asekuro kaj asekuro de vojaĝo	health insurance and travel insurance	assurance maladie et assurance voyage	Dua Bulteno		
Dua Bulteno	dokumentoj kaj vizoj	documents and visas	documents et visas	Dua Bulteno		
Dua Bulteno	valida identigilo	a valid ID	une pièce d'identité valide	Dua Bulteno		
Dua Bulteno	pasporto valida	a valid passport	un passeport valide	Dua Bulteno		
Dua Bulteno	reguloj pri viz-donado	visa-issuance rules	règles de délivrance des visas	Dua Bulteno		
Dua Bulteno	akiro de vizo	obtaining a visa	obtenir un visa	Dua Bulteno		
Dua Bulteno	CO (centra oficejo) de UEA (Universala Esperanto Asocio)	CO (central office) of UEA (Universal Esperanto Association)	CO (bureau central) de l'UEA (Association universelle d'espéranto)	Dua Bulteno		
Dua Bulteno	elŝuti la oficialan konfirmilon (invitilon)	to download the official confirmation letter (invitation letter)	pour télécharger la lettre de confirmation officielle (lettre d'invitation)	Dua Bulteno		
Dua Bulteno	uzante la mendilon	using the order form	en utilisant le formulaire de commande	Dua Bulteno		
Dua Bulteno	al la viz-dona instanco	to the visa issuing authority	à l'autorité délivrant les visas	Dua Bulteno		
Dua Bulteno	la oficiala kongres-daŭro	the official congress duration	la durée officielle du congrès	Dua Bulteno		
Dua Bulteno	mendis loĝadon pere de UEA (Universala Esperanto Asocio)	booked accommodation through UEA (Universal Esperanto Association)	hébergement réservé via l'UEA (Association universelle d'espéranto)	Dua Bulteno		
