La unua renkonto	saluton!	hello!	Bonjour!	La unua renkonto		
Akceptiĝo	se ne, vi povas membriĝi ĉe la venonta budo	if not, you can join at the next booth	Sinon, vous pouvez rejoindre le prochain stand	Akceptiĝo		
Akceptiĝo	jen kvitancoj de antaŭpagoj	here are receipts of advance payments	Voici les reçus des paiements préalables	Akceptiĝo		
Akceptiĝo	membrokartoj kaj niaj pasportoj	membership cards and our passports	Cartes d'adhésion et nos passeports	Akceptiĝo		
Akceptiĝo	tre bone	very good	très bien	Akceptiĝo		
Akceptiĝo	do, mi vidas ke vi loĝos en amasloĝejo	so, I see you will live in a mass-lodging (crash space)	Donc, je vois que vous vivrez dans un lodging en masse (espace de crash)	Akceptiĝo		
Akceptiĝo	kaj manĝos en la junulargastejo	and will eat in the youth hostel	et mangera dans l'auberge de jeunesse	Akceptiĝo		
Akceptiĝo	ĉu ĝustas tiuj informoj?	are those information correct?	Ces informations sont-elles correctes?	Akceptiĝo		
Akceptiĝo	jes, perfekte	yes, perfect	Oui parfait	Akceptiĝo		
Akceptiĝo	sako kun programo, mapo ktp	a bag with program, map etc	un sac avec programme, carte, etc.	Akceptiĝo		sako kun programo, mapo, kaj tiel plu
Akceptiĝo	vi povas pagi kaj ricevi sakon kun programo, mapo ktp	you can pay and receive a bag with program, map etc	Vous pouvez payer et recevoir un sac avec programme, carte, etc.	Akceptiĝo		vi povas pagi kaj ricevi sakon kun programo, mapo, kaj tiel plu
Akceptiĝo	ĉe la ruĝa budo, tie	at the red booth, there	à la cabine rouge, là	Akceptiĝo		
Akceptiĝo	bone, dankon	good, thank you	bien, merci	Akceptiĝo		
Akceptiĝo	aspektas laca sed sana	looks tired but healthy	Ça a l'air fatigué mais en bonne santé	Akceptiĝo		
Akceptiĝo	tiuj personoj vere aspektis lacaj	those people really looked tired	Ces gens avaient l'air vraiment fatigués	Akceptiĝo		
Akceptiĝo	kaj ne estis tre afablaj	and were not very kind	et n'étaient pas très gentils	Akceptiĝo		
Akceptiĝo	vi pravas	you are right	tu as raison	Akceptiĝo		
Akceptiĝo	sed memoru ke ~	but remember that ~	Mais rappelez-vous que ~	Akceptiĝo		
Akceptiĝo	laboras dum ok horoj	are working for 8 hours	travaillent pendant 8 heures	Akceptiĝo		
Akceptiĝo	la LKK laboras jam dum eble ok horoj	the LKK has been working for maybe eight hours	Le LKK travaille depuis peut-être huit heures	Akceptiĝo		la Lo-Ko-Ko laboras jam dum eble ok horoj 
Akceptiĝo	sen multe da paŭzoj	without much pause	sans trop de pause	Akceptiĝo		
Akceptiĝo	sed memoru ke la LKK laboras sen paŭzoj	but remember that the LKK works without breaks	Mais rappelez-vous que le LKK fonctionne sans pause	Akceptiĝo		sed memoru ke la Lo-Ko-Ko laboras sen paŭzoj
Komenco	babilema dum la semajno	chatty during the week	bavard pendant la semaine	Komenco		
Komenco	mi certas ke ~	I'm sure that ~	Je suis sûr que ~	Komenco		
Komenco	mi certas ke ili estos pli afablaj	I'm sure they'll be kinder	Je suis sûr qu'ils seront plus gentils	Komenco		
Komenco	ili estos pli afablaj kaj babilemaj	they will be kinder and more talkative	Ils seront plus gentils et plus bavards	Komenco		
Komenco	ni trovu ĝin	let's find it	Trouvons-le	Komenco		
Komenco	bone, nun ni trovu la amasloĝejon	well, now let's find the mass-lodging place	Eh bien, maintenant, trouvons le lieu de lodage en masse	Komenco		
Komenco	kaj poste mi ŝatus ion manĝi	and then I would like something to eat	Et puis j'aimerais que quelque chose mange	Komenco		
Komenco	ĉu vi vidis la knabinon ĉe la TEJO-budo?	did you see the girl at the TEJO booth?	Avez-vous vu la fille au stand Tejo?	Komenco		ĉu vi vidis la knabinon ĉe la TE-JO-budo?
Komenco	jes, kio pri ŝi?	yes, what about her?	Oui, qu'en est-il?	Komenco		
Komenco	ĉu vi konas ŝin?	do you know her?	Est-ce que tu la connais?	Komenco		
Komenco	bedaŭrinde ne	unfortunately no	Malheureusement non	Komenco		
Komenco	sed ŝi estas ege bela, ĉu ne?	but she's very pretty, isn't she?	Mais elle est très jolie, non?	Komenco		
Komenco	mi konsentas	I agree	Je suis d'accord	Komenco		
Komenco	tamen ne bone komprenas	however does not understand well	Cependant ne comprend bien	Komenco		
Komenco	mi konsentas tamen ne komprenas	I agree but I don't understand	Je suis d'accord mais je ne comprends pas	Komenco		
Komenco	ĉu al vi plaĉas inoj?	do you like females?	Aimez-vous les femmes?	Komenco		
Komenco	jes, mi volis diri al vi antaŭe	jes, mi volis diri al vi antaŭe	Jes, Mi Volis Diri al VI Antaŭe	Komenco		
Komenco	sed ial ne faris	but for some reason did not	mais pour une raison quelconque n'a pas	Komenco		
Komenco	virinoj plaĉas al mi pli ol viroj	virinoj plaĉas al mi pli ol viroj	virinoj plaĉas al mi pli ol viroj	Komenco		
Komenco	aspekte ktp	aspect etc	Aspect, etc.	Komenco		aspekte kaj tiel plu
Komenco	ĉu, ĉu vi estas ?	are you, are you?	Êtes-vous, êtes-vous?	Komenco		
Komenco	jes, mi estas samseksemulo	yes, I am a homosexual	Oui, je suis un homosexuel	Komenco		
Komenco	oni ankaŭ povas diri lesbo	one can also say lesbian	on peut aussi dire lesbien	Komenco		
Komenco	bone, mi tute ne sciis	well, I didn't know at all	Eh bien, je ne savais pas du tout	Komenco		
Komenco	sed mi ĝojas ke vi diris	but I'm glad you said	Mais je suis content que tu aies dit	Komenco		
Komenco	fakte mi ankaŭ ĝojas ke vi estas samseksemulo	in fact I am glad that you are a homosexual	en fait je suis heureux que vous soyez un homosexuel	Komenco		
Komenco	vi estas la plej afabla kaj agrabla lesbo	you are the kindest and nicest lesbian	Vous êtes la la plus gentille et la plus gentille lesbienne	Komenco		
Komenco	la plej agrabla lesbo kiun mi konas	the nicest lesbian I know	la plus belle lesbienne que je connais	Komenco		
Komenco	dankon! ĉu vi konas aliajn?	thank you! do you know others?	merci! En connaissez-vous les autres?	Komenco		
Komenco	sed kiel vi scias tion?	but how do you know that?	Mais comment le savez-vous?	Komenco		
Komenco	tiu knabino preferas virojn!	that girl prefers men!	Cette fille préfère les hommes!	Komenco		
Komenco	ĉiukaze mi kredas ke tiu knabino preferas virojn!	in any case I believe that girl prefer men!	En tout cas je crois que la fille préfère les hommes!	Komenco		
Komenco	tiu knabino pri kiu vi parolis	that girl whom you were talking about	cette fille dont tu parlais	Komenco		
Komenco	ni vidos	we'll see	nous verrons	Komenco		
Komenco	en la amasloĝejo	in the mass lodging place (a crash space)	dans le logement de masse (un espace de crash)	Komenco		
Komenco	bonan matenon!	good morning!	bonjour!	Komenco		
Komenco	ĉu vi bone dormis?	did you sleep well?	avez-vous bien dormi?	Komenco		
Komenco	apenaŭ vidas	hardly see	voir à peine	Komenco		
Komenco	male, mi apenaŭ dormis	on the contrary, I could hardly sleep	au contraire, je pouvais à peine dormir	Komenco		
Komenco	sed kial?	but why?	mais pourquoi?	Komenco		
Komenco	eble vi estis nervoza pri via unua IJK-tago?	maybe you were nervous about your first IJK day?	Peut-être que vous étiez nerveux à propos de votre première journée IJK?	Komenco		eble vi estis nervoza pri via unua Yi-Jo-Ko-tago?
Komenco	ne vere	not really	pas vraiment	Komenco		
Komenco	la tutan nokton, dum la tuta nokto	all night, all night long	toute la nuit, toute la nuit	Komenco		
Komenco	tre laŭte ronkis	snored very loudly	Rangué très fort	Komenco		
Komenco	simple iu tre laŭte ronkis la tutan nokton	just someone snored very loudly all night	Juste quelqu'un a ronflé très fort toute la nuit	Komenco		
Komenco	ne ĝenu min	don't bother me	Ne me dérange pas	Komenco		
Komenco	kaj tio ege ĝenis min	and that bothered me greatly	Et ça m'a beaucoup dérangé	Komenco		
Komenco	ĉu vi ne aŭdis tion?	didn't you hear that	Tu n'as pas entendu ça	Komenco		
Komenco	tute ne, mi profunde dormis	not at all, I slept deeply	Pas du tout, j'ai dormi profondément	Komenco		
la unua tago	ĉu mi forgesis diri al vi ke ~?	did I forget to tell you that ~?	Ai-je oublié de vous dire que ~?	la unua tago		
la unua tago	orelo, ŝtopi, orelŝtopiloj	ear, to plug, ear plugs	oreille, boucher, bouchons d'oreille	la unua tago		
la unua tago	indas uzi orelŝtopilojn	it is worth using earplugs	il vaut la peine d'utiliser des bouchons d'oreille	la unua tago		
la unua tago	indas uzi ~	is worth using ~	vaut la peine d'utiliser ~	la unua tago		
la unua tago	diris al vi ke indas uzi orelŝtopilojn	told you it's worth using earplugs	vous a dit que cela valait la peine d'utiliser des bouchons d'oreille	la unua tago		
la unua tago	kiam vi dormas en amasloĝejo	when you sleep at a mass lodging (crash place)	Lorsque vous dormez dans un hébergement de masse (Crash Place)	la unua tago		
la unua tago	evidente jes	obviously yes	évidemment oui	la unua tago		
la unua tago	ho, kompatinda Kaĉjo!	oh, poor Katty!	Oh, pauvre Katty!	la unua tago		
la unua tago	pri kiu vi parolas?	who are you talking about?	De qui parles-tu?	la unua tago		
la unua tago	pri vi	about you	au propos de vous	la unua tago		
la unua tago	karesi, karesa nomo, karesnomo	to caress, caressing name, nickname	à caresser, caresser le nom, surnom	la unua tago		
la unua tago	per -ĉjo aŭ -njo eblas krei karesnomojn en Esperanto	with -ĉjo or -njo, it is possible to create nicknames in Esperanto	Avec -ĉjo ou -njo, il est possible de créer des surnoms dans Esperanto	la unua tago		
la unua tago	ha, jes, mi iam legis pri tio	ah, yes, I once read about it	Ah, oui, j'ai lu une fois à ce sujet	la unua tago		
la unua tago	kaj vi do estus Injo?	and then you would be Injo?	Et puis tu serais une injo?	la unua tago		
la unua tago	se vi volas iri tien	if you want go there	Si tu veux y aller	la unua tago		
la unua tago	kioma horo estas nun?	what time is it now?	quelle heure est-il maintenant?	la unua tago		
la unua tago	jam estas kvin minutoj antaŭ la deka	it's already five minutes to ten	c'est déjà cinq minutes à dix	la unua tago		
la unua tago	kvin minutoj antaŭ la deka, aŭ naŭa kvindek kvin	five minutes before ten, or nine fifty-five	cinq minutes avant dix, ou neuf cinquante-cinq	la unua tago		
la unua tago	trafis aŭ maltrafis?	hit or missed?	frapper ou manquer?	la unua tago		
la unua tago	vi maltrafis la matenmanĝon	you missed breakfast	Vous avez manqué le petit déjeuner	la unua tago		
la unua tago	o, fek!	oh, shit!	Oh merde!	la unua tago		o, fek!
la unua tago	ĉu vi estas sata?	are you satisfied ?	es-tu satisfait ?	la unua tago		
la unua tago	kaj mi kiu estas ege malsata	and I who am extremely hungry	et moi qui avons extrêmement faim	la unua tago		
la unua tago	se vi hastos	if you hurry	Si vous vous dépêchez	la unua tago		
la unua tago	povas almenaŭ trafi la malfermon	can at least hit the opening	peut au moins frapper l'ouverture	la unua tago		
la unua tago	la malfermo de la kongreso	the opening of the congress	L'ouverture du Congrès	la unua tago		
la unua tago	vi povas almenaŭ trafi la malfermon de la kongreso	you can at least hit the opening of the convention	Vous pouvez au moins frapper l'ouverture de la convention	la unua tago		
la unua tago	kiam ĝi estos?	when will it be?	quand sera-t-il?	la unua tago		
la unua tago	je kvarono post la deka	at a quarter past ten	à dix heures quart	la unua tago		
la unua tago	ĝi daŭros horon	it will last an hour	ça durera une heure	la unua tago		
la unua tago	kaj je la dek dua eblos manĝi	and at twelve it will be possible to eat	Et à douze ans, il sera possible de manger	la unua tago		
la unua tago	bele mi antaŭĝojas	beautifully I'm looking forward to it	Magnifiquement, je l'attends avec impatience	la unua tago		
la unua tago	diru, kio okazas dum la malfermo?	tell me, what happens during the opening?	Dites-moi, que se passe-t-il pendant l'ouverture?	la unua tago		
la unua tago	ĉu ĝi estas vizitinda entute?	is it worth visiting at all?	Cela vaut-il la peine de visiter?	la unua tago		 ĉu ĝi estas vizitinda entute?
la unua tago	laŭ mi jes	in my opinion yes	à mon avis oui	la unua tago		
la unua tago	kutime ĝi ne estas tre vigla	usually it is not very lively	Habituellement, ce n'est pas très vivant	la unua tago		
la unua tago	sed por vi, kiel "novulo"	but for you as a 'rookie'	Mais pour vous en tant que «recrue»	la unua tago		
la unua tago	povus esti interese ĉeesti ĝin	it might be interesting to attend it	Il pourrait être intéressant d'y assister	la unua tago		
la unua tago	mi supozas ke ~	I guess that ~	Je suppose que ~	la unua tago		
la unua tago	la prezidanto de TEJO diros kelkajn vortojn	the president of TEJO will say a few words	Le président de Tejo dira quelques mots	la unua tago		
la unua tago	la temon de la kongreso	the theme of the congress	Le thème du Congrès	la unua tago		
la unua tago	ŝajnas, verŝajne	it seems, probably	Il semble probablement	la unua tago		
la unua tago	iu de LKK verŝajne prezentos la temon de la kongreso	someone from LKK will probably present the topic of the congress	Quelqu'un de LKK présentera probablement le sujet du Congrès	la unua tago		iu de lokoko verŝajne prezentos la temon de la kongreso
la unua tago	ĉiu IJK havas sian temon	each IJK has its theme	Chaque ijk a son thème	la unua tago		ĉiu Yi-Jo-Ko havas sian temon
la unua tago	mi esperas ke estos iom da muziko ankaŭ	I hope there will be some music as well	J'espère qu'il y aura aussi de la musique	la unua tago		
la unua tago	bone, kie ĝi okazos?	well, where will it take place?	Eh bien, où cela aura-t-il lieu?	la unua tago		
la unua tago	en la granda prelegejo	in the great lecture hall	Dans la grande salle de conférence	la unua tago		
la unua tago	kiel trovi tiun?	how to find that?	Comment trouver ça?	la unua tago		
la unua tago	kiam vi eliras tiun ĉi ejon	when you leave this place	Lorsque vous quittez cet endroit	la unua tago		
la unua tago	iru dekstren ĝis la fino de la konstruaĵo	go right to the end of the building	aller directement à la fin du bâtiment	la unua tago		
Gardanĝeloj	dum eble 100 metroj	for maybe 100 meters	pour peut-être 100 mètres	Gardanĝeloj		dum eble cent metroj
Gardanĝeloj	dekstren denove, rekten dum eble 100 metroj	right again, straight for maybe 100 meters	Encore une fois, droit sur peut-être 100 mètres	Gardanĝeloj		dekstren denove, rekten dum eble cent metroj
Gardanĝeloj	kaj estas flava domo	and there is a yellow house	Et il y a une maison jaune	Gardanĝeloj		
Gardanĝeloj	je la maldekstra flanko de la vojo	on the left side of the road	sur le côté gauche de la route	Gardanĝeloj		
Gardanĝeloj	ŝildoj pri ĉiuj ejoj de IJK	signs about all IJK sites	Signes sur tous les sites IJK	Gardanĝeloj		ŝildoj pri ĉiuj ejoj de Yi-Jo-Ko
Gardanĝeloj	en ĝi, vi trovos ŝildojn pri ĉiuj ejoj de IJK	in it, you will find signs about all IJK sites	Vous y trouverez des panneaux sur tous les sites IJK	Gardanĝeloj		en ĝi, vi trovos ŝildojn pri ĉiuj ejoj de Yi-Jo-Ko
Gardanĝeloj	mi sendos mesaĝon per poŝtelefono	I will send a message by mobile phone	J'enverrai un message par téléphone mobile	Gardanĝeloj		
Gardanĝeloj	se mi ne trovos	if I don't find it	Si je ne le trouve pas	Gardanĝeloj		
Gardanĝeloj	ha, bona ideo, ĝis tie!	oh, good idea, see you up there!	Oh, bonne idée, à bientôt!	Gardanĝeloj		
Gardanĝeloj	en la prelegejo	in the lecture hall	dans la salle de conférence	Gardanĝeloj		
Gardanĝeloj	gardanĝeloj? ĉu vi ŝercas?	guardian angels? are you kidding?	anges gardiens? Est-ce que vous plaisantez?	Gardanĝeloj		
Gardanĝeloj	prezidanto de TEJO	president of TEJO	Président de Tejo	Gardanĝeloj		
Gardanĝeloj	fine mi deziras al vi ĉiuj amuzan semajnon	finally I wish you all a fun week	Enfin je vous souhaite à tous une semaine amusante	Gardanĝeloj		
Gardanĝeloj	laŭ la lastaj informoj	according to the latest information	Selon les dernières informations	Gardanĝeloj		
Gardanĝeloj	ni estas 423 ĉi tie de 38 landoj	we are 423 here from 38 countries	Nous sommes 423 ici de 38 pays	Gardanĝeloj		ni estas kvar cent du-dek tri ĉi tie de tri-dek ok landoj
Gardanĝeloj	mi deziras fruktodonan kaj amuzegan IJK-semajnon	I wish you a fruitful and great fun IJK week	Je vous souhaite une semaine ijk fructueuse et très amusante	Gardanĝeloj		mi deziras fruktodonan kaj amuzegan Yi-Jo-Ko-semajnon
Gardanĝeloj	koran bonvenon nome de la TEJO-estraro	a warm welcome, on behalf of the TEJO board	Un accueil chaleureux, au nom de la carte Tejo	Gardanĝeloj		
Gardanĝeloj	post granda aplaŭdo	after a big round of applause	Après une grande série d'applaudissements	Gardanĝeloj		
Gardanĝeloj	ĉu vi sukcesis resti veka?	did you manage to stay awake?	Avez-vous réussi à rester éveillé?	Gardanĝeloj		
Gardanĝeloj	jes, ĉefe pro mia malsato	yes, mainly because of my hunger	Oui, principalement à cause de ma faim	Gardanĝeloj		
Gardanĝeloj	ne, mi ŝercas, estis interese aŭdi	no, I'm kidding. it was interesting to hear	Non, je plaisante. C'était intéressant d'entendre	Gardanĝeloj		ne, mi ŝercas. estis interese aŭdi
Gardanĝeloj	estis interese aŭdi iom pri la agado	was interesting to hear a little about the activity	était intéressant d'entendre un peu parler de l'activité	Gardanĝeloj		
Gardanĝeloj	aŭdi pri la agado kaj strukturo de la movado	to hear about the activity and structure of the movement	Pour entendre parler de l'activité et de la structure du mouvement	Gardanĝeloj		
Gardanĝeloj	TEJO-kunsido interesos vin	a TEJO session will interest you	Une session Tejo vous intéressera	Gardanĝeloj		
Gardanĝeloj	eble iu el la TEJO-kunsidoj povas interesi vin	maybe some of the TEJO sessions may be interesting to you	Peut-être que certaines des sessions Tejo peuvent être intéressantes pour vous	Gardanĝeloj		
Gardanĝeloj	jes eble	yes maybe	Oui peut-être	Gardanĝeloj		
Gardanĝeloj	mi provos	I will try	J'essaierai	Gardanĝeloj		
Gardanĝeloj	provos ĉeesti	will try to attend	essaiera d'assister	Gardanĝeloj		
Gardanĝeloj	mi provos ĉeesti	I will try to attend	J'essaierai d'assister	Gardanĝeloj		
Gardanĝeloj	ĉeesti unu	to attend one	pour assister à un	Gardanĝeloj		
Gardanĝeloj	ĉeesti por vidi	attend to see	assister à voir	Gardanĝeloj		
Gardanĝeloj	iun tagon	one day (someday)	un jour (un jour)	Gardanĝeloj		
Gardanĝeloj	mi provos iun tagon	I will try one day	J'essaierai un jour	Gardanĝeloj		
Gardanĝeloj	iun tagon ĉeesti	one day to attend	un jour pour y assister	Gardanĝeloj		
Gardanĝeloj	ĉeesti iun tagon por vidi	attend someday to see	assister un jour pour voir	Gardanĝeloj		
Gardanĝeloj	mi provos iun tagon ĉeesti unu por vidi	I will try one day to attend one to see	J'essaierai un jour pour y assister pour voir	Gardanĝeloj		
Gardanĝeloj	kio estas tio?	what is that?	qu'est-ce que c'est?	Gardanĝeloj		
Gardanĝeloj	kio estas tio pri ~	what is that about ~	De quoi parle ~	Gardanĝeloj		
Gardanĝeloj	gard-anĝelo	a guard angel	Un ange de garde	Gardanĝeloj		
Gardanĝeloj	tio pri "gardanĝelo"	that about "guard angel"	Cela à propos de "Guard Angel"	Gardanĝeloj		
Gardanĝeloj	sed kio estas	but what is	mais comment ça	Gardanĝeloj		
Gardanĝeloj	sed kio estas tio pri "gardanĝelo"?	but what is that about a "guardian angel"?	Mais qu'est-ce que c'est un "ange gardien"?	Gardanĝeloj		
Gardanĝeloj	ĉu ŝerco?	a joke?	une blague?	Gardanĝeloj		
Gardanĝeloj	ĉu malbona ŝerco?	a bad joke?	Une mauvaise blague?	Gardanĝeloj		
Gardanĝeloj	malbona ŝerco	bad joke	mauvaise blague	Gardanĝeloj		
Gardanĝeloj	iu ŝerco	some joke	une blague	Gardanĝeloj		
Gardanĝeloj	iu malbona ŝerco	some bad joke	une mauvaise blague	Gardanĝeloj		
Gardanĝeloj	ĉu iu malbona ŝerco?	(is that) some bad joke?	(C'est) une mauvaise blague?	Gardanĝeloj		
Gardanĝeloj	mi ŝercas	I'm joking	Je plaisante	Gardanĝeloj		
Gardanĝeloj	ne, mi ŝercas	no, I'm kidding	Non, je plaisante	Gardanĝeloj		
IJK-preĝo	estis interese aŭdi	it was interesting to hear	C'était intéressant d'entendre	IJK-preĝo		
IJK-preĝo	kiel kontakti ~	how to contact ~	comment contacter ~	IJK-preĝo		
IJK-preĝo	kaj kiel kontakti tiujn anĝelojn?	and how to contact those angels?	Et comment contacter ces anges?	IJK-preĝo		
IJK-preĝo	per iu IJK-preĝo eble	with some IJK prayer maybe	avec une certaine prière ijk peut-être	IJK-preĝo		
IJK-preĝo	provu! se ne funkcias vi povas iri al ~	try it! if it doesn't work you can go to ~	Essayez-le! Si cela ne fonctionne pas, vous pouvez aller à ~	IJK-preĝo		
IJK-preĝo	vi povas iri al la ĉambro "La ĉielo" post la tagmanĝo	you can go to the room "The sky" after lunch	Vous pouvez aller dans la chambre "le ciel" après le déjeuner	IJK-preĝo		
IJK-preĝo	bonege, unue manĝo, poste ĉielen	great, first food, then heaven	Super, d'abord la nourriture, puis le paradis	IJK-preĝo		
IJK-preĝo	unue manĝo, poste ĉielen al la anĝelinoj	first food, then in the sky to the angels	D'abord la nourriture, puis dans le ciel aux anges	IJK-preĝo		
IJK-preĝo	maltro da manĝo	a little meal	un peu de repas	IJK-preĝo		
IJK-preĝo	post iom maltro da manĝo	after a little less food	Après un peu moins de nourriture	IJK-preĝo		
IJK-preĝo	Kabe iras al la ĉambro "La ĉielo"	Kabe goes to the room "the sky"	Kabe va dans la pièce "le ciel"	IJK-preĝo		
IJK-preĝo	saluton. ĉu estas via unua IJK?	hello, is it your first IJK?	Bonjour, est-ce votre premier IJK?	IJK-preĝo		
IJK-preĝo	bone. mi tre ĝojas. mi estas Jesi	ok. I am very glad. I'm Jesi	d'accord. Je suis très content. Je suis Jesi	IJK-preĝo		
IJK-preĝo	kaj tiu ĉi estas jam mia sesa IJK	and this is already my sixth IJK	Et c'est déjà mon sixième ijk	IJK-preĝo		
IJK-preĝo	jen estas papero kun kelkaj demandoj	here is a paper with some questions	Voici un article avec quelques questions	IJK-preĝo		
IJK-preĝo	papero kun demandoj kaj taskoj	paper with questions and tasks	papier avec des questions et des tâches	IJK-preĝo		
IJK-preĝo	kelkaj demandoj kaj taskoj rilate al la kongreso	some questions and tasks related to the congress	Quelques questions et tâches liées au Congrès	IJK-preĝo		
IJK-preĝo	vi provu solvi ilin	you try to solve them	Vous essayez de les résoudre	IJK-preĝo		
IJK-preĝo	mi proponas ke vi provu solvi ilin	I suggest you try to solve them	Je vous suggère d'essayer de les résoudre	IJK-preĝo		
IJK-preĝo	kun Ana de Pollando, Boris de Germanio kaj Nacuko de Japanio	with Ana from Poland, Boris from Germany and Natsuko from Japan	avec Ana de Pologne, Boris d'Allemagne et Natsuko du Japon	IJK-preĝo		
IJK-preĝo	nur voku min se vi bezonos helpon	just call me if you need help	Appelez-moi simplement si vous avez besoin d'aide	IJK-preĝo		
IJK-preĝo	poste en la libroservo	later in the book service	Plus tard dans le service de livre	IJK-preĝo		
IJK-preĝo	kiel do estis en la ĉielo?	so how was it in heaven?	Alors, comment était-ce au paradis?	IJK-preĝo		
IJK-preĝo	mi fakte renkontis veran anĝelinon!	I actually met a real angel!	J'ai rencontré un vrai ange!	IJK-preĝo		
IJK-preĝo	ĉielece, mi pensas ke mi fakte renkontis veran anĝelinon!	heavenly, I think I actually met a real angel!	Céleste, je pense que j'ai rencontré un véritable ange!	IJK-preĝo		
IJK-preĝo	mirinde bela kaj afabla ŝi estis	she was amazingly beautiful and kind	Elle était incroyablement belle et gentille	IJK-preĝo		
IJK-preĝo	ho, Dio mia! kaj kio estas ŝia nomo?	oh my god! and what is her name?	oh mon Dieu! Et quel est son nom?	IJK-preĝo		
IJK-preĝo	aj, mi jam forgesis!	oh, I already forgot!	Oh, j'ai déjà oublié!	IJK-preĝo		
IJK-preĝo	pli kaj pli ebriiĝas	more and more gets drunk	De plus en plus se saoule	IJK-preĝo		
IJK-preĝo	en la trinkejo, Kabe pli kaj pli ebriiĝas	in the bar, Kabe gets more and more drunk	Dans le bar, Kabe devient de plus en plus ivre	IJK-preĝo		
IJK-preĝo	ĉu ankaŭ la trinkejestro?	is the bartender too?	Le barman est-il aussi?	IJK-preĝo		
IJK-preĝo	unu bieron mi petas	one beer please	Une bière, s'il vous plaît	IJK-preĝo		
IJK-preĝo	ĝi kostas 1 eŭron	it costs 1 euro	Cela coûte 1 euro	IJK-preĝo		ĝi kostas unu eŭron
IJK-preĝo	ĉu vi ŝatus ankaŭ ion alian?	would you like something else too?	Voulez-vous aussi autre chose?	IJK-preĝo		
IJK-preĝo	ne dankon, biero sufiĉas por mi	no thanks, beer is enough for me	Non merci, la bière me suffit	IJK-preĝo		
IJK-preĝo	ĉu vere? kio pri vodko, labambo kaj inoj?	really? what about vodka, labamba and females?	vraiment ? Qu'en est-il de la vodka, du labamba et des femmes?	IJK-preĝo		
IJK-preĝo	nu, kial ne	well, why not	Eh bien pourquoi pas	IJK-preĝo		
IJK-preĝo	laŭdire ĝi estas amuza	it is said to be fun	On dit que c'est amusant	IJK-preĝo		
IJK-preĝo	mi ankoraŭ ne dancis labambon, sed laŭdire ĝi estas amuza	I haven't danced the labamba yet, but I'm told it's fun	Je n'ai pas encore dansé le Labamba, mais on me dit que c'est amusant	IJK-preĝo		
IJK-preĝo	dum la kantaĵo "La Bamba" homoj dancas	during the song "La Bamba" people dance	Pendant la chanson "La Bamba", les gens dansent	IJK-preĝo		
IJK-preĝo	homoj dancas en granda rondo	people dance in a big circle	Les gens dansent en grand cercle	IJK-preĝo		
IJK-preĝo	kaj ene de tiu rondo dancas aliaj homoj	and within that circle other people dance	Et dans ce cercle, d'autres personnes dansent	IJK-preĝo		
IJK-preĝo	funkcias tiel ke ~	works so that ~	fonctionne pour que ~	IJK-preĝo		
IJK-preĝo	funkcias tiel ke homoj dancas en granda rondo	works so that people dance in a big circle	fonctionne pour que les gens dansent en grand cercle	IJK-preĝo		
IJK-preĝo	dancas en granda rondo kaj ene de tiu rondo	dances in a big circle and within that circle	danse dans un grand cercle et dans ce cercle	IJK-preĝo		
IJK-preĝo	homoj dancas kaj dancas aliaj homoj	people dance and other people dance	Les gens dansent et les autres dansent	IJK-preĝo		
IJK-preĝo	tiuj dancantaj ene de la rondo	those who dance within the circle	Ceux qui dansent dans le cercle	IJK-preĝo		
