level	ankaŭ ŝi vizitos nin	ona również nas odwiedzi	she will also visit us	grupo	0    	0000-00-00 00:00:00
level	dolĉa kuko	słodkie ciasto	a sweet cake	grupo	0    	0000-00-00 00:00:00
level	ŝi tre ŝatas dolĉan kukon	ona naprawdę lubi słodkie ciasta	she really likes sweet cake	grupo	0    	0000-00-00 00:00:00
level	atentas por ne dikiĝi	uważa, żeby nie przytyć	is careful not to get fat	grupo	0    	0000-00-00 00:00:00
level	kvankam ŝi atentos	chociaż zwróci uwagę	although she will pay attention	grupo	0    	0000-00-00 00:00:00
level	tuj ŝanĝis la opinion	natychmiast zmienił zdanie	immediately changed the mind	grupo	0    	0000-00-00 00:00:00
level	dum la ekskurso	podczas wycieczki	during the excursion	grupo	0    	0000-00-00 00:00:00
level	sen ŝi	bez niej	without her	grupo	0    	0000-00-00 00:00:00
level	li estus tre soleca	byłby bardzo samotny	he would be very lonely	grupo	0    	0000-00-00 00:00:00
level	mi tamen pasigos	Jednak przejdę	I will pass though	grupo	0    	0000-00-00 00:00:00
level	mi tamen pasigos la morgaŭan tagon hejme	Jutro jednak spędzę w domu	I will spend tomorrow at home though	grupo	0    	0000-00-00 00:00:00
level	en juneco	w młodości	in youth	grupo	0    	0000-00-00 00:00:00
level	oni havas	jeden ma	one has	grupo	0    	0000-00-00 00:00:00
level	havas ankaŭ belecon	też ma piękno	also has beauty	grupo	0    	0000-00-00 00:00:00
level	malsimplaj laboroj	skomplikowane prace	complicated jobs	grupo	0    	0000-00-00 00:00:00
level	malsimplajn laborojn	skomplikowane prace (cel)	complicated jobs (objective)	grupo	0    	0000-00-00 00:00:00
level	devus plisimpligi	powinno uprościć	should simplify	grupo	0    	0000-00-00 00:00:00
level	en tiu aĝo	w tym wieku	at that age	grupo	0    	0000-00-00 00:00:00
level	li jam fariĝis ~	już stał się ~	he has already become ~	grupo	0    	0000-00-00 00:00:00
level	estro de la sporta klubo	szef klubu sportowego	head of the sports club	grupo	0    	0000-00-00 00:00:00
level	monon oni metas	ktoś wkłada pieniądze	one puts money	grupo	0    	0000-00-00 00:00:00
level	en monujon	do portfela	into a wallet	grupo	0    	0000-00-00 00:00:00
level	metas en monujon	wkłada do torebki	puts in a purse	grupo	0    	0000-00-00 00:00:00
level	sekvu la ekzemplojn	postępuj zgodnie z przykładami	follow the examples	grupo	0    	0000-00-00 00:00:00
level	de la bonaj familianoj	od dobrych członków rodziny	from the good family members	grupo	0    	0000-00-00 00:00:00
level	ĉu amikeco pli feliĉigas?	czy przyjaźń czyni cię szczęśliwszym?	does friendship make you happier?	grupo	0    	0000-00-00 00:00:00
level	feliĉigas vin	czyni cię szczęśliwym	makes you happy	grupo	0    	0000-00-00 00:00:00
level	ol la amo	niż miłość	than the love	grupo	0    	0000-00-00 00:00:00
level	kiel ofte vi ~ ?	jak często ~?	how often do you ~ ?	grupo	0    	0000-00-00 00:00:00
level	vi skribas leterojn al ~	piszesz listy do ~	you write letters to ~	grupo	0    	0000-00-00 00:00:00
level	skrivas leterojn al viaj amikinoj	pisze listy do twoich koleżanek	writes letters to your girl friends	grupo	0    	0000-00-00 00:00:00
level	viaj amikinoj en Italio	twoje przyjaciółki we Włoszech	your girl friends in Italy	grupo	0    	0000-00-00 00:00:00
level	la rilato inter vi kaj via instruisto	relacji między Tobą a Twoim nauczycielem	the relation between you and your teacher	grupo	0    	0000-00-00 00:00:00
level	ĉu la rilato ŝanĝiĝis?	czy związek się zmienił?	has the relationship changed?	grupo	0    	0000-00-00 00:00:00
level	ĉu vi jam scias ~ ?	czy już wiesz ~?	do you already know ~ ?	grupo	0    	0000-00-00 00:00:00
level	sufiĉe bone	bardzo dobrze	quite well	grupo	0    	0000-00-00 00:00:00
level	estis vespero en ~	był wieczór w ~	it was evening in ~	grupo	0    	0000-00-00 00:00:00
level	centoj da homoj	setki ludzi	hundreds of people	grupo	0    	0000-00-00 00:00:00
level	plenigas la placon	wypełnia kwadrat	fills the square	grupo	0    	0000-00-00 00:00:00
level	junuloj kaj militistoj	młodzi mężczyźni i żołnierze	young men and soldiers	grupo	0    	0000-00-00 00:00:00
level	maristoj de sur la ŝipoj	marynarze ze statków	sailors from the ships	grupo	0    	0000-00-00 00:00:00
level	elstara sinjorino	wybitna pani	outstanding lady	grupo	0    	0000-00-00 00:00:00
level	elstaraj sinjorinoj	wybitne panie	outstanding ladies	grupo	0    	0000-00-00 00:00:00
level	alilandaj vojaĝantoj	zagraniczni podróżnicy	foreign travelers	grupo	0    	0000-00-00 00:00:00
level	ĉiuj moviĝas al urbomezo	wszyscy przenoszą się do centrum miasta	everyone is moving to the city center	grupo	0    	0000-00-00 00:00:00
level	iom plue	trochę dalej	a little further	grupo	0    	0000-00-00 00:00:00
level	ne malproksime de la maro	niedaleko morza	not far from the sea	grupo	0    	0000-00-00 00:00:00
level	troviĝis malgranda placo	był mały plac	there was a small square	grupo	0    	0000-00-00 00:00:00
level	iom plue sed ne malproksime	trochę dalej, ale nie daleko	a little further but not far	grupo	0    	0000-00-00 00:00:00
level	fine de ĝi	na końcu	at the end of it	grupo	0    	0000-00-00 00:00:00
level	proksime de la maro	niedaleko morza	near the sea	grupo	0    	0000-00-00 00:00:00
level	proksime staris homo	w pobliżu stał mężczyzna	a man stood nearby	grupo	0    	0000-00-00 00:00:00
level	laŭ la vestaĵo	według ubioru	according to the clothing	grupo	0    	0000-00-00 00:00:00
level	oni facile scii ~	można łatwo wiedzieć ~	one may know easily ~	grupo	0    	0000-00-00 00:00:00
level	oni povis ekscii, ke ~	można było się tego dowiedzieć ~	it was possible to find out that ~	grupo	0    	0000-00-00 00:00:00
level	gondolisto de iu riĉulo	gondolier bogatego człowieka	a rich man's gondolier	grupo	0    	0000-00-00 00:00:00
level	povis ekscii, ke li estas gondolisto	dowiedział się, że jest gondolierem	could find out that he was a gondolier	grupo	0    	0000-00-00 00:00:00
level	li rigardis ~	spojrzał~	he looked ~	grupo	0    	0000-00-00 00:00:00
level	rigardis la ĝojan hommulton	spojrzał na radosny tłum	looked at the joyful crowd	grupo	0    	0000-00-00 00:00:00
level	rideto lumigis lian vizaĝon	uśmiech rozjaśnił jego twarz	a smile lit up his face	grupo	0    	0000-00-00 00:00:00
level	kiam li ekvidis mariston	kiedy zobaczył marynarza	when he saw a sailor	grupo	0    	0000-00-00 00:00:00
level	la mariston, kiu alvenis	marynarz, który przybył	the sailor who arrived	grupo	0    	0000-00-00 00:00:00
level	la flanko de la maro	stronie morza	the side of the sea	grupo	0    	0000-00-00 00:00:00
level	alvenis el la flanko de la maro	przybył od strony morza	arrived from the side of the sea	grupo	0    	0000-00-00 00:00:00
level	ĉu tio estas vi, Stefano?	czy to ty, Stephen?	is that you, Stephen?	grupo	0    	0000-00-00 00:00:00
level	ekkriis la gondolisto	— zawołał gondolier	exclaimed the gondolier	grupo	0    	0000-00-00 00:00:00
level	ĉiuj diras, ke ~	wszyscy tak mówią ~	everyone says that ~	grupo	0    	0000-00-00 00:00:00
level	en la manojn de la Turkoj	w ręce Turków	into the hands of the Turks	grupo	0    	0000-00-00 00:00:00
level	ke vi falis en la manojn de la Turkoj	że wpadłeś w ręce Turków	that you fell into the hands of the Turks	grupo	0    	0000-00-00 00:00:00
level	ni renkontis unu	spotkaliśmy jednego	we met one	grupo	0    	0000-00-00 00:00:00
level	el niaj ŝipoj	z naszych statków	from our ships	grupo	0    	0000-00-00 00:00:00
level	ĝi sekvis nin	podążało za nami	it followed us	grupo	0    	0000-00-00 00:00:00
level	dum pli ol unu horo	przez ponad godzinę	for more than an hour	grupo	0    	0000-00-00 00:00:00
level	sed ne estas facile iri ~	ale nie jest łatwo iść ~	but it is not easy to go ~	grupo	0    	0000-00-00 00:00:00
level	iri pli rapide ol nia ŝipo	płynąć szybciej niż nasz statek	to go faster than our ship	grupo	0    	0000-00-00 00:00:00
level	kiaj novaĵoj estas tie ĉi?	jakie tu są wieści?	what news is here?	grupo	0    	0000-00-00 00:00:00
level	tie ĉi en Venecio	tutaj, w Wenecji	here in Venice	grupo	0    	0000-00-00 00:00:00
level	nenio interesa	nic interesującego	nothing interesting	grupo	0    	0000-00-00 00:00:00
level	nur granda malfeliĉo	po prostu wielkie nieszczęście	just a big misfortune	grupo	0    	0000-00-00 00:00:00
level	ĉu vi konas Pietron?	znasz Pietra?	do you know Pietro?	grupo	0    	0000-00-00 00:00:00
level	mi konas lin	znam go	I know him	grupo	0    	0000-00-00 00:00:00
level	granda ŝipo subakvigis lian gondolon	duży statek zanurzył jego gondolę	a large ship submerged his gondola	grupo	0    	0000-00-00 00:00:00
level	kaj kio pri li?	i co z nim?	and what about him?	grupo	0    	0000-00-00 00:00:00
level	la gondolo subakviĝis	gondola zatonęła	the gondola sank	grupo	0    	0000-00-00 00:00:00
level	okazis, ke ~	zdarzyło się, że ~	it happened that ~	grupo	0    	0000-00-00 00:00:00
level	ni troviĝis proksime	byliśmy blisko	we were close	grupo	0    	0000-00-00 00:00:00
level	ni prenis lin en nian gondolon	zabraliśmy go naszą gondolą	we took him in our gondola	grupo	0    	0000-00-00 00:00:00
level	en la sama tempo	w tym samym czasie	at the same time	grupo	0    	0000-00-00 00:00:00
level	mia estro subakviĝis	mój szef utonął	my boss drowned	grupo	0    	0000-00-00 00:00:00
level	por helpi junulinon	pomóc młodej kobiecie	to help a young woman	grupo	0    	0000-00-00 00:00:00
level	junulinon, kiu preskaŭ mortis	młoda kobieta, która prawie umarła	a young woman who almost died	grupo	0    	0000-00-00 00:00:00
level	kun sia onklo	ze swoim wujkiem	with his uncle	grupo	0    	0000-00-00 00:00:00
level	preskaŭ mortis kun sia onklo	prawie umarł razem ze swoim wujkiem	almost died with his uncle	grupo	0    	0000-00-00 00:00:00
level	tie estis junulino	była młoda kobieta	there was a young woman	grupo	0    	0000-00-00 00:00:00
level	lin ni ne povis helpi	nie mogliśmy mu pomóc	we could not help him	grupo	0    	0000-00-00 00:00:00
level	estis grava homo	był ważną osobą	was an important person	grupo	0    	0000-00-00 00:00:00
level	kio alvenigis vin en Venecion?	co sprowadziło cię do Wenecji?	what brought you to Venice?	grupo	0    	0000-00-00 00:00:00
level	amiko mia	mój przyjaciel	my friend	grupo	0    	0000-00-00 00:00:00
level	la maristo ekrigardis	marynarz podniósł wzrok	the sailor looked up	grupo	0    	0000-00-00 00:00:00
level	rapide ekrigardis sian amikon	szybko spojrzał na przyjaciela	quickly glanced at his friend	grupo	0    	0000-00-00 00:00:00
level	kaj komencis diri	i zaczął mówić	and began to say	grupo	0    	0000-00-00 00:00:00
level	do vi scias ~	więc wiesz ~	so you know ~	grupo	0    	0000-00-00 00:00:00
level	mi alportis ~	Przyniosłem ~	I brought ~	grupo	0    	0000-00-00 00:00:00
level	la gondolisto subite haltigis lin	gondolier nagle go zatrzymał	the gondolier suddenly stopped him	grupo	0    	0000-00-00 00:00:00
level	li diris	powiedział	he said	grupo	0    	0000-00-00 00:00:00
level	tiam iu homo pasis	potem przechodził mężczyzna	then a man passed by	grupo	0    	0000-00-00 00:00:00
level	iu homo pasis apud li	przechodził obok niego mężczyzna	a man passed by him	grupo	0    	0000-00-00 00:00:00
level	li ankoraŭ ne estis tridekjara	nie miał jeszcze trzydziestu lat	he was not yet thirty	grupo	0    	0000-00-00 00:00:00
level	kaj lia vizaĝo estis senkolora	a jego twarz była bezbarwna	and his face was colorless	grupo	0    	0000-00-00 00:00:00
level	lia iro estis certa kaj facila	jego odejście było pewne i łatwe	his going was sure and easy	grupo	0    	0000-00-00 00:00:00
level	lia vizaĝo estis malĝoja	jego twarz była smutna	his face was sad	grupo	0    	0000-00-00 00:00:00
level	kiam li ekvidis la homon, ~	kiedy zobaczył mężczyznę, ~	when he saw the man, ~	grupo	0    	0000-00-00 00:00:00
level	oni diras, ke ~	mówi się, że ~	it is said that ~	grupo	0    	0000-00-00 00:00:00
level	multaj gravuloj donas ~	wiele ważnych osób daje ~	many important people give ~	grupo	0    	0000-00-00 00:00:00
level	sekreta laboro	tajna praca	secret work	grupo	0    	0000-00-00 00:00:00
level	sekretaj laboroj	tajne prace	secret jobs	grupo	0    	0000-00-00 00:00:00
level	donas sekretajn laborojn al li	daje mu tajne prace	gives secret jobs to him	grupo	0    	0000-00-00 00:00:00
level	tro da sekretoj	zbyt wiele tajemnic	too many secrets	grupo	0    	0000-00-00 00:00:00
level	li scias tro da sekretoj	zna zbyt wiele tajemnic	he knows too many secrets	grupo	0    	0000-00-00 00:00:00
level	tial ili timas	dlatego się boją	therefore they are afraid	grupo	0    	0000-00-00 00:00:00
level	sendi lin en malliberejon	wysłać go do więzienia	to send him to prison	grupo	0    	0000-00-00 00:00:00
level	diris la maristo	powiedział marynarz	said the sailor	grupo	0    	0000-00-00 00:00:00
level	kaj dum li parolis	i jak mówił	and as he spoke	grupo	0    	0000-00-00 00:00:00
level	li montris la domegon	– wskazał na rezydencję	he pointed to the mansion	grupo	0    	0000-00-00 00:00:00
level	la domego de Doĝoj	rezydencja Dożów	the mansion of Doges	grupo	0    	0000-00-00 00:00:00
level	multaj gravuloj bezonas lian helpon	wiele ważnych osób potrzebuje jego pomocy	many important people need his help	grupo	0    	0000-00-00 00:00:00
level	kiom ili pagas?	ile płacą?	how much they pay?	grupo	0    	0000-00-00 00:00:00
level	pagas al li	płaci mu	pays him	grupo	0    	0000-00-00 00:00:00
level	pagas por unu mortigo	płaci za jedno zabójstwo	pays for one kill	grupo	0    	0000-00-00 00:00:00
level	certe ne malpli ol ~	z pewnością nie mniej niż ~	certainly not less than ~	grupo	0    	0000-00-00 00:00:00
level	ol cent moneroj	niż sto monet	than a hundred coins	grupo	0    	0000-00-00 00:00:00
level	ne forgesu, ke ~	nie zapominaj o tym ~	don't forget that ~	grupo	0    	0000-00-00 00:00:00
level	ke li laboras por tiuj	że dla nich pracuje	that he works for them	grupo	0    	0000-00-00 00:00:00
level	por tiuj, kiuj havas sufiĉe da mono	dla tych, którym wystarczy pieniędzy	for those who have enough money	grupo	0    	0000-00-00 00:00:00
level	por pagi al li	mu zapłacić	to pay him	grupo	0    	0000-00-00 00:00:00
level	en Venecio estas ~	w Wenecji jest ~	in Venice there is ~	grupo	0    	0000-00-00 00:00:00
level	tiuj aferoj	te rzeczy	those things	grupo	0    	0000-00-00 00:00:00
level	forgesi tiujn aferojn	zapomnieć o tych rzeczach	to forget those things	grupo	0    	0000-00-00 00:00:00
level	aferoj, kiujn estas pli bone forgesi	rzeczy, o których lepiej zapomnieć	things that are better forgotten	grupo	0    	0000-00-00 00:00:00
level	se vi volas trankvile manĝi	jeśli chcesz zjeść w spokoju	if you want to eat in peace	grupo	0    	0000-00-00 00:00:00
level	trankvile manĝi vian panon	aby w spokoju zjeść swój chleb	to eat your bread in peace	grupo	0    	0000-00-00 00:00:00
level	estis iom da silento	zapadła cisza	there was some silence	grupo	0    	0000-00-00 00:00:00
level	kaj poste	i później	and later	grupo	0    	0000-00-00 00:00:00
level	la gondolisto denove ekparolis	gondolier przemówił ponownie	the gondolier spoke again	grupo	0    	0000-00-00 00:00:00
level	vi venis ĝustatempe	przyszedłeś w samą porę	you came just in time	grupo	0    	0000-00-00 00:00:00
level	por vidi ŝipkuron	aby zobaczyć wyścigi łodzi	to see a boat race	grupo	0    	0000-00-00 00:00:00
level	iu diris malforte	ktoś powiedział słabo	someone said weakly	grupo	0    	0000-00-00 00:00:00
level	proksime de la gondolisto	niedaleko gondoliera	near the gondolier	grupo	0    	0000-00-00 00:00:00
level	la estro de la urbo	burmistrz miasta	the mayor of the city	grupo	0    	0000-00-00 00:00:00
level	senvorte montris al la gondolo	bez słowa wskazał na gondolę	wordlessly pointed to the gondola	grupo	0    	0000-00-00 00:00:00
level	diris la gondolisto	powiedział gondolier	said the gondolier	grupo	0    	0000-00-00 00:00:00
level	kaj prenis la manon de sia amiko	i wziął przyjaciela za rękę	and took his friend's hand	grupo	0    	0000-00-00 00:00:00
level	ĵetas la paperon	rzuca papier	throws the paper	grupo	0    	0000-00-00 00:00:00
level	en la paperujon	do kosza na papier	into the paper bin	grupo	0    	0000-00-00 00:00:00
level	la knabinoj ĵetis la paperojn	dziewczyny rzuciły papiery	the girls threw the papers	grupo	0    	0000-00-00 00:00:00
level	kie estas mia skribilo?	gdzie jest mój długopis	where is my pen	grupo	0    	0000-00-00 00:00:00
level	mi volas respondi al li	Chcę mu odpowiedzieć	I want to answer him	grupo	0    	0000-00-00 00:00:00
level	la suno malaperis	słońce zniknęło	the sun disappeared	grupo	0    	0000-00-00 00:00:00
level	kaj nun estas preskaŭ malhele	a teraz jest już prawie ciemno	and now it is almost dark	grupo	0    	0000-00-00 00:00:00
level	bonvolu manĝi	Proszę jedz	please eat	grupo	0    	0000-00-00 00:00:00
level	bonvolu manĝi la panon	proszę zjeść chleb	please eat the bread	grupo	0    	0000-00-00 00:00:00
level	per manĝiloj	ze sztućcami	with cutlery	grupo	0    	0000-00-00 00:00:00
level	pardonu min	Przepraszam	excuse me	grupo	0    	0000-00-00 00:00:00
level	rajtas resti	wolno pozostać	is allowed to stay	grupo	0    	0000-00-00 00:00:00
level	mi ne rajtas resti	Nie mam prawa zostać	I have no right to stay	grupo	0    	0000-00-00 00:00:00
level	ĉu vi povas kunporti ~ ?	możesz przynieść ~?	can you bring ~ ?	grupo	0    	0000-00-00 00:00:00
level	de mia fratino	od mojej siostry	from my sister	grupo	0    	0000-00-00 00:00:00
level	kiam vi aĉetis ~ ?	kiedy kupiłeś ~?	when did you buy ~ ?	grupo	0    	0000-00-00 00:00:00
level	aĉetis tiun muzikilon	kupił ten instrument muzyczny	bought that musical instrument	grupo	0    	0000-00-00 00:00:00
level	kiu laste uzis ?	kto używał ostatni?	who used last?	grupo	0    	0000-00-00 00:00:00
level	uzis mian ŝlosilon	użyłem mojego klucza	used my key	grupo	0    	0000-00-00 00:00:00
level	ĉu vi veturis?	jeździłeś?	did you drive?	grupo	0    	0000-00-00 00:00:00
level	en Venecio	w Wenecji	in Venice	grupo	0    	0000-00-00 00:00:00
level	ankaŭ per gondolo	także gondolą	also by gondola	grupo	0    	0000-00-00 00:00:00
level	ĉu vi povos ekdormi?	będziesz mógł zasnąć?	will you be able to fall asleep?	grupo	0    	0000-00-00 00:00:00
level	tiam, kiam silentiĝis	potem, kiedy zapadła cisza	then, when there was silence	grupo	0    	0000-00-00 00:00:00
level	la sinjoro estis alta	pan był wysoki	the gentleman was tall	grupo	0    	0000-00-00 00:00:00
level	alta, dika	Wysoki tłuszcz	tall, fat	grupo	0    	0000-00-00 00:00:00
level	dika, peza	gruby, ciężki	thick, heavy	grupo	0    	0000-00-00 00:00:00
level	peza kaj larĝa	ciężki i duży	heavy and large	grupo	0    	0000-00-00 00:00:00
level	estis alta, dika, peza, kaj larĝa	był wysoki, gruby, ciężki i duży	was tall, thick, heavy, and large	grupo	0    	0000-00-00 00:00:00
level	donis forton	dał siłę	gave strength	grupo	0    	0000-00-00 00:00:00
level	havinda forto	siła, którą warto posiadać	a force worth having	grupo	0    	0000-00-00 00:00:00
level	havinda korpoforto	siłę fizyczną, którą warto posiadać	physical strength worth having	grupo	0    	0000-00-00 00:00:00
level	tio donis	to dało	that gave	grupo	0    	0000-00-00 00:00:00
level	donis al li	dał mu	gave him	grupo	0    	0000-00-00 00:00:00
level	tio donis forton	co dało siłę	that gave strength	grupo	0    	0000-00-00 00:00:00
level	donis havindan korpoforton	dał ciału siłę, którą warto mieć	gave body strength worth having	grupo	0    	0000-00-00 00:00:00
level	lia aspekto	jego wygląd	his appearance	grupo	0    	0000-00-00 00:00:00
level	grandula aspekto	wygląd wysokiej osoby	appearance of a tall person	grupo	0    	0000-00-00 00:00:00
level	eta rolo	małą rolę	a small role	grupo	0    	0000-00-00 00:00:00
level	ludis rolon	odegrał rolę	played a role	grupo	0    	0000-00-00 00:00:00
level	ne eta rolo	niemała rola	not a small role	grupo	0    	0000-00-00 00:00:00
level	ludis etan rolon	odegrał małą rolę	played a small role	grupo	0    	0000-00-00 00:00:00
level	ludis ne etan rolon	odegrał niemałą rolę	played no small role	grupo	0    	0000-00-00 00:00:00
level	en la fakto, ke ~	w tym, że ~	in the fact that ~	grupo	0    	0000-00-00 00:00:00
level	la plimulto el la homoj	większość ludzi	the majority of the people	grupo	0    	0000-00-00 00:00:00
level	se ne timis	jeśli się nie boi	if not afraid	grupo	0    	0000-00-00 00:00:00
level	lin timis	bał się go	was afraid of him	grupo	0    	0000-00-00 00:00:00
level	se lin timis	gdyby się bał	if he was afraid	grupo	0    	0000-00-00 00:00:00
level	se ne lin timis	jeśli się go nie boi	if not afraid of him	grupo	0    	0000-00-00 00:00:00
level	certe respektis	z pewnością szanowany	certainly respected	grupo	0    	0000-00-00 00:00:00
level	almenaŭ pripensis ~	przynajmniej pomyślałem o ~	at least thought about ~	grupo	0    	0000-00-00 00:00:00
level	antaŭ ol ~	przed ~	before ~	grupo	0    	0000-00-00 00:00:00
level	kontentigi lin	żeby go zadowolić	to satisfy him	grupo	0    	0000-00-00 00:00:00
level	malkontentigi lin	żeby go nie zadowolić	to displease him	grupo	0    	0000-00-00 00:00:00
level	antaŭ ol malkontentigi ~	przed niezadowalającym ~	before dissatisfying ~	grupo	0    	0000-00-00 00:00:00
level	antaŭ ol decidi ~	przed podjęciem decyzji ~	before deciding ~	grupo	0    	0000-00-00 00:00:00
level	decidi malkontentigi ~	zdecydować się na niezadowolenie ~	to decide to displease ~	grupo	0    	0000-00-00 00:00:00
level	decidi kontentigi lin	postanowić go zadowolić	to decide to satisfy him	grupo	0    	0000-00-00 00:00:00
level	antaŭ ol decidi malkontentigi lin	zanim zdecydowałeś się go nie zadowolić	before deciding to displease him	grupo	0    	0000-00-00 00:00:00
level	tio, kio estas utila	to, co jest przydatne	that, which is useful	grupo	0    	0000-00-00 00:00:00
level	ofte utila dumtage	często przydatne w ciągu dnia	often useful during the day	grupo	0    	0000-00-00 00:00:00
level	malplaĉa ĝeno	nieprzyjemna dolegliwość	an unpleasant nuisance	grupo	0    	0000-00-00 00:00:00
level	per si	samodzielnie	by himself	grupo	0    	0000-00-00 00:00:00
level	prezentas malplaĉan ĝenon	stanowi nieprzyjemną dolegliwość	presents an unpleasant nuisance	grupo	0    	0000-00-00 00:00:00
level	prezentas per si malplaĉan ĝenon	prezentuje się jako nieprzyjemna dokuczliwość	presents itself as an unpleasant nuisance	grupo	0    	0000-00-00 00:00:00
level	en loko arboplena	w miejscu pełnym drzew	in a place full of trees	grupo	0    	0000-00-00 00:00:00
level	tiam, kiam oni devojiĝis	potem, gdy ktoś zbłądził	then, when one went astray	grupo	0    	0000-00-00 00:00:00
level	en nehoma sovaĝejo	na nieludzkiej pustyni	in an inhuman wilderness	grupo	0    	0000-00-00 00:00:00
level	kaj ekstervoje iraĉas	i w chaosie wypada z drogi	and goes off the road in chaos	grupo	0    	0000-00-00 00:00:00
level	alta larĝa korpo	wysokie, duże ciało	a tall large body	grupo	0    	0000-00-00 00:00:00
level	ne sukcesis pasi ~	nie udało się przejść ~	failed to pass ~	grupo	0    	0000-00-00 00:00:00
level	inter la arbetoj	wśród krzaków	among the bushes	grupo	0    	0000-00-00 00:00:00
level	krome tuŝi la naturaĵojn	oprócz dotykania rzeczy naturalnych	in addition to touching the natural things	grupo	0    	0000-00-00 00:00:00
level	ĝenerale malsekajn	ogólnie mokry	generally wet	grupo	0    	0000-00-00 00:00:00
level	meze de malsekaj naturaĵoj	pośrodku mokrej przyrody	in the middle of wet nature	grupo	0    	0000-00-00 00:00:00
level	malsekaj naturaĵoj, meze de kiuj ~	mokre naturalne rzeczy, w środku których ~	wet natural things, in the middle of which ~	grupo	0    	0000-00-00 00:00:00
level	li malfacile paŝis	szedł z trudem	he walked with difficulty	grupo	0    	0000-00-00 00:00:00
level	estis travivaĵo	to było przeżycie	it was an experience	grupo	0    	0000-00-00 00:00:00
level	ne malofte	nierzadki	not uncommon	grupo	0    	0000-00-00 00:00:00
level	doloriga kaj ĉiam malagrabla	bolesne i zawsze nieprzyjemne	painful and always unpleasant	grupo	0    	0000-00-00 00:00:00
level	ju pli ~	tym bardziej ~	the more ~	grupo	0    	0000-00-00 00:00:00
level	antaŭeniris en la vivo	posunął się w życiu do przodu	moved forward in life	grupo	0    	0000-00-00 00:00:00
level	en la kastela arbaro	w lesie zamkowym	in the castle forest	grupo	0    	0000-00-00 00:00:00
level	ju pli antaŭeniris des pli malŝatis ~	im dalej posuwał się do przodu, tym bardziej był nielubiany ~	the further went forward the more disliked ~	grupo	0    	0000-00-00 00:00:00
level	malŝatis la noktan naturon	nie lubił nocnej natury	disliked the nocturnal nature	grupo	0    	0000-00-00 00:00:00
level	viro kun okuloj bone videblaj	człowiek o oczach, które można wyraźnie zobaczyć	a man with eyes that can be seen clearly	grupo	0    	0000-00-00 00:00:00
level	okuloj, kiuj kapablis bone vidi	oczy, które dobrze widziały	eyes that could see well	grupo	0    	0000-00-00 00:00:00
level	bone vidi en la mallumo	aby dobrze widzieć w ciemności	to see well in the dark	grupo	0    	0000-00-00 00:00:00
level	rigardis la malfacilan iron	spojrzał na trudną drogę	looked at the difficult going	grupo	0    	0000-00-00 00:00:00
level	de nia industriisto	od naszego przemysłowca	from our industrialist	grupo	0    	0000-00-00 00:00:00
level	li ridetis	uśmiechnął się	he smiled	grupo	0    	0000-00-00 00:00:00
level	apud tiu viro	obok tego mężczyzny	next to that man	grupo	0    	0000-00-00 00:00:00
level	en vestaĵo de policano	w stroju policjanta	in policeman's clothing	grupo	0    	0000-00-00 00:00:00
level	staris alia persono	stała kolejna osoba	another person was standing	grupo	0    	0000-00-00 00:00:00
level	en simila vestaĵo	w podobnym ubraniu	in similar clothing	grupo	0    	0000-00-00 00:00:00
level	ĉi lasta estis virino	ta ostatnia była kobietą	the latter was a woman	grupo	0    	0000-00-00 00:00:00
level	ni iru	chodźmy	let's go	grupo	0    	0000-00-00 00:00:00
level	la viro diris mallaŭte	powiedział cicho mężczyzna	the man said softly	grupo	0    	0000-00-00 00:00:00
