level	pensis, ke tio ne necesas	pensei que não era necessário	thought that was not necessary	grupo	0    	0000-00-00 00:00:00
level	loĝis proksime, kaj tio utilis	morava perto, e isso foi útil	lived nearby, and that was useful	grupo	0    	0000-00-00 00:00:00
level	nia lando hodiaŭ teruriĝis	nosso país ficou aterrorizado hoje	our country became terrified today	grupo	0    	0000-00-00 00:00:00
level	karaj infanoj el ĉiuj familioj	queridos filhos de todas as famílias	dear children from all families	grupo	0    	0000-00-00 00:00:00
level	unu fojon hieraŭ, du fojojn morgaŭ	uma vez ontem, duas vezes amanhã	once yesterday, twice tomorrow	grupo	0    	0000-00-00 00:00:00
level	hodiaŭ familioj bezonas infanojn	hoje as famílias precisam de crianças	today families need children	grupo	0    	0000-00-00 00:00:00
level	esperis, ke li fartos bone morgaŭ	esperava que ele estivesse bem amanhã	hoped he would be well tomorrow	grupo	0    	0000-00-00 00:00:00
level	li fartis ege trankvila	ele estava se sentindo (tem estado) muito calmo	he was feeling (has been) very calm	grupo	0    	0000-00-00 00:00:00
level	tri etuloj altigis la monton	três pequeninos levantaram a montanha	three little ones raised the mountain	grupo	0    	0000-00-00 00:00:00
level	gravuloj ne petis helpon	pessoas importantes não pediram ajuda	important people did not ask for help	grupo	0    	0000-00-00 00:00:00
level	piediris tien por helpi	fui até lá para ajudar	walked there to help	grupo	0    	0000-00-00 00:00:00
level	restu hejme se temperaturo altas	fique em casa se a temperatura estiver alta	stay home if temperature is high	grupo	0    	0000-00-00 00:00:00
level	temperaturo restis simila hodiaŭ	temperatura permaneceu semelhante hoje	temperature remained similar today	grupo	0    	0000-00-00 00:00:00
level	voku la doktoron je la naŭa	ligue para o médico às nove	call the doctor at nine	grupo	0    	0000-00-00 00:00:00
level	montru ĝin al via doktoro	mostre ao seu médico	show it to your doctor	grupo	0    	0000-00-00 00:00:00
level	por montri vian piedon	mostrar seu pé	to show your foot	grupo	0    	0000-00-00 00:00:00
level	vestu ĉi tiun ĉemizon	use esta camisa	wear this shirt	grupo	0    	0000-00-00 00:00:00
level	semajnfine ĉio trankviliĝos	no final de semana tudo vai se acalmar	on the weekend everything will calm down	grupo	0    	0000-00-00 00:00:00
level	sub la te-taso kion vi trovis?	debaixo da xícara de chá, o que você encontrou?	under the tea-cup what did you find?	grupo	0    	0000-00-00 00:00:00
level	mi deziras matenan teon	Eu quero chá da manhã	I want morning tea	grupo	0    	0000-00-00 00:00:00
level	esperis trankvilan vesperon	esperava por uma noite tranquila	hoped for a quiet evening	grupo	0    	0000-00-00 00:00:00
level	deziras, ke vi lernu	quer que você aprenda	wants that you learn	grupo	0    	0000-00-00 00:00:00
level	insistis, ke mi iru	insistiu que eu fosse	insisted that I go	grupo	0    	0000-00-00 00:00:00
level	je kioma horo?	a que horas?	at what hour?	grupo	0    	0000-00-00 00:00:00
level	je la sesa, li venos	às seis ele virá	at six he will come	grupo	0    	0000-00-00 00:00:00
level	la libreto estis ĉarma	o libreto era encantador	the libretto was charming	grupo	0    	0000-00-00 00:00:00
level	estu trankvila	fique quieto	be quiet	grupo	0    	0000-00-00 00:00:00
level	li estu trankvila	deixe ele ficar quieto	let him be quiet	grupo	0    	0000-00-00 00:00:00
level	ankaŭ li	ele também	he too	grupo	0    	0000-00-00 00:00:00
level	mi deziras	Eu quero (desejo)	I want (desire)	grupo	0    	0000-00-00 00:00:00
level	mi deziras, ke ~	Eu desejo (desejo) que ~	I wish (desire) that ~	grupo	0    	0000-00-00 00:00:00
level	ke vi lernu	que você aprende	that you learn	grupo	0    	0000-00-00 00:00:00
level	mi deziras, ke vi lernu	Eu quero que você aprenda	I want you to learn	grupo	0    	0000-00-00 00:00:00
level	patro insistas	pai insiste	father insists	grupo	0    	0000-00-00 00:00:00
level	patro insistas, ke ~	pai insiste que ~	father insists that ~	grupo	0    	0000-00-00 00:00:00
level	ke mi iru	que eu vá	that I go	grupo	0    	0000-00-00 00:00:00
level	patro insistas, ke mi iru	pai insiste que eu vá	father insists that I go	grupo	0    	0000-00-00 00:00:00
level	je kioma horo	a que horas	at what hour	grupo	0    	0000-00-00 00:00:00
level	je kioma horo vi venos?	que horas você vem?	what time do you come?	grupo	0    	0000-00-00 00:00:00
level	je la kvina	às cinco horas)	at five (o'clock)	grupo	0    	0000-00-00 00:00:00
level	je la kvina horo	às cinco horas	at five o'clock	grupo	0    	0000-00-00 00:00:00
level	kiel li fartas?	como ele está?	how does he doing?	grupo	0    	0000-00-00 00:00:00
level	kiel vi fartis lastatempe?	como tens estado ultimamente?	how have you been lately?	grupo	0    	0000-00-00 00:00:00
level	etaj libroj belas	livrinhos são lindos	little books are beautiful	grupo	0    	0000-00-00 00:00:00
level	libreto, belaj libroj	um livreto, lindos livros	a booklet, beautiful books	grupo	0    	0000-00-00 00:00:00
level	bela, beleta, belega	lindo, um pouco lindo, muito lindo	beautiful, a little pretty, very beautiful	grupo	0    	0000-00-00 00:00:00
level	varma, varmeta, varmega	morno, morno, muito quente	warm, lukewarm, very hot	grupo	0    	0000-00-00 00:00:00
level	librego, libreto	um grande livro, um livreto	a big book, a booklet	grupo	0    	0000-00-00 00:00:00
level	bona, bonega, bonege	bom, ótimo, bem	good, great, well	grupo	0    	0000-00-00 00:00:00
level	riĉa, riĉiĝi, riĉulo	rico, ficar rico, uma pessoa rica	rich, become rich, a rich person	grupo	0    	0000-00-00 00:00:00
level	trankvila, trankviliĝi, trankviliĝu	acalmar, acalmar, acalmar	calm, to calm down, calm down	grupo	0    	0000-00-00 00:00:00
level	sana, resaniĝi, resaniĝis	saudável, ficar curado, ficar curado	healthy, to become healed, became healed	grupo	0    	0000-00-00 00:00:00
level	edzo, edziĝo, geedziĝis	um marido, casamento, casado	a husband, marriage, married	grupo	0    	0000-00-00 00:00:00
level	leterportisto	um carteiro de cartas	a letter postman	grupo	0    	0000-00-00 00:00:00
level	hejmlando	uma pátria	a homeland	grupo	0    	0000-00-00 00:00:00
level	iom, iomete	um pouco, um pouco	somewhat, a little	grupo	0    	0000-00-00 00:00:00
level	ni bonege vespermanĝis	tivemos um ótimo jantar	we had a great dinner	grupo	0    	0000-00-00 00:00:00
level	espereble, prizorgu vin	esperançosamente, cuide-se	hopefully, take care of yourself	grupo	0    	0000-00-00 00:00:00
level	mi zorgis pri la altkvalita loĝejo	Eu me importava com a habitação de alta qualidade	I cared about the high-quality housing	grupo	0    	0000-00-00 00:00:00
level	pripensu dufoje, multfoje	pense duas vezes, muitas vezes	think twice, many times	grupo	0    	0000-00-00 00:00:00
level	kiu deprenis la libreton?	quem pegou o livreto?	who took down the booklet?	grupo	0    	0000-00-00 00:00:00
level	kato, kiu nomiĝas Cezaro	um gato chamado César	a cat named Caesar	grupo	0    	0000-00-00 00:00:00
level	kuko, kiu estas sur la tablo	um bolo que está na mesa	a cake which is on the table	grupo	0    	0000-00-00 00:00:00
level	manĝu kukon, kiu estas sur la tablo	coma um bolo que está na mesa	eat a cake that is on the table	grupo	0    	0000-00-00 00:00:00
level	fariĝis varmega kaj ruĝiĝis	ficou quente e corou	became hot and blushed	grupo	0    	0000-00-00 00:00:00
level	patro volas, ke lia infano manĝu	um pai quer que seu filho coma	a father wants his child to eat	grupo	0    	0000-00-00 00:00:00
level	en malgranda ĉambro	em uma pequena sala	in a small room	grupo	0    	0000-00-00 00:00:00
level	ni loĝas en ~	vivemos em ~	we live in ~	grupo	0    	0000-00-00 00:00:00
level	mi fariĝis maltrankvila	Fiquei ansioso	I became anxious	grupo	0    	0000-00-00 00:00:00
level	tiam, kiam mi vidis vin	naquela hora em que te vi	at that time when I saw you	grupo	0    	0000-00-00 00:00:00
level	ĉiuj rimarkis tion	todo mundo notou isso	everyone noticed that	grupo	0    	0000-00-00 00:00:00
level	tion, ke ŝi estas belega	o fato de ela ser linda	the fact that she is beautiful	grupo	0    	0000-00-00 00:00:00
level	ĉu vi deziras, ke ~ ?	você quer isso ~? (deziri)	do you want that ~ ? (deziri)	grupo	0    	0000-00-00 00:00:00
level	ke mi montru al vi	que eu possa te mostrar	that I may show you	grupo	0    	0000-00-00 00:00:00
level	ĉu vi deziras, ke mi montru?	você quer que eu mostre?	do you want me to show?	grupo	0    	0000-00-00 00:00:00
level	mian plej novan libron	meu mais novo livro (objetivo)	my newest book (objective)	grupo	0    	0000-00-00 00:00:00
level	morgaŭ matene, kion vi volas?	amanhã de manhã, o que você quer?	tomorrow morning, what do you want?	grupo	0    	0000-00-00 00:00:00
level	matenmanĝis malfrue	tomei café da manhã tarde	had breakfast late	grupo	0    	0000-00-00 00:00:00
level	kiam Marko alvenos?	quando Mark chegará?	when will Mark arrive?	grupo	0    	0000-00-00 00:00:00
level	je la kvina aŭ je la oka horo	às cinco ou oito horas	at five or eight o'clock	grupo	0    	0000-00-00 00:00:00
level	kiam vi rimarkis, ke ~ ?	quando você percebeu isso ~?	when did you notice that ~ ?	grupo	0    	0000-00-00 00:00:00
level	la tuta familio nomas min bonfarulo	toda a família me chama de benfeitor	the whole family calls me a benefactor	grupo	0    	0000-00-00 00:00:00
level	utila por vi	útil para você	useful for you	grupo	0    	0000-00-00 00:00:00
level	ĉu la libreto estis utila?	o livreto foi útil?	was the booklet useful?	grupo	0    	0000-00-00 00:00:00
level	tiu libreto, kiun mi sendis	o livreto que enviei	the booklet, which I sent	grupo	0    	0000-00-00 00:00:00
level	matene dormis tre longe	de manhã dormi muito tempo	in the morning slept for a long time	grupo	0    	0000-00-00 00:00:00
level	kiam li vidis la sunon	quando ele viu o sol	when he saw the sun	grupo	0    	0000-00-00 00:00:00
level	subite li eksaltis	de repente ele pulou	suddenly he jumped up	grupo	0    	0000-00-00 00:00:00
level	li estis ĉiam frua	ele sempre chegava cedo	he was always early	grupo	0    	0000-00-00 00:00:00
level	ĉiam li malfruas	ele está sempre atrasado	he is always late	grupo	0    	0000-00-00 00:00:00
level	tiam, kiam li devas iri	naquela hora, quando ele tem que ir	at that time, when he has to go	grupo	0    	0000-00-00 00:00:00
level	iri al la lernejo	ir para a escola	to go to the school	grupo	0    	0000-00-00 00:00:00
level	li scias, ke ~	ele sabe, isso ~	he knows, that ~	grupo	0    	0000-00-00 00:00:00
level	li scias tion, ke ~	ele sabe o fato, que ~	he knows the fact, that ~	grupo	0    	0000-00-00 00:00:00
level	tion, ke la instruisto malŝatas abelon	o fato de a professora odiar abelhas	the fact that the teacher hates bees	grupo	0    	0000-00-00 00:00:00
level	scias tion, ke la instruisto malŝatas abelon	sabe o fato de que o professor odeia abelhas	knows the fact that the teacher hates bees	grupo	0    	0000-00-00 00:00:00
level	scias, ke la instruisto malŝatas tion	sabe que o professor odeia isso	knows that the teacher hates that	grupo	0    	0000-00-00 00:00:00
level	sed hodiaŭ li trinkis la kafon	mas hoje ele tomou o café	but today he drank the coffee	grupo	0    	0000-00-00 00:00:00
level	li rapide surmetas la vestaĵon	ele rapidamente veste as roupas	he quickly puts on the clothes	grupo	0    	0000-00-00 00:00:00
level	li ne volas malfrui	ele não quer se atrasar	he doesn't want to be late	grupo	0    	0000-00-00 00:00:00
level	rapidege kun la libroj en la mano	muito rapidamente com os livros em mãos	very quickly with the books in hand	grupo	0    	0000-00-00 00:00:00
level	poste li kuris kaj saltis	depois ele correu e pulou	later he ran and jumped	grupo	0    	0000-00-00 00:00:00
level	li kuris kaj saltis	ele correu e pulou	he ran and jumped	grupo	0    	0000-00-00 00:00:00
level	laŭ la strato	ao longo da rua	along the street	grupo	0    	0000-00-00 00:00:00
level	la homoj rigardis lin	as pessoas olharam para ele	the people looked at him	grupo	0    	0000-00-00 00:00:00
level	rigardis lin kaj diris	olhou para ele e disse	looked at him and said	grupo	0    	0000-00-00 00:00:00
level	saĝa kaj malsaĝa	sábio e tolo	wise and foolish	grupo	0    	0000-00-00 00:00:00
level	kia malsaĝa knabo!	que menino tolo!	what a foolish boy!	grupo	0    	0000-00-00 00:00:00
level	estis antaŭ lernejo	estava na frente de uma escola	was in front of a school	grupo	0    	0000-00-00 00:00:00
level	baldaŭ	breve	soon	grupo	0    	0000-00-00 00:00:00
level	li estis antaŭ ~	ele estava na frente de ~	he was in front of ~	grupo	0    	0000-00-00 00:00:00
level	iri kaj eniri	ir e entrar	to go and to enter	grupo	0    	0000-00-00 00:00:00
level	li volis eniri	ele queria entrar	he wanted to enter	grupo	0    	0000-00-00 00:00:00
level	eniri la lernejon	para entrar na escola	to enter into the school	grupo	0    	0000-00-00 00:00:00
level	sed tamen	mas entretanto	but however	grupo	0    	0000-00-00 00:00:00
level	sed li ne povis	mas ele não conseguiu	but he couldn't	grupo	0    	0000-00-00 00:00:00
level	fermi kaj fermita	fechar e fechar	to close and closed	grupo	0    	0000-00-00 00:00:00
level	ĝi estis fermita	estava fechado	it was closed	grupo	0    	0000-00-00 00:00:00
level	nek ~ nek ~	nem ~ nem ~	neither ~ nor ~	grupo	0    	0000-00-00 00:00:00
level	nek instruisto nek gelernantoj	nem professor nem estudantes masculinos e femininos	neither a teacher nor male-and-female students	grupo	0    	0000-00-00 00:00:00
level	vidis nek instruiston nek gelernantojn	não vi nem professor nem alunos	saw neither a teacher nor students	grupo	0    	0000-00-00 00:00:00
level	sidi, eksidi	sentar, sentar	to sit, to get sitted	grupo	0    	0000-00-00 00:00:00
level	eksidis	sentou-se (estava sentado)	got seated (had seated)	grupo	0    	0000-00-00 00:00:00
level	li eksidis	ele se sentou	he got seated	grupo	0    	0000-00-00 00:00:00
level	kaj pensis	e pensamento	and thought	grupo	0    	0000-00-00 00:00:00
level	kio okazis?	O que aconteceu?	what did happen?	grupo	0    	0000-00-00 00:00:00
level	diable	para o terrível (como um demônio)	to the awful (like a devil)	grupo	0    	0000-00-00 00:00:00
level	damne	dane-se	dam it	grupo	0    	0000-00-00 00:00:00
level	memoras	lembra	remembers	grupo	0    	0000-00-00 00:00:00
level	nun mi memoras	agora eu lembro	now I remember	grupo	0    	0000-00-00 00:00:00
level	dimanĉo	Domingo	Sunday	grupo	0    	0000-00-00 00:00:00
level	hodiaŭ estas ~	hoje é ~	today is ~	grupo	0    	0000-00-00 00:00:00
level	hodiaŭ estas dimanĉo	Hoje é domingo	today is Sunday	grupo	0    	0000-00-00 00:00:00
level	dormi kaj ekdormi	dormir e adormecer	to sleep and to get into sleep	grupo	0    	0000-00-00 00:00:00
level	suno kaj luno	um sol e uma lua	a sun and a moon	grupo	0    	0000-00-00 00:00:00
level	subita kaj subite	de repente e de repente	sudden and suddenly	grupo	0    	0000-00-00 00:00:00
level	ek!	desligado! (para iniciar)	off! (to start)	grupo	0    	0000-00-00 00:00:00
level	salti kaj eksaltis	pular e pular	to jump and jumped 	grupo	0    	0000-00-00 00:00:00
level	ĉiam frua	sempre cedo	always early	grupo	0    	0000-00-00 00:00:00
level	hodiaŭ metis kaj kuris	hoje coloquei e corri	today put and ran	grupo	0    	0000-00-00 00:00:00
level	aĵo, ne aĝo	uma coisa que não é idade	a thing not age	grupo	0    	0000-00-00 00:00:00
level	kuris laŭ homoj saĝaj	correu junto com pessoas sábias	ran along wise people	grupo	0    	0000-00-00 00:00:00
level	laŭeble baldaŭ	assim que possível	soon as possible	grupo	0    	0000-00-00 00:00:00
level	kia knabo, kia knabino	que menino, que menina	what a boy, what a girl	grupo	0    	0000-00-00 00:00:00
level	nek pensita nek memorita	nem pensei nem memorizei	neither thought nor memorized	grupo	0    	0000-00-00 00:00:00
level	diablo atendis akvon dimanĉe	um demônio esperou por água no domingo	a devil waited for water on Sunday	grupo	0    	0000-00-00 00:00:00
level	tiom malgranda momento	um momento tão pequeno	such a small moment	grupo	0    	0000-00-00 00:00:00
level	eĉ tiom malgranda momento valoras	mesmo um momento tão pequeno vale a pena	even such a small moment is worthwhile	grupo	0    	0000-00-00 00:00:00
level	kriis for ĝis nokto	chorei até a noite	cried away until night	grupo	0    	0000-00-00 00:00:00
level	lasis la poŝton de la mano	guarde a correspondência da mão	put away the mailpost from the hand	grupo	0    	0000-00-00 00:00:00
level	ridis mem lasante la poŝton	riu sozinho, guardando a correspondência	laughed by oneself, putting away the mailpost	grupo	0    	0000-00-00 00:00:00
level	nek li nek ŝi ridis	nem ele nem ela riram	neither he nor she laughed	grupo	0    	0000-00-00 00:00:00
level	ŝi nek ridis nek respondis	ela não riu nem respondeu	she neither laughed nor answered	grupo	0    	0000-00-00 00:00:00
level	li nek sidas nek rigardas	ele não senta nem assiste	he neither sits nor watches	grupo	0    	0000-00-00 00:00:00
level	neniam mi vidis	eu nunca vi	I have never seen	grupo	0    	0000-00-00 00:00:00
level	mi neniam diros al iu	Eu nunca vou contar a ninguém	I will never tell anyone	grupo	0    	0000-00-00 00:00:00
level	diru al neniu	Não contes a ninguém	tell no one	grupo	0    	0000-00-00 00:00:00
level	mi neniam diros	Eu nunca direi	I will never say	grupo	0    	0000-00-00 00:00:00
level	mem	para si mesmo (por si mesmo)	to oneself (by oneself)	grupo	0    	0000-00-00 00:00:00
level	mi mem faris	eu mesmo fiz	I did it myself	grupo	0    	0000-00-00 00:00:00
level	faris tion	fez isso (fez isso)	did it (made it)	grupo	0    	0000-00-00 00:00:00
level	mem faris tion	fez você mesmo (fez você mesmo)	did it oneself (made it oneself)	grupo	0    	0000-00-00 00:00:00
level	ĝis la revido, ĝis revido	vejo você (de novo), vejo você (de novo)	see you (again), see you (again)	grupo	0    	0000-00-00 00:00:00
level	ĝis!	até! (adeus!)	until! (goodbye!)	grupo	0    	0000-00-00 00:00:00
level	ekparoli	para começar a falar	to start talking	grupo	0    	0000-00-00 00:00:00
level	ekparolis, komencis paroli finfine	comecei a dizer, comecei a falar finalmente	started saying, began to speak at last	grupo	0    	0000-00-00 00:00:00
level	trinkis rapidege	bebi muito rápido	drank very fast	grupo	0    	0000-00-00 00:00:00
level	trinkis matenan trinkaĵon	tomei uma bebida matinal	had a morning drink	grupo	0    	0000-00-00 00:00:00
level	por frue veni	chegar mais cedo	to come early	grupo	0    	0000-00-00 00:00:00
level	veni al la lernejo	vir para a escola	to come to school	grupo	0    	0000-00-00 00:00:00
level	frue veni al ~	chegar cedo para ~	to come early to ~	grupo	0    	0000-00-00 00:00:00
level	ne aŭdis novaĵon	não ouvi notícias	didn't hear news	grupo	0    	0000-00-00 00:00:00
level	ankoraŭ ne aŭdis	ainda não ouvi	didn't hear yet	grupo	0    	0000-00-00 00:00:00
level	mi ankoraŭ ne aŭdis	Eu não ouvi ainda	I didn't hear yet	grupo	0    	0000-00-00 00:00:00
level	en tiu momento	naquele momento	in that moment	grupo	0    	0000-00-00 00:00:00
level	en tiu momento li ekkriis	naquele momento ele chorou	in that moment he cried	grupo	0    	0000-00-00 00:00:00
level	knabo, kiu ne amas	um menino que não ama	a boy, who does not love	grupo	0    	0000-00-00 00:00:00
level	geknaboj	meninos e meninas	boys and girls	grupo	0    	0000-00-00 00:00:00
level	aliaj geknaboj	outros meninos e meninas	other boys and girls	grupo	0    	0000-00-00 00:00:00
level	ne amas aliajn geknabojn	não ama outros meninos e meninas	does not love other boys and girls	grupo	0    	0000-00-00 00:00:00
level	nek amikojn, nek amikinojn	nem amigos nem namoradas	neither friends nor girl friends	grupo	0    	0000-00-00 00:00:00
level	havas nek monon, nek tempon	não tem dinheiro nem tempo	does not have neither money nor time	grupo	0    	0000-00-00 00:00:00
level	kiu havis la libron?	quem tinha o livro?	who had the book?	grupo	0    	0000-00-00 00:00:00
level	la libron, kiun vi atendis	o livro que você esperou	the book which you waited	grupo	0    	0000-00-00 00:00:00
level	tiun, kiun vi atendis pli ol du jarojn	aquilo que você esperou por mais de 2 anos	that, which you waited for more than 2 years	grupo	0    	0000-00-00 00:00:00
level	ĉu vi volas tion?	você quer isso?	do you want that?	grupo	0    	0000-00-00 00:00:00
level	ĉu vi volas, ke ~ ?	você quer isso ~?	do you want that ~ ?	grupo	0    	0000-00-00 00:00:00
level	plej kara	querido	dearest	grupo	0    	0000-00-00 00:00:00
level	plej kara foto	foto querida	dearest photo	grupo	0    	0000-00-00 00:00:00
level	mian plej karan foton	minha querida foto	my dearest photo	grupo	0    	0000-00-00 00:00:00
level	kie vi aĉetis ~ ?	onde você comprou ~?	where did you buy ~ ?	grupo	0    	0000-00-00 00:00:00
level	tiu vestaĵo	aquela roupa	that clothing	grupo	0    	0000-00-00 00:00:00
level	tiun vestaĵon	aquela roupa (objetivo)	that clothing (objective)	grupo	0    	0000-00-00 00:00:00
level	aĉetis tiun vestaĵon	comprei aquela roupa	bought that outfit	grupo	0    	0000-00-00 00:00:00
level	vi iros tien	você irá lá	you will go there	grupo	0    	0000-00-00 00:00:00
level	kien vi iros?	Onde você está indo?	where are you going to?	grupo	0    	0000-00-00 00:00:00
level	suna tago	dia ensolarado	sunny day	grupo	0    	0000-00-00 00:00:00
level	estos suna tago	será um dia ensolarado	it will be a sunny day	grupo	0    	0000-00-00 00:00:00
level	se estos suna tago	se será um dia ensolarado	if it will be a sunny day	grupo	0    	0000-00-00 00:00:00
level	via frato jam ekiris	seu irmão já começou	your brother has already started	grupo	0    	0000-00-00 00:00:00
level	ĉu via frato jam ekiris?	seu irmão já começou?	has your brother started yet?	grupo	0    	0000-00-00 00:00:00
level	kie estas la akvo?	onde está a água	where is the water	grupo	0    	0000-00-00 00:00:00
level	kunporti la akvon	para trazer a água	to bring the water	grupo	0    	0000-00-00 00:00:00
level	vi mem kunportis	você mesmo trouxe	you yourself brought	grupo	0    	0000-00-00 00:00:00
level	la akvon, kion vi mem kunportis	a água que você mesmo trouxe	the water, that you yourself brought	grupo	0    	0000-00-00 00:00:00
level	estis tre trankvila	estava muito quieto	was very quiet	grupo	0    	0000-00-00 00:00:00
level	hodiaŭ mia patrino estis ~	hoje minha mãe estava ~	today my mother was ~	grupo	0    	0000-00-00 00:00:00
level	mi venis el ~	Eu vim de ~	I came from ~	grupo	0    	0000-00-00 00:00:00
level	el la lernejo	fora da escola	out of the school	grupo	0    	0000-00-00 00:00:00
level	raportis al ~	relatado para ~	reported to ~	grupo	0    	0000-00-00 00:00:00
level	kaj raportis al ŝi	e relatou a ela	and reported to her	grupo	0    	0000-00-00 00:00:00
level	raportis, ke ~	relatou que ~	reported that ~	grupo	0    	0000-00-00 00:00:00
level	raportis, ke mi ricevos	informou que vou receber	reported that I will receive	grupo	0    	0000-00-00 00:00:00
level	mi ricevos malbonan noton	vou tirar uma nota ruim	I will get a bad grade	grupo	0    	0000-00-00 00:00:00
level	ŝi diris, ke ~	ela disse isso ~	she said that ~	grupo	0    	0000-00-00 00:00:00
level	vi devas laborigi ~	você tem que fazer ~ funcionar	you have to make ~ work	grupo	0    	0000-00-00 00:00:00
level	pli multe	mais	more	grupo	0    	0000-00-00 00:00:00
level	pli multe laborigi	para tornar o trabalho mais	to make work more	grupo	0    	0000-00-00 00:00:00
level	laborigi vian kapon	para fazer sua cabeça funcionar	to make your head work	grupo	0    	0000-00-00 00:00:00
level	kiom da malbonaj notoj	quantas notas ruins	how many bad grades	grupo	0    	0000-00-00 00:00:00
level	vi havas tiom da malbonaj notoj	você tem tantas notas ruins	you have so many bad grades	grupo	0    	0000-00-00 00:00:00
level	estis malĝoja	estava triste	was sad	grupo	0    	0000-00-00 00:00:00
level	en vian ĉambron	para o seu quarto	into your room	grupo	0    	0000-00-00 00:00:00
level	iru en vian ĉambron	entre no seu quarto	go into your room	grupo	0    	0000-00-00 00:00:00
level	iru kaj lernu	vá e aprenda	go and learn	grupo	0    	0000-00-00 00:00:00
level	mi sidis	eu sentei	I sat	grupo	0    	0000-00-00 00:00:00
level	en mia ĉambro	no meu quarto	in my room	grupo	0    	0000-00-00 00:00:00
level	sidis en mia ĉambro	sentei no meu quarto	sat in my room	grupo	0    	0000-00-00 00:00:00
level	nek lerni nek legi	não aprende nem lê	neither learn nor read	grupo	0    	0000-00-00 00:00:00
level	sed mi povis nek lerni nek legi	mas eu não conseguia aprender nem ler	but I could neither learn nor read	grupo	0    	0000-00-00 00:00:00
level	miaj pensoj	meus pensamentos	my thoughts	grupo	0    	0000-00-00 00:00:00
level	ĉe ludo	em um jogo	at a game	grupo	0    	0000-00-00 00:00:00
level	ludo kun miaj amikoj	jogo com meus amigos	game with my friends	grupo	0    	0000-00-00 00:00:00
level	ĉe sporto	no esporte	at sport	grupo	0    	0000-00-00 00:00:00
level	al mi mem	para mim mesmo	to myself	grupo	0    	0000-00-00 00:00:00
level	diris al mi mem	disse para mim mesmo	said to myself	grupo	0    	0000-00-00 00:00:00
level	tiom malsaĝa	tão estúpido	so stupid	grupo	0    	0000-00-00 00:00:00
level	ĉu mi estas tiom malsaĝa?	eu sou tão estúpido?	am I that stupid?	grupo	0    	0000-00-00 00:00:00
level	kvankam mi lernis multe	embora eu tenha aprendido muito	although I learned a lot	grupo	0    	0000-00-00 00:00:00
level	la patrino eniris	a mãe entrou	the mother entered	grupo	0    	0000-00-00 00:00:00
level	miaj vortoj	minhas palavras	my words	grupo	0    	0000-00-00 00:00:00
level	kaj aŭdis miajn vortojn	e ouvi minhas palavras	and heard my words	grupo	0    	0000-00-00 00:00:00
level	ŝi tuj respondis	ela respondeu imediatamente	she answered immediately	grupo	0    	0000-00-00 00:00:00
level	ne, mia kara	não, minha querida	no, my dear	grupo	0    	0000-00-00 00:00:00
level	vi ne estas malsaĝa	Você não é estupido	you are not stupid	grupo	0    	0000-00-00 00:00:00
level	la problemo estas, ke ~	o problema é que ~	the problem is that ~	grupo	0    	0000-00-00 00:00:00
level	ke vi devas lerni	que você deve aprender	that you must learn	grupo	0    	0000-00-00 00:00:00
level	devas lerni multe pli	deve aprender muito mais	must learn much more	grupo	0    	0000-00-00 00:00:00
