level	tuj ŝanĝis la opinion	imediatamente mudou de idéia	immediately changed the mind	grupo	0    	0000-00-00 00:00:00
level	dum la ekskurso	durante a excursão	during the excursion	grupo	0    	0000-00-00 00:00:00
level	sen ŝi	sem ela	without her	grupo	0    	0000-00-00 00:00:00
level	li estus tre soleca	ele ficaria muito solitário	he would be very lonely	grupo	0    	0000-00-00 00:00:00
level	mi tamen pasigos	eu vou passar embora	I will pass though	grupo	0    	0000-00-00 00:00:00
level	mi tamen pasigos la morgaŭan tagon hejme	Vou passar amanhã em casa	I will spend tomorrow at home though	grupo	0    	0000-00-00 00:00:00
level	en juneco	na juventude	in youth	grupo	0    	0000-00-00 00:00:00
level	oni havas	um tem	one has	grupo	0    	0000-00-00 00:00:00
level	havas ankaŭ belecon	também tem beleza	also has beauty	grupo	0    	0000-00-00 00:00:00
level	malsimplaj laboroj	trabalhos complicados	complicated jobs	grupo	0    	0000-00-00 00:00:00
level	malsimplajn laborojn	trabalhos complicados (objetivo)	complicated jobs (objective)	grupo	0    	0000-00-00 00:00:00
level	devus plisimpligi	deveria simplificar	should simplify	grupo	0    	0000-00-00 00:00:00
level	en tiu aĝo	naquela idade	at that age	grupo	0    	0000-00-00 00:00:00
level	li jam fariĝis ~	ele já se tornou ~	he has already become ~	grupo	0    	0000-00-00 00:00:00
level	estro de la sporta klubo	chefe do clube desportivo	head of the sports club	grupo	0    	0000-00-00 00:00:00
level	monon oni metas	um coloca dinheiro	one puts money	grupo	0    	0000-00-00 00:00:00
level	en monujon	em uma carteira	into a wallet	grupo	0    	0000-00-00 00:00:00
level	metas en monujon	coloca em uma bolsa	puts in a purse	grupo	0    	0000-00-00 00:00:00
level	sekvu la ekzemplojn	siga os exemplos	follow the examples	grupo	0    	0000-00-00 00:00:00
level	de la bonaj familianoj	dos bons familiares	from the good family members	grupo	0    	0000-00-00 00:00:00
level	ĉu amikeco pli feliĉigas?	a amizade te deixa mais feliz?	does friendship make you happier?	grupo	0    	0000-00-00 00:00:00
level	feliĉigas vin	faz-te feliz	makes you happy	grupo	0    	0000-00-00 00:00:00
level	ol la amo	do que o amor	than the love	grupo	0    	0000-00-00 00:00:00
level	kiel ofte vi ~ ?	com que frequência você ~?	how often do you ~ ?	grupo	0    	0000-00-00 00:00:00
level	vi skribas leterojn al ~	você escreve cartas para ~	you write letters to ~	grupo	0    	0000-00-00 00:00:00
level	skrivas leterojn al viaj amikinoj	escreve cartas para suas amigas	writes letters to your girl friends	grupo	0    	0000-00-00 00:00:00
level	viaj amikinoj en Italio	suas amigas na Itália	your girl friends in Italy	grupo	0    	0000-00-00 00:00:00
level	la rilato inter vi kaj via instruisto	a relação entre você e seu professor	the relation between you and your teacher	grupo	0    	0000-00-00 00:00:00
level	ĉu la rilato ŝanĝiĝis?	o relacionamento mudou?	has the relationship changed?	grupo	0    	0000-00-00 00:00:00
level	ĉu vi jam scias ~ ?	você já conhece ~?	do you already know ~ ?	grupo	0    	0000-00-00 00:00:00
level	sufiĉe bone	muito bem	quite well	grupo	0    	0000-00-00 00:00:00
level	estis vespero en ~	era noite em ~	it was evening in ~	grupo	0    	0000-00-00 00:00:00
level	centoj da homoj	centenas de pessoas	hundreds of people	grupo	0    	0000-00-00 00:00:00
level	plenigas la placon	preenche o quadrado	fills the square	grupo	0    	0000-00-00 00:00:00
level	junuloj kaj militistoj	jovens e soldados	young men and soldiers	grupo	0    	0000-00-00 00:00:00
level	maristoj de sur la ŝipoj	marinheiros dos navios	sailors from the ships	grupo	0    	0000-00-00 00:00:00
level	elstara sinjorino	excelente senhora	outstanding lady	grupo	0    	0000-00-00 00:00:00
level	elstaraj sinjorinoj	senhoras excepcionais	outstanding ladies	grupo	0    	0000-00-00 00:00:00
level	alilandaj vojaĝantoj	viajantes estrangeiros	foreign travelers	grupo	0    	0000-00-00 00:00:00
level	ĉiuj moviĝas al urbomezo	todo mundo está se mudando para o centro da cidade	everyone is moving to the city center	grupo	0    	0000-00-00 00:00:00
level	iom plue	um pouco mais longe	a little further	grupo	0    	0000-00-00 00:00:00
level	ne malproksime de la maro	não muito longe do mar	not far from the sea	grupo	0    	0000-00-00 00:00:00
level	troviĝis malgranda placo	havia uma pequena praça	there was a small square	grupo	0    	0000-00-00 00:00:00
level	iom plue sed ne malproksime	um pouco mais longe, mas não muito	a little further but not far	grupo	0    	0000-00-00 00:00:00
level	fine de ĝi	no final disso	at the end of it	grupo	0    	0000-00-00 00:00:00
level	proksime de la maro	perto do mar	near the sea	grupo	0    	0000-00-00 00:00:00
level	proksime staris homo	um homem estava por perto	a man stood nearby	grupo	0    	0000-00-00 00:00:00
level	laŭ la vestaĵo	de acordo com a roupa	according to the clothing	grupo	0    	0000-00-00 00:00:00
level	oni facile scii ~	pode-se saber facilmente ~	one may know easily ~	grupo	0    	0000-00-00 00:00:00
level	oni povis ekscii, ke ~	foi possível descobrir isso ~	it was possible to find out that ~	grupo	0    	0000-00-00 00:00:00
level	gondolisto de iu riĉulo	gondoleiro de um homem rico	a rich man's gondolier	grupo	0    	0000-00-00 00:00:00
level	povis ekscii, ke li estas gondolisto	poderia descobrir que ele era um gondoleiro	could find out that he was a gondolier	grupo	0    	0000-00-00 00:00:00
level	li rigardis ~	ele olhou ~	he looked ~	grupo	0    	0000-00-00 00:00:00
level	rigardis la ĝojan hommulton	olhou para a multidão alegre	looked at the joyful crowd	grupo	0    	0000-00-00 00:00:00
level	rideto lumigis lian vizaĝon	um sorriso iluminou seu rosto	a smile lit up his face	grupo	0    	0000-00-00 00:00:00
level	kiam li ekvidis mariston	quando ele viu um marinheiro	when he saw a sailor	grupo	0    	0000-00-00 00:00:00
level	la mariston, kiu alvenis	o marinheiro que chegou	the sailor who arrived	grupo	0    	0000-00-00 00:00:00
level	la flanko de la maro	o lado do mar	the side of the sea	grupo	0    	0000-00-00 00:00:00
level	alvenis el la flanko de la maro	chegou do lado do mar	arrived from the side of the sea	grupo	0    	0000-00-00 00:00:00
level	ĉu tio estas vi, Stefano?	é você, Estêvão?	is that you, Stephen?	grupo	0    	0000-00-00 00:00:00
level	ekkriis la gondolisto	exclamou o gondoleiro	exclaimed the gondolier	grupo	0    	0000-00-00 00:00:00
level	ĉiuj diras, ke ~	todo mundo diz isso ~	everyone says that ~	grupo	0    	0000-00-00 00:00:00
level	en la manojn de la Turkoj	nas mãos dos turcos	into the hands of the Turks	grupo	0    	0000-00-00 00:00:00
level	ke vi falis en la manojn de la Turkoj	que você caiu nas mãos dos turcos	that you fell into the hands of the Turks	grupo	0    	0000-00-00 00:00:00
level	ni renkontis unu	nós conhecemos um	we met one	grupo	0    	0000-00-00 00:00:00
level	el niaj ŝipoj	dos nossos navios	from our ships	grupo	0    	0000-00-00 00:00:00
level	ĝi sekvis nin	nos seguiu	it followed us	grupo	0    	0000-00-00 00:00:00
level	dum pli ol unu horo	por mais de uma hora	for more than an hour	grupo	0    	0000-00-00 00:00:00
level	sed ne estas facile iri ~	mas não é fácil ir ~	but it is not easy to go ~	grupo	0    	0000-00-00 00:00:00
level	iri pli rapide ol nia ŝipo	ir mais rápido que nosso navio	to go faster than our ship	grupo	0    	0000-00-00 00:00:00
level	kiaj novaĵoj estas tie ĉi?	que novidades estão aqui?	what news is here?	grupo	0    	0000-00-00 00:00:00
level	tie ĉi en Venecio	aqui em Veneza	here in Venice	grupo	0    	0000-00-00 00:00:00
level	nenio interesa	nada interessante	nothing interesting	grupo	0    	0000-00-00 00:00:00
level	nur granda malfeliĉo	apenas um grande infortúnio	just a big misfortune	grupo	0    	0000-00-00 00:00:00
level	ĉu vi konas Pietron?	você conhece Pietro?	do you know Pietro?	grupo	0    	0000-00-00 00:00:00
level	mi konas lin	Eu o conheço	I know him	grupo	0    	0000-00-00 00:00:00
level	granda ŝipo subakvigis lian gondolon	um grande navio submergiu sua gôndola	a large ship submerged his gondola	grupo	0    	0000-00-00 00:00:00
level	kaj kio pri li?	e o que tem ele?	and what about him?	grupo	0    	0000-00-00 00:00:00
level	la gondolo subakviĝis	a gôndola afundou	the gondola sank	grupo	0    	0000-00-00 00:00:00
level	okazis, ke ~	aconteceu que ~	it happened that ~	grupo	0    	0000-00-00 00:00:00
level	ni troviĝis proksime	estávamos perto	we were close	grupo	0    	0000-00-00 00:00:00
level	ni prenis lin en nian gondolon	nós o levamos em nossa gôndola	we took him in our gondola	grupo	0    	0000-00-00 00:00:00
level	en la sama tempo	ao mesmo tempo	at the same time	grupo	0    	0000-00-00 00:00:00
level	mia estro subakviĝis	meu chefe se afogou	my boss drowned	grupo	0    	0000-00-00 00:00:00
level	por helpi junulinon	ajudar uma jovem	to help a young woman	grupo	0    	0000-00-00 00:00:00
level	junulinon, kiu preskaŭ mortis	uma jovem que quase morreu	a young woman who almost died	grupo	0    	0000-00-00 00:00:00
level	kun sia onklo	com seu tio	with his uncle	grupo	0    	0000-00-00 00:00:00
level	preskaŭ mortis kun sia onklo	quase morreu com o tio	almost died with his uncle	grupo	0    	0000-00-00 00:00:00
level	tie estis junulino	havia uma jovem	there was a young woman	grupo	0    	0000-00-00 00:00:00
level	lin ni ne povis helpi	não poderíamos ajudá-lo	we could not help him	grupo	0    	0000-00-00 00:00:00
level	estis grava homo	era uma pessoa importante	was an important person	grupo	0    	0000-00-00 00:00:00
level	kio alvenigis vin en Venecion?	o que o trouxe a Veneza?	what brought you to Venice?	grupo	0    	0000-00-00 00:00:00
level	amiko mia	meu amigo	my friend	grupo	0    	0000-00-00 00:00:00
level	la maristo ekrigardis	o marinheiro olhou para cima	the sailor looked up	grupo	0    	0000-00-00 00:00:00
level	rapide ekrigardis sian amikon	rapidamente olhou para seu amigo	quickly glanced at his friend	grupo	0    	0000-00-00 00:00:00
level	kaj komencis diri	e comecei a dizer	and began to say	grupo	0    	0000-00-00 00:00:00
level	do vi scias ~	então você sabe ~	so you know ~	grupo	0    	0000-00-00 00:00:00
level	mi alportis ~	Eu trouxe ~	I brought ~	grupo	0    	0000-00-00 00:00:00
level	la gondolisto subite haltigis lin	o gondoleiro o deteve de repente	the gondolier suddenly stopped him	grupo	0    	0000-00-00 00:00:00
level	li diris	ele disse	he said	grupo	0    	0000-00-00 00:00:00
level	tiam iu homo pasis	então um homem passou	then a man passed by	grupo	0    	0000-00-00 00:00:00
level	iu homo pasis apud li	um homem passou por ele	a man passed by him	grupo	0    	0000-00-00 00:00:00
level	li ankoraŭ ne estis tridekjara	ele ainda não tinha trinta	he was not yet thirty	grupo	0    	0000-00-00 00:00:00
level	kaj lia vizaĝo estis senkolora	e seu rosto estava incolor	and his face was colorless	grupo	0    	0000-00-00 00:00:00
level	lia iro estis certa kaj facila	sua partida foi certa e fácil	his going was sure and easy	grupo	0    	0000-00-00 00:00:00
level	lia vizaĝo estis malĝoja	seu rosto estava triste	his face was sad	grupo	0    	0000-00-00 00:00:00
level	kiam li ekvidis la homon, ~	quando ele viu o homem, ~	when he saw the man, ~	grupo	0    	0000-00-00 00:00:00
level	oni diras, ke ~	diz-se que ~	it is said that ~	grupo	0    	0000-00-00 00:00:00
level	multaj gravuloj donas ~	muitas pessoas importantes dão ~	many important people give ~	grupo	0    	0000-00-00 00:00:00
level	sekreta laboro	trabalho secreto	secret work	grupo	0    	0000-00-00 00:00:00
level	sekretaj laboroj	empregos secretos	secret jobs	grupo	0    	0000-00-00 00:00:00
level	donas sekretajn laborojn al li	dá empregos secretos para ele	gives secret jobs to him	grupo	0    	0000-00-00 00:00:00
level	tro da sekretoj	muitos segredos	too many secrets	grupo	0    	0000-00-00 00:00:00
level	li scias tro da sekretoj	ele conhece muitos segredos	he knows too many secrets	grupo	0    	0000-00-00 00:00:00
level	tial ili timas	por isso eles têm medo	therefore they are afraid	grupo	0    	0000-00-00 00:00:00
level	sendi lin en malliberejon	mandá-lo para a prisão	to send him to prison	grupo	0    	0000-00-00 00:00:00
level	diris la maristo	disse o marinheiro	said the sailor	grupo	0    	0000-00-00 00:00:00
level	kaj dum li parolis	e enquanto ele falava	and as he spoke	grupo	0    	0000-00-00 00:00:00
level	li montris la domegon	ele apontou para a mansão	he pointed to the mansion	grupo	0    	0000-00-00 00:00:00
level	la domego de Doĝoj	a mansão dos Doges	the mansion of Doges	grupo	0    	0000-00-00 00:00:00
level	multaj gravuloj bezonas lian helpon	muitas pessoas importantes precisam da ajuda dele	many important people need his help	grupo	0    	0000-00-00 00:00:00
level	kiom ili pagas?	quanto eles pagam?	how much they pay?	grupo	0    	0000-00-00 00:00:00
level	pagas al li	paga ele	pays him	grupo	0    	0000-00-00 00:00:00
level	pagas por unu mortigo	paga por uma morte	pays for one kill	grupo	0    	0000-00-00 00:00:00
level	certe ne malpli ol ~	certamente não menos que ~	certainly not less than ~	grupo	0    	0000-00-00 00:00:00
level	ol cent moneroj	do que cem moedas	than a hundred coins	grupo	0    	0000-00-00 00:00:00
level	ne forgesu, ke ~	não se esqueça disso ~	don't forget that ~	grupo	0    	0000-00-00 00:00:00
level	ke li laboras por tiuj	que ele trabalha para eles	that he works for them	grupo	0    	0000-00-00 00:00:00
level	por tiuj, kiuj havas sufiĉe da mono	para quem tem dinheiro suficiente	for those who have enough money	grupo	0    	0000-00-00 00:00:00
level	por pagi al li	pagar-lhe	to pay him	grupo	0    	0000-00-00 00:00:00
level	en Venecio estas ~	em Veneza há ~	in Venice there is ~	grupo	0    	0000-00-00 00:00:00
level	tiuj aferoj	aquelas coisas	those things	grupo	0    	0000-00-00 00:00:00
level	forgesi tiujn aferojn	esquecer essas coisas	to forget those things	grupo	0    	0000-00-00 00:00:00
level	aferoj, kiujn estas pli bone forgesi	coisas que são melhores esquecidas	things that are better forgotten	grupo	0    	0000-00-00 00:00:00
level	se vi volas trankvile manĝi	se você quiser comer em paz	if you want to eat in peace	grupo	0    	0000-00-00 00:00:00
level	trankvile manĝi vian panon	comer seu pão em paz	to eat your bread in peace	grupo	0    	0000-00-00 00:00:00
level	estis iom da silento	houve algum silêncio	there was some silence	grupo	0    	0000-00-00 00:00:00
level	kaj poste	e depois	and later	grupo	0    	0000-00-00 00:00:00
level	la gondolisto denove ekparolis	o gondoleiro falou novamente	the gondolier spoke again	grupo	0    	0000-00-00 00:00:00
level	vi venis ĝustatempe	você chegou bem na hora	you came just in time	grupo	0    	0000-00-00 00:00:00
level	por vidi ŝipkuron	ver uma corrida de barco	to see a boat race	grupo	0    	0000-00-00 00:00:00
level	iu diris malforte	alguém disse fracamente	someone said weakly	grupo	0    	0000-00-00 00:00:00
level	proksime de la gondolisto	perto do gondoleiro	near the gondolier	grupo	0    	0000-00-00 00:00:00
level	la estro de la urbo	o prefeito da cidade	the mayor of the city	grupo	0    	0000-00-00 00:00:00
level	senvorte montris al la gondolo	sem palavras apontou para a gôndola	wordlessly pointed to the gondola	grupo	0    	0000-00-00 00:00:00
level	diris la gondolisto	disse o gondoleiro	said the gondolier	grupo	0    	0000-00-00 00:00:00
level	kaj prenis la manon de sia amiko	e pegou a mão do amigo	and took his friend's hand	grupo	0    	0000-00-00 00:00:00
level	ĵetas la paperon	joga o papel	throws the paper	grupo	0    	0000-00-00 00:00:00
level	en la paperujon	na caixa de papel	into the paper bin	grupo	0    	0000-00-00 00:00:00
level	la knabinoj ĵetis la paperojn	as meninas jogaram os papéis	the girls threw the papers	grupo	0    	0000-00-00 00:00:00
level	kie estas mia skribilo?	onde está a minha caneta	where is my pen	grupo	0    	0000-00-00 00:00:00
level	mi volas respondi al li	Eu quero responder a ele	I want to answer him	grupo	0    	0000-00-00 00:00:00
level	la suno malaperis	o sol desapareceu	the sun disappeared	grupo	0    	0000-00-00 00:00:00
level	kaj nun estas preskaŭ malhele	e agora está quase escuro	and now it is almost dark	grupo	0    	0000-00-00 00:00:00
level	bonvolu manĝi	por favor coma	please eat	grupo	0    	0000-00-00 00:00:00
level	bonvolu manĝi la panon	por favor coma o pão	please eat the bread	grupo	0    	0000-00-00 00:00:00
level	per manĝiloj	com talheres	with cutlery	grupo	0    	0000-00-00 00:00:00
level	pardonu min	com licença	excuse me	grupo	0    	0000-00-00 00:00:00
level	rajtas resti	é permitido ficar	is allowed to stay	grupo	0    	0000-00-00 00:00:00
level	mi ne rajtas resti	Eu não tenho o direito de ficar	I have no right to stay	grupo	0    	0000-00-00 00:00:00
level	ĉu vi povas kunporti ~ ?	você pode trazer ~?	can you bring ~ ?	grupo	0    	0000-00-00 00:00:00
level	de mia fratino	da minha irmã	from my sister	grupo	0    	0000-00-00 00:00:00
level	kiam vi aĉetis ~ ?	quando você comprou ~?	when did you buy ~ ?	grupo	0    	0000-00-00 00:00:00
level	aĉetis tiun muzikilon	comprei aquele instrumento musical	bought that musical instrument	grupo	0    	0000-00-00 00:00:00
level	kiu laste uzis ?	quem usou por último?	who used last?	grupo	0    	0000-00-00 00:00:00
level	uzis mian ŝlosilon	usei minha chave	used my key	grupo	0    	0000-00-00 00:00:00
level	ĉu vi veturis?	você dirigiu?	did you drive?	grupo	0    	0000-00-00 00:00:00
level	en Venecio	em Veneza	in Venice	grupo	0    	0000-00-00 00:00:00
level	ankaŭ per gondolo	também de gôndola	also by gondola	grupo	0    	0000-00-00 00:00:00
level	ĉu vi povos ekdormi?	você conseguirá adormecer?	will you be able to fall asleep?	grupo	0    	0000-00-00 00:00:00
level	tiam, kiam silentiĝis	então, quando houve silêncio	then, when there was silence	grupo	0    	0000-00-00 00:00:00
level	la sinjoro estis alta	o cavalheiro era alto	the gentleman was tall	grupo	0    	0000-00-00 00:00:00
level	alta, dika	Gordo alto	tall, fat	grupo	0    	0000-00-00 00:00:00
level	dika, peza	grosso, pesado	thick, heavy	grupo	0    	0000-00-00 00:00:00
level	peza kaj larĝa	pesado e grande	heavy and large	grupo	0    	0000-00-00 00:00:00
level	estis alta, dika, peza, kaj larĝa	era alto, grosso, pesado e grande	was tall, thick, heavy, and large	grupo	0    	0000-00-00 00:00:00
level	donis forton	deu força	gave strength	grupo	0    	0000-00-00 00:00:00
level	havinda forto	uma força que vale a pena ter	a force worth having	grupo	0    	0000-00-00 00:00:00
level	havinda korpoforto	força física que vale a pena ter	physical strength worth having	grupo	0    	0000-00-00 00:00:00
level	tio donis	que deu	that gave	grupo	0    	0000-00-00 00:00:00
level	donis al li	deu a ele	gave him	grupo	0    	0000-00-00 00:00:00
level	tio donis forton	que deu força	that gave strength	grupo	0    	0000-00-00 00:00:00
level	donis havindan korpoforton	deu força ao corpo que vale a pena ter	gave body strength worth having	grupo	0    	0000-00-00 00:00:00
level	lia aspekto	a aparência dele	his appearance	grupo	0    	0000-00-00 00:00:00
level	grandula aspekto	aparência de uma pessoa alta	appearance of a tall person	grupo	0    	0000-00-00 00:00:00
level	eta rolo	um pequeno papel	a small role	grupo	0    	0000-00-00 00:00:00
level	ludis rolon	desempenhou um papel	played a role	grupo	0    	0000-00-00 00:00:00
level	ne eta rolo	não é um papel pequeno	not a small role	grupo	0    	0000-00-00 00:00:00
level	ludis etan rolon	desempenhou um pequeno papel	played a small role	grupo	0    	0000-00-00 00:00:00
level	ludis ne etan rolon	desempenhou um papel não pequeno	played no small role	grupo	0    	0000-00-00 00:00:00
level	en la fakto, ke ~	no fato de que ~	in the fact that ~	grupo	0    	0000-00-00 00:00:00
level	la plimulto el la homoj	a maioria das pessoas	the majority of the people	grupo	0    	0000-00-00 00:00:00
level	se ne timis	se não tiver medo	if not afraid	grupo	0    	0000-00-00 00:00:00
level	lin timis	tinha medo dele	was afraid of him	grupo	0    	0000-00-00 00:00:00
level	se lin timis	se ele tivesse medo	if he was afraid	grupo	0    	0000-00-00 00:00:00
level	se ne lin timis	se não tiver medo dele	if not afraid of him	grupo	0    	0000-00-00 00:00:00
level	certe respektis	certamente respeitado	certainly respected	grupo	0    	0000-00-00 00:00:00
level	almenaŭ pripensis ~	pelo menos pensei em ~	at least thought about ~	grupo	0    	0000-00-00 00:00:00
level	antaŭ ol ~	antes ~	before ~	grupo	0    	0000-00-00 00:00:00
level	kontentigi lin	para satisfazê-lo	to satisfy him	grupo	0    	0000-00-00 00:00:00
level	malkontentigi lin	desagradá-lo	to displease him	grupo	0    	0000-00-00 00:00:00
level	antaŭ ol malkontentigi ~	antes de ficar insatisfeito ~	before dissatisfying ~	grupo	0    	0000-00-00 00:00:00
level	antaŭ ol decidi ~	antes de decidir ~	before deciding ~	grupo	0    	0000-00-00 00:00:00
level	decidi malkontentigi ~	decidir desagradar ~	to decide to displease ~	grupo	0    	0000-00-00 00:00:00
level	decidi kontentigi lin	decidir satisfazê-lo	to decide to satisfy him	grupo	0    	0000-00-00 00:00:00
level	antaŭ ol decidi malkontentigi lin	antes de decidir desagradá-lo	before deciding to displease him	grupo	0    	0000-00-00 00:00:00
level	tio, kio estas utila	isso, o que é útil	that, which is useful	grupo	0    	0000-00-00 00:00:00
level	ofte utila dumtage	muitas vezes útil durante o dia	often useful during the day	grupo	0    	0000-00-00 00:00:00
level	malplaĉa ĝeno	um incômodo desagradável	an unpleasant nuisance	grupo	0    	0000-00-00 00:00:00
level	per si	sozinhos	by himself	grupo	0    	0000-00-00 00:00:00
level	prezentas malplaĉan ĝenon	apresenta um incômodo desagradável	presents an unpleasant nuisance	grupo	0    	0000-00-00 00:00:00
level	prezentas per si malplaĉan ĝenon	apresenta-se como um incômodo desagradável	presents itself as an unpleasant nuisance	grupo	0    	0000-00-00 00:00:00
level	en loko arboplena	em um lugar cheio de árvores	in a place full of trees	grupo	0    	0000-00-00 00:00:00
level	tiam, kiam oni devojiĝis	então, quando alguém se extraviou	then, when one went astray	grupo	0    	0000-00-00 00:00:00
level	en nehoma sovaĝejo	em um deserto desumano	in an inhuman wilderness	grupo	0    	0000-00-00 00:00:00
level	kaj ekstervoje iraĉas	e sai da estrada no caos	and goes off the road in chaos	grupo	0    	0000-00-00 00:00:00
level	alta larĝa korpo	um corpo alto e grande	a tall large body	grupo	0    	0000-00-00 00:00:00
level	ne sukcesis pasi ~	não conseguiu passar ~	failed to pass ~	grupo	0    	0000-00-00 00:00:00
level	inter la arbetoj	entre os arbustos	among the bushes	grupo	0    	0000-00-00 00:00:00
level	krome tuŝi la naturaĵojn	além de tocar as coisas naturais	in addition to touching the natural things	grupo	0    	0000-00-00 00:00:00
level	ĝenerale malsekajn	geralmente molhado	generally wet	grupo	0    	0000-00-00 00:00:00
level	meze de malsekaj naturaĵoj	no meio da natureza molhada	in the middle of wet nature	grupo	0    	0000-00-00 00:00:00
level	malsekaj naturaĵoj, meze de kiuj ~	coisas naturais molhadas, no meio das quais ~	wet natural things, in the middle of which ~	grupo	0    	0000-00-00 00:00:00
level	li malfacile paŝis	ele caminhou com dificuldade	he walked with difficulty	grupo	0    	0000-00-00 00:00:00
level	estis travivaĵo	foi uma experiência	it was an experience	grupo	0    	0000-00-00 00:00:00
level	ne malofte	não é incomum	not uncommon	grupo	0    	0000-00-00 00:00:00
level	doloriga kaj ĉiam malagrabla	doloroso e sempre desagradável	painful and always unpleasant	grupo	0    	0000-00-00 00:00:00
level	ju pli ~	quanto mais ~	the more ~	grupo	0    	0000-00-00 00:00:00
level	antaŭeniris en la vivo	avançou na vida	moved forward in life	grupo	0    	0000-00-00 00:00:00
level	en la kastela arbaro	na floresta do castelo	in the castle forest	grupo	0    	0000-00-00 00:00:00
level	ju pli antaŭeniris des pli malŝatis ~	quanto mais avançava mais detestava ~	the further went forward the more disliked ~	grupo	0    	0000-00-00 00:00:00
level	malŝatis la noktan naturon	não gostava da natureza noturna	disliked the nocturnal nature	grupo	0    	0000-00-00 00:00:00
level	viro kun okuloj bone videblaj	um homem com olhos que podem ser vistos claramente	a man with eyes that can be seen clearly	grupo	0    	0000-00-00 00:00:00
level	okuloj, kiuj kapablis bone vidi	olhos que podiam ver bem	eyes that could see well	grupo	0    	0000-00-00 00:00:00
level	bone vidi en la mallumo	ver bem no escuro	to see well in the dark	grupo	0    	0000-00-00 00:00:00
level	rigardis la malfacilan iron	olhou para a difícil situação	looked at the difficult going	grupo	0    	0000-00-00 00:00:00
level	de nia industriisto	do nosso industrial	from our industrialist	grupo	0    	0000-00-00 00:00:00
level	li ridetis	ele sorriu	he smiled	grupo	0    	0000-00-00 00:00:00
level	apud tiu viro	ao lado daquele homem	next to that man	grupo	0    	0000-00-00 00:00:00
level	en vestaĵo de policano	com roupas de policial	in policeman's clothing	grupo	0    	0000-00-00 00:00:00
level	staris alia persono	outra pessoa estava de pé	another person was standing	grupo	0    	0000-00-00 00:00:00
level	en simila vestaĵo	em roupas semelhantes	in similar clothing	grupo	0    	0000-00-00 00:00:00
level	ĉi lasta estis virino	a última era uma mulher	the latter was a woman	grupo	0    	0000-00-00 00:00:00
level	ni iru	vamos	let's go	grupo	0    	0000-00-00 00:00:00
level	la viro diris mallaŭte	o homem disse suavemente	the man said softly	grupo	0    	0000-00-00 00:00:00
level	en la orelon de sia kunulino	no ouvido de seu companheiro	into the ear of his companion	grupo	0    	0000-00-00 00:00:00
level	nun estas la ĝusta momento	agora é o momento certo	now is the right moment	grupo	0    	0000-00-00 00:00:00
level	ambaŭ paŝis direkte al la persono	ambos se aproximaram da pessoa	both stepped toward the person	grupo	0    	0000-00-00 00:00:00
level	ili zorgis fari ~	eles tiveram o cuidado de fazer ~	they were careful to do ~	grupo	0    	0000-00-00 00:00:00
level	kiel eble plej ~	tanto quanto possível ~	as possible as ~	grupo	0    	0000-00-00 00:00:00
