Gufujo	unue mi faris afiŝon	first I made a post	j'ai d'abord fait un post	Gufujo	0    	0000-00-00 00:00:00
Gufujo	afiŝo por la morgaŭaj ekskursoj	post for tomorrow's excursions	post pour les excursions de demain	Gufujo	0    	0000-00-00 00:00:00
Gufujo	mi faris afiŝon por ekskursoj	I made a post for excursions	J'ai fait un post pour les excursions	Gufujo	0    	0000-00-00 00:00:00
Gufujo	cetere, ĉu vi iros?	by the way, are you going?	au fait, tu y vas ?	Gufujo	0    	0000-00-00 00:00:00
Ekskurso	iros al ekskurso	will go on an excursion	je ferai une excursion	Ekskurso	0    	0000-00-00 00:00:00
Ekskurso	ĉu vi iros al iu ekskurso?	are you going on any excursion?	tu pars en excursion ?	Ekskurso	0    	0000-00-00 00:00:00
Ekskurso	jes, al la granda akvofalo	yes, to the great waterfall	oui, à la grande cascade	Ekskurso	0    	0000-00-00 00:00:00
Ekskurso	kaj poste al ekspozicio	and then to an exhibition	puis à une exposition	Ekskurso	0    	0000-00-00 00:00:00
Ekskurso	ekspozicio pri moderna arto	an exhibition on modern art	une exposition sur l'art moderne	Ekskurso	0    	0000-00-00 00:00:00
Ekskurso	al akvofalo kaj poste al ekspozicio	to a waterfall and then to an exhibition	à une cascade puis à une exposition	Ekskurso	0    	0000-00-00 00:00:00
Ekskurso	bona elekto	a good choice	un bon choix	Ekskurso	0    	0000-00-00 00:00:00
Ekskurso	ankaŭ mi iros tien	I will go there too	j'y vais aussi	Ekskurso	0    	0000-00-00 00:00:00
Ekskurso	ĉiukaze, mi gvidis diskutrondon	anyway, I led a discussion group	de toute façon, j'ai animé un groupe de discussion	Ekskurso	0    	0000-00-00 00:00:00
Ekskurso	pendigi afiŝojn	to hang posters	accrocher des affiches	Ekskurso	0    	0000-00-00 00:00:00
Ekskurso	post la pendigado de la ekskursafiŝoj	after the hanging of the excursion posters	après l'accrochage des affiches d'excursion	Ekskurso	0    	0000-00-00 00:00:00
Ekskurso	diskutrondo kun la titolo "feminismo"	discussion group with the title "feminism"	groupe de discussion intitulé "féminisme"	Ekskurso	0    	0000-00-00 00:00:00
Ekskurso	gvidis diskuton kun la titolo "feminismo"	led a discussion with the title "feminism"	a mené une discussion intitulée "féminisme"	Ekskurso	0    	0000-00-00 00:00:00
Ekskurso	ĉu feminismo samas en diversaj landoj?	is feminism the same in different countries?	le féminisme est-il le même dans différents pays ?	Ekskurso	0    	0000-00-00 00:00:00
Ekskurso	interesa kaj vigla diskuto	interesting and lively discussion	discussion intéressante et animée	Ekskurso	0    	0000-00-00 00:00:00
Ekskurso	estis tre interesa kaj vigla	was very interesting and lively	c'était très intéressant et vivant	Ekskurso	0    	0000-00-00 00:00:00
Ekskurso	dum la lastaj kvin horoj	for the last five hours	pendant les cinq dernières heures	Ekskurso	0    	0000-00-00 00:00:00
Ekskurso	mi estis en longa kunsido	I was in a long session	J'étais dans une longue séance	Ekskurso	0    	0000-00-00 00:00:00
Ekskurso	dum lastaj horoj mi estis en komitatkunsido	for the last few hours I have been in a committee meeting	ces dernières heures, j'étais en réunion de commission	Ekskurso	0    	0000-00-00 00:00:00
Ekskurso	en longa komitatkunsido	in a long committee meeting	lors d'une longue réunion de comité	Ekskurso	0    	0000-00-00 00:00:00
Ekskurso	vere estis tro longa	it really was too long	c'était vraiment trop long	Ekskurso	0    	0000-00-00 00:00:00
Ekskurso	la komitato finkunsidis	the committee has concluded its meeting	le comité a terminé sa réunion	Ekskurso	0    	0000-00-00 00:00:00
Ekskurso	sed nun la komitato finis kunsidon	but now the committee has finished the meeting	mais maintenant le comité a terminé la réunion	Ekskurso	0    	0000-00-00 00:00:00
Ekskurso	vere estis longa, sed nun finiĝis	it was really long, but now it's over	c'était vraiment long, mais maintenant c'est fini	Ekskurso	0    	0000-00-00 00:00:00
Ekskurso	ha, vi do estas komitatano?	oh, so you're a committee member?	oh, alors tu es membre du comité ?	Ekskurso	0    	0000-00-00 00:00:00
Ekskurso	la estraro de TEJO	the board of TEJO	le conseil d'administration de TEJO	Ekskurso	0    	0000-00-00 00:00:00
Ekskurso	mi ankaŭ estas en la estraro	I'm also on the board	je suis aussi au conseil d'administration	Ekskurso	0    	0000-00-00 00:00:00
Ekskurso	jes, mi ankaŭ estas ~	yes, I am too ~	oui, je le suis aussi ~	Ekskurso	0    	0000-00-00 00:00:00
Ekskurso	ankaŭ estas en la estraro de TEJO	is also on the board of TEJO	est également membre du conseil d'administration de TEJO	Ekskurso	0    	0000-00-00 00:00:00
Ekskurso	jes, kaj mi estas ~	yes, and I'm ~	oui, et je suis ~	Ekskurso	0    	0000-00-00 00:00:00
Ekskurso	mi neniam estis aktiva	I have never been active	Je n'ai jamais été actif	Ekskurso	0    	0000-00-00 00:00:00
Ekskurso	tre aktiva en la movado	very active in the movement	très actif dans le mouvement	Ekskurso	0    	0000-00-00 00:00:00
Ekskurso	neniam estis aktiva en la movado	was never active in the movement	n'a jamais été actif dans le mouvement	Ekskurso	0    	0000-00-00 00:00:00
Ekskurso	la ĉefa agado de TEJO	the main activity of TEJO	l'activité principale de TEJO	Ekskurso	0    	0000-00-00 00:00:00
Ekskurso	kio estas la ĉefa agado nun?	what is the main activity now?	quelle est l'activité principale maintenant ?	Ekskurso	0    	0000-00-00 00:00:00
Ekskurso	fakte kio estas la ĉefa agado?	actually what is the main activity?	au fait, quelle est l'activité principale ?	Ekskurso	0    	0000-00-00 00:00:00
Ekskurso	ĝi estas vasta	it is vast	c'est vaste	Ekskurso	0    	0000-00-00 00:00:00
Ekskurso	plej diversaj kampoj	a wide variety of fields	une grande variété de domaines	Ekskurso	0    	0000-00-00 00:00:00
Ekskurso	en diversaj kampoj ni havas agadon	in various fields we have activity	dans divers domaines nous avons une activité	Ekskurso	0    	0000-00-00 00:00:00
Ekskurso	seminarioj pri homaj rajtoj	seminars on human rights	séminaires sur les droits de l'homme	Ekskurso	0    	0000-00-00 00:00:00
Ekskurso	homaj rajtoj kaj interkulturaj rilatoj	human rights and intercultural relations	droits de l'homme et relations interculturelles	Ekskurso	0    	0000-00-00 00:00:00
Ekskurso	biciklo, karavano, festivalo	bicycle, caravan, festival	vélo, caravane, festival	Ekskurso	0    	0000-00-00 00:00:00
Ekskurso	ekzemple seminarioj, biciklokaravanoj kaj festivaloj	for example seminars, bicycle caravans and festivals	par exemple séminaires, caravanes à vélo et festivals	Ekskurso	0    	0000-00-00 00:00:00
Ekskurso	lingvaj festivaloj, konstruado de ttt-paĝoj	language festivals, building web pages	festivals de langues, création de pages Web	Ekskurso	0    	0000-00-00 00:00:00
Ekskurso	ekzemple biciklokaravanoj, festivaloj ktp	for example bicycle caravans, festivals etc	par exemple caravanes à vélo, festivals, etc.	Ekskurso	0    	0000-00-00 00:00:00
Ekskurso	seminario pri rajtoj kaj rilatoj	a seminar about rights and relationship	un séminaire sur les droits et les relations	Ekskurso	0    	0000-00-00 00:00:00
Ekskurso	karavano, festivalo, konstruado ktp	caravan, festival, construction etc	caravane, festival, construction, etc.	Ekskurso	0    	0000-00-00 00:00:00
Ekskurso	oficialaj instancoj kiel UNESKO	official bodies such as UNESCO	organismes officiels tels que l'UNESCO	Ekskurso	0    	0000-00-00 00:00:00
Ekskurso	reprezentitaj en oficialaj instancoj	represented in official bodies	représenté dans les instances officielles	Ekskurso	0    	0000-00-00 00:00:00
Ekskurso	ni ankaŭ estas reprezentitaj	we are also represented	nous sommes également représentés	Ekskurso	0    	0000-00-00 00:00:00
UNESKO	estas reprezentita en diversaj instancoj	is represented in various bodies	est représenté dans diverses instances	UNESKO	0    	0000-00-00 00:00:00
UNESKO	instancoj kiel Forumo Junulara Eŭropa, UNESKO	bodies such as the European Youth Forum, UNESCO	des organismes tels que le Forum européen de la jeunesse, l'UNESCO	UNESKO	0    	0000-00-00 00:00:00
UNESKO	la junulara sekcio de Unuiĝintaj Nacioj	the youth section of the United Nations	la section jeunesse des Nations Unies	UNESKO	0    	0000-00-00 00:00:00
UNESKO	diversaj instancoj kiel UNESKO kaj la junulara sekcio de UN	various bodies such as UNESCO and the youth section of the UN	diverses instances telles que l'UNESCO et la section jeunesse de l'ONU	UNESKO	0    	0000-00-00 00:00:00
UNESKO	UNESKO kaj la junulara sekcio de Unuiĝintaj Nacioj	UNESCO and the youth section of the United Nations	L'UNESCO et la section jeunesse des Nations Unies	UNESKO	0    	0000-00-00 00:00:00
UNESKO	Forumo Junulara Eŭropa kaj la junulara sekcio de UN	European Youth Forum and the youth section of the UN	Forum européen de la Jeunesse et section jeunesse de l'ONU	UNESKO	0    	0000-00-00 00:00:00
UNESKO	sonas interese	sounds interesting	Ça semble intéressant	UNESKO	0    	0000-00-00 00:00:00
UNESKO	folio, foliumi, vento, ventumi, esperanto, esperantumi	a leaf, to browse, a wind, to fan, Esperanto, to enjoy Esperanto	une feuille, parcourir, un vent, ventiler, espéranto, profiter de l'espéranto	UNESKO	0    	0000-00-00 00:00:00
UNESKO	por mi sufiĉas esperantumi	for me it's enough to speak Esperanto	pour moi, il suffit de parler espéranto	UNESKO	0    	0000-00-00 00:00:00
UNESKO	esperantumi unu aŭ du semajnojn	to enjoy Esperanto for a week or two	profiter de l'espéranto pendant une semaine ou deux	UNESKO	0    	0000-00-00 00:00:00
UNESKO	unu aŭ du semajnojn jare	one or two weeks a year	une à deux semaines par an	UNESKO	0    	0000-00-00 00:00:00
UNESKO	tamen por mi sufiĉas	however, it is enough for me	mais ça me suffit	UNESKO	0    	0000-00-00 00:00:00
UNESKO	jes, oni trovu ~	yes, one should find ~	oui, il faut trouver ~	UNESKO	0    	0000-00-00 00:00:00
UNESKO	trovi ekvilibron	to find balance	trouver l'équilibre	UNESKO	0    	0000-00-00 00:00:00
UNESKO	oni trovu sian ekvilibron	everyone should find one's own balance	chacun devrait trouver son propre équilibre	UNESKO	0    	0000-00-00 00:00:00
UNESKO	mi sentas ke estas tro	I feel it's too much	je sens que c'est trop	UNESKO	0    	0000-00-00 00:00:00
UNESKO	ĝuste nun mi sentas	right now I feel	en ce moment je me sens	UNESKO	0    	0000-00-00 00:00:00
UNESKO	mi sentas ke ~	I feel that ~	Je sens que ~	UNESKO	0    	0000-00-00 00:00:00
UNESKO	sentas ke estas tro da ~	feels like there are too many ~	on dirait qu'il y en a trop ~	UNESKO	0    	0000-00-00 00:00:00
UNESKO	tro da Esperanto en mia vivo	too much Esperanto in my life	trop d'espéranto dans ma vie	UNESKO	0    	0000-00-00 00:00:00
UNESKO	estas tro da Esperanto en mia vivo	there is too much Esperanto in my life	il y a trop d'espéranto dans ma vie	UNESKO	0    	0000-00-00 00:00:00
UNESKO	ĉu vi estas membro?	are you a member?	Êtes vous membre?	UNESKO	0    	0000-00-00 00:00:00
UNESKO	ĉu vi estas membro de organizo?	are you a member of an organization?	êtes-vous membre d'une organisation?	UNESKO	0    	0000-00-00 00:00:00
UNESKO	membro de iu alia organizo	a member of some other organization	un membre d'une autre organisation	UNESKO	0    	0000-00-00 00:00:00
UNESKO	ne vere organizo, sed ~	not really an organization, but ~	pas vraiment une organisation, mais ~	UNESKO	0    	0000-00-00 00:00:00
UNESKO	sed mi ludas gitaron	but I play guitar	mais je joue de la guitare	UNESKO	0    	0000-00-00 00:00:00
UNESKO	ludas gitaron en bando	plays guitar in a band	joue de la guitare dans un groupe	UNESKO	0    	0000-00-00 00:00:00
UNESKO	bele! mi tre ŝatas	nice! I really like	bon! J'aime vraiment	UNESKO	0    	0000-00-00 00:00:00
UNESKO	mi ŝatas kanti	I like to sing	J'aime chanter	UNESKO	0    	0000-00-00 00:00:00
UNESKO	tre ŝatas kanti	likes to sing very much	aime beaucoup chanter	UNESKO	0    	0000-00-00 00:00:00
UNESKO	kian muzikon vi ludas?	what kind of music do you play?	Quelle sorte de musique joues tu?	UNESKO	0    	0000-00-00 00:00:00
UNESKO	nu, estas simpla popo	well, it's simple pop	eh bien, c'est simple pop	UNESKO	0    	0000-00-00 00:00:00
UNESKO	ni ĵus fondis la bandon	we just started the band	nous venons de créer le groupe	UNESKO	0    	0000-00-00 00:00:00
UNESKO	sed eventuale ni ludos	but eventually we will play	mais finalement nous jouerons	UNESKO	0    	0000-00-00 00:00:00
UNESKO	ni ludis dum la IJK	we played during the IJK	nous avons joué pendant l'IJK	UNESKO	0    	0000-00-00 00:00:00
UNESKO	ludos dum la venonta IJK	will play during the next IJK	jouera lors du prochain IJK	UNESKO	0    	0000-00-00 00:00:00
UNESKO	mi jam antaŭĝojas!	I'm already looking forward to it!	J'ai déjà hâte d'y être !	UNESKO	0    	0000-00-00 00:00:00
UNESKO	nur diru se vi bezonas ~	just say if you need ~	dis juste si tu as besoin ~	UNESKO	0    	0000-00-00 00:00:00
UNESKO	bezonas iun helpkantiston	needs some backup singer	a besoin d'un chanteur suppléant	UNESKO	0    	0000-00-00 00:00:00
UNESKO	se vi bezonas helpkantiston	if you need a backup singer	si tu as besoin d'un chanteur suppléant	UNESKO	0    	0000-00-00 00:00:00
UNESKO	kial ne? eble vi volas ~	why not? maybe you want ~	pourquoi pas? peut-être que tu veux ~	UNESKO	0    	0000-00-00 00:00:00
UNESKO	vi volas kanti ion nun	you want to sing something now	tu veux chanter quelque chose maintenant	UNESKO	0    	0000-00-00 00:00:00
UNESKO	mi povas ludi gitaron	I can play guitar	Je peux jouer de la guitare	UNESKO	0    	0000-00-00 00:00:00
UNESKO	vi volas kanti kaj mi povas ludi	you want to sing and I can play	tu veux chanter et je peux jouer	UNESKO	0    	0000-00-00 00:00:00
UNESKO	kanti ion nun kaj ludi gitaron	to sing something now and to play guitar	chanter quelque chose maintenant et jouer de la guitare	UNESKO	0    	0000-00-00 00:00:00
UNESKO	jes, mi ŝatus tion	yes, I would like that	Oui, j'aimerais cela	UNESKO	0    	0000-00-00 00:00:00
UNESKO	venigi mian gitaron	to bring my guitar	apporter ma guitare	UNESKO	0    	0000-00-00 00:00:00
UNESKO	tuj venigos mian gitaron	will bring my guitar right away	j'apporterai ma guitare tout de suite	UNESKO	0    	0000-00-00 00:00:00
UNESKO	tre bone, mi venigos gitaron	very well, I'll bring a guitar	très bien, j'apporterai une guitare	UNESKO	0    	0000-00-00 00:00:00
UNESKO	mi tuj venigos mian gitaron	I'll bring my guitar right away	J'apporte ma guitare tout de suite	UNESKO	0    	0000-00-00 00:00:00
Reveno	atendas vian revenon	waits for your return	attend ton retour	Reveno	0    	0000-00-00 00:00:00
Reveno	via espereble rapida reveno	your hopefully speedy return	votre retour, je l'espère, rapide	Reveno	0    	0000-00-00 00:00:00
Reveno	mi atendas rapidan revenon	I expect a quick return	j'attends un retour rapide	Reveno	0    	0000-00-00 00:00:00
Reveno	atendas vian espereble rapidan revenon	waits for your hopefully speedy return	attend votre retour, je l'espère, rapide	Reveno	0    	0000-00-00 00:00:00
Reveno	du tagojn poste	two days later	deux jours plus tard	Reveno	0    	0000-00-00 00:00:00
Reveno	ekster la dancejo	outside the dance floor	en dehors de la piste de danse	Reveno	0    	0000-00-00 00:00:00
Reveno	tagojn poste, ekster la dancejo	days later, outside the dance floor	quelques jours plus tard, à l'extérieur de la piste de danse	Reveno	0    	0000-00-00 00:00:00
Reveno	ej Kabe, vi aspektas ~	hey Kabe, you look ~	Hé Kabe, tu as l'air ~	Reveno	0    	0000-00-00 00:00:00
Reveno	vi aspektas feliĉega	you look very happy	Tu sembles très heureux	Reveno	0    	0000-00-00 00:00:00
Reveno	jes, mi estas ~	yes, I am ~	oui, je le suis ~	Reveno	0    	0000-00-00 00:00:00
Reveno	bele, mi ĝojas!	nicely, I'm glad!	bien, je suis content!	Reveno	0    	0000-00-00 00:00:00
Reveno	kongreso plaĉas al vi?	do you like congress?	tu aimes le congrès ?	Reveno	0    	0000-00-00 00:00:00
Reveno	ĉu la kongreso tiom plaĉas al vi?	do you like the congress that much?	est-ce que tu aimes tant le congrès ?	Reveno	0    	0000-00-00 00:00:00
Reveno	jes kaj ne	yes and no	Oui et non	Reveno	0    	0000-00-00 00:00:00
Reveno	certe mi tre kontentas	I'm sure I'm very satisfied	je suis sûr que je suis très satisfait	Reveno	0    	0000-00-00 00:00:00
Reveno	tre kontentas pri IJK	is very satisfied with IJK	est très satisfait d'IJK	Reveno	0    	0000-00-00 00:00:00
Reveno	sed estas io alia	but there is something else	mais il y a autre chose	Reveno	0    	0000-00-00 00:00:00
Reveno	io alia, kio feliĉigas min	something else, that makes me happy	autre chose, ça me fait plaisir	Reveno	0    	0000-00-00 00:00:00
Reveno	estas io kio feliĉigas ~	is something that makes ~	est quelque chose qui fait ~	Reveno	0    	0000-00-00 00:00:00
Reveno	pli ĝuste dirite	more correctly said	dit plus correctement	Reveno	0    	0000-00-00 00:00:00
Reveno	estas iu, kiu batigas ~	there is someone who beats ~	il y a quelqu'un qui bat ~	Reveno	0    	0000-00-00 00:00:00
Reveno	iu kiu batigas mian koron	someone who makes my heart beat	quelqu'un qui fait battre mon coeur	Reveno	0    	0000-00-00 00:00:00
Reveno	diru, diru, ĉu vi enamiĝis?	say, say, have you fallen in love?	dis, dis, es-tu tombé amoureux ?	Reveno	0    	0000-00-00 00:00:00
Reveno	enamiĝis al iu knabino	fell in love with some girl	je suis tombé amoureux d'une fille	Reveno	0    	0000-00-00 00:00:00
Reveno	ĉu vi enamiĝis al knabino?	did you fall in love with a girl?	es-tu tombé amoureux d'une fille ?	Reveno	0    	0000-00-00 00:00:00
Reveno	ne certas ĉu mi enamiĝis	is not sure if I fell in love	je ne suis pas sûr d'être tombé amoureux	Reveno	0    	0000-00-00 00:00:00
Reveno	ne certas, sed sentiĝas bone	is not sure, but it feels good	je ne suis pas sûr, mais ça fait du bien	Reveno	0    	0000-00-00 00:00:00
Reveno	mi ne certas ĉu mi jam enamiĝis	I'm not sure if I'm in love yet	Je ne sais pas si je suis encore amoureux	Reveno	0    	0000-00-00 00:00:00
Reveno	sed sentiĝas tre bone	but it feels very good	mais ça fait du bien	Reveno	0    	0000-00-00 00:00:00
Reveno	ŝi eĉ kisis min	she even kissed me	elle m'a même embrassé	Reveno	0    	0000-00-00 00:00:00
Reveno	kisis min sur la buŝon	kissed me on the lips	m'a embrassé sur les lèvres	Reveno	0    	0000-00-00 00:00:00
Reveno	eĉ kisis min dum labambo	even kissed me during La Bamba	m'a même embrassé pendant La Bamba	Reveno	0    	0000-00-00 00:00:00
Reveno	mirinde kian kison	amazing what a kiss	incroyable quel baiser	Reveno	0    	0000-00-00 00:00:00
Reveno	kian kison ŝi donis!	what a kiss she gave!	quel baiser elle a donné !	Reveno	0    	0000-00-00 00:00:00
Reveno	bonege! nun mi komprenas	great! now I understand	super! Maintenant, je comprends	Reveno	0    	0000-00-00 00:00:00
Reveno	komprenas kial vi elradias	understands why you are radiating	comprend pourquoi vous rayonnez	Reveno	0    	0000-00-00 00:00:00
Reveno	vi elradias tiom da ĝojo	you exude so much joy	tu respires tellement de joie	Reveno	0    	0000-00-00 00:00:00
Reveno	fakte, io simila okazis	in fact, something similar happened	en fait, quelque chose de similaire s'est produit	Reveno	0    	0000-00-00 00:00:00
Reveno	io simila okazis al mi	something similar happened to me	quelque chose de similaire m'est arrivé	Reveno	0    	0000-00-00 00:00:00
Reveno	sed mi pensis ke ~	but I thought that ~	mais je pensais que ~	Reveno	0    	0000-00-00 00:00:00
Reveno	pensis ke vi ne ŝatas ~	thought you didn't like ~	je pensais que tu n'aimais pas ~	Reveno	0    	0000-00-00 00:00:00
Reveno	vi ne ŝatas labambumi	you don't like dance on La Bamba	tu n'aimes pas danser sur La Bamba	Reveno	0    	0000-00-00 00:00:00
Reveno	prave, ne okazis	right, it didn't happen	c'est vrai, ça n'est pas arrivé	Reveno	0    	0000-00-00 00:00:00
Reveno	okazis en la dancejo	happened in the dance floor	c'est arrivé sur la piste de danse	Reveno	0    	0000-00-00 00:00:00
Reveno	ne okazis en dancejo	it didn't happen on a dance floor	ça ne s'est pas produit sur une piste de danse	Reveno	0    	0000-00-00 00:00:00
Reveno	sed en la Gufujo	but in the Owlery	mais dans la Volière	Reveno	0    	0000-00-00 00:00:00
Reveno	kaj ne estis kiso	and it was not kiss	et ce n'était pas un baiser	Reveno	0    	0000-00-00 00:00:00
Reveno	ne kiso sed tamen io ĝojiga	not a kiss but still something gratifying	pas un baiser mais quand même quelque chose de gratifiant	Reveno	0    	0000-00-00 00:00:00
Reveno	sed tamen io tre ĝojiga	but nevertheless something very joyful	mais néanmoins quelque chose de très joyeux	Reveno	0    	0000-00-00 00:00:00
Reveno	do, rakontu!	so, tell!	alors, dis-le !	Reveno	0    	0000-00-00 00:00:00
Flirtumi	mi ne scias kion diri	I don't know what to say	Je ne sais pas quoi dire	Flirtumi	0    	0000-00-00 00:00:00
Flirtumi	ne scias kion diri vere	don't know what to say really	je ne sais pas vraiment quoi dire	Flirtumi	0    	0000-00-00 00:00:00
Flirtumi	nenio speciala okazis	nothing special happened	rien de spécial ne s'est produit	Flirtumi	0    	0000-00-00 00:00:00
Flirtumi	almenaŭ ankoraŭ ne okazis	at least it hasn't happened yet	au moins, ce n'est pas encore arrivé	Flirtumi	0    	0000-00-00 00:00:00
Flirtumi	sed mi iel sentis ~	but I somehow felt ~	mais je me sentais d'une manière ou d'une autre ~	Flirtumi	0    	0000-00-00 00:00:00
Flirtumi	sentis ke ŝi tre ŝatas min	felt that she likes me very much	je sentais qu'elle m'aimait beaucoup	Flirtumi	0    	0000-00-00 00:00:00
Flirtumi	iel sentis ke ŝi tre ŝatas min	somehow felt that she likes me very much	d'une manière ou d'une autre, j'avais l'impression qu'elle m'aimait beaucoup	Flirtumi	0    	0000-00-00 00:00:00
Flirtumi	ŝi ŝatas min kaj mi ŝin	she likes me and I like her	elle m'aime bien et je l'aime bien	Flirtumi	0    	0000-00-00 00:00:00
Flirtumi	ni longe babilis pri ~	we chatted for a long time about ~	nous avons longuement discuté de ~	Flirtumi	0    	0000-00-00 00:00:00
Flirtumi	longe babilis pri muziko	had a long chat about music	nous avons longuement discuté de musique	Flirtumi	0    	0000-00-00 00:00:00
Flirtumi	kaj poste kantis kune	and then sang together	puis ils ont chanté ensemble	Flirtumi	0    	0000-00-00 00:00:00
Flirtumi	mi pensas ke ŝi flirtumis	I think she was flirting	Je pense qu'elle flirtait	Flirtumi	0    	0000-00-00 00:00:00
Flirtumi	ŝi flirtumis kun mi	she was flirting with me	elle flirtait avec moi	Flirtumi	0    	0000-00-00 00:00:00
Flirtumi	estis tre agrable	it was very nice	c'était très agréable	Flirtumi	0    	0000-00-00 00:00:00
Flirtumi	kiel diras via amiko de Kanado	as your friend from Canada says	comme le dit ton ami du Canada	Flirtumi	0    	0000-00-00 00:00:00
Flirtumi	"Malfeke!", kiel diras amiko de Kanado	"Shit good!", as a friend from Canada says	Merde, c'est bien !, comme dit un ami du Canada	Flirtumi	0    	0000-00-00 00:00:00
Flirtumi	jes, vere! mi esperas ~	yes, really! I hope ~	Oui vraiment! j'espère ~	Flirtumi	0    	0000-00-00 00:00:00
Flirtumi	renkonti ŝin baldaŭ denove	to meet her again soon	pour la revoir bientôt	Flirtumi	0    	0000-00-00 00:00:00
Flirtumi	esperas renkonti ŝin denove	hopes to meet her again	j'espère la revoir	Flirtumi	0    	0000-00-00 00:00:00
Flirtumi	mi esperas renkonti ŝin baldaŭ	I hope to meet her soon	J'espère la rencontrer bientôt	Flirtumi	0    	0000-00-00 00:00:00
Flirtumi	same mi	same me	pareil moi	Flirtumi	0    	0000-00-00 00:00:00
Flirtumi	ĉe lago proksime de ~	at a lake near ~	au bord d'un lac près de ~	Flirtumi	0    	0000-00-00 00:00:00
Flirtumi	lago proksime de kongresejo	a lake near a congress place	un lac près d'un lieu de congrès	Flirtumi	0    	0000-00-00 00:00:00
Flirtumi	proksime de la kongresejo	near the congress hall	près de la salle des congrès	Flirtumi	0    	0000-00-00 00:00:00
Flirtumi	ho, ankaŭ vi estas ~	oh, you are too ~	oh, tu l'es aussi ~	Flirtumi	0    	0000-00-00 00:00:00
Flirtumi	ankaŭ vi estas ĉi tie!?	you are here too!?	tu es là aussi !?	Flirtumi	0    	0000-00-00 00:00:00
Flirtumi	jes, mi renkontos ~	yes, I will meet ~	oui, je vais rencontrer ~	Flirtumi	0    	0000-00-00 00:00:00
Flirtumi	renkontos amikon ĉi tie baldaŭ	will meet a friend here soon	je rencontrerai bientôt un ami ici	Flirtumi	0    	0000-00-00 00:00:00
Flirtumi	por privata interparolo	for a private conversation	pour une conversation privée	Flirtumi	0    	0000-00-00 00:00:00
Flirtumi	renkontos amikon por privata interparolo	will meet a friend for a private conversation	je rencontrerai un ami pour une conversation privée	Flirtumi	0    	0000-00-00 00:00:00
Flirtumi	do, mi ŝatus peti vin ~	so, I would like to ask you ~	alors, je voudrais vous demander ~	Flirtumi	0    	0000-00-00 00:00:00
Flirtumi	mi ŝatus peti vin foriri	I'd like to ask you to leave	J'aimerais te demander de partir	Flirtumi	0    	0000-00-00 00:00:00
Flirtumi	nu, tio ne eblas	well, that's not possible	eh bien, ce n'est pas possible	Flirtumi	0    	0000-00-00 00:00:00
Flirtumi	tute ne eblas fakte	is not possible at all actually	ce n'est pas du tout possible en fait	Flirtumi	0    	0000-00-00 00:00:00
Flirtumi	kial? estas tre grava por mi!	why? it is very important to me!	pourquoi ? c'est très important pour moi!	Flirtumi	0    	0000-00-00 00:00:00
Flirtumi	tiu ĉi renkonto estas tre grava	this meeting is very important	cette réunion est très importante	Flirtumi	0    	0000-00-00 00:00:00
Flirtumi	do, bonvolu lasi min	so please let me go	alors s'il te plaît, laisse-moi partir	Flirtumi	0    	0000-00-00 00:00:00
Flirtumi	bonvolu lasi min sola	please leave me alone	s'il te plaît laisse moi seul	Flirtumi	0    	0000-00-00 00:00:00
Flirtumi	kiel mi ĵus diris,	like I just said,	comme je viens de le dire,	Flirtumi	0    	0000-00-00 00:00:00
Flirtumi	mi diris, tio ne eblas	I said, that is not possible	J'ai dit, ce n'est pas possible	Flirtumi	0    	0000-00-00 00:00:00
Flirtumi	amiko de mi baldaŭ aperos	a friend of mine will appear soon	un de mes amis apparaîtra bientôt	Flirtumi	0    	0000-00-00 00:00:00
Flirtumi	ĉar ankaŭ amiko baldaŭ aperos	because a friend will soon appear too	parce qu'un ami va bientôt apparaître aussi	Flirtumi	0    	0000-00-00 00:00:00
Flirtumi	ankaŭ amiko aperos ĉi tie	a friend will also appear here	un ami apparaîtra également ici	Flirtumi	0    	0000-00-00 00:00:00
