level	nur diru se vi bezonas ~	basta dizer se precisar ~	just say if you need ~	grupo	0    	0000-00-00 00:00:00
level	bezonas iun helpkantiston	precisa de algum cantor de apoio	needs some backup singer	grupo	0    	0000-00-00 00:00:00
level	se vi bezonas helpkantiston	se você precisar de um cantor de apoio	if you need a backup singer	grupo	0    	0000-00-00 00:00:00
level	kial ne? eble vi volas ~	por que não? talvez você queira ~	why not? maybe you want ~	grupo	0    	0000-00-00 00:00:00
level	vi volas kanti ion nun	você quer cantar alguma coisa agora	you want to sing something now	grupo	0    	0000-00-00 00:00:00
level	mi povas ludi gitaron	eu posso tocar violão	I can play guitar	grupo	0    	0000-00-00 00:00:00
level	vi volas kanti kaj mi povas ludi	você quer cantar e eu posso tocar	you want to sing and I can play	grupo	0    	0000-00-00 00:00:00
level	kanti ion nun kaj ludi gitaron	cantar alguma coisa agora e tocar violão	to sing something now and to play guitar	grupo	0    	0000-00-00 00:00:00
level	jes, mi ŝatus tion	sim eu gostaria disso	yes, I would like that	grupo	0    	0000-00-00 00:00:00
level	venigi mian gitaron	trazer meu violão	to bring my guitar	grupo	0    	0000-00-00 00:00:00
level	tuj venigos mian gitaron	vou trazer meu violão imediatamente	will bring my guitar right away	grupo	0    	0000-00-00 00:00:00
level	tre bone, mi venigos gitaron	muito bem, vou trazer um violão	very well, I'll bring a guitar	grupo	0    	0000-00-00 00:00:00
level	mi tuj venigos mian gitaron	Vou trazer meu violão imediatamente	I'll bring my guitar right away	grupo	0    	0000-00-00 00:00:00
level	atendas vian revenon	espera pelo seu retorno	waits for your return	grupo	0    	0000-00-00 00:00:00
level	via espereble rapida reveno	seu retorno esperançosamente rápido	your hopefully speedy return	grupo	0    	0000-00-00 00:00:00
level	mi atendas rapidan revenon	Espero um retorno rápido	I expect a quick return	grupo	0    	0000-00-00 00:00:00
level	atendas vian espereble rapidan revenon	aguarda seu retorno esperançosamente rápido	waits for your hopefully speedy return	grupo	0    	0000-00-00 00:00:00
level	du tagojn poste	dois dias depois	two days later	grupo	0    	0000-00-00 00:00:00
level	ekster la dancejo	fora da pista de dança	outside the dance floor	grupo	0    	0000-00-00 00:00:00
level	tagojn poste, ekster la dancejo	dias depois, fora da pista de dança	days later, outside the dance floor	grupo	0    	0000-00-00 00:00:00
level	ej Kabe, vi aspektas ~	ei Kabe, você parece ~	hey Kabe, you look ~	grupo	0    	0000-00-00 00:00:00
level	vi aspektas feliĉega	você parece muito feliz	you look very happy	grupo	0    	0000-00-00 00:00:00
level	jes, mi estas ~	sim, eu sou ~	yes, I am ~	grupo	0    	0000-00-00 00:00:00
level	bele, mi ĝojas!	bem, estou feliz!	nicely, I'm glad!	grupo	0    	0000-00-00 00:00:00
level	kongreso plaĉas al vi?	você gosta de congresso?	do you like congress?	grupo	0    	0000-00-00 00:00:00
level	ĉu la kongreso tiom plaĉas al vi?	você gosta tanto do congresso?	do you like the congress that much?	grupo	0    	0000-00-00 00:00:00
level	jes kaj ne	sim e não	yes and no	grupo	0    	0000-00-00 00:00:00
level	certe mi tre kontentas	Tenho certeza que estou muito satisfeito	I'm sure I'm very satisfied	grupo	0    	0000-00-00 00:00:00
level	tre kontentas pri IJK	está muito satisfeito com IJK	is very satisfied with IJK	grupo	0    	0000-00-00 00:00:00
level	sed estas io alia	Mas há algo mais	but there is something else	grupo	0    	0000-00-00 00:00:00
level	io alia, kio feliĉigas min	outra coisa que me deixa feliz	something else, that makes me happy	grupo	0    	0000-00-00 00:00:00
level	estas io kio feliĉigas ~	é algo que faz ~	is something that makes ~	grupo	0    	0000-00-00 00:00:00
level	pli ĝuste dirite	mais corretamente dito	more correctly said	grupo	0    	0000-00-00 00:00:00
level	estas iu, kiu batigas ~	tem alguém que bate ~	there is someone who beats ~	grupo	0    	0000-00-00 00:00:00
level	iu kiu batigas mian koron	alguém que faz meu coração bater	someone who makes my heart beat	grupo	0    	0000-00-00 00:00:00
level	diru, diru, ĉu vi enamiĝis?	diga, diga, você se apaixonou?	say, say, have you fallen in love?	grupo	0    	0000-00-00 00:00:00
level	enamiĝis al iu knabino	me apaixonei por alguma garota	fell in love with some girl	grupo	0    	0000-00-00 00:00:00
level	ĉu vi enamiĝis al knabino?	você se apaixonou por uma garota?	did you fall in love with a girl?	grupo	0    	0000-00-00 00:00:00
level	ne certas ĉu mi enamiĝis	não tenho certeza se me apaixonei	is not sure if I fell in love	grupo	0    	0000-00-00 00:00:00
level	ne certas, sed sentiĝas bone	não tenho certeza, mas é bom	is not sure, but it feels good	grupo	0    	0000-00-00 00:00:00
level	mi ne certas ĉu mi jam enamiĝis	Não tenho certeza se estou apaixonado ainda	I'm not sure if I'm in love yet	grupo	0    	0000-00-00 00:00:00
level	sed sentiĝas tre bone	mas é muito bom	but it feels very good	grupo	0    	0000-00-00 00:00:00
level	ŝi eĉ kisis min	ela até me beijou	she even kissed me	grupo	0    	0000-00-00 00:00:00
level	kisis min sur la buŝon	me beijou nos lábios	kissed me on the lips	grupo	0    	0000-00-00 00:00:00
level	eĉ kisis min dum labambo	até me beijou durante La Bamba	even kissed me during La Bamba	grupo	0    	0000-00-00 00:00:00
level	mirinde kian kison	incrível que beijo	amazing what a kiss	grupo	0    	0000-00-00 00:00:00
level	kian kison ŝi donis!	que beijo ela deu!	what a kiss she gave!	grupo	0    	0000-00-00 00:00:00
level	bonege! nun mi komprenas	ótimo! agora eu entendo	great! now I understand	grupo	0    	0000-00-00 00:00:00
level	komprenas kial vi elradias	entende por que você está irradiando	understands why you are radiating	grupo	0    	0000-00-00 00:00:00
level	vi elradias tiom da ĝojo	você exala tanta alegria	you exude so much joy	grupo	0    	0000-00-00 00:00:00
level	fakte, io simila okazis	na verdade, algo semelhante aconteceu	in fact, something similar happened	grupo	0    	0000-00-00 00:00:00
level	io simila okazis al mi	Algo parecido ocorreu comigo	something similar happened to me	grupo	0    	0000-00-00 00:00:00
level	sed mi pensis ke ~	mas eu pensei que ~	but I thought that ~	grupo	0    	0000-00-00 00:00:00
level	pensis ke vi ne ŝatas ~	pensei que você não gostasse ~	thought you didn't like ~	grupo	0    	0000-00-00 00:00:00
level	vi ne ŝatas labambumi	você não gosta de dançar no La Bamba	you don't like dance on La Bamba	grupo	0    	0000-00-00 00:00:00
level	prave, ne okazis	certo, isso não aconteceu	right, it didn't happen	grupo	0    	0000-00-00 00:00:00
level	okazis en la dancejo	aconteceu na pista de dança	happened in the dance floor	grupo	0    	0000-00-00 00:00:00
level	ne okazis en dancejo	isso não aconteceu em uma pista de dança	it didn't happen on a dance floor	grupo	0    	0000-00-00 00:00:00
level	sed en la Gufujo	mas na sala de chá (corujal)	but in the tea launge(Owlery)	grupo	0    	0000-00-00 00:00:00
level	kaj ne estis kiso	e não foi beijo	and it was not kiss	grupo	0    	0000-00-00 00:00:00
level	ne kiso sed tamen io ĝojiga	não é um beijo, mas ainda assim algo gratificante	not a kiss but still something gratifying	grupo	0    	0000-00-00 00:00:00
level	sed tamen io tre ĝojiga	mas mesmo assim algo muito alegre	but nevertheless something very joyful	grupo	0    	0000-00-00 00:00:00
level	do, rakontu!	então diga!	so, tell!	grupo	0    	0000-00-00 00:00:00
level	mi ne scias kion diri	Eu não sei o que dizer	I don't know what to say	grupo	0    	0000-00-00 00:00:00
level	ne scias kion diri vere	não sei o que dizer realmente	don't know what to say really	grupo	0    	0000-00-00 00:00:00
level	nenio speciala okazis	nada de especial aconteceu	nothing special happened	grupo	0    	0000-00-00 00:00:00
level	almenaŭ ankoraŭ ne okazis	pelo menos ainda não aconteceu	at least it hasn't happened yet	grupo	0    	0000-00-00 00:00:00
level	sed mi iel sentis ~	mas de alguma forma eu senti ~	but I somehow felt ~	grupo	0    	0000-00-00 00:00:00
level	sentis ke ŝi tre ŝatas min	senti que ela gosta muito de mim	felt that she likes me very much	grupo	0    	0000-00-00 00:00:00
level	iel sentis ke ŝi tre ŝatas min	de alguma forma senti que ela gosta muito de mim	somehow felt that she likes me very much	grupo	0    	0000-00-00 00:00:00
level	ŝi ŝatas min kaj mi ŝin	ela gosta de mim e eu gosto dela	she likes me and I like her	grupo	0    	0000-00-00 00:00:00
level	ni longe babilis pri ~	conversamos por um longo tempo sobre ~	we chatted for a long time about ~	grupo	0    	0000-00-00 00:00:00
level	longe babilis pri muziko	tivemos uma longa conversa sobre música	had a long chat about music	grupo	0    	0000-00-00 00:00:00
level	kaj poste kantis kune	e então cantamos juntos	and then sang together	grupo	0    	0000-00-00 00:00:00
level	mi pensas ke ŝi flirtumis	Eu acho que ela estava flertando	I think she was flirting	grupo	0    	0000-00-00 00:00:00
level	ŝi flirtumis kun mi	ela estava flertando comigo	she was flirting with me	grupo	0    	0000-00-00 00:00:00
level	estis tre agrable	foi muito bom	it was very nice	grupo	0    	0000-00-00 00:00:00
level	kiel diras via amiko de Kanado	como diz seu amigo do Canadá	as your friend from Canada says	grupo	0    	0000-00-00 00:00:00
level	"Malfeke!", kiel diras amiko de Kanado	&quot;Que merda!&quot;, como diz um amigo do Canadá	"Shit good!", as a friend from Canada says	grupo	0    	0000-00-00 00:00:00
level	jes, vere! mi esperas ~	sim com certeza! Eu espero ~	yes, really! I hope ~	grupo	0    	0000-00-00 00:00:00
level	renkonti ŝin baldaŭ denove	encontrá-la novamente em breve	to meet her again soon	grupo	0    	0000-00-00 00:00:00
level	esperas renkonti ŝin denove	espera encontrá-la novamente	hopes to meet her again	grupo	0    	0000-00-00 00:00:00
level	mi esperas renkonti ŝin baldaŭ	Espero conhecê-la em breve	I hope to meet her soon	grupo	0    	0000-00-00 00:00:00
level	same mi	mesmo eu	same me	grupo	0    	0000-00-00 00:00:00
level	ĉe lago proksime de ~	em um lago perto ~	at a lake near ~	grupo	0    	0000-00-00 00:00:00
level	lago proksime de kongresejo	um lago perto de um local de congressos	a lake near a congress place	grupo	0    	0000-00-00 00:00:00
level	proksime de la kongresejo	perto da sala de congressos	near the congress hall	grupo	0    	0000-00-00 00:00:00
level	ho, ankaŭ vi estas ~	ah, você também é ~	oh, you are too ~	grupo	0    	0000-00-00 00:00:00
level	ankaŭ vi estas ĉi tie!?	você também está aqui!?	you are here too!?	grupo	0    	0000-00-00 00:00:00
level	jes, mi renkontos ~	sim, vou me encontrar ~	yes, I will meet ~	grupo	0    	0000-00-00 00:00:00
level	renkontos amikon ĉi tie baldaŭ	encontrarei um amigo aqui em breve	will meet a friend here soon	grupo	0    	0000-00-00 00:00:00
level	por privata interparolo	para uma conversa privada	for a private conversation	grupo	0    	0000-00-00 00:00:00
level	renkontos amikon por privata interparolo	encontrarei um amigo para uma conversa privada	will meet a friend for a private conversation	grupo	0    	0000-00-00 00:00:00
level	do, mi ŝatus peti vin ~	então, eu gostaria de perguntar a você ~	so, I would like to ask you ~	grupo	0    	0000-00-00 00:00:00
level	mi ŝatus peti vin foriri	Eu gostaria de pedir para você sair	I'd like to ask you to leave	grupo	0    	0000-00-00 00:00:00
level	nu, tio ne eblas	bem, isso não é possível	well, that's not possible	grupo	0    	0000-00-00 00:00:00
level	tute ne eblas fakte	não é de todo possível na verdade	is not possible at all actually	grupo	0    	0000-00-00 00:00:00
level	kial? estas tre grava por mi!	por que? É muito importante para mim!	why? it is very important to me!	grupo	0    	0000-00-00 00:00:00
level	tiu ĉi renkonto estas tre grava	esse encontro é muito importante	this meeting is very important	grupo	0    	0000-00-00 00:00:00
level	do, bonvolu lasi min	então por favor me deixe ir	so please let me go	grupo	0    	0000-00-00 00:00:00
level	bonvolu lasi min sola	por favor, deixe-me só	please leave me alone	grupo	0    	0000-00-00 00:00:00
level	kiel mi ĵus diris,	como acabei de dizer,	like I just said,	grupo	0    	0000-00-00 00:00:00
level	mi diris, tio ne eblas	Eu disse, isso não é possível	I said, that is not possible	grupo	0    	0000-00-00 00:00:00
level	amiko de mi baldaŭ aperos	um amigo meu aparecerá em breve	a friend of mine will appear soon	grupo	0    	0000-00-00 00:00:00
level	ĉar ankaŭ amiko baldaŭ aperos	porque um amigo também aparecerá em breve	because a friend will soon appear too	grupo	0    	0000-00-00 00:00:00
level	ankaŭ amiko aperos ĉi tie	um amigo também aparecerá aqui	a friend will also appear here	grupo	0    	0000-00-00 00:00:00
level	damne, tipe ke ĝuste nun	caramba, normalmente isso agora	damn, typically that right now	grupo	0    	0000-00-00 00:00:00
level	fakte temas pri la knabino	na verdade é sobre a garota	actually it's about the girl	grupo	0    	0000-00-00 00:00:00
level	la knabino, pri kiu mi rakontis	a garota sobre quem eu contei	the girl, whom I told about	grupo	0    	0000-00-00 00:00:00
level	ŝia nomo estas Jesi cetere	A propósito, o nome dela é Jesi	her name is Jesi by the way	grupo	0    	0000-00-00 00:00:00
level	gekaraj! bonege ke vi povis veni	meninos e meninas! que bom que você pôde vir	boys and girls! great that you could come	grupo	0    	0000-00-00 00:00:00
level	mi tiom ĝojas vidi vin	Estou tão feliz em ver você	I'm so glad to see you	grupo	0    	0000-00-00 00:00:00
level	mi ĝojas vidi vin denove	Que bom te ver novamente	I'm glad to see you again	grupo	0    	0000-00-00 00:00:00
level	sed, vi aspektas ~	mas você parece ~	but, you look ~	grupo	0    	0000-00-00 00:00:00
level	vi aspektas ŝokitaj kaj konfuzitaj	você parece chocado e confuso	you look shocked and confused	grupo	0    	0000-00-00 00:00:00
level	ŝokita kaj iel konfuzita	chocado e de alguma forma confuso	shocked and somehow confused	grupo	0    	0000-00-00 00:00:00
level	evidente	obviamente	obviously	grupo	0    	0000-00-00 00:00:00
level	do, mi supozas ke ~	então, eu acho ~	so, I guess ~	grupo	0    	0000-00-00 00:00:00
level	vi jam ekkomprenis	você já entendeu	you already got it	grupo	0    	0000-00-00 00:00:00
level	ekkomprenis kiel statas, ĉu?	entenda como é, certo?	understand how it is, right?	grupo	0    	0000-00-00 00:00:00
level	supozas ke vi jam komprenis	acho que você já entendeu	guess you already understood	grupo	0    	0000-00-00 00:00:00
level	jam ekkomprenis kiel statas	já entendi como é	already understood how it is	grupo	0    	0000-00-00 00:00:00
level	mi nenion komprenas!	Eu não entendo nada!	I don't understand anything!	grupo	0    	0000-00-00 00:00:00
level	mi pensas ke mi ne volas ~	Eu acho que não quero ~	I think I don't want ~	grupo	0    	0000-00-00 00:00:00
level	ne volas kompreni	não quer entender	doesn't want to understand	grupo	0    	0000-00-00 00:00:00
level	mi ne volas kompreni	Eu não quero entender	I don't want to understand	grupo	0    	0000-00-00 00:00:00
level	sed ne estas komplike!	mas não é complicado!	but it's not complicated!	grupo	0    	0000-00-00 00:00:00
level	lasu al mi klarigi	deixe-me explicar	let me explain	grupo	0    	0000-00-00 00:00:00
level	kiam Ina rakontis al mi	quando Ina me contou	when Ina told me	grupo	0    	0000-00-00 00:00:00
level	rakontis al mi pri sia amiko	me contou sobre seu próprio amigo	told me about his own friend	grupo	0    	0000-00-00 00:00:00
level	amiko kiu lernis Esperanton	um amigo que aprendeu esperanto	a friend who learned Esperanto	grupo	0    	0000-00-00 00:00:00
level	lernis Esperanton tre rapide	aprendi Esperanto muito rapidamente	learned Esperanto very quickly	grupo	0    	0000-00-00 00:00:00
level	amiko kiu nomiĝas Kabe	um amigo que se chama Kabe	a friend who is called Kabe	grupo	0    	0000-00-00 00:00:00
level	mi kaptis ke ~	Eu peguei isso ~	I have caught that ~	grupo	0    	0000-00-00 00:00:00
level	mi kaptis ke vi du jam konas	Eu entendi que vocês dois já se conhecem	I understood that you two already know each other	grupo	0    	0000-00-00 00:00:00
level	vi du jam konas unu la alian	vocês dois já se conhecem	you two already know each other	grupo	0    	0000-00-00 00:00:00
level	jes, sed. sed kio?	sim mas. mas o que?	yes, but. but what?	grupo	0    	0000-00-00 00:00:00
level	havis la impreson ke ~	tive a impressão de que ~	had the impression that ~	grupo	0    	0000-00-00 00:00:00
level	ni ambaŭ havis la impreson	nós dois tivemos a impressão	we both had the impression	grupo	0    	0000-00-00 00:00:00
level	vi flirtumis kun ni, kaj	você flertou conosco e	you flirted with us, and	grupo	0    	0000-00-00 00:00:00
level	la impreson ke vi flirtumis kun ni	a impressão de que você estava flertando conosco	the impression that you were flirting with us	grupo	0    	0000-00-00 00:00:00
level	tute prave!	absolutamente certo!	absolutely right!	grupo	0    	0000-00-00 00:00:00
level	pro tio mi volis paroli	é por isso que eu queria conversar	that's why I wanted to talk	grupo	0    	0000-00-00 00:00:00
level	mi volis paroli kun vi	Eu queria falar com você	I wanted to talk to you	grupo	0    	0000-00-00 00:00:00
level	paroli kun vi ambaŭ nun	falar com vocês dois agora	to talk to you both now	grupo	0    	0000-00-00 00:00:00
level	aŭskultu mi petas	escute-me por favor	listen to me please	grupo	0    	0000-00-00 00:00:00
level	mi ofte tre ŝatas ~	Muitas vezes eu gosto muito ~	I often really like ~	grupo	0    	0000-00-00 00:00:00
level	ŝatas plurajn personojn samtempe	gosta de várias pessoas ao mesmo tempo	likes several people at once	grupo	0    	0000-00-00 00:00:00
level	mi ŝatas plurajn personojn	Eu gosto de várias pessoas	I like several people	grupo	0    	0000-00-00 00:00:00
level	ne gravas ĉu estas ~	não importa se é ~	it doesn't matter if it's ~	grupo	0    	0000-00-00 00:00:00
level	ĉu estas viro aŭ virino	seja um homem ou uma mulher	whether it is a man or a woman	grupo	0    	0000-00-00 00:00:00
level	kaj dum IJK okazis ~	e durante o IJK aconteceu ~	and during IJK happened ~	grupo	0    	0000-00-00 00:00:00
level	okazis ke mi enamiĝis	aconteceu que eu me apaixonei	it happened that I fell in love	grupo	0    	0000-00-00 00:00:00
level	mi enamiĝis al vi ambaŭ!	Me apaixonei por vocês dois!	I fell in love with you both!	grupo	0    	0000-00-00 00:00:00
level	kaj ni ambaŭ al vi	e nós dois para você	and we both to you	grupo	0    	0000-00-00 00:00:00
level	ŝajne ni al vi	aparentemente nós para você	apparently us to you	grupo	0    	0000-00-00 00:00:00
level	momenton, mi estas laca	espere um minuto, estou cansado	wait a minute, I'm tired	grupo	0    	0000-00-00 00:00:00
level	tiom laca ke mi apenaŭ povas ~	tão cansado que mal consigo ~	so tired that I can hardly ~	grupo	0    	0000-00-00 00:00:00
level	mi apenaŭ povas pensi	Mal consigo pensar	I can hardly think	grupo	0    	0000-00-00 00:00:00
level	ĉu mi ĝuste komprenis ke ~	eu entendi corretamente isso ~	did I understand correctly that ~	grupo	0    	0000-00-00 00:00:00
level	Jes! vidu	Sim! dê uma olhada	Yes! take a look	grupo	0    	0000-00-00 00:00:00
level	kun ĝojplena vizaĝo	com uma cara alegre	with a joyful face	grupo	0    	0000-00-00 00:00:00
level	desegnis grandan koron	desenhou um grande coração	drew a big heart	grupo	0    	0000-00-00 00:00:00
level	desegnis grandan koron en la sablo	desenhei um grande coração na areia	drew a big heart in the sand	grupo	0    	0000-00-00 00:00:00
level	en la sablo kaj skribis en ĝi	na areia e escrevi nela	in the sand and wrote in it	grupo	0    	0000-00-00 00:00:00
level	skribis en ĝi "I J K"	escreveu nele &quot;IJK&quot;	wrote in it "I J K"	grupo	0    	0000-00-00 00:00:00
level	post sekunda pripensado diris	depois de pensar duas vezes disse	after a second thought said	grupo	0    	0000-00-00 00:00:00
level	post pripensado diris "Jen nia IJK"	depois de pensar disse &quot;este é o nosso IJK&quot;	after thinking said "this is our IJK"	grupo	0    	0000-00-00 00:00:00
level	kaj ili ekridis!	e eles começaram a rir!	and they burst out laughing!	grupo	0    	0000-00-00 00:00:00
level	ili ĉiuj ekridis!	todos começaram a rir!	they all burst out laughing!	grupo	0    	0000-00-00 00:00:00
level	post sekunda pripensado kaj ili ridis	depois de pensar um segundo e eles riram	after a second's thought and they laughed	grupo	0    	0000-00-00 00:00:00
level	Kabe diris "Jen nia IJK"	Kabe disse &quot;este é o nosso IJK&quot;	Kabe said "this is our IJK"	grupo	0    	0000-00-00 00:00:00
level	ĉu vi sendis la aliĝilon?	você enviou o formulário de inscrição?	have you sent the application form?	grupo	0    	0000-00-00 00:00:00
level	submetis aliĝilon al loka asocio	enviou um formulário de inscrição a uma associação local	submitted a registration form to a local association	grupo	0    	0000-00-00 00:00:00
level	mendis grupe pere de la asocio	ordenados como um grupo através da associação	ordered as a group through the association	grupo	0    	0000-00-00 00:00:00
level	submetis pere de retpoŝto	enviado por e-mail	submitted via email	grupo	0    	0000-00-00 00:00:00
level	ricevis konfirmilon de aliĝo	recebeu uma confirmação de inscrição	received a confirmation of registration	grupo	0    	0000-00-00 00:00:00
level	ne trovis kien submeti aliĝilon	não consegui encontrar onde enviar um formulário de registro	could not find where to submit a registration form	grupo	0    	0000-00-00 00:00:00
level	ĉu estas reta aliĝilo?	existe um formulário de inscrição online?	is there an online application form?	grupo	0    	0000-00-00 00:00:00
level	ĉu vi submetis paperan mendilon?	você enviou um pedido em papel?	did you submit a paper order?	grupo	0    	0000-00-00 00:00:00
level	ĉu oni devas pagi per eŭro?	alguém tem que pagar em euros?	do someone have to pay in euro?	grupo	0    	0000-00-00 00:00:00
level	ĉu eblas pagi surloke?	é possível pagar na hora?	is it possible to pay on the spot?	grupo	0    	0000-00-00 00:00:00
level	pagis sed ne ricevis kvitancon	paguei mas não recebi recibo	paid but did not receive a receipt	grupo	0    	0000-00-00 00:00:00
level	povas pagi grupe pere de loka societo	podem pagar como um grupo através da sociedade local	can pay as a group through local society	grupo	0    	0000-00-00 00:00:00
level	ĉu oni repagas se ne ĉeestus?	há um reembolso se não estiver presente?	is there a refund if not present?	grupo	0    	0000-00-00 00:00:00
level	ne mendis specialan programon	não encomendou um programa especial	did not order a special program	grupo	0    	0000-00-00 00:00:00
level	kiel oni povas mendi aldone?	como alguém pode fazer um pedido adicional?	how can someone order additionally?	grupo	0    	0000-00-00 00:00:00
level	kiel oni povas pagi por aldona mendo?	como alguém pode pagar por um pedido adicional?	how can someone pay for an additional order?	grupo	0    	0000-00-00 00:00:00
level	ĉu ni povas vidi liston de aliĝintoj?	podemos ver uma lista de inscritos?	can we see a list of registrants?	grupo	0    	0000-00-00 00:00:00
level	mia nomo ne troviĝas en la listo de aliĝintoj	meu nome não está na lista de inscritos	my name is not in the list of registrants	grupo	0    	0000-00-00 00:00:00
level	ĉu vi bonvolus kontroli la liston?	você poderia verificar a lista?	could you please check the list?	grupo	0    	0000-00-00 00:00:00
level	post la limdato de mendado	após o prazo do pedido	after the order deadline	grupo	0    	0000-00-00 00:00:00
level	ĉu oni povas aliĝi plu?	alguém pode participar além disso?	can someone join furthermore?	grupo	0    	0000-00-00 00:00:00
level	rezervi hotelon kune	reservar um hotel juntos	to book a hotel together	grupo	0    	0000-00-00 00:00:00
level	oni rezervas hotelon, ĉu vi volas akompani?	alguém está reservando um hotel, você quer ir junto?	someone is booking a hotel, do you want to come along?	grupo	0    	0000-00-00 00:00:00
level	se estus libera ĉambro, mi volas tion rezervi	se houvesse um quarto livre, quero reservá-lo	if there was a free room, I want to book it	grupo	0    	0000-00-00 00:00:00
level	ĉu eblas rezervi hotelon surloke?	é possível reservar um hotel no local?	is it possible to book a hotel on site?	grupo	0    	0000-00-00 00:00:00
level	ĉu ni aĉetu aviadilan bileton kune?	devemos comprar uma passagem de avião juntos?	should we buy a plane ticket together?	grupo	0    	0000-00-00 00:00:00
level	bileto de kiu dato	bilhete a partir de que data	ticket from which date	grupo	0    	0000-00-00 00:00:00
level	ĉu ni akompanu al la flug-haveno?	vamos acompanhá-lo ao aeroporto?	shall we accompany you to the airport?	grupo	0    	0000-00-00 00:00:00
level	ĉu estas iu gvidanto ĉe la flug-haveno?	há guia no aeroporto?	is there a guide at the airport?	grupo	0    	0000-00-00 00:00:00
level	ĉu oni devas iri al la kongresejo per si mem?	alguém tem que ir sozinho ao local da convenção?	does someone have to go to the convention place by oneself?	grupo	0    	0000-00-00 00:00:00
level	giĉeto de la kongresejo	bilheteria do local da convenção	box office of the convention place	grupo	0    	0000-00-00 00:00:00
level	mi pagis tamen mia nomŝildo ne troviĝas	Paguei, mas meu crachá não foi encontrado	I paid but my name tag can't be found	grupo	0    	0000-00-00 00:00:00
level	volas registriĝi surloke	quer se registrar no local	wants to register on the spot	grupo	0    	0000-00-00 00:00:00
level	pagis grupe, tamen kial ne estas markita?	pago em grupo, mas por que não está marcado?	paid in group, yet why is it not marked?	grupo	0    	0000-00-00 00:00:00
level	kongresa sako kun kongresa libro kaj aliaj informiloj	uma bolsa de conferência com livro de conferência e outros materiais informativos	a conference bag with conference book and other information materials	grupo	0    	0000-00-00 00:00:00
level	rektora halo, ekspozicio	sala do reitor, exposição	rector's hall, exhibition	grupo	0    	0000-00-00 00:00:00
level	malfermo kaj fermo	abrindo e fechando	opening and closing	grupo	0    	0000-00-00 00:00:00
