A - la plej baza kurso por komencantoj						
Level	Esperanto	Japanese el Korea	English	Grupo	Alternativoj	Prononco
Saluton	mi, vi	私、あなた	I, you	Saluton		
Saluton	estas, estis	（現在）〜だ、（過去）〜だった	(present) is, am, are (past) was, were	Saluton		
Saluton	mi estas ~	私は〜です	I am ~	Saluton		
Saluton	vi estas ~	あなたは〜です	you are ~	Saluton		
Saluton	saluton	こんにちは	hello	Saluton		
Saluton	saluton, mi estas ~	こんにちは、私は〜です	hello, I am ~	Saluton		
Saluton	mia, via	私の、あなたの	my, your	Saluton		
Saluton	nomo	名前	a name	Saluton		
Saluton	mia nomo, via nomo	私の名前、あなたの名前	my name, your name	Saluton		
Saluton	mia nomo estas ~	私の名前は〜です	my name is ~	Saluton		
Saluton	via nomo estas ~	あなたの名前は〜です	your name is ~	Saluton		
Saluton	fartas, fartis	（現在）過ごす、（過去）過ごした	(present) does, (past) did	Saluton		
Saluton	estis, estos	（過去）だった、（未来）だろう	(present) was, were (future) will be	Saluton		
Saluton	nomo, nomon	名前、名前	a name, an (objective) name	Saluton		
Saluton	mia amo	私の愛	my love	Saluton		
Saluton	vi fartas	あなたは過ごす	you are doing ~	Saluton		
Saluton	kiel	どのように	how	Saluton		
Saluton	kiel vi fartas?	あなたはどのように過ごしますか？	how are you doing?	Saluton		
Saluton	kio	何	what	Saluton		
Saluton	kio estas via nomo?	あなたの名前は何ですか？	what is your name?	Saluton		
Saluton	bona, bone	良い（形容詞）、よく（副詞）	good, well	Saluton		
Saluton	fartas bone	よく過ごす（過ごしている）	is doing well	Saluton		
Saluton	mi fartas bone	私は元気です	I am doing well	Saluton		
Saluton	kaj	そして（〜と、〜と）	and	Saluton		
Saluton	bone, kaj vi?	さて、あなたは？	fine, and you?	Saluton		
Saluton	ĝis ~	~まで	until ~	Saluton		
Saluton	vidas, vidis	（現在）見る、（過去）見た	(present) sees, (past) saw	Saluton		
Saluton	vidis, revidis	見た、また見た	(past) saw, (past) saw again	Saluton		
Saluton	revidis, revidos	（過去）また見た、（未来）また会う	saw again, will see again	Saluton		
Saluton	revido, revidon	もう一度、もう一度	seeing-again, seeing-again (objective)	Saluton		
Saluton	ĝis revido!	また見るまで（こんにちは）！	see you again!	Saluton		
Saluton	dankon	ありがとう	thank you	Saluton		
Saluton	dankon kaj ĝis revido!	ありがとうございます。そしてまた見るまで（こんにちは）！	thank you and see you again!	Saluton		
Saluton	al ~	〜へ	to ~	Saluton		
Saluton	al vi, al mi	あなたに、私に	to you, to me	Saluton		
Saluton	dankas, dankis	（現在）ありがとう、（過去）ありがとう	(present) thanks, (past) thanked	Saluton		
Saluton	mi dankas al vi	私はあなたに感謝します	I appreciate to you	Saluton		
Saluton	jes, ne	はい、いいえ	yes, no	Saluton		
Saluton	jes, dankon	はい、ありがとう	yes, thaink you	Saluton		
Saluton	manĝas, manĝos	（現在）食べる、（未来）食べる	eats, will eat	Saluton		
Saluton	mi ne manĝas	私は食べません	I don't eat	Saluton		
Saluton	ne, mi ne manĝas	いいえ、私は食べません	no, I don't eat	Saluton		
Saluton	bela, bele	美しい、美しく	beautiful, beautifully	Saluton		
Saluton	-inda	（母）〜する価値がある	worthwhile (ending)	Saluton		
Saluton	dankinda, dankinde	ありがとう、感謝して	appreciatable, worthwhile to thank	Saluton		
Saluton	tuta, tute	全体的に、全体的に	whole, as a whole	Saluton		
Saluton	tuto, tuton	すべて、すべて	all, (objective) all	Saluton		
Saluton	nedankinde	千万です。	not at all, you're welcome	Saluton		
Saluton	tute ne	まったくない	totally no	Saluton		
Saluton	pardoni ~, pardono	〜を許す、許す	to forgive, a forgiving	Saluton		
Bonan nokton	pardonon al mi	私に許し	a forgiving to me	Bonan nokton		
Bonan nokton	pardonon	すみません	I'm sorry! (pardon me)	Bonan nokton		
Bonan nokton	pardonon, mi petas	すみません、お願いします	I'm sorry, please	Bonan nokton		
Bonan nokton	bona mateno	おはよう	a good morning	Bonan nokton		
Bonan nokton	bonan matenon	朝の挨拶、こんにちは	good morning	Bonan nokton		
Bonan nokton	bonan nokton	（夜の挨拶）おはようございます。	good night	Bonan nokton		
Bonan nokton	bonan sonĝon	良い夢を見てください	sweet dream	Bonan nokton		
Bonan nokton	bonan vojaĝon, al vi	良い旅行になることを、あなたに（祈ります）	(have) a good trip, to you	Bonan nokton		
Bonan nokton	bonan tagon	昼ご挨拶、こんにちは	good day!	Bonan nokton		
Bonan nokton	ĉu ~	〜ですか？	is it ~ ?	Bonan nokton		
Bonan nokton	ĉu vi fartas bone?	お元気ですか？	are you doing well? (how are you?)	Bonan nokton		
Bonan nokton	jes, mi fartas bone	はい、私は元気です	yes, I'm fine	Bonan nokton		
Bonan nokton	ne, tute ne	いいえ、まったくありません	no, not at all	Bonan nokton		
Bonan nokton	tre, tro	非常に、あまりにも	very, too much	Bonan nokton		
Bonan nokton	granda, grande	大きい、大きい	big, largely	Bonan nokton		
Bonan nokton	tre bona, tro granda	とても良い、大きすぎる	very big, too big	Bonan nokton		
Bonan nokton	vi tre bone fartas	あなたはとても元気です	you are doing very well	Bonan nokton		
Bonan nokton	ne tre bone	腐って良くないように	not very well	Bonan nokton		
Bonan nokton	lerni ~, lerno	~を学ぶ、学ぶ	to learn, a learning	Bonan nokton		
Bonan nokton	vidanta, vidanto	（現在進行）見ている、見ている人	is looking, a spectator	Bonan nokton		
Bonan nokton	lernanta, lernanto	学んでいる、学んでいる人（学生）	is learning, a student (a learning person)	Bonan nokton		
Bonan nokton	-anta, -anto	（現在進行）〜している、〜する人	is -ing, a person who is doing	Bonan nokton		
Bonan nokton	lernanto, lerninto	学んでいる人（学生）、学んだ人	a student, a person who has learned	Bonan nokton		
Bonan nokton	mi estas lernanto	私は学生です	I am a student.	Bonan nokton		
Bonan nokton	~ estas mia amiko	〜は私の友達です	~ is my friend	Bonan nokton		
Bonan nokton	li, ŝi	あの男、その女	he, she	Bonan nokton		
Bonan nokton	sidi, sidas	座る、座る	to sit, sits	Bonan nokton		
Bonan nokton	sidanta, sidinta, sidonta	座っている、座った、座る予定	is sitting, was sitting, will be sitting	Bonan nokton		
Bonan nokton	li sidas kaj ŝi lernas	彼は座っていて、彼女は学んでいます。	he is sitting and she is learning	Bonan nokton		
Bonan nokton	ĉambro	部屋	a room	Bonan nokton		
Bonan nokton	lernas en ĉambro	部屋で学ぶ	learns in a room	Bonan nokton		
Bonan nokton	lernanto kaj sportisto	学習者と運動選手	a student and a sportsman	Bonan nokton		
Bonan nokton	sporto kaj sportisto	スポーツと運動選手	sport and a sportsman	Bonan nokton		
Bonan nokton	sportisto nun sportas	運動選手は今運動をしている	a sportsman is sporting	Bonan nokton		
Bonan nokton	li estas lernanto	彼は学ぶ人だ	he is a student	Bonan nokton		
Bonan nokton	estas lernanto kaj sportisto	学ぶ人でスポーツマンだ	he is a student and a sportman	Bonan nokton		
Bonan nokton	li nun sidas	彼は今座っている	he is now sitting	Bonan nokton		
Bonan nokton	kaj nun lernas	そして今学んでいる	and is now learning	Bonan nokton		
Bonan nokton	sidas kaj lernas	座って学んでいる	is sitting and is learning	Bonan nokton		
Bonan nokton	nun en ĉambro	今部屋で	now in a room	Bonan nokton		
Bonan nokton	estas sur tablo	テーブルの上にある	is on a table	Bonan nokton		
Bonan nokton	papero kaj paperoj	紙と紙	a paper and papers	Bonan nokton		
Bonan nokton	tablo kaj tabloj	テーブルとテーブル	a table and tables	Bonan nokton		
Bonan nokton	libro kaj libroj	本と本	a book and books	Bonan nokton		
Bonan nokton	la paperoj kaj libroj	その紙と本	the papers and books	Bonan nokton		
Bonan nokton	ĝi estas sur tablo	それがテーブルの上にある	it is on a table.	Bonan nokton		
Bonan nokton	skribas sur la skribotablo	その机の上で書く	is writing on a writing table	Bonan nokton		
Bonan nokton	la libroj estas ~	その本は〜です	the books are ~	Bonan nokton		
Bonan nokton	sur la tablo	その机の上に	on the table	Bonan nokton		
Bonan nokton	lernolibro kaj la lernolibroj	教科書とその教科書	a textbook and the textbooks	Bonan nokton		
Amiko	sur la tablo estas ~	そのテーブルの上に〜がある	on the table there is ~	Amiko		
Amiko	patro kaj patrino	父と母	a father and a mother	Amiko		
Amiko	la patro kaj la patrino	その父とその母	the father and the mother	Amiko		
Amiko	la patrino de mia amiko	私の友人のその母	the mother of my friend	Amiko		
Amiko	en la ĉambro	その部屋で	in the room	Amiko		
Amiko	ne estas en la ĉambro	その部屋にない	is not in the room	Amiko		
Amiko	ili nun laboras	彼らは今働いています	they are now working	Amiko		
Amiko	lia patro estas laboristo	彼の父は労働者です。	his father is a worker	Amiko		
Amiko	li laboras en hotelo	彼はホテルで働く	he works in a hotel	Amiko		
Amiko	la patrino instruas	その母は教える	the mother teaches	Amiko		
Amiko	ŝi estas instruistino	彼女は女教師です。	she is a teacher	Amiko		
Amiko	ĉu ŝi estas patrino?	彼女は母親ですか？	is she a mother?	Amiko		
Amiko	ne, ŝi estas hotelisto	いいえ、彼女はホテルスタッフです	no, she is an hotelier	Amiko		
Amiko	ne, mi ne laboras	いいえ、私は働いていません	no, I don't work	Amiko		
Amiko	kio estas ŝia nomo?	彼女の名前は何ですか？	what is her name?	Amiko		
Amiko	kiu nun respondas?	誰が今答えていますか？	who is now answering?	Amiko		
Amiko	la lingvo de ilia patrino	彼らの母親のその言語	the language of their mother	Amiko		
Amiko	ĉu via nomo estas ~ ?	あなたの名前は〜ですか？	is your name ~ ?	Amiko		
Amiko	ni sidas kaj respondas	私たちは座って答える	we are sitting and answering	Amiko		
Amiko	ŝia labora seĝo	彼女の働く椅子	her working chair	Amiko		
Amiko	ĝia nomo ne estas ~	その名前は〜ではありません	its name is not ~	Amiko		
Amiko	ŝia lingvo estas ilia lingvo	彼女の言語は彼らの言語です	her language is their language	Amiko		
Amiko	nia patro kaj patrino	私たちの父と母	our father and mother	Amiko		
Amiko	via lernanto, viaj lernantoj	あなたの学生、あなたの学生	your student, your students	Amiko		
Amiko	ĉu ili estas viaj lernantoj?	彼らはあなたの学生ですか？	are they your students?	Amiko		
Amiko	ĉu vi estas lernanto?	あなたは学生ですか？	are you a student?	Amiko		
Amiko	ĉu vi estas en la ĉambro?	あなたはその部屋にいますか？	are you in the room?	Amiko		
Amiko	mi ne estas ~	私は〜ではない	I'm not ~	Amiko		
Amiko	esperantisto kaj esperantistino	エスペランティストと女性エスペランティスト	an Esperantist and a female Esperantist	Amiko		
Amiko	enskribis por la hotelĉambro	そのホテルの部屋のために予約した	checked in for the hotel room	Amiko		
Amiko	lingvisto kaj laboristino	言語学者と女性労働者	a linguist and a female worker	Amiko		
Amiko	lia amikino estas ~	彼のガールフレンドは〜です。	his girl friend is ~	Amiko		
Amiko	lernantoj kaj sportistoj	学生と運動選手	students and sportsmen	Amiko		
Amiko	mia familia nomo estas ~	私の姓（家族名）は〜です	my familia name is ~	Amiko		
Amiko	kiu estas ŝi?	彼女は誰ですか？	who is she? which is she?	Amiko		
Amiko	estas via amikino	あなたのガールフレンドです。	is your girl friend	Amiko		
Amiko	ĉu via amiko estas ~ ?	あなたの友人は〜あるか。	is your friend ~ ?	Amiko		
Amiko	skribas nun en la ĉambro	その部屋で今書いている	is writing now in the room	Amiko		
Amiko	ĉu la amiko de via patro ~ ?	あなたの父のその友人は〜？	is the friend of you father ~ ?	Amiko		
Amiko	laboras en hotelo	ホテルで働く	works in a hotel	Amiko		
Amiko	kio estas sur la tablo?	そのテーブルの上に何がありますか？	what is on the table?	Amiko		
Amiko	sur la tablo en nia ĉambro	私たちの部屋のそのテーブルの上に	on the table in our room	Amiko		
Amiko	ĉu la lernolibro de Esperanto ~ ?	エスペラント教科書は〜ですか？	is the Esperanto textbook ~ ?	Amiko		
Amiko	estas sur via tablo	あなたのテーブルの上にある。	is on your table	Amiko		
Amiko	havas amikinon	彼女がいる	has a friend	Amiko		
Amiko	ŝia nomo estas ~	彼女の名前は〜です	her name is ~	Amiko		
Amiko	juna kaj bela	若くて美しい	young and beautiful	Amiko		
Amiko	estas juna kaj bela	若くて美しい	is young and beautiful	Amiko		
Amiko	junaj kaj belaj amikoj	若くて美しい友達	young and beautiful friends	Amiko		
La amiko	estas geamikoj	男女友達だ	are male-and-female friends	La amiko		
La amiko	hejmo de ŝia instruisto	彼女の先生の家	a home of her teacher	La amiko		
La amiko	venis al la hejmo	その家に来た	came to the home	La amiko		
La amiko	la hejmo de ~	～の家（家）	the home of ~	La amiko		
La amiko	bonvolu eniri	入ってください	please come in	La amiko		
La amiko	saluton! kion vi faras?	こんにちは！何をしていますか？	hello, what are you doing?	La amiko		
La amiko	kion vi faras?	何をしていますか？	what do you do? what are you doing?	La amiko		
La amiko	sed nun mi volas ~	しかし今、私は〜したいです。	but now I want ~	La amiko		
La amiko	mi volas paroli	言いたい	I want to speak	La amiko		
La amiko	kun tri geamikoj	3人の男女友達と	with three male-and-female friends	La amiko		
La amiko	parolis kun vi	あなたと言った	spoke with you	La amiko		
La amiko	volas paroli kun vi	あなたと話したい	wants to speak with you	La amiko		
La amiko	ĉu vi havas geamikojn?	あなたは男女友達がいますか？	do you have male-and-female friends	La amiko		
La amiko	li havas libron	彼は本を持っています	he has a book	La amiko		
La amiko	havas bonan libron	良い本を持っている	has a good book	La amiko		
La amiko	jes, mi havas	はい、私は持っています	yes, I have	La amiko		
La amiko	ili ŝatas ĝin	彼らはそれが好きです	they like it	La amiko		
La amiko	ŝi legis libron	彼女は本を読んだ	she read a book	La amiko		
La amiko	ŝatas legi librojn	本を読むのが好き	likes to read books	La amiko		
La amiko	nur bona libro	ただ良い本だけ	only a good book	La amiko		
La amiko	multaj bonaj libroj	多くの良い本	many good books	La amiko		
La amiko	legis nur bonajn librojn	良い本だけを読んだ	read only good books	La amiko		
La amiko	ŝatas legi bonajn librojn	良い本を読むのが好き	likes to read good books	La amiko		
La amiko	ĉu vi volas legi?	読むことを望むか。	do you want to read?	La amiko		
La amiko	la junulo trinkis kafon	その若者はコーヒーを飲んだ	the youngster drank coffee	La amiko		
La amiko	volas trinki akvon	水を飲みたい	wants to drink water	La amiko		
La amiko	patro kaj patrino, gepatroj	父、母;両親	a father and a mother; parents	La amiko		
La amiko	frato kaj fratino, gefratoj	兄弟と姉妹、兄弟姉妹	a bother and a sister, siblings	La amiko		
La amiko	viaj gepatroj kaj gefratoj	あなたの両親と兄弟姉妹	your parents and siblings	La amiko		
La amiko	estas en via hejmo	あなたの家にいる	is in your home	La amiko		
La amiko	jen la kafo	ここにコーヒーがあります。	here is the coffee	La amiko		
La amiko	ankoraŭ ne trinkis	まだ飲んでいない	didn't drink yet	La amiko		
La amiko	estas ankoraŭ varma	まだ暑い	is still warm	La amiko		
La amiko	hieraŭ kuiris ĝin	昨日それを調理した	cooked it yesterday	La amiko		
La amiko	mi nun kuiris	私は今調理しました	I now cooked	La amiko		
La amiko	dankon. tiel li diris	ありがとうございます。だから彼は言った	thank you. so he said.	La amiko		
La amiko	povas trinki kaj manĝi	飲んで食べることができる	can drink and eat	La amiko		
La amiko	trinkis malvarman kafon	冷たいコーヒーを飲んだ	drank cold coffee	La amiko		
La amiko	ankaŭ varma kafo	ホットコーヒーも	still warm coffee	La amiko		
La amiko	trinkas ankaŭ malvarman kafon	冷たいコーヒーも飲む	drinks cold coffee too	La amiko		
La amiko	povas trinki ankaŭ malvarman kafon	冷たいコーヒーも飲める	can also drink cold coffee	La amiko		
La amiko	rigardas ŝian okulon	彼女の目を見る	looks at her eye	La amiko		
La amiko	la plej bela okulo	最も美しい目	the most beautiful eye	La amiko		
La amiko	la belaj okuloj	その美しい目	the beautiful eyes	La amiko		
La amiko	rigardis la belajn okulojn	その美しい目を眺めた	looked the beautiful eyes	La amiko		
La amiko	la belaj okuloj de ŝi	彼女の美しい目	the beautiful eyes of her	La amiko		
La amiko	vidas kaj komprenas	〜を見る、そして理解する。	sees and understands	La amiko		
La amiko	mi vidas, ke ~	私は〜ということを見る	I see that ~	La amiko		
La amiko	ke li amas ŝin	彼が彼女を愛していること	that he loves her	La amiko		
En kafejo	ŝi sentis, ke li amas ŝin	彼女は感じた、彼が彼女を愛していることを	she feels that he loves her	En kafejo		
En kafejo	demandas, ĉu tio estis granda	質問する、それが大きくなったかどうか	asks whether that was big	En kafejo		
En kafejo	pri facila demando	簡単な質問について	about an easy question	En kafejo		
En kafejo	diris pri nova mono	新しいお金について話した	said about a new money	En kafejo		
En kafejo	tre belaj okuloj	とても美しい目	very beautiful eyes	En kafejo		
En kafejo	rigardis la grandan fraton	その大きな兄を見た	looked the big brother	En kafejo		
En kafejo	malgranda fratino forgesis ĝin	妹はそれを忘れてしまった	a little sister forgot it	En kafejo		
En kafejo	akuzativo	目的格	an accusative (objective)	En kafejo		
En kafejo	ne forgesu akuzativon	目的格サフィックスを忘れないでください	don't forget the accusative ending	En kafejo		
En kafejo	kiun vi vidas?	どのだれを見るか。	whom are you seeing? which one do you see?	En kafejo		
En kafejo	mi vidas amikon	私は友達を見る	I see a friend	En kafejo		
En kafejo	havas bonajn geamikojn	良い男女友達がいる	has good male-and-female friends	En kafejo		
En kafejo	ili laboras pri la malnova domo	彼らは働く、その古家について	they are working about the old house	En kafejo		
En kafejo	laboras, laboris, laboros	働く、働いた、働く	works, worked, will work	En kafejo		
En kafejo	vidas, ke mi manĝas	見ている、私が食べているもの	sees, that I eat	En kafejo		
En kafejo	diris, ke li iros	話した、彼は行くだろう	said, that he will go	En kafejo		
En kafejo	malbela kaj malbona	醜くて悪い	ugly and bad	En kafejo		
En kafejo	kion ŝi diris?	彼女が何を話したのか？	what did she say?	En kafejo		
En kafejo	kion vi atendas?	あなたは何を待っていますか？	what are you waiting for?	En kafejo		
En kafejo	eniris en la ĉambron	その部屋に入った	went into the room	En kafejo		
En kafejo	enhavo estis tre malfacila	内容がとても難しかった	a content is very difficult	En kafejo		
En kafejo	alvenis al la kunsido	その会議に到着しました	arrived at the meeting	En kafejo		
En kafejo	bonvenon, al la kunveno	ようこそ、大会へようこそ	welcome to the meeting	En kafejo		
En kafejo	maljuna viro donis trinkmonon	老人はヒントを与えた	an old man gave a tip	En kafejo		
En kafejo	alvenis kaj estis bonvena	到着して歓迎されました	arrived and was welcomed	En kafejo		
En kafejo	ili malamas sed kunlaboras.	彼らは憎むが、協力する	they hate but cooperate	En kafejo		
En kafejo	iris al la hotelo	そのホテルに行った	went to the hotel	En kafejo		
En kafejo	havas facilajn lernolibrojn	簡単な学習書を持っている	has easy textbooks	En kafejo		
En kafejo	kia estis via patrino?	あなたの母はどうでしたか？	how was your mother?	En kafejo		
En kafejo	via malnova hejmo	あなたの古い家	your old home	En kafejo		
La amiko	kiujn librojn vi legis?	あなたはどの本を読んだのですか？	which books did you read?	La amiko		
La amiko	ĉu ili estis bonaj?	彼らは良かったか。	were they good?	La amiko		
La amiko	kion faris hieraŭ?	昨日何をしたの？	did what yesterday?	La amiko		
La amiko	en la malgranda ĉambro	その小さな部屋の中で	in the small room	La amiko		
En kafejo	tre longe parolis	かなり長い間言った	spoke very long while	En kafejo		
En kafejo	antaŭ la lernejo	その学校の前で	in front of the school, before the school	En kafejo		
En kafejo	parolis antaŭ la lernejo	その学校の前で話した	spoke before the school	En kafejo		
En kafejo	poste parolis pri la libro	後でその本について語った	later spoke about the book	En kafejo		
En kafejo	ĝoje iris al la lernejo	その学校に喜んで行った	gladly went to the school	En kafejo		
En kafejo	tra la strato	その通りを通って	through the street	En kafejo		
En kafejo	iris tra la strato	その通りを通り過ぎた	went through the street	En kafejo		
En kafejo	estis varma tago	暑い日だった	was a warm day	En kafejo		
En kafejo	ili vidis kafejon	彼らはカフェを見ました。	they saw a cafe'	En kafejo		
En kafejo	vidis ruĝajn kukojn	赤いお菓子を見た	saw red cookies	En kafejo		
En kafejo	vidis kukojn en ĝi	その中でお菓子を見た	saw cookies in it	En kafejo		
En kafejo	vidis kafejon kaj en ĝi kukojn	カフェを見て、その中でお菓子を（見た）	saw a cafe' and in it  cookies	En kafejo		
En kafejo	eniru kaj manĝu!	入って食べる	go in and eat!	En kafejo		
En kafejo	ni eniru kaj manĝu	私たちに入って食べましょう	let's come in and eat	En kafejo		
En kafejo	havas sufiĉan monon	十分なお金を持っている	has sufficient money	En kafejo		
En kafejo	ĉu vi havas sufiĉan monon?	あなたは十分なお金を持っていますか？	do you have sufficient money?	En kafejo		
Renkonto	ĉu vi komprenas?	理解するか。	do you understand?	Renkonto		
Renkonto	kompreneble!	当然！	of course!	Renkonto		
Renkonto	tio ne sufiĉas	十分ではない	that is not enough	Renkonto		
Renkonto	cent dolaroj sufiĉas	百ドルは十分	a hundred dollars is enough	Renkonto		
Renkonto	dolaro, dolaroj, dolarojn	ドル、ドル、ドル	a dollar, dollars, dollars (plural objective)	Renkonto		
Renkonto	havas cent dolarojn	100ドルを持っている	has a hundred dollars	Renkonto		
Renkonto	kompreneble, mi havas	もちろん私は持っています	of course, I have	Renkonto		
Renkonto	ho! vi estas riĉa!	ああ！あなたは裕福です！	oh! you are rich!	Renkonto		
Renkonto	kelnero, kelnerino	食堂従業員、女従業員	a water, an waitress	Renkonto		
Renkonto	kelnero portas menuon	レストランの従業員がメニューを持ってくる	a waiter brings a menu	Renkonto		
Renkonto	portis tion al ni, alportis tion	それを私たちに持ってきた、それを持ってきた	brought that to us, brought that	Renkonto		
Renkonto	kelnero alportis multajn kukojn	レストランの従業員がたくさんのお菓子を持ってくれた	a waiter brought a lot of cookies	Renkonto		
Renkonto	ili manĝis iom	彼らは少し食べました	they ate some (a little)	Renkonto		
Renkonto	post la manĝo	その食事の後	after the eating (meal)	Renkonto		
Renkonto	nova, denove	新しい、再び	new, again	Renkonto		
Renkonto	la kelnero denove venis	そのウェイターがまた来た	the waiter came again	Renkonto		
Renkonto	en iu loko	どこかで	in some place	Renkonto		
Renkonto	serĉis en iu loko	どこかで見つけた	had searched in some place	Renkonto		
Renkonto	serĉis en alia loko	別の場所で見つけた	searched in other place	Renkonto		
Renkonto	lia vizaĝo estis ĝoja	彼の顔は嬉しかった	his face was joyous	Renkonto		
Renkonto	ŝi estis malĝoja	彼女は悲しい	she was sad	Renkonto		
Renkonto	fine kaj finfine	終わりとついに	in the end and finally at last	Renkonto		
Renkonto	via forta voĉo	あなたの強い声	your strong voice	Renkonto		
Renkonto	en malforta voĉo	弱い声で	in weak voice	Renkonto		
Renkonto	ne havas monon	お金がない	doesn't have money	Renkonto		
Renkonto	kio okazis tie?	そこに何が起こったか。	what did happen there?	Renkonto		
Renkonto	akcidento okazis poste	事件がその後起こった	an accident happened later	Renkonto		
Renkonto	ĉu vi scias, kiam ĝi okazis?	あなたは知っています、それがいつ発生したのですか？	do you know when did it happen?	Renkonto		
Renkonto	scias pri la afero	その事件について知る	knows about the matter	Renkonto		
Renkonto	ankoraŭ unu afero restas	まだ一つが残っている	still one thing remains	Renkonto		
Renkonto	vi aŭ ŝi, ajna homo	あなたまたは彼女、誰でも	you or she, any person	Renkonto		
Renkonto	kiel kantisto	歌手のように、歌手として	like a singer, as a signer	Renkonto		
Renkonto	kantis kiel profesia kantisto	プロの歌手のように歌った	sang like a professional singer	Renkonto		
