A - la plej baza kurso por komencantoj						
Familianoj kunvenas	mi tamen pasigos	しかし、私は送信します	I will pass though	Familianoj kunvenas		
Familianoj kunvenas	mi tamen pasigos la morgaŭan tagon hejme	しかし、私は明日を家庭で過ごすでしょう	I will spend tomorrow at home though	Familianoj kunvenas		
Familianoj kunvenas	en juneco	若い時	in youth	Familianoj kunvenas		
Familianoj kunvenas	oni havas	人々は持っている	one has	Familianoj kunvenas		
Familianoj kunvenas	havas ankaŭ belecon	美しさも持っている	also has beauty	Familianoj kunvenas		
Familianoj kunvenas	malsimplaj laboroj	複雑なこと	complicated jobs	Familianoj kunvenas		
Familianoj kunvenas	malsimplajn laborojn	複雑なこと	complicated jobs (objective)	Familianoj kunvenas		
Familianoj kunvenas	devus plisimpligi	もっと単純化する必要があるでしょう	should simplify	Familianoj kunvenas		
Familianoj kunvenas	en tiu aĝo	その年齢で	at that age	Familianoj kunvenas		
Familianoj kunvenas	li jam fariĝis ~	彼はすでに〜になった	he has already become ~	Familianoj kunvenas		
Familianoj kunvenas	estro de la sporta klubo	そのスポーツクラブの代表	head of the sports club	Familianoj kunvenas		
Familianoj kunvenas	monon oni metas	誰かがお金を置く	one puts money	Familianoj kunvenas		
Familianoj kunvenas	en monujon	財布の中	into a wallet	Familianoj kunvenas		
Familianoj kunvenas	metas en monujon	財布の中に置く	puts in a purse	Familianoj kunvenas		
Familianoj kunvenas	sekvu la ekzemplojn	その事例に従う	follow the examples	Familianoj kunvenas		
Familianoj kunvenas	de la bonaj familianoj	素晴らしいその家族のメンバー	from the good family members	Familianoj kunvenas		
Familianoj kunvenas	ĉu amikeco pli feliĉigas?	友情がもっと幸せになりますか？	does friendship make you happier?	Familianoj kunvenas		
Familianoj kunvenas	feliĉigas vin	あなたを幸せにする	makes you happy	Familianoj kunvenas		
Familianoj kunvenas	ol la amo	その愛よりも	than the love	Familianoj kunvenas		
Familianoj kunvenas	kiel ofte vi ~ ?	あなたはどのくらいの頻度〜？	how often do you ~ ?	Familianoj kunvenas		
Familianoj kunvenas	vi skribas leterojn al ~	あなたは〜に手紙を書く	you write letters to ~	Familianoj kunvenas		
Familianoj kunvenas	skrivas leterojn al viaj amikinoj	あなたのガールフレンドに手紙を書く	writes letters to your girl friends	Familianoj kunvenas		
Familianoj kunvenas	viaj amikinoj en Italio	イタリアのあなたのガールフレンド	your girl friends in Italy	Familianoj kunvenas		
Familianoj kunvenas	la rilato inter vi kaj via instruisto	あなたとあなたの先生との関係	the relation between you and your teacher	Familianoj kunvenas		
Familianoj kunvenas	ĉu la rilato ŝanĝiĝis?	その関係が変わったのか？	has the relationship changed?	Familianoj kunvenas		
Familianoj kunvenas	ĉu vi jam scias ~ ?	あなたはすでに〜を知っていますか？	do you already know ~ ?	Familianoj kunvenas		
Familianoj kunvenas	sufiĉe bone	十分に良い	quite well	Familianoj kunvenas		
La sentimulo	estis vespero en ~	〜は夕方だった	it was evening in ~	La sentimulo		
La sentimulo	centoj da homoj	何百人もの人々	hundreds of people	La sentimulo		
La sentimulo	plenigas la placon	その広場をいっぱい詰める	fills the square	La sentimulo		
La sentimulo	junuloj kaj militistoj	若者と兵士	young men and soldiers	La sentimulo		
La sentimulo	maristoj de sur la ŝipoj	その船の上からの船員	sailors from the ships	La sentimulo		
La sentimulo	elstara sinjorino	著名な妻	outstanding lady	La sentimulo		
La sentimulo	elstaraj sinjorinoj	著名な妻	outstanding ladies	La sentimulo		
La sentimulo	alilandaj vojaĝantoj	外国の旅行者	foreign travelers	La sentimulo		
La sentimulo	ĉiuj moviĝas al urbomezo	都市を中心にみんな動く	everyone is moving to the city center	La sentimulo		
La sentimulo	iom plue	もう少し	a little further	La sentimulo		
La sentimulo	ne malproksime de la maro	その海から遠くないように	not far from the sea	La sentimulo		
La sentimulo	troviĝis malgranda placo	小さな広場があった	there was a small square	La sentimulo		
La sentimulo	iom plue sed ne malproksime	もう少ししかし遠くないように	a little further but not far	La sentimulo		
La sentimulo	fine de ĝi	その終わりの裾に	at the end of it	La sentimulo		
La sentimulo	proksime de la maro	その海の近くに	near the sea	La sentimulo		
La sentimulo	proksime staris homo	近くに人が立っていた	a man stood nearby	La sentimulo		
La sentimulo	laŭ la vestaĵo	その服の枝に応じて	according to the clothing	La sentimulo		
La sentimulo	oni facile scii ~	誰でも簡単に〜がわかる	one may know easily ~	La sentimulo		
La sentimulo	oni povis ekscii, ke ~	誰でも〜であることに気づくことができた	it was possible to find out that ~	La sentimulo		
La sentimulo	gondolisto de iu riĉulo	ある金持ちのゴンドラ運転手	a rich man's gondolier	La sentimulo		
La sentimulo	povis ekscii, ke li estas gondolisto	彼がゴンドラ運転手であることに気づくことができた	could find out that he was a gondolier	La sentimulo		
La sentimulo	li rigardis ~	彼は〜を見ました。	he looked ~	La sentimulo		
La sentimulo	rigardis la ĝojan hommulton	面白い人の群れを眺めた	looked at the joyful crowd	La sentimulo		
La sentimulo	rideto lumigis lian vizaĝon	笑顔が彼の顔を明るくした	a smile lit up his face	La sentimulo		
La sentimulo	kiam li ekvidis mariston	彼が船員を見たとき	when he saw a sailor	La sentimulo		
La sentimulo	la mariston, kiu alvenis	その船員、到着した彼	the sailor who arrived	La sentimulo		
La sentimulo	la flanko de la maro	その海側	the side of the sea	La sentimulo		
La sentimulo	alvenis el la flanko de la maro	その海側から到着した	arrived from the side of the sea	La sentimulo		
La sentimulo	ĉu tio estas vi, Stefano?	そこにステファノ（Stefano）あなたですか？	is that you, Stephen?	La sentimulo		
La sentimulo	ekkriis la gondolisto	ゴンドラ運転手が叫んだ	exclaimed the gondolier	La sentimulo		
La sentimulo	ĉiuj diras, ke ~	みんなが〜だと言う	everyone says that ~	La sentimulo		
La sentimulo	en la manojn de la Turkoj	トルコ人の手	into the hands of the Turks	La sentimulo		
La sentimulo	ke vi falis en la manojn de la Turkoj	爆発した人の手に落ちたと	that you fell into the hands of the Turks	La sentimulo		
La sentimulo	ni renkontis unu	私たちは一人に会った	we met one	La sentimulo		
La sentimulo	el niaj ŝipoj	私たちの船から	from our ships	La sentimulo		
La sentimulo	ĝi sekvis nin	それが私たちに従った	it followed us	La sentimulo		
La sentimulo	dum pli ol unu horo	1時間以上	for more than an hour	La sentimulo		
La sentimulo	sed ne estas facile iri ~	しかし〜に行くのは簡単ではありません	but it is not easy to go ~	La sentimulo		
La sentimulo	iri pli rapide ol nia ŝipo	私たちの船よりも早く行く	to go faster than our ship	La sentimulo		
La sentimulo	kiaj novaĵoj estas tie ĉi?	どのようなニュースがここにありますか？	what news is here?	La sentimulo		
La sentimulo	tie ĉi en Venecio	ここヴェネツィアの中	here in Venice	La sentimulo		
La sentimulo	nenio interesa	何も面白くない	nothing interesting	La sentimulo		
La sentimulo	nur granda malfeliĉo	ただ大きな不幸だけ	just a big misfortune	La sentimulo		
La sentimulo	ĉu vi konas Pietron?	あなたはピエトロを知っていますか？	do you know Pietro?	La sentimulo		
La sentimulo	mi konas lin	私は彼を知っています	I know him	La sentimulo		
La sentimulo	granda ŝipo subakvigis lian gondolon	大きな船が彼のゴンドラを沈めた	a large ship submerged his gondola	La sentimulo		
La sentimulo	kaj kio pri li?	そして彼について何？	and what about him?	La sentimulo		
La sentimulo	la gondolo subakviĝis	そのゴンドラが沈んだ	the gondola sank	La sentimulo		
La sentimulo	okazis, ke ~	〜することが起こった	it happened that ~	La sentimulo		
La sentimulo	ni troviĝis proksime	私たちは近くにいた	we were close	La sentimulo		
La sentimulo	ni prenis lin en nian gondolon	私たちは彼を私たちのゴンドラに連れて行きました。	we took him in our gondola	La sentimulo		
La sentimulo	en la sama tempo	同じ時間内に	at the same time	La sentimulo		
La sentimulo	mia estro subakviĝis	私の相関は水に落ちた	my boss drowned	La sentimulo		
La sentimulo	por helpi junulinon	若い女性を助けるために	to help a young woman	La sentimulo		
La sentimulo	junulinon, kiu preskaŭ mortis	若い女性を、ほとんど死んでいるように	a young woman who almost died	La sentimulo		
La sentimulo	kun sia onklo	自分のおじさんと一緒に	with his uncle	La sentimulo		
La sentimulo	preskaŭ mortis kun sia onklo	自分の叔父と一緒にほとんど死んだ。	almost died with his uncle	La sentimulo		
La sentimulo	tie estis junulino	そこに若い女性がいた	there was a young woman	La sentimulo		
La sentimulo	lin ni ne povis helpi	彼を私たちが助けることができなかった	we could not help him	La sentimulo		
La sentimulo	estis grava homo	大切な人だった	was an important person	La sentimulo		
La sentimulo	kio alvenigis vin en Venecion?	何があなたをベネチアに来たのですか？	what brought you to Venice?	La sentimulo		
La sentimulo	amiko mia	私の友達	my friend	La sentimulo		
La sentimulo	la maristo ekrigardis	その船員は見つめ始めた。	the sailor looked up	La sentimulo		
La sentimulo	rapide ekrigardis sian amikon	すぐに自分の友達を見つめた	quickly glanced at his friend	La sentimulo		
La sentimulo	kaj komencis diri	そして話し始めた	and began to say	La sentimulo		
La sentimulo	do vi scias ~	だからあなたは〜を知っています	so you know ~	La sentimulo		
La sentimulo	mi alportis ~	私は〜を持ってきた	I brought ~	La sentimulo		
La sentimulo	la gondolisto subite haltigis lin	そのゴンドラ運転手が突然彼を止めた。	the gondolier suddenly stopped him	La sentimulo		
La sentimulo	li diris	彼は言った	he said	La sentimulo		
La sentimulo	tiam iu homo pasis	その時、ある人が通り過ぎた	then a man passed by	La sentimulo		
La sentimulo	iu homo pasis apud li	ある人がそのそばを通り過ぎた	a man passed by him	La sentimulo		
La sentimulo	li ankoraŭ ne estis tridekjara	彼はまだ30歳ではありませんでした	he was not yet thirty	La sentimulo		
La sentimulo	kaj lia vizaĝo estis senkolora	そして彼の顔を淡くなった	and his face was colorless	La sentimulo		
La sentimulo	lia iro estis certa kaj facila	彼が行くのは確実で簡単でした。	his going was sure and easy	La sentimulo		
La sentimulo	lia vizaĝo estis malĝoja	彼の顔は悲しい	his face was sad	La sentimulo		
La sentimulo	kiam li ekvidis la homon, ~	彼がその人を見つめたとき、～	when he saw the man, ~	La sentimulo		
La sentimulo	oni diras, ke ~	誰か〜と言う	it is said that ~	La sentimulo		
La sentimulo	multaj gravuloj donas ~	多くの主要人物が〜を与える	many important people give ~	La sentimulo		
La sentimulo	sekreta laboro	秘密の仕事	secret work	La sentimulo		
La sentimulo	sekretaj laboroj	秘密の仕事	secret jobs	La sentimulo		
La sentimulo	donas sekretajn laborojn al li	彼に秘密の仕事を与える	gives secret jobs to him	La sentimulo		
La sentimulo	tro da sekretoj	あまりにも多くの秘密	too many secrets	La sentimulo		
La sentimulo	li scias tro da sekretoj	彼はあまりにも多くの秘密を知っています。	he knows too many secrets	La sentimulo		
La sentimulo	tial ili timas	だから彼らは恐れている	therefore they are afraid	La sentimulo		
La sentimulo	sendi lin en malliberejon	彼を刑務所に送る	to send him to prison	La sentimulo		
La sentimulo	diris la maristo	その船員が言った	said the sailor	La sentimulo		
La sentimulo	kaj dum li parolis	そして彼が言った間	and as he spoke	La sentimulo		
La sentimulo	li montris la domegon	彼はその建物を指した。	he pointed to the mansion	La sentimulo		
La sentimulo	la domego de Doĝoj	東条（Doĝoj）のその建物	the mansion of Doges	La sentimulo		
La sentimulo	multaj gravuloj bezonas lian helpon	多くの主要人物が彼の助けを必要とする	many important people need his help	La sentimulo		
La sentimulo	kiom ili pagas?	彼らはいくら支払うのですか？	how much they pay?	La sentimulo		
La sentimulo	pagas al li	彼に支払う	pays him	La sentimulo		
La sentimulo	pagas por unu mortigo	殺人一度に支払う	pays for one kill	La sentimulo		
La sentimulo	certe ne malpli ol ~	確かに〜より少なくない	certainly not less than ~	La sentimulo		
La sentimulo	ol cent moneroj	コイン100個より	than a hundred coins	La sentimulo		
La sentimulo	ne forgesu, ke ~	〜であることを忘れないでください	don't forget that ~	La sentimulo		
La sentimulo	ke li laboras por tiuj	彼が彼らのために働くこと	that he works for them	La sentimulo		
La sentimulo	por tiuj, kiuj havas sufiĉe da mono	彼らのために、十分なお金を持つそれら	for those who have enough money	La sentimulo		
La sentimulo	por pagi al li	彼に支払うために	to pay him	La sentimulo		
La sentimulo	en Venecio estas ~	ヴェネツィアの中には〜がある	in Venice there is ~	La sentimulo		
La sentimulo	tiuj aferoj	そのような出来事	those things	La sentimulo		
La sentimulo	forgesi tiujn aferojn	そのような出来事を忘れる	to forget those things	La sentimulo		
La sentimulo	aferoj, kiujn estas pli bone forgesi	事件、忘れた方が良い	things that are better forgotten	La sentimulo		
La sentimulo	se vi volas trankvile manĝi	静かに食べたい場合	if you want to eat in peace	La sentimulo		
La sentimulo	trankvile manĝi vian panon	あなたのパンを静かに食べる	to eat your bread in peace	La sentimulo		
La sentimulo	estis iom da silento	少しの静的が流れた	there was some silence	La sentimulo		
La sentimulo	kaj poste	そして後で	and later	La sentimulo		
La sentimulo	la gondolisto denove ekparolis	そのゴンドラ運転手は再び話し始めた。	the gondolier spoke again	La sentimulo		
La sentimulo	vi venis ĝustatempe	あなたは適当な時間に来ました	you came just in time	La sentimulo		
La sentimulo	por vidi ŝipkuron	ボートレースを見るために	to see a boat race	La sentimulo		
La sentimulo	iu diris malforte	誰かがずっと言った	someone said weakly	La sentimulo		
La sentimulo	proksime de la gondolisto	そのゴンドラ運転手の近くに	near the gondolier	La sentimulo		
La sentimulo	la estro de la urbo	その都市の市長	the mayor of the city	La sentimulo		
La sentimulo	senvorte montris al la gondolo	言わずにゴンドラを指した	wordlessly pointed to the gondola	La sentimulo		
La sentimulo	diris la gondolisto	そのゴンドラ運転手が言った	said the gondolier	La sentimulo		
La sentimulo	kaj prenis la manon de sia amiko	そして自分の友人の手を握った	and took his friend's hand	La sentimulo		
La sentimulo	ĵetas la paperon	その紙を投げる	throws the paper	La sentimulo		
La sentimulo	en la paperujon	その書類に	into the paper bin	La sentimulo		
La sentimulo	la knabinoj ĵetis la paperojn	その少女たちは紙を投げた	the girls threw the papers	La sentimulo		
La sentimulo	kie estas mia skribilo?	私の筆記具はどこにありますか？	where is my pen	La sentimulo		
La sentimulo	mi volas respondi al li	私は彼に答えたい	I want to answer him	La sentimulo		
La sentimulo	la suno malaperis	太陽が消えた	the sun disappeared	La sentimulo		
La sentimulo	kaj nun estas preskaŭ malhele	そして今はほぼ暗い	and now it is almost dark	La sentimulo		
La sentimulo	bonvolu manĝi	お召し上がりください	please eat	La sentimulo		
La sentimulo	bonvolu manĝi la panon	そのパンをお召し上がりください	please eat the bread	La sentimulo		
La sentimulo	per manĝiloj	スザー（フォーク）を持って	with cutlery	La sentimulo		
La sentimulo	pardonu min	ご了承ください	excuse me	La sentimulo		
La sentimulo	rajtas resti	滞在するのに許された	is allowed to stay	La sentimulo		
La sentimulo	mi ne rajtas resti	私は滞在することを許されません。	I have no right to stay	La sentimulo		
La sentimulo	ĉu vi povas kunporti ~ ?	あなたは〜を運ぶことができますか？	can you bring ~ ?	La sentimulo		
La sentimulo	de mia fratino	私の妹（姉）	from my sister	La sentimulo		
La sentimulo	kiam vi aĉetis ~ ?	いつあなたは〜を買ったのですか？	when did you buy ~ ?	La sentimulo		
La sentimulo	aĉetis tiun muzikilon	その楽器を買った	bought that musical instrument	La sentimulo		
La sentimulo	kiu laste uzis ?	誰が最後に使用しましたか？	who used last?	La sentimulo		
La sentimulo	uzis mian ŝlosilon	私の鍵を使った	used my key	La sentimulo		
La sentimulo	ĉu vi veturis?	あなたは運転しましたか？	did you drive?	La sentimulo		
La sentimulo	en Venecio	ヴェネツィアの中	in Venice	La sentimulo		
La sentimulo	ankaŭ per gondolo	ゴンドラでも利用して	also by gondola	La sentimulo		
La sentimulo	ĉu vi povos ekdormi?	あなたは眠ることができますか？	will you be able to fall asleep?	La sentimulo		
La sentimulo	tiam, kiam silentiĝis	その時、静かになったその時	then, when there was silence	La sentimulo		
Nokta Promeno	la sinjoro estis alta	その神社は背が高かった。	the gentleman was tall	Nokta Promeno		
Nokta Promeno	alta, dika	高い(背の高い)、太い(太った)	tall, fat	Nokta Promeno		
Nokta Promeno	dika, peza	太い（太った）、重い	thick, heavy	Nokta Promeno		
Nokta Promeno	peza kaj larĝa	重くて巨大な	heavy and large	Nokta Promeno		
Nokta Promeno	estis alta, dika, peza, kaj larĝa	大きく、太く、重く、巨大だった	was tall, thick, heavy, and large	Nokta Promeno		
Nokta Promeno	donis forton	力を与えた	gave strength	Nokta Promeno		
Nokta Promeno	havinda forto	持つべき力	a force worth having	Nokta Promeno		
Nokta Promeno	havinda korpoforto	行くことができる物理的な力	physical strength worth having	Nokta Promeno		
Nokta Promeno	tio donis	それは与えた	that gave	Nokta Promeno		
Nokta Promeno	donis al li	彼に与えた	gave him	Nokta Promeno		
Nokta Promeno	tio donis forton	それは力を与えた	that gave strength	Nokta Promeno		
Nokta Promeno	donis havindan korpoforton	それは持つべき物理的な力を与えた	gave body strength worth having	Nokta Promeno		
Nokta Promeno	lia aspekto	彼の外観	his appearance	Nokta Promeno		
Nokta Promeno	grandula aspekto	巨人のような外観	appearance of a tall person	Nokta Promeno		
Nokta Promeno	eta rolo	小さな役割	a small role	Nokta Promeno		
Nokta Promeno	ludis rolon	役割を果たした	played a role	Nokta Promeno		
Nokta Promeno	ne eta rolo	小さくない役割	not a small role	Nokta Promeno		
Nokta Promeno	ludis etan rolon	小さな役割を果たした	played a small role	Nokta Promeno		
Nokta Promeno	ludis ne etan rolon	小さくない役割を果たした	played no small role	Nokta Promeno		
Nokta Promeno	en la fakto, ke ~	〜するという事実に	in the fact that ~	Nokta Promeno		
Nokta Promeno	la plimulto el la homoj	その人の大多数	the majority of the people	Nokta Promeno		
Nokta Promeno	se ne timis	怖がらないと	if not afraid	Nokta Promeno		
Nokta Promeno	lin timis	彼を怖がった	was afraid of him	Nokta Promeno		
Nokta Promeno	se lin timis	彼を怖がっていたら	if he was afraid	Nokta Promeno		
Nokta Promeno	se ne lin timis	彼を怖がらない限り	if not afraid of him	Nokta Promeno		
Nokta Promeno	certe respektis	確かに尊重した	certainly respected	Nokta Promeno		
Nokta Promeno	almenaŭ pripensis ~	少なくとも〜について考えた	at least thought about ~	Nokta Promeno		
Nokta Promeno	antaŭ ol ~	〜する前に	before ~	Nokta Promeno		
Nokta Promeno	kontentigi lin	彼を満足させる	to satisfy him	Nokta Promeno		
Nokta Promeno	malkontentigi lin	彼の苦情を引き起こす	to displease him	Nokta Promeno		
Nokta Promeno	antaŭ ol malkontentigi ~	~の苦情を起こす前に	before dissatisfying ~	Nokta Promeno		
Nokta Promeno	antaŭ ol decidi ~	~を決める前に	before deciding ~	Nokta Promeno		
Nokta Promeno	decidi malkontentigi ~	〜の苦情を起こすことにする	to decide to displease ~	Nokta Promeno		
Nokta Promeno	decidi kontentigi lin	彼を満足させることにする	to decide to satisfy him	Nokta Promeno		
Nokta Promeno	antaŭ ol decidi malkontentigi lin	彼の苦情を詐欺にする前に	before deciding to displease him	Nokta Promeno		
Nokta Promeno	tio, kio estas utila	それ、役に立つ	that, which is useful	Nokta Promeno		
Nokta Promeno	ofte utila dumtage	主に日中に便利	often useful during the day	Nokta Promeno		
Nokta Promeno	malplaĉa ĝeno	不快な妨害	an unpleasant nuisance	Nokta Promeno		
Nokta Promeno	per si	自分で	by himself	Nokta Promeno		
Nokta Promeno	prezentas malplaĉan ĝenon	不快で迷惑を掛ける	presents an unpleasant nuisance	Nokta Promeno		
Nokta Promeno	prezentas per si malplaĉan ĝenon	自分で不快で迷惑を掛ける	presents itself as an unpleasant nuisance	Nokta Promeno		
Nokta Promeno	en loko arboplena	木がいっぱいの場所に	in a place full of trees	Nokta Promeno		
Nokta Promeno	tiam, kiam oni devojiĝis	その時、誰かが迷子になった	then, when one went astray	Nokta Promeno		
Nokta Promeno	en nehoma sovaĝejo	人的で珍しい野生の地に	in an inhuman wilderness	Nokta Promeno		
Nokta Promeno	kaj ekstervoje iraĉas	そして道を離れて迷う	and goes off the road in chaos	Nokta Promeno		
Nokta Promeno	alta larĝa korpo	背が高くて巨大な小柄	a tall large body	Nokta Promeno		
Nokta Promeno	ne sukcesis pasi ~	〜を通過するのに成功しなかった	failed to pass ~	Nokta Promeno		
Nokta Promeno	inter la arbetoj	その小さな低木の間に	among the bushes	Nokta Promeno		
Nokta Promeno	krome tuŝi la naturaĵojn	自然のままに触れる以外に	in addition to touching the natural things	Nokta Promeno		
Nokta Promeno	ĝenerale malsekajn	一般的に湿った	generally wet	Nokta Promeno		
Nokta Promeno	meze de malsekaj naturaĵoj	湿った野生の途中で	in the middle of wet nature	Nokta Promeno		
Nokta Promeno	malsekaj naturaĵoj, meze de kiuj ~	湿った野生のもの、それらの真ん中に〜	wet natural things, in the middle of which ~	Nokta Promeno		
Nokta Promeno	li malfacile paŝis	彼は難しく歩いた。	he walked with difficulty	Nokta Promeno		
Nokta Promeno	estis travivaĵo	経験だった	it was an experience	Nokta Promeno		
Nokta Promeno	ne malofte	まれではない	not uncommon	Nokta Promeno		
Nokta Promeno	doloriga kaj ĉiam malagrabla	痛くていつも甘くない	painful and always unpleasant	Nokta Promeno		
Nokta Promeno	ju pli ~	〜するほど	the more ~	Nokta Promeno		
Nokta Promeno	antaŭeniris en la vivo	人生でこれから前進していった	moved forward in life	Nokta Promeno		
Nokta Promeno	en la kastela arbaro	その城の森の中	in the castle forest	Nokta Promeno		
Nokta Promeno	ju pli antaŭeniris des pli malŝatis ~	これから前進していくにつれて、もっと～が嫌になった	the further went forward the more disliked ~	Nokta Promeno		
Nokta Promeno	malŝatis la noktan naturon	夜の自然が嫌いだった	disliked the nocturnal nature	Nokta Promeno		
Nokta Promeno	viro kun okuloj bone videblaj	見やすい目を持つ男	a man with eyes that can be seen clearly	Nokta Promeno		
Nokta Promeno	okuloj, kiuj kapablis bone vidi	目、よく見ることができる	eyes that could see well	Nokta Promeno		
Nokta Promeno	bone vidi en la mallumo	暗闇の中でよく	to see well in the dark	Nokta Promeno		
Nokta Promeno	rigardis la malfacilan iron	頑張って行くのを見た	looked at the difficult going	Nokta Promeno		
Nokta Promeno	de nia industriisto	私たちの産業家	from our industrialist	Nokta Promeno		
Nokta Promeno	li ridetis	彼は微笑んだ。	he smiled	Nokta Promeno		
Nokta Promeno	apud tiu viro	その男のそばに	next to that man	Nokta Promeno		
Nokta Promeno	en vestaĵo de policano	警察の服に	in policeman's clothing	Nokta Promeno		
Nokta Promeno	staris alia persono	他の人が立っていた	another person was standing	Nokta Promeno		
Nokta Promeno	en simila vestaĵo	似たような服を着ている	in similar clothing	Nokta Promeno		
Nokta Promeno	ĉi lasta estis virino	ここで後者は女性だった	the latter was a woman	Nokta Promeno		
Nokta Promeno	ni iru	私たちに行きましょう	let's go	Nokta Promeno		
Nokta Promeno	la viro diris mallaŭte	その男はずっと言った。	the man said softly	Nokta Promeno		
Nokta Promeno	en la orelon de sia kunulino	自分の同居女性の耳に向かって	into the ear of his companion	Nokta Promeno		
Nokta Promeno	nun estas la ĝusta momento	今が適切な瞬間です	now is the right moment	Nokta Promeno		
Nokta Promeno	ambaŭ paŝis direkte al la persono	両方ともすぐにその人に歩いた	both stepped toward the person	Nokta Promeno		
