A - la plej baza kurso por komencantoj						
Maja	je kioma horo?	何時に？	at what hour?	Maja		
Maja	je la sesa, li venos	6時に彼は来るでしょう	at six he will come	Maja		
Maja	la libreto estis ĉarma	その冊子は魅力的だった	the libretto was charming	Maja		
Maja	estu trankvila	静かにしてください。	be quiet	Maja		
Maja	li estu trankvila	その人に、静かにさせなさい。	let him be quiet	Maja		
Maja	ankaŭ li	彼も	he too	Maja		
Maja	mi deziras	欲しい(dzr)	I want (desire)	Maja		
Maja	mi deziras, ke ~	私は〜したい	I wish (desire) that ~	Maja		
Maja	ke vi lernu	あなたが学ぶ	that you learn	Maja		
Maja	mi deziras, ke vi lernu	私はあなたが学びたい	I want you to learn	Maja		
Maja	patro insistas	父はこだわる	father insists	Maja		
Maja	patro insistas, ke ~	父は～とこだわる	father insists that ~	Maja		
Maja	ke mi iru	私が行く	that I go	Maja		
Maja	patro insistas, ke mi iru	父は私が行くように固執する	father insists that I go	Maja		
Maja	je kioma horo	何時に	at what hour	Maja		
Maja	je kioma horo vi venos?	何時に来るの？	what time do you come?	Maja		
Maja	je la kvina	5時に	at five (o'clock)	Maja		
Maja	je la kvina horo	5時に	at five o'clock	Maja		
Maja	kiel li fartas?	彼はどのように過ごしますか？	how does he doing?	Maja		
Maja	kiel vi fartis lastatempe?	最近、どのように過ごしましたか？ (あいさつ)	how have you been lately?	Maja		
Maja	etaj libroj belas	小さな本は美しいです	little books are beautiful	Maja		
Maja	libreto, belaj libroj	小冊子、美しい本	a booklet, beautiful books	Maja		
Maja	bela, beleta, belega	美しい、少し美しい、とても美しい	beautiful, a little pretty, very beautiful	Maja		
Maja	varma, varmeta, varmega	暖かい、やや暖かい、とても暑い	warm, lukewarm, very hot	Maja		
Maja	librego, libreto	大きな本、小冊子	a big book, a booklet	Maja		
Maja	bona, bonega, bonege	良い、とても良い（とても良い）、素晴らしい	good, great, well	Maja		
Maja	riĉa, riĉiĝi, riĉulo	裕福な、豊かな、金持ち	rich, become rich, a rich person	Maja		
Maja	trankvila, trankviliĝi, trankviliĝu	穏やかで静かで静けさになる、平静を保ちなさい	calm, to calm down, calm down	Maja		
ĉiam malfrue	sana, resaniĝi, resaniĝis	健康、回復する、回復した	healthy, to become healed, became healed	ĉiam malfrue		
ĉiam malfrue	edzo, edziĝo, geedziĝis	夫、結婚、チャンガガダ（結婚する）	a husband, marriage, married	ĉiam malfrue		
ĉiam malfrue	leterportisto	手紙配達人（郵便局）	a letter postman	ĉiam malfrue		
ĉiam malfrue	hejmlando	祖国、故国	a homeland	ĉiam malfrue		
ĉiam malfrue	iom, iomete	少し、非常に少し	somewhat, a little	ĉiam malfrue		
ĉiam malfrue	ni bonege vespermanĝis	我々は非常に良い夜を食べた	we had a great dinner	ĉiam malfrue		
ĉiam malfrue	espereble, prizorgu vin	希望を、自分自身の世話を	hopefully, take care of yourself	ĉiam malfrue		
ĉiam malfrue	mi zorgis pri la altkvalita loĝejo	私はその高品質の宿泊施設の世話をしました。	I cared about the high-quality housing	ĉiam malfrue		
ĉiam malfrue	pripensu dufoje, multfoje	二度、何度も考えてみて	think twice, many times	ĉiam malfrue		
ĉiam malfrue	kiu deprenis la libreton?	誰がその本を取り出しましたか？	who took down the booklet?	ĉiam malfrue		
ĉiam malfrue	kato, kiu nomiĝas Cezaro	シーザーと呼ばれる猫	a cat named Caesar	ĉiam malfrue		
ĉiam malfrue	kuko, kiu estas sur la tablo	テーブルの上のお菓子	a cake which is on the table	ĉiam malfrue		
ĉiam malfrue	manĝu kukon, kiu estas sur la tablo	テーブルの上にあるお菓子を食べる	eat a cake that is on the table	ĉiam malfrue		
ĉiam malfrue	fariĝis varmega kaj ruĝiĝis	とても熱くなり、赤くなった	became hot and blushed	ĉiam malfrue		
ĉiam malfrue	patro volas, ke lia infano manĝu	父は欲しかった、彼の赤ちゃんを食べる	a father wants his child to eat	ĉiam malfrue		
ĉiam malfrue	en malgranda ĉambro	小さな部屋で	in a small room	ĉiam malfrue		
ĉiam malfrue	ni loĝas en ~	私たちは〜に住んでいます	we live in ~	ĉiam malfrue		
ĉiam malfrue	mi fariĝis maltrankvila	私は不安になった	I became anxious	ĉiam malfrue		
ĉiam malfrue	tiam, kiam mi vidis vin	私があなたを見たとき	at that time when I saw you	ĉiam malfrue		
ĉiam malfrue	ĉiuj rimarkis tion	誰もがそれに気づいた	everyone noticed that	ĉiam malfrue		
ĉiam malfrue	tion, ke ŝi estas belega	それを、彼女はとても美しい（それを）	the fact that she is beautiful	ĉiam malfrue		
ĉiam malfrue	ĉu vi deziras, ke ~ ?	〜することを望むか。 (デジリ)	do you want that ~ ? (deziri)	ĉiam malfrue		
ĉiam malfrue	ke mi montru al vi	私があなたに見せる	that I may show you	ĉiam malfrue		
ĉiam malfrue	ĉu vi deziras, ke mi montru?	あなたは私が表示したいですか？	do you want me to show?	ĉiam malfrue		
ĉiam malfrue	mian plej novan libron	私の最も新しい本	my newest book (objective)	ĉiam malfrue		
ĉiam malfrue	morgaŭ matene, kion vi volas?	明日の朝、あなたは何をしたいですか？	tomorrow morning, what do you want?	ĉiam malfrue		
ĉiam malfrue	matenmanĝis malfrue	遅く朝食を取った	had breakfast late	ĉiam malfrue		
ĉiam malfrue	kiam Marko alvenos?	マルコはいつ到着しますか？	when will Mark arrive?	ĉiam malfrue		
ĉiam malfrue	je la kvina aŭ je la oka horo	5時または8時に	at five or eight o'clock	ĉiam malfrue		
ĉiam malfrue	kiam vi rimarkis, ke ~ ?	いつあなたは〜ということに気づきましたか？	when did you notice that ~ ?	ĉiam malfrue		
ĉiam malfrue	la tuta familio nomas min bonfarulo	家族全員が私をスポンサーと呼びます	the whole family calls me a benefactor	ĉiam malfrue		
ĉiam malfrue	utila por vi	あなたに役立つ	useful for you	ĉiam malfrue		
ĉiam malfrue	ĉu la libreto estis utila?	その小冊子が役に立ちましたか？	was the booklet useful?	ĉiam malfrue		
ĉiam malfrue	tiu libreto, kiun mi sendis	その小冊子、私が送った彼	the booklet, which I sent	ĉiam malfrue		
ĉiam malfrue	matene dormis tre longe	朝はとても長く眠りました。	in the morning slept for a long time	ĉiam malfrue		
ĉiam malfrue	kiam li vidis la sunon	彼が太陽を見たとき	when he saw the sun	ĉiam malfrue		
ĉiam malfrue	subite li eksaltis	突然彼は走った	suddenly he jumped up	ĉiam malfrue		
ĉiam malfrue	li estis ĉiam frua	彼はいつも早かった。	he was always early	ĉiam malfrue		
ĉiam malfrue	ĉiam li malfruas	いつも彼は遅い	he is always late	ĉiam malfrue		
ĉiam malfrue	tiam, kiam li devas iri	その時、彼が行かなければならない（その時）	at that time, when he has to go	ĉiam malfrue		
ĉiam malfrue	iri al la lernejo	学校に行く	to go to the school	ĉiam malfrue		
ĉiam malfrue	li scias, ke ~	彼は〜することを知っています	he knows, that ~	ĉiam malfrue		
ĉiam malfrue	li scias tion, ke ~	彼は〜ということを知っています	he knows the fact, that ~	ĉiam malfrue		
ĉiam malfrue	tion, ke la instruisto malŝatas abelon	それを、先生が罰を嫌うという（その事実を）	the fact that the teacher hates bees	ĉiam malfrue		
ĉiam malfrue	scias tion, ke la instruisto malŝatas abelon	それを知って、先生が罰を嫌うことを	knows the fact that the teacher hates bees	ĉiam malfrue		
ĉiam malfrue	scias, ke la instruisto malŝatas tion	知っている、先生がそれを嫌うことを	knows that the teacher hates that	ĉiam malfrue		
ĉiam malfrue	sed hodiaŭ li trinkis la kafon	しかし今日、彼はコーヒーを飲んだ	but today he drank the coffee	ĉiam malfrue		
ĉiam malfrue	li rapide surmetas la vestaĵon	彼はすぐに服を着る	he quickly puts on the clothes	ĉiam malfrue		
ĉiam malfrue	li ne volas malfrui	彼は遅くしたくない	he doesn't want to be late	ĉiam malfrue		
ĉiam malfrue	rapidege kun la libroj en la mano	本を手に持ってとても素早く	very quickly with the books in hand	ĉiam malfrue		
ĉiam malfrue	poste li kuris kaj saltis	その後彼は走って走った。	later he ran and jumped	ĉiam malfrue		
la strato	li kuris kaj saltis	彼は走って走った。	he ran and jumped	la strato		
la strato	laŭ la strato	通りに沿って	along the street	la strato		
la strato	la homoj rigardis lin	彼らは彼を見た	the people looked at him	la strato		
la strato	rigardis lin kaj diris	彼を見て言った	looked at him and said	la strato		
la strato	saĝa kaj malsaĝa	賢明で愚かな	wise and foolish	la strato		
la strato	kia malsaĝa knabo!	愚かな奴のようだから！	what a foolish boy!	la strato		
la strato	estis antaŭ lernejo	学校の前にいた	was in front of a school	la strato		
la strato	baldaŭ	すぐに	soon	la strato		
la strato	li estis antaŭ ~	彼は〜の前にいた	he was in front of ~	la strato		
la strato	iri kaj eniri	行くと入る	to go and to enter	la strato		
la strato	li volis eniri	彼は入りたかった。	he wanted to enter	la strato		
la strato	eniri la lernejon	その学校に入る	to enter into the school	la strato		
la strato	sed tamen	しかし、しかし	but however	la strato		
la strato	sed li ne povis	しかし彼はできなかった。	but he couldn't	la strato		
la strato	fermi kaj fermita	閉じて閉じた	to close and closed	la strato		
la strato	ĝi estis fermita	閉じていた	it was closed	la strato		
la strato	nek ~ nek ~	~でもない~でもない	neither ~ nor ~	la strato		
la strato	nek instruisto nek gelernantoj	先生でも男女学生でもない	neither a teacher nor male-and-female students	la strato		
la strato	vidis nek instruiston nek gelernantojn	先生も見られず、学生も見えなかった	saw neither a teacher nor students	la strato		
la strato	sidi, eksidi	座る、座る	to sit, to get sitted	la strato		
la strato	eksidis	座った	got seated (had seated)	la strato		
la strato	li eksidis	彼は座った。	he got seated	la strato		
la strato	kaj pensis	そして考えた	and thought	la strato		
la strato	kio okazis?	何が起こったのか？	what did happen?	la strato		
la strato	diable	ひどく（悪魔のように）	to the awful (like a devil)	la strato		
la strato	damne	ジェギラル	dam it	la strato		
la strato	memoras	覚える	remembers	la strato		
la strato	nun mi memoras	私は今覚えています	now I remember	la strato		
la strato	dimanĉo	日曜日	Sunday	la strato		
la strato	hodiaŭ estas ~	今日は〜です	today is ~	la strato		
la strato	hodiaŭ estas dimanĉo	今日は日曜日です	today is Sunday	la strato		
la strato	dormi kaj ekdormi	寝て寝る	to sleep and to get into sleep	la strato		
la strato	suno kaj luno	太陽と月	a sun and a moon	la strato		
la strato	subita kaj subite	突然と突然	sudden and suddenly	la strato		
la strato	ek!	さあ！ (スタート)	off! (to start)	la strato		
la strato	salti kaj eksaltis	ジャンプし、パルジャンジャンプした	to jump and jumped 	la strato		
la strato	ĉiam frua	いつも早い	always early	la strato		
la strato	hodiaŭ metis kaj kuris	今日置いて走った	today put and ran	la strato		
la strato	aĵo, ne aĝo	もの、年齢ではない	a thing not age	la strato		
la strato	kuris laŭ homoj saĝaj	賢い人のように走った	ran along wise people	la strato		
la strato	laŭeble baldaŭ	できるだけすぐに	soon as possible	la strato		
la strato	kia knabo, kia knabino	どんな男の子、どんな女の子	what a boy, what a girl	la strato		
la strato	nek pensita nek memorita	考えられたものでもなく、記憶されたものでもない	neither thought nor memorized	la strato		
la strato	diablo atendis akvon dimanĉe	悪魔は日曜日に水を待っていた	a devil waited for water on Sunday	la strato		
	tiom malgranda momento	そんな小さな瞬間	such a small moment			
la strato	eĉ tiom malgranda momento valoras	そんな小さな瞬間でさえ価値がある	even such a small moment is worthwhile	la strato		
la strato	kriis for ĝis nokto	遠く泣いた、夜まで	cried away until night	la strato		
la strato	lasis la poŝton de la mano	手から郵便物を降ろした	put away the mailpost from the hand	la strato		
la strato	ridis mem lasante la poŝton	郵便物を出して自分で笑った	laughed by oneself, putting away the mailpost	la strato		
la strato	nek li nek ŝi ridis	彼も笑わなかったし、彼女も笑わなかった	neither he nor she laughed	la strato		
ĉiam Malfrue	ŝi nek ridis nek respondis	彼女は笑わなかったし、答えもしなかった。	she neither laughed nor answered	ĉiam Malfrue		
ĉiam Malfrue	li nek sidas nek rigardas	彼は座っていないし、見ていない。	he neither sits nor watches	ĉiam Malfrue		
ĉiam Malfrue	neniam mi vidis	私は全く見ませんでした	I have never seen	ĉiam Malfrue		
ĉiam Malfrue	mi neniam diros al iu	私は誰にも言わない。	I will never tell anyone	ĉiam Malfrue		
ĉiam Malfrue	diru al neniu	誰にも言わないで	tell no one	ĉiam Malfrue		
ĉiam Malfrue	mi neniam diros	私は決して言わない。	I will never say	ĉiam Malfrue		
ĉiam Malfrue	mem	自分（手作り）	to oneself (by oneself)	ĉiam Malfrue		
ĉiam Malfrue	mi mem faris	私一人でした（作った）	I did it myself	ĉiam Malfrue		
ĉiam Malfrue	faris tion	それをした（それを作った）	did it (made it)	ĉiam Malfrue		
ĉiam Malfrue	mem faris tion	自分でやった（作った）	did it oneself (made it oneself)	ĉiam Malfrue		
ĉiam Malfrue	ĝis la revido, ĝis revido	また見るまで（こんにちは）	see you (again), see you (again)	ĉiam Malfrue		
ĉiam Malfrue	ĝis!	こんにちは！ (再び見るまで)	until! (goodbye!)	ĉiam Malfrue		
ĉiam Malfrue	ekparoli	話し始める	to start talking	ĉiam Malfrue		
ĉiam Malfrue	ekparolis, komencis paroli finfine	口を開いた、終わりに言葉を始めた	started saying, began to speak at last	ĉiam Malfrue		
ĉiam Malfrue	trinkis rapidege	とても早く飲んだ	drank very fast	ĉiam Malfrue		
ĉiam Malfrue	trinkis matenan trinkaĵon	朝ドリンクを飲んだ	had a morning drink	ĉiam Malfrue		
ĉiam Malfrue	por frue veni	早く来るために	to come early	ĉiam Malfrue		
ĉiam Malfrue	veni al la lernejo	学校に来る	to come to school	ĉiam Malfrue		
ĉiam Malfrue	frue veni al ~	早く〜に来る	to come early to ~	ĉiam Malfrue		
ĉiam Malfrue	ne aŭdis novaĵon	ニュースを聞くことができませんでした	didn't hear news	ĉiam Malfrue		
ĉiam Malfrue	ankoraŭ ne aŭdis	まだ聞いていない	didn't hear yet	ĉiam Malfrue		
ĉiam Malfrue	mi ankoraŭ ne aŭdis	私はまだ聞いていない	I didn't hear yet	ĉiam Malfrue		
ĉiam Malfrue	en tiu momento	その瞬間に	in that moment	ĉiam Malfrue		
ĉiam Malfrue	en tiu momento li ekkriis	その瞬間に彼は叫んだ。	in that moment he cried	ĉiam Malfrue		
ĉiam Malfrue	knabo, kiu ne amas	愛していない少年	a boy, who does not love	ĉiam Malfrue		
ĉiam Malfrue	geknaboj	(男女)少年少女たち	boys and girls	ĉiam Malfrue		
ĉiam Malfrue	aliaj geknaboj	他の男の子の女の子	other boys and girls	ĉiam Malfrue		
ĉiam Malfrue	ne amas aliajn geknabojn	他の男の子の女の子を愛していない	does not love other boys and girls	ĉiam Malfrue		
ĉiam Malfrue	nek amikojn, nek amikinojn	（男）友達でもなく、ガールフレンドでもない	neither friends nor girl friends	ĉiam Malfrue		
ĉiam Malfrue	havas nek monon, nek tempon	お金もなく時間もない	does not have neither money nor time	ĉiam Malfrue		
ĉiam Malfrue	kiu havis la libron?	誰がその本を持っていましたか？	who had the book?	ĉiam Malfrue		
ĉiam Malfrue	la libron, kiun vi atendis	あなたが待っていたその本	the book which you waited	ĉiam Malfrue		
ĉiam Malfrue	tiun, kiun vi atendis pli ol du jarojn	あなたが2年以上待っていたもの	that, which you waited for more than 2 years	ĉiam Malfrue		
ĉiam Malfrue	ĉu vi volas tion?	あなたはそれをしたいですか？	do you want that?	ĉiam Malfrue		
ĉiam Malfrue	ĉu vi volas, ke ~ ?	あなたは〜したいですか？	do you want that ~ ?	ĉiam Malfrue		
ĉiam Malfrue	plej kara	最も貴重な	dearest	ĉiam Malfrue		
ĉiam Malfrue	plej kara foto	最も貴重な写真	dearest photo	ĉiam Malfrue		
ĉiam Malfrue	mian plej karan foton	私の最も貴重な写真	my dearest photo	ĉiam Malfrue		
ĉiam Malfrue	kie vi aĉetis ~ ?	どこで〜を買ったの？	where did you buy ~ ?	ĉiam Malfrue		
ĉiam Malfrue	tiu vestaĵo	その服	that clothing	ĉiam Malfrue		
ĉiam Malfrue	tiun vestaĵon	その服	that clothing (objective)	ĉiam Malfrue		
ĉiam Malfrue	aĉetis tiun vestaĵon	その服を買った	bought that outfit	ĉiam Malfrue		
ĉiam Malfrue	vi iros tien	あなたはそこに行きます	you will go there	ĉiam Malfrue		
ĉiam Malfrue	kien vi iros?	どこに行きますか？	where are you going to?	ĉiam Malfrue		
ĉiam Malfrue	suna tago	日当たりの良い日	sunny day	ĉiam Malfrue		
ĉiam Malfrue	estos suna tago	太陽が良い日になります	it will be a sunny day	ĉiam Malfrue		
ĉiam Malfrue	se estos suna tago	晴れた日になると	if it will be a sunny day	ĉiam Malfrue		
ĉiam Malfrue	via frato jam ekiris	私の兄（弟）はすでに出発しています	your brother has already started	ĉiam Malfrue		
ĉiam Malfrue	ĉu via frato jam ekiris?	あなたは兄（弟）はすでに出発していますか？	has your brother started yet?	ĉiam Malfrue		
ĉiam Malfrue	kie estas la akvo?	どこに水がありますか？	where is the water	ĉiam Malfrue		
ĉiam Malfrue	kunporti la akvon	水を運ぶ	to bring the water	ĉiam Malfrue		
ĉiam Malfrue	vi mem kunportis	あなたは自分で持っていった	you yourself brought	ĉiam Malfrue		
ĉiam Malfrue	la akvon, kion vi mem kunportis	その水、あなたが自分で持っている	the water, that you yourself brought	ĉiam Malfrue		
Malbela Tago	estis tre trankvila	とても静かでした	was very quiet	ĉiam Malfrue		
Malbela Tago	hodiaŭ mia patrino estis ~	今日私の母は〜だった	today my mother was ~	ĉiam Malfrue		
Malbela Tago	mi venis el ~	〜から来た	I came from ~	ĉiam Malfrue		
Malbela Tago	el la lernejo	学校から	out of the school	ĉiam Malfrue		
Malbela Tago	raportis al ~	〜に報告した	reported to ~	ĉiam Malfrue		
Malbela Tago	kaj raportis al ŝi	そして彼女に話した	and reported to her	ĉiam Malfrue		
Malbela Tago	raportis, ke ~	〜と報告した	reported that ~	ĉiam Malfrue		
Malbela Tago	raportis, ke mi ricevos	私は受け取ると言った	reported that I will receive	ĉiam Malfrue		
Malbela Tago	mi ricevos malbonan noton	私は悪いスコアを得るでしょう	I will get a bad grade	ĉiam Malfrue		
Malbela Tago	ŝi diris, ke ~	彼女は〜と言った	she said that ~	ĉiam Malfrue		
Malbela Tago	vi devas laborigi ~	あなたは〜を働かせなければなりませんでした	you have to make ~ work	ĉiam Malfrue		
Malbela Tago	pli multe	もっと	more	ĉiam Malfrue		
Malbela Tago	pli multe laborigi	もっと仕事をする	to make work more	ĉiam Malfrue		
Malbela Tago	laborigi vian kapon	君の脳を稼動させる	to make your head work	ĉiam Malfrue		
Malbela Tago	kiom da malbonaj notoj	どのくらいの悪いスコア	how many bad grades	ĉiam Malfrue		
Malbela Tago	vi havas tiom da malbonaj notoj	私はそんなに悪いスコアを受け取る	you have so many bad grades	ĉiam Malfrue		
Malbela Tago	estis malĝoja	悲しい	was sad	ĉiam Malfrue		
Malbela Tago	en vian ĉambron	あなたの部屋に	into your room	ĉiam Malfrue		
Malbela Tago	iru en vian ĉambron	あなたの部屋に行く	go into your room	ĉiam Malfrue		
Malbela Tago	iru kaj lernu	行って学ぶ	go and learn	ĉiam Malfrue		
Malbela Tago	mi sidis	私は座っていた	I sat	ĉiam Malfrue		
Malbela Tago	en mia ĉambro	私の部屋の中で	in my room	ĉiam Malfrue		
Malbela Tago	sidis en mia ĉambro	私の部屋に座っていた	sat in my room	ĉiam Malfrue		
Malbela Tago	nek lerni nek legi	学ぶことも読まない	neither learn nor read	ĉiam Malfrue		
Malbela Tago	sed mi povis nek lerni nek legi	しかし学ぶこともできず、読むこともできなかった	but I could neither learn nor read	ĉiam Malfrue		
Malbela Tago	miaj pensoj	私の考え	my thoughts	ĉiam Malfrue		
Malbela Tago	ĉe ludo	ゲーム（遊ぶ）に	at a game	ĉiam Malfrue		
Malbela Tago	ludo kun miaj amikoj	友達と遊ぶ	game with my friends	ĉiam Malfrue		
Malbela Tago	ĉe sporto	スポーツに	at sport	ĉiam Malfrue		
Malbela Tago	al mi mem	私自身に	to myself	ĉiam Malfrue		
Malbela Tago	diris al mi mem	自分に言った	said to myself	ĉiam Malfrue		
Malbela Tago	tiom malsaĝa	とても愚かな	so stupid	ĉiam Malfrue		
Malbela Tago	ĉu mi estas tiom malsaĝa?	私はとても愚かですか？	am I that stupid?	ĉiam Malfrue		
Malbela Tago	kvankam mi lernis multe	私はたくさん勉強したにもかかわらず	although I learned a lot	ĉiam Malfrue		
Malbela Tago	la patrino eniris	母が入ってきた	the mother entered	ĉiam Malfrue		
Malbela Tago	miaj vortoj	私の言葉	my words	ĉiam Malfrue		
Malbela Tago	kaj aŭdis miajn vortojn	そして私が言うことを聞いた	and heard my words	ĉiam Malfrue		
Malbela Tago	ŝi tuj respondis	彼女はすぐに答えた	she answered immediately	ĉiam Malfrue		
Malbela Tago	ne, mia kara	いいえ、私の大切な人	no, my dear	ĉiam Malfrue		
Malbela Tago	vi ne estas malsaĝa	あなたは愚かではありません。	you are not stupid	ĉiam Malfrue		
Malbela Tago	la problemo estas, ke ~	問題なら、〜したの	the problem is that ~	ĉiam Malfrue		
Malbela Tago	ke vi devas lerni	勉強すべきこと	that you must learn	ĉiam Malfrue		
Malbela Tago	devas lerni multe pli	はるかに勉強しなければならない	must learn much more	ĉiam Malfrue		
Malbela Tago	tiam vi ne havos	それからあなたは持っているでしょう	then you will not have	ĉiam Malfrue		
Malbela Tago	malbonaj notoj	悪いスコア	bad grades	ĉiam Malfrue		
Malbela Tago	havos nur malbonajn notojn	悪いスコアだけが届くでしょう	will have only bad grades	ĉiam Malfrue		
Malbela Tago	ankaŭ nun	今でも	also now	ĉiam Malfrue		
Malbela Tago	mi ne havas ilin	私はそれらを持っていません	I don't have them	ĉiam Malfrue		
Malbela Tago	mi havas bonan noton	私は良いスコアを得る	I have a good grade	ĉiam Malfrue		
Malbela Tago	pri muziko	音楽について	about music	ĉiam Malfrue		
Malbela Tago	bonan noton pri muziko	音楽で良いスコア	a good note on music	ĉiam Malfrue		
Malbela Tago	la patrino subite ekridis	母は突然笑いを放った	the mother suddenly burst out laughing	ĉiam Malfrue		
Malbela Tago	tio plibeligis ~	それは〜をもっと美しくしました	that beautified ~	ĉiam Malfrue		
Malbela Tago	mian tagon	私の一日	my day	ĉiam Malfrue		
Malbela Tago	plibeligis mian tagon	私の一日をもっと美しくしました	made my day	ĉiam Malfrue		
Malbela Tago	sed tamen restis	しかしまだ残った	but still remained	ĉiam Malfrue		
Malbela Tago	sed la problemo tamen restis	しかし問題はまだ残っていた	but the problem still remained	ĉiam Malfrue		
Malbela Tago	kilogramo da ~	〜1キログラム	a kilogram of ~	ĉiam Malfrue		
Malbela Tago	kilogramo da sukero	砂糖1キログラム	a kilogram of sugar	ĉiam Malfrue		
Malbela Tago	glaso da ~	〜一杯	a glass of ~	ĉiam Malfrue		
Malbela Tago	glaso da akvo	水のカップ	a glass of water	ĉiam Malfrue		
Malbela Tago	multe da ~	〜たくさん	a lot of ~	ĉiam Malfrue		
Malbela Tago	multe da ideoj	多くのアイデア	lots of ideas	ĉiam Malfrue		
Malbela Tago	deteni sin	自分で退く	to hold back	ĉiam Malfrue		
Malbela Tago	ordigis ĉion	すべてを整えた	sorted everything out	ĉiam Malfrue		
Malbela Tago	transdonis al li	彼に伝えた	handed over to him	ĉiam Malfrue		
Malbela Tago	mi petas	お願いします	I'm asking	ĉiam Malfrue		
Malbela Tago	glason da kafo	コーヒー1杯	a glass of coffee	ĉiam Malfrue		
Malbela Tago	kaj iom da akvo	そして水が少し	and some water	ĉiam Malfrue		
Malbela Tago	mi petas glason da kafo	一杯のコーヒーをお願いします	I would like a glass of coffee	ĉiam Malfrue		
Malbela Tago	mi petas tason da teo	お茶を一杯お願いします	I would like a cup of tea	ĉiam Malfrue		
Malbela Tago	doloris lin	彼を苦しめた	hurt him	ĉiam Malfrue		
Malbela Tago	la kapo doloris lin	彼の頭が痛い	his head hurt	ĉiam Malfrue		
Malbela Tago	li malsaniĝis	彼は健康が悪かった。	he fell ill	ĉiam Malfrue		
Malbela Tago	ŝatas esti bela	美しくいるのが好き	likes to be beautiful	ĉiam Malfrue		
Malbela Tago	ŝi beligis sian vizaĝon	彼女は彼自身の顔を美しく飾った。	she beautified her face	ĉiam Malfrue		
Malbela Tago	la knabo ŝatas esti bela	その少年は素敵になるのが好きだった	the boy likes to be pretty	ĉiam Malfrue		
Malbela Tago	pro tio ŝi beligis ĝin	それのために彼女はそれを美しく飾った	therefore she beautified it	ĉiam Malfrue		
Malbela Tago	post la tagmanĝo	昼食後	after lunch	ĉiam Malfrue		
