level	en longa komitatkunsido	في اجتماع طويل للجنة	in a long committee meeting	grupo	0    	0000-00-00 00:00:00
level	vere estis tro longa	لقد كانت حقا طويلة جدا	it really was too long	grupo	0    	0000-00-00 00:00:00
level	la komitato finkunsidis	وقد اختتمت اللجنة اجتماعها	the committee has concluded its meeting	grupo	0    	0000-00-00 00:00:00
level	sed nun la komitato finis kunsidon	ولكن الآن أنهت اللجنة الاجتماع	but now the committee has finished the meeting	grupo	0    	0000-00-00 00:00:00
level	vere estis longa, sed nun finiĝis	لقد كانت طويلة حقًا، لكنها انتهت الآن	it was really long, but now it's over	grupo	0    	0000-00-00 00:00:00
level	ha, vi do estas komitatano?	أوه، إذن أنت عضو في اللجنة؟	oh, so you're a committee member?	grupo	0    	0000-00-00 00:00:00
level	la estraro de TEJO	مجلس تيجو	the board of TEJO	grupo	0    	0000-00-00 00:00:00
level	mi ankaŭ estas en la estraro	أنا أيضا على متن الطائرة	I'm also on the board	grupo	0    	0000-00-00 00:00:00
level	jes, mi ankaŭ estas ~	نعم انا كذلك~	yes, I am too ~	grupo	0    	0000-00-00 00:00:00
level	ankaŭ estas en la estraro de TEJO	وهو أيضًا عضو في مجلس إدارة TEJO	is also on the board of TEJO	grupo	0    	0000-00-00 00:00:00
level	jes, kaj mi estas ~	نعم وأنا ~	yes, and I'm ~	grupo	0    	0000-00-00 00:00:00
level	mi neniam estis aktiva	لم أكن نشطًا أبدًا	I have never been active	grupo	0    	0000-00-00 00:00:00
level	tre aktiva en la movado	نشط جدا في الحركة	very active in the movement	grupo	0    	0000-00-00 00:00:00
level	neniam estis aktiva en la movado	لم ينشط قط في الحركة	was never active in the movement	grupo	0    	0000-00-00 00:00:00
level	la ĉefa agado de TEJO	النشاط الرئيسي لتيجو	the main activity of TEJO	grupo	0    	0000-00-00 00:00:00
level	kio estas la ĉefa agado nun?	ما هو النشاط الرئيسي الآن؟	what is the main activity now?	grupo	0    	0000-00-00 00:00:00
level	fakte kio estas la ĉefa agado?	في الواقع ما هو النشاط الرئيسي؟	actually what is the main activity?	grupo	0    	0000-00-00 00:00:00
level	ĝi estas vasta	إنها واسعة	it is vast	grupo	0    	0000-00-00 00:00:00
level	plej diversaj kampoj	مجموعة واسعة من المجالات	a wide variety of fields	grupo	0    	0000-00-00 00:00:00
level	en diversaj kampoj ni havas agadon	في مختلف المجالات لدينا النشاط	in various fields we have activity	grupo	0    	0000-00-00 00:00:00
level	seminarioj pri homaj rajtoj	ندوات حول حقوق الإنسان	seminars on human rights	grupo	0    	0000-00-00 00:00:00
level	homaj rajtoj kaj interkulturaj rilatoj	حقوق الإنسان والعلاقات بين الثقافات	human rights and intercultural relations	grupo	0    	0000-00-00 00:00:00
level	biciklo, karavano, festivalo	دراجة، قافلة، مهرجان	bicycle, caravan, festival	grupo	0    	0000-00-00 00:00:00
level	ekzemple seminarioj, biciklokaravanoj kaj festivaloj	على سبيل المثال الندوات وقوافل الدراجات والمهرجانات	for example seminars, bicycle caravans and festivals	grupo	0    	0000-00-00 00:00:00
level	lingvaj festivaloj, konstruado de ttt-paĝoj	مهرجانات اللغة، وبناء صفحات الويب	language festivals, building web pages	grupo	0    	0000-00-00 00:00:00
level	ekzemple biciklokaravanoj, festivaloj ktp	على سبيل المثال قوافل الدراجات والمهرجانات وما إلى ذلك	for example bicycle caravans, festivals etc	grupo	0    	0000-00-00 00:00:00
level	seminario pri rajtoj kaj rilatoj	ندوة حول الحقوق والعلاقات	a seminar about rights and relationship	grupo	0    	0000-00-00 00:00:00
level	karavano, festivalo, konstruado ktp	قافلة، مهرجان، البناء الخ	caravan, festival, construction etc	grupo	0    	0000-00-00 00:00:00
level	oficialaj instancoj kiel UNESKO	الهيئات الرسمية مثل اليونسكو	official bodies such as UNESCO	grupo	0    	0000-00-00 00:00:00
level	reprezentitaj en oficialaj instancoj	الممثلة في الجهات الرسمية	represented in official bodies	grupo	0    	0000-00-00 00:00:00
level	ni ankaŭ estas reprezentitaj	نحن ممثلون أيضًا	we are also represented	grupo	0    	0000-00-00 00:00:00
level	estas reprezentita en diversaj instancoj	يتم تمثيلها في مختلف الهيئات	is represented in various bodies	grupo	0    	0000-00-00 00:00:00
level	instancoj kiel Forumo Junulara Eŭropa, UNESKO	هيئات مثل منتدى الشباب الأوروبي واليونسكو	bodies such as the European Youth Forum, UNESCO	grupo	0    	0000-00-00 00:00:00
level	la junulara sekcio de Unuiĝintaj Nacioj	قسم الشباب في الأمم المتحدة	the youth section of the United Nations	grupo	0    	0000-00-00 00:00:00
level	diversaj instancoj kiel UNESKO kaj la junulara sekcio de UN	هيئات مختلفة مثل اليونسكو وقسم الشباب في الأمم المتحدة	various bodies such as UNESCO and the youth section of the UN	grupo	0    	0000-00-00 00:00:00
level	UNESKO kaj la junulara sekcio de Unuiĝintaj Nacioj	اليونسكو وقسم الشباب في الأمم المتحدة	UNESCO and the youth section of the United Nations	grupo	0    	0000-00-00 00:00:00
level	Forumo Junulara Eŭropa kaj la junulara sekcio de UN	منتدى الشباب الأوروبي وقسم الشباب في الأمم المتحدة	European Youth Forum and the youth section of the UN	grupo	0    	0000-00-00 00:00:00
level	sonas interese	مثير للاهتمام	sounds interesting	grupo	0    	0000-00-00 00:00:00
level	folio, foliumi, vento, ventumi, esperanto, esperantumi	ورقة، للتصفح، ريح، للمروحة، الاسبرانتو، للاستمتاع بالاسبرانتو	a leaf, to browse, a wind, to fan, Esperanto, to enjoy Esperanto	grupo	0    	0000-00-00 00:00:00
level	por mi sufiĉas esperantumi	بالنسبة لي يكفي أن أتكلم الاسبرانتو	for me it's enough to speak Esperanto	grupo	0    	0000-00-00 00:00:00
level	esperantumi unu aŭ du semajnojn	للاستمتاع بالاسبرانتو لمدة أسبوع أو أسبوعين	to enjoy Esperanto for a week or two	grupo	0    	0000-00-00 00:00:00
level	unu aŭ du semajnojn jare	أسبوع أو أسبوعين في السنة	one or two weeks a year	grupo	0    	0000-00-00 00:00:00
level	tamen por mi sufiĉas	ومع ذلك، فهذا يكفي بالنسبة لي	however, it is enough for me	grupo	0    	0000-00-00 00:00:00
level	jes, oni trovu ~	نعم، ينبغي للمرء أن يجد ~	yes, one should find ~	grupo	0    	0000-00-00 00:00:00
level	trovi ekvilibron	للعثور على التوازن	to find balance	grupo	0    	0000-00-00 00:00:00
level	oni trovu sian ekvilibron	يجب على الجميع إيجاد التوازن الخاص بهم	everyone should find one's own balance	grupo	0    	0000-00-00 00:00:00
level	mi sentas ke estas tro	أشعر أن هذا أكثر من اللازم	I feel it's too much	grupo	0    	0000-00-00 00:00:00
level	ĝuste nun mi sentas	الآن أشعر	right now I feel	grupo	0    	0000-00-00 00:00:00
level	mi sentas ke ~	أشعر أن ~	I feel that ~	grupo	0    	0000-00-00 00:00:00
level	sentas ke estas tro da ~	يبدو أن هناك الكثير ~	feels like there are too many ~	grupo	0    	0000-00-00 00:00:00
level	tro da Esperanto en mia vivo	الكثير من الاسبرانتو في حياتي	too much Esperanto in my life	grupo	0    	0000-00-00 00:00:00
level	estas tro da Esperanto en mia vivo	هناك الكثير من الاسبرانتو في حياتي	there is too much Esperanto in my life	grupo	0    	0000-00-00 00:00:00
level	ĉu vi estas membro?	هل أنت عضو؟	are you a member?	grupo	0    	0000-00-00 00:00:00
level	ĉu vi estas membro de organizo?	هل أنت عضو في منظمة؟	are you a member of an organization?	grupo	0    	0000-00-00 00:00:00
level	membro de iu alia organizo	عضو في منظمة أخرى	a member of some other organization	grupo	0    	0000-00-00 00:00:00
level	ne vere organizo, sed ~	ليست حقا منظمة، ولكن ~	not really an organization, but ~	grupo	0    	0000-00-00 00:00:00
level	sed mi ludas gitaron	لكني أعزف على الجيتار	but I play guitar	grupo	0    	0000-00-00 00:00:00
level	ludas gitaron en bando	يعزف الجيتار في فرقة	plays guitar in a band	grupo	0    	0000-00-00 00:00:00
level	bele! mi tre ŝatas	لطيف - جيد! انا فعلا احب	nice! I really like	grupo	0    	0000-00-00 00:00:00
level	mi ŝatas kanti	أحب أن أغني	I like to sing	grupo	0    	0000-00-00 00:00:00
level	tre ŝatas kanti	يحب الغناء كثيرا	likes to sing very much	grupo	0    	0000-00-00 00:00:00
level	kian muzikon vi ludas?	أي نوع من الموسيقى هل لعب؟	what kind of music do you play?	grupo	0    	0000-00-00 00:00:00
level	nu, estas simpla popo	حسنًا، إنها موسيقى البوب البسيطة	well, it's simple pop	grupo	0    	0000-00-00 00:00:00
level	ni ĵus fondis la bandon	لقد بدأنا الفرقة للتو	we just started the band	grupo	0    	0000-00-00 00:00:00
level	sed eventuale ni ludos	ولكن في نهاية المطاف سوف نلعب	but eventually we will play	grupo	0    	0000-00-00 00:00:00
level	ni ludis dum la IJK	لعبنا خلال IJK	we played during the IJK	grupo	0    	0000-00-00 00:00:00
level	ludos dum la venonta IJK	سيلعب خلال IJK القادم	will play during the next IJK	grupo	0    	0000-00-00 00:00:00
level	mi jam antaŭĝojas!	أنا أتطلع لذلك بالفعل!	I'm already looking forward to it!	grupo	0    	0000-00-00 00:00:00
level	nur diru se vi bezonas ~	أقول فقط إذا كنت في حاجة ~	just say if you need ~	grupo	0    	0000-00-00 00:00:00
level	bezonas iun helpkantiston	يحتاج الى بعض المغني الاحتياطية	needs some backup singer	grupo	0    	0000-00-00 00:00:00
level	se vi bezonas helpkantiston	إذا كنت بحاجة إلى مغني احتياطي	if you need a backup singer	grupo	0    	0000-00-00 00:00:00
level	kial ne? eble vi volas ~	ولم لا؟ ربما تريد ~	why not? maybe you want ~	grupo	0    	0000-00-00 00:00:00
level	vi volas kanti ion nun	تريد أن تغني شيئا الآن	you want to sing something now	grupo	0    	0000-00-00 00:00:00
level	mi povas ludi gitaron	استطيع العزف على الجيتار	I can play guitar	grupo	0    	0000-00-00 00:00:00
level	vi volas kanti kaj mi povas ludi	تريد الغناء وأستطيع أن ألعب	you want to sing and I can play	grupo	0    	0000-00-00 00:00:00
level	kanti ion nun kaj ludi gitaron	لغناء شيء ما الآن والعزف على الجيتار	to sing something now and to play guitar	grupo	0    	0000-00-00 00:00:00
level	jes, mi ŝatus tion	نعم، أود ذلك	yes, I would like that	grupo	0    	0000-00-00 00:00:00
level	venigi mian gitaron	لإحضار جيتاري	to bring my guitar	grupo	0    	0000-00-00 00:00:00
level	tuj venigos mian gitaron	سوف أحضر جيتاري على الفور	will bring my guitar right away	grupo	0    	0000-00-00 00:00:00
level	tre bone, mi venigos gitaron	حسنًا، سأحضر جيتارًا	very well, I'll bring a guitar	grupo	0    	0000-00-00 00:00:00
level	mi tuj venigos mian gitaron	سأحضر جيتاري على الفور	I'll bring my guitar right away	grupo	0    	0000-00-00 00:00:00
level	atendas vian revenon	ينتظر عودتك	waits for your return	grupo	0    	0000-00-00 00:00:00
level	via espereble rapida reveno	نأمل عودتك السريعة	your hopefully speedy return	grupo	0    	0000-00-00 00:00:00
level	mi atendas rapidan revenon	أتوقع عودة سريعة	I expect a quick return	grupo	0    	0000-00-00 00:00:00
level	atendas vian espereble rapidan revenon	ينتظر عودتك السريعة على أمل	waits for your hopefully speedy return	grupo	0    	0000-00-00 00:00:00
level	du tagojn poste	بعد يومين	two days later	grupo	0    	0000-00-00 00:00:00
level	ekster la dancejo	خارج حلبة الرقص	outside the dance floor	grupo	0    	0000-00-00 00:00:00
level	tagojn poste, ekster la dancejo	بعد أيام، خارج حلبة الرقص	days later, outside the dance floor	grupo	0    	0000-00-00 00:00:00
level	ej Kabe, vi aspektas ~	يا كابي، أنت تنظر ~	hey Kabe, you look ~	grupo	0    	0000-00-00 00:00:00
level	vi aspektas feliĉega	تبدو سعيدا جدا	you look very happy	grupo	0    	0000-00-00 00:00:00
level	jes, mi estas ~	نعم انا~	yes, I am ~	grupo	0    	0000-00-00 00:00:00
level	bele, mi ĝojas!	جيد، أنا سعيد!	nicely, I'm glad!	grupo	0    	0000-00-00 00:00:00
level	kongreso plaĉas al vi?	هل تحب الكونغرس؟	do you like congress?	grupo	0    	0000-00-00 00:00:00
level	ĉu la kongreso tiom plaĉas al vi?	هل يعجبك المؤتمر إلى هذا الحد؟	do you like the congress that much?	grupo	0    	0000-00-00 00:00:00
level	jes kaj ne	نعم و لا	yes and no	grupo	0    	0000-00-00 00:00:00
level	certe mi tre kontentas	أنا متأكد من أنني راضٍ جدًا	I'm sure I'm very satisfied	grupo	0    	0000-00-00 00:00:00
level	tre kontentas pri IJK	راض جدًا عن IJK	is very satisfied with IJK	grupo	0    	0000-00-00 00:00:00
level	sed estas io alia	ولكن هناك شيء آخر	but there is something else	grupo	0    	0000-00-00 00:00:00
level	io alia, kio feliĉigas min	شيء آخر، يجعلني سعيدا	something else, that makes me happy	grupo	0    	0000-00-00 00:00:00
level	estas io kio feliĉigas ~	هو الشيء الذي يجعل ~	is something that makes ~	grupo	0    	0000-00-00 00:00:00
level	pli ĝuste dirite	قال بشكل صحيح	more correctly said	grupo	0    	0000-00-00 00:00:00
level	estas iu, kiu batigas ~	هناك من يدق ~	there is someone who beats ~	grupo	0    	0000-00-00 00:00:00
level	iu kiu batigas mian koron	شخص يجعل قلبي ينبض	someone who makes my heart beat	grupo	0    	0000-00-00 00:00:00
level	diru, diru, ĉu vi enamiĝis?	قل قل هل وقعت في الحب؟	say, say, have you fallen in love?	grupo	0    	0000-00-00 00:00:00
level	enamiĝis al iu knabino	وقعت في حب فتاة ما	fell in love with some girl	grupo	0    	0000-00-00 00:00:00
level	ĉu vi enamiĝis al knabino?	هل وقعت في حب فتاة؟	did you fall in love with a girl?	grupo	0    	0000-00-00 00:00:00
level	ne certas ĉu mi enamiĝis	لست متأكدا إذا وقعت في الحب	is not sure if I fell in love	grupo	0    	0000-00-00 00:00:00
level	ne certas, sed sentiĝas bone	لست متأكدا، لكنه يشعر بالارتياح	is not sure, but it feels good	grupo	0    	0000-00-00 00:00:00
level	mi ne certas ĉu mi jam enamiĝis	لست متأكدا إذا كنت في الحب حتى الآن	I'm not sure if I'm in love yet	grupo	0    	0000-00-00 00:00:00
level	sed sentiĝas tre bone	لكنه شعور جيد جدا	but it feels very good	grupo	0    	0000-00-00 00:00:00
level	ŝi eĉ kisis min	حتى أنها قبلتني	she even kissed me	grupo	0    	0000-00-00 00:00:00
level	kisis min sur la buŝon	قبلني على الشفاه	kissed me on the lips	grupo	0    	0000-00-00 00:00:00
level	eĉ kisis min dum labambo	حتى قبلني خلال لا بامبا	even kissed me during La Bamba	grupo	0    	0000-00-00 00:00:00
level	mirinde kian kison	مذهلة يا لها من قبلة	amazing what a kiss	grupo	0    	0000-00-00 00:00:00
level	kian kison ŝi donis!	يا لها من قبلة أعطتها!	what a kiss she gave!	grupo	0    	0000-00-00 00:00:00
level	bonege! nun mi komprenas	عظيم! الآن أنا أفهم	great! now I understand	grupo	0    	0000-00-00 00:00:00
level	komprenas kial vi elradias	يفهم لماذا أنت يشع	understands why you are radiating	grupo	0    	0000-00-00 00:00:00
level	vi elradias tiom da ĝojo	أنت تحلب الكثير من الفرح	you exude so much joy	grupo	0    	0000-00-00 00:00:00
level	fakte, io simila okazis	في الواقع، حدث شيء مماثل	in fact, something similar happened	grupo	0    	0000-00-00 00:00:00
level	io simila okazis al mi	حدث شيء مماثل لي	something similar happened to me	grupo	0    	0000-00-00 00:00:00
level	sed mi pensis ke ~	ولكن اعتقدت أن ~	but I thought that ~	grupo	0    	0000-00-00 00:00:00
level	pensis ke vi ne ŝatas ~	اعتقدت أنك لم تحب ~	thought you didn't like ~	grupo	0    	0000-00-00 00:00:00
level	vi ne ŝatas labambumi	أنت لا تحب الرقص في لا بامبا	you don't like dance on La Bamba	grupo	0    	0000-00-00 00:00:00
level	prave, ne okazis	صحيح، لم يحدث	right, it didn't happen	grupo	0    	0000-00-00 00:00:00
level	okazis en la dancejo	حدث في حلبة الرقص	happened in the dance floor	grupo	0    	0000-00-00 00:00:00
level	ne okazis en dancejo	لم يحدث ذلك على حلبة الرقص	it didn't happen on a dance floor	grupo	0    	0000-00-00 00:00:00
level	sed en la Gufujo	ولكن في غرفة الشاي (Owlery)	but in the tea launge(Owlery)	grupo	0    	0000-00-00 00:00:00
level	kaj ne estis kiso	ولم تكن قبلة	and it was not kiss	grupo	0    	0000-00-00 00:00:00
level	ne kiso sed tamen io ĝojiga	ليست قبلة ولكن لا يزال هناك شيء يبعث على السرور	not a kiss but still something gratifying	grupo	0    	0000-00-00 00:00:00
level	sed tamen io tre ĝojiga	ولكن مع ذلك شيء بهيج للغاية	but nevertheless something very joyful	grupo	0    	0000-00-00 00:00:00
level	do, rakontu!	لذلك، أخبر!	so, tell!	grupo	0    	0000-00-00 00:00:00
level	mi ne scias kion diri	أنا لا أعرف ماذا أقول	I don't know what to say	grupo	0    	0000-00-00 00:00:00
level	ne scias kion diri vere	لا أعرف ماذا أقول حقا	don't know what to say really	grupo	0    	0000-00-00 00:00:00
level	nenio speciala okazis	لم يحدث شيء خاص	nothing special happened	grupo	0    	0000-00-00 00:00:00
level	almenaŭ ankoraŭ ne okazis	على الأقل لم يحدث بعد	at least it hasn't happened yet	grupo	0    	0000-00-00 00:00:00
level	sed mi iel sentis ~	لكنني شعرت بطريقة أو بأخرى ~	but I somehow felt ~	grupo	0    	0000-00-00 00:00:00
level	sentis ke ŝi tre ŝatas min	شعرت أنها تحبني كثيرا	felt that she likes me very much	grupo	0    	0000-00-00 00:00:00
level	iel sentis ke ŝi tre ŝatas min	شعرت بطريقة ما أنها تحبني كثيرًا	somehow felt that she likes me very much	grupo	0    	0000-00-00 00:00:00
level	ŝi ŝatas min kaj mi ŝin	هي تحبني وأنا أحبها	she likes me and I like her	grupo	0    	0000-00-00 00:00:00
level	ni longe babilis pri ~	تحدثنا لفترة طويلة حول ~	we chatted for a long time about ~	grupo	0    	0000-00-00 00:00:00
level	longe babilis pri muziko	كان لدينا محادثة طويلة حول الموسيقى	had a long chat about music	grupo	0    	0000-00-00 00:00:00
level	kaj poste kantis kune	ثم غنوا معًا	and then sang together	grupo	0    	0000-00-00 00:00:00
level	mi pensas ke ŝi flirtumis	أعتقد أنها كانت تغازل	I think she was flirting	grupo	0    	0000-00-00 00:00:00
level	ŝi flirtumis kun mi	كانت تغازلني	she was flirting with me	grupo	0    	0000-00-00 00:00:00
level	estis tre agrable	كان لطيفا جدا	it was very nice	grupo	0    	0000-00-00 00:00:00
level	kiel diras via amiko de Kanado	كما يقول صديقك من كندا	as your friend from Canada says	grupo	0    	0000-00-00 00:00:00
level	"Malfeke!", kiel diras amiko de Kanado	&quot;تبًا جيدًا!&quot;، كما يقول صديق من كندا	"Shit good!", as a friend from Canada says	grupo	0    	0000-00-00 00:00:00
level	jes, vere! mi esperas ~	نعم حقا! أتمنى ~	yes, really! I hope ~	grupo	0    	0000-00-00 00:00:00
level	renkonti ŝin baldaŭ denove	لمقابلتها مرة أخرى قريبا	to meet her again soon	grupo	0    	0000-00-00 00:00:00
level	esperas renkonti ŝin denove	يأمل أن يلتقي بها مرة أخرى	hopes to meet her again	grupo	0    	0000-00-00 00:00:00
level	mi esperas renkonti ŝin baldaŭ	أتمنى أن ألتقي بها قريبا	I hope to meet her soon	grupo	0    	0000-00-00 00:00:00
level	same mi	مثلي	same me	grupo	0    	0000-00-00 00:00:00
level	ĉe lago proksime de ~	في بحيرة قريبة ~	at a lake near ~	grupo	0    	0000-00-00 00:00:00
level	lago proksime de kongresejo	بحيرة بالقرب من مكان انعقاد المؤتمر	a lake near a congress place	grupo	0    	0000-00-00 00:00:00
level	proksime de la kongresejo	بالقرب من قاعة المؤتمرات	near the congress hall	grupo	0    	0000-00-00 00:00:00
level	ho, ankaŭ vi estas ~	أوه، أنت أيضا ~	oh, you are too ~	grupo	0    	0000-00-00 00:00:00
level	ankaŭ vi estas ĉi tie!?	أنت هنا أيضا!؟	you are here too!?	grupo	0    	0000-00-00 00:00:00
level	jes, mi renkontos ~	نعم سألتقي ~	yes, I will meet ~	grupo	0    	0000-00-00 00:00:00
level	renkontos amikon ĉi tie baldaŭ	سوف يجتمع صديق هنا قريبا	will meet a friend here soon	grupo	0    	0000-00-00 00:00:00
level	por privata interparolo	لمحادثة خاصة	for a private conversation	grupo	0    	0000-00-00 00:00:00
level	renkontos amikon por privata interparolo	سوف يجتمع صديق لمحادثة خاصة	will meet a friend for a private conversation	grupo	0    	0000-00-00 00:00:00
level	do, mi ŝatus peti vin ~	لذلك أود أن أسألك ~	so, I would like to ask you ~	grupo	0    	0000-00-00 00:00:00
level	mi ŝatus peti vin foriri	أود أن أطلب منك المغادرة	I'd like to ask you to leave	grupo	0    	0000-00-00 00:00:00
level	nu, tio ne eblas	حسنا، هذا غير ممكن	well, that's not possible	grupo	0    	0000-00-00 00:00:00
level	tute ne eblas fakte	غير ممكن على الإطلاق في الواقع	is not possible at all actually	grupo	0    	0000-00-00 00:00:00
level	kial? estas tre grava por mi!	لماذا ؟ من المهم جدا بالنسبة لي!	why? it is very important to me!	grupo	0    	0000-00-00 00:00:00
level	tiu ĉi renkonto estas tre grava	هذا الاجتماع مهم جدا	this meeting is very important	grupo	0    	0000-00-00 00:00:00
level	do, bonvolu lasi min	لذا من فضلك دعني أذهب	so please let me go	grupo	0    	0000-00-00 00:00:00
level	bonvolu lasi min sola	أرجوك دعني وشأني	please leave me alone	grupo	0    	0000-00-00 00:00:00
level	kiel mi ĵus diris,	كما قلت للتو،	like I just said,	grupo	0    	0000-00-00 00:00:00
level	mi diris, tio ne eblas	قلت: هذا غير ممكن	I said, that is not possible	grupo	0    	0000-00-00 00:00:00
level	amiko de mi baldaŭ aperos	سيظهر صديق لي قريبا	a friend of mine will appear soon	grupo	0    	0000-00-00 00:00:00
level	ĉar ankaŭ amiko baldaŭ aperos	لأن الصديق سيظهر قريباً أيضاً	because a friend will soon appear too	grupo	0    	0000-00-00 00:00:00
level	ankaŭ amiko aperos ĉi tie	سيظهر صديق هنا أيضًا	a friend will also appear here	grupo	0    	0000-00-00 00:00:00
level	damne, tipe ke ĝuste nun	اللعنة، عادة ما يكون ذلك الآن	damn, typically that right now	grupo	0    	0000-00-00 00:00:00
level	fakte temas pri la knabino	في الواقع يتعلق الأمر بالفتاة	actually it's about the girl	grupo	0    	0000-00-00 00:00:00
level	la knabino, pri kiu mi rakontis	الفتاة التي أخبرت عنها	the girl, whom I told about	grupo	0    	0000-00-00 00:00:00
level	ŝia nomo estas Jesi cetere	اسمها جيسي بالمناسبة	her name is Jesi by the way	grupo	0    	0000-00-00 00:00:00
level	gekaraj! bonege ke vi povis veni	الفتيان والفتيات! عظيم أنه يمكنك أن تأتي	boys and girls! great that you could come	grupo	0    	0000-00-00 00:00:00
level	mi tiom ĝojas vidi vin	أنا سعيد جدا لرؤيتك	I'm so glad to see you	grupo	0    	0000-00-00 00:00:00
level	mi ĝojas vidi vin denove	أنا سعيد برؤيتك ثانية	I'm glad to see you again	grupo	0    	0000-00-00 00:00:00
level	sed, vi aspektas ~	ولكن، نظرتم ~	but, you look ~	grupo	0    	0000-00-00 00:00:00
level	vi aspektas ŝokitaj kaj konfuzitaj	تبدو مصدومًا ومربكًا	you look shocked and confused	grupo	0    	0000-00-00 00:00:00
level	ŝokita kaj iel konfuzita	بالصدمة والارتباك إلى حد ما	shocked and somehow confused	grupo	0    	0000-00-00 00:00:00
level	evidente	بوضوح	obviously	grupo	0    	0000-00-00 00:00:00
level	do, mi supozas ke ~	لذلك أعتقد ~	so, I guess ~	grupo	0    	0000-00-00 00:00:00
level	vi jam ekkomprenis	لقد حصلت عليه بالفعل	you already got it	grupo	0    	0000-00-00 00:00:00
level	ekkomprenis kiel statas, ĉu?	فهم كيف هو، أليس كذلك؟	understand how it is, right?	grupo	0    	0000-00-00 00:00:00
level	supozas ke vi jam komprenis	أعتقد أنك فهمت بالفعل	guess you already understood	grupo	0    	0000-00-00 00:00:00
level	jam ekkomprenis kiel statas	لقد فهمت بالفعل كيف هو	already understood how it is	grupo	0    	0000-00-00 00:00:00
level	mi nenion komprenas!	أنا لا أفهم شيئا!	I don't understand anything!	grupo	0    	0000-00-00 00:00:00
level	mi pensas ke mi ne volas ~	أعتقد أنني لا أريد ~	I think I don't want ~	grupo	0    	0000-00-00 00:00:00
